id,conversation_id,created_at,date,time,timezone,user_id,username,name,place,tweet,language,mentions,urls,photos,replies_count,retweets_count,likes_count,hashtags,cashtags,link,retweet,quote_url,video,thumbnail,near,geo,source,user_rt_id,user_rt,retweet_id,reply_to,retweet_date,translate,trans_src,trans_dest
945074108991180800,945074108991180800,2017-12-24 23:30:00 UTC,2017-12-24,23:30:00,+0000,2564597449,elonmusknewsorg,Elon Musk News,,"Tesla is planning a major navigation update ‘light-years ahead’ of current system, says Elon Musk  https://t.co/ejlbDQYW9N",en,[],['https://electrek.co/2017/12/21/tesla-major-navigation-update-elon-musk/'],[],8,33,102,[],[],https://twitter.com/ElonMuskNewsOrg/status/945074108991180800,False,,0,,,,,,,,[],,,,
945065296812965889,945065296812965889,2017-12-24 22:54:59 UTC,2017-12-24,22:54:59,+0000,18200793,teslamotorsclub,Tesla Motors Club,,Tesla Releases “Santa Mode” in Latest Software Push  https://t.co/8Y4rFCwDb5 #Tesla  https://t.co/oQyD92GFcY,ro,[],['https://teslamotorsclub.com/blog/2017/12/24/tesla-releases-santa-mode-in-latest-software-push/'],['https://pbs.twimg.com/media/DR2L0r3XkAgtWiv.jpg'],3,25,140,['tesla'],[],https://twitter.com/TeslaMotorsClub/status/945065296812965889,False,,1,https://pbs.twimg.com/media/DR2L0r3XkAgtWiv.jpg,,,,,,,[],,,,
945051194954735616,945051194954735616,2017-12-24 21:58:57 UTC,2017-12-24,21:58:57,+0000,577732270,mondobytes,Armando Ferreira,,"If Apple is going to slow down an old phone so the battery can handle it, does that mean @Tesla would do the same with their older cars?  Would love to hear what @elonmusk has to say about this.",en,"[{'screen_name': 'tesla', 'name': 'tesla', 'id': '13298072'}, {'screen_name': 'elonmusk', 'name': 'elon musk', 'id': '44196397'}]",[],[],9,15,139,[],[],https://twitter.com/mondobytes/status/945051194954735616,False,,0,,,,,,,,[],,,,
945037449650229248,945037449650229248,2017-12-24 21:04:20 UTC,2017-12-24,21:04:20,+0000,14372486,engadget,Engadget,,Tesla 'Santa Mode' Easter egg turns your EV into a winter wonderland  https://t.co/ocqBuVHNyz,en,[],['http://engt.co/2D7bSIp'],[],0,38,74,[],[],https://twitter.com/engadget/status/945037449650229248,False,,0,,,,,,,,[],,,,
945034099382784002,945029849189666822,2017-12-24 20:51:01 UTC,2017-12-24,20:51:01,+0000,932946118530486272,scottybarr6,Scotty Barr,,@HistoryInPix Tesla’s feud with Thomas Edison comes to blows...  https://t.co/pODPaJtgIY,en,[],[],['https://pbs.twimg.com/media/DR1vgHRW4AElwzO.jpg'],11,87,858,[],[],https://twitter.com/ScottyBarr6/status/945034099382784002,False,,1,https://pbs.twimg.com/media/DR1vgHRW4AElwzO.jpg,,,,,,,"[{'screen_name': 'HistoryInPix', 'name': 'History In Pictures', 'id': '1557315432'}]",,,,
945031087696302080,945029849189666822,2017-12-24 20:39:03 UTC,2017-12-24,20:39:03,+0000,2759624985,hejaub,buajeh*,,@HistoryInPix Nikola Tesla in his private Lab  https://t.co/NGnvK6SBfU,sl,[],[],['https://pbs.twimg.com/media/DR1swlEWsAIERGh.jpg'],1,8,78,[],[],https://twitter.com/hejaub/status/945031087696302080,False,,1,https://pbs.twimg.com/media/DR1swlEWsAIERGh.jpg,,,,,,,"[{'screen_name': 'HistoryInPix', 'name': 'History In Pictures', 'id': '1557315432'}]",,,,
945022059305951235,945022059305951235,2017-12-24 20:03:11 UTC,2017-12-24,20:03:11,+0000,49753604,ritholtz,Barry Ritholtz,,"At a red light, I slip next to a Tesla P100D. On green, I floor the Macan S, which leaps forward in a cacophony of internal combustion shrieks. As the Tesla smokes us silently, its driver throws her head back in laughter as she leaves us in her dust. A good time had by all",en,[],[],[],16,17,225,[],[],https://twitter.com/ritholtz/status/945022059305951235,False,,0,,,,,,,,[],,,,
945006673307029504,945006673307029504,2017-12-24 19:02:02 UTC,2017-12-24,19:02:02,+0000,91478624,forbes,Forbes,,World's most innovative companies: 1. Salesforce 2. Tesla 3. Amazon  https://t.co/0mkFnJrSI7  https://t.co/rBKiH4OGoa,en,[],['http://on.forbes.com/6011DHKel'],"['https://pbs.twimg.com/media/DR1WjgkVwAA9Qmg.jpg', 'https://pbs.twimg.com/media/DR1WjrMVoAAjU0y.jpg', 'https://pbs.twimg.com/media/DR1Wj3ZUEAAAvvu.jpg']",38,477,796,[],[],https://twitter.com/Forbes/status/945006673307029504,False,,1,https://pbs.twimg.com/media/DR1WjgkVwAA9Qmg.jpg,,,,,,,[],,,,
944993978553733120,944993978553733120,2017-12-24 18:11:36 UTC,2017-12-24,18:11:36,+0000,33846113,dennis_p,Dennis Pascual,,My first direct purchase from @Etsy ever...  these ice cube trays that make replica @tesla #ModelS Fobs...  https://t.co/0BWJyHmuka,en,"[{'screen_name': 'etsy', 'name': 'etsy', 'id': '11522502'}, {'screen_name': 'tesla', 'name': 'tesla', 'id': '13298072'}]",[],"['https://pbs.twimg.com/media/DR1K-e1VAAEw8IN.jpg', 'https://pbs.twimg.com/media/DR1K-e1V4AEuHqp.jpg']",2,6,70,['models'],[],https://twitter.com/dennis_p/status/944993978553733120,False,,1,https://pbs.twimg.com/media/DR1K-e1VAAEw8IN.jpg,,,,,,,[],,,,
944931946680893440,944931946680893440,2017-12-24 14:05:06 UTC,2017-12-24,14:05:06,+0000,704835627183788032,model3owners,Trev Page,,"It's that time of year again. A time for reflection, family and taking count of everything that's happened over the last year. Indeed, a lot of us have much to thank for: friends, health and happiness.  Merry Christmas from  https://t.co/YNkHFOvbnm #tesla #model3  https://t.co/WsEK8QhcA0",en,[],['http://M3OC.com'],['https://pbs.twimg.com/media/DR0ShIpUIAAJR0_.jpg'],12,12,168,"['tesla', 'model3']",[],https://twitter.com/Model3Owners/status/944931946680893440,False,,1,https://pbs.twimg.com/media/DR0ShIpUIAAJR0_.jpg,,,,,,,[],,,,
944930674896711681,944930674896711681,2017-12-24 14:00:03 UTC,2017-12-24,14:00:03,+0000,70124891,colbyhunt,Hunt Farm,,"So if you drive to your families house in your Tesla and charge it while your there, isn’t that like asking for gas money? #thoughtsinmyhead",en,[],[],[],3,2,94,['thoughtsinmyhead'],[],https://twitter.com/colbyhunt/status/944930674896711681,False,,0,,,,,,,,[],,,,
944877817577140224,944877817577140224,2017-12-24 10:30:01 UTC,2017-12-24,10:30:01,+0000,992633006,webtekno,Webtekno,,"Elon Musk Dinlenme Tesisi, Tesla şarj istasyonu.  https://t.co/29tDzSWLzf",tr,[],[],['https://pbs.twimg.com/media/DRzPQZ_WAAA-2Bn.png'],2,8,191,[],[],https://twitter.com/webtekno/status/944877817577140224,False,,1,https://pbs.twimg.com/media/DRzPQZ_WAAA-2Bn.png,,,,,,,[],,,,
944852899997323264,944852899997323264,2017-12-24 08:51:00 UTC,2017-12-24,08:51:00,+0000,368696655,goyucel,Gökhan Yücel,,"Önemli bir kaynak. Bizim elektrikli araba üretimi konusunda elimizi çabuktan da tez tutmamızı gerektiren tablo. Şu ana kadar üretilen elektrikli araba modelleri, segmentleri ve dolu şarjla gittikleri menzil. Yani konu sadece Tesla'dan ibaret değil. Ne dersiniz?  https://t.co/TbwvvlrPGv",tr,[],[],['https://pbs.twimg.com/media/DRzKZp1XUAACKmb.jpg'],1,30,88,[],[],https://twitter.com/goyucel/status/944852899997323264,False,,1,https://pbs.twimg.com/media/DRzKZp1XUAACKmb.jpg,,,,,,,[],,,,
944816599004938240,944816599004938240,2017-12-24 06:26:45 UTC,2017-12-24,06:26:45,+0000,1720701343,zacksjerryrig,JerryRigEverything,,Elon Musk is giving away a Tesla Roadster!! First one to the drivers seat gets to keep it! I wish you all the best of luck.  https://t.co/Rymlm5d79x,en,[],[],['https://pbs.twimg.com/media/DRyprimV4AAKLQL.jpg'],16,89,1142,[],[],https://twitter.com/ZacksJerryRig/status/944816599004938240,False,,1,https://pbs.twimg.com/media/DRyprimV4AAKLQL.jpg,,,,,,,[],,,,
944800882981453824,944172872041488385,2017-12-24 05:24:18 UTC,2017-12-24,05:24:18,+0000,812984,shawnbot,Shawn Allen,,"@SEFDStuff @HazelMonforton @HackerC0w The patent giveaway was cool, but it wasn’t exactly an act of charity; it was strategic. There’s no way Tesla can succeed unless other automakers help shoulder the costs of charging infrastructure.  Yes, Musk is brilliant and innovative. He’s *also* an egomaniacal asshole.",en,[],[],[],4,9,227,[],[],https://twitter.com/shawnbot/status/944800882981453824,False,,0,,,,,,,,"[{'screen_name': 'sefdstuff', 'name': 'sefdstuff', 'id': '1045466483248123904'}, {'screen_name': 'HazelMonforton', 'name': 'dr. hazel 💐', 'id': '1276068319'}, {'screen_name': 'HackerC0w', 'name': 'HackerCow', 'id': '2184609556'}]",,,,
944752917327646720,944752917327646720,2017-12-24 02:13:42 UTC,2017-12-24,02:13:42,+0000,1308211178,teslarati,TESLARATI,,"A happy holiday to all courtesy of Tesla's ""Santa Mode"" easter egg. ""Ho Ho Ho""  https://t.co/XptP6rhJ3g  https://t.co/H3XwWYIGTv",en,[],['https://www.teslarati.com/tesla-santa-mode-easter-egg-ho-ho-ho-voice-activated/'],['https://pbs.twimg.com/media/DRxvtIzUEAEJ4sb.jpg'],1,28,159,[],[],https://twitter.com/Teslarati/status/944752917327646720,False,,1,https://pbs.twimg.com/media/DRxvtIzUEAEJ4sb.jpg,,,,,,,[],,,,
944741507851943936,944741507851943936,2017-12-24 01:28:22 UTC,2017-12-24,01:28:22,+0000,2306006378,ed_techsource,Edgar Oganesyan,,I went to pickup my @tesla Model X only to realize they messed up on the configuration. They had the 5 seater instead of 6 so now I have to wait for a brand new custom build ETA March. Wanted to do a cool xmas video but it didnt happen haha. Saving the vlog footage until then!  https://t.co/nE0PdtX2K3,en,"[{'screen_name': 'tesla', 'name': 'tesla', 'id': '13298072'}]",[],['https://pbs.twimg.com/media/DRxkql5UMAAMIAQ.jpg'],36,22,551,[],[],https://twitter.com/Ed_TechSource/status/944741507851943936,False,,1,https://pbs.twimg.com/media/DRxkql5UMAAMIAQ.jpg,,,,,,,[],,,,
944736362917449729,944736362917449729,2017-12-24 01:07:55 UTC,2017-12-24,01:07:55,+0000,2786511581,sinceroeng,Engenheiro Sincero,,Nikola Tesla está para Engenharia Elétrica assim como Einstein está para a Física.,pt,[],[],[],1,24,113,[],[],https://twitter.com/SinceroEng/status/944736362917449729,False,,0,,,,,,,,[],,,,
944727150178877440,944727150178877440,2017-12-24 00:31:19 UTC,2017-12-24,00:31:19,+0000,5978352,hasegaw,Takeshi HASEGAWA,,Tesla P100と他のPascalモデルを比べたときにP100のパフォーマンスが伸びる理由は搭載メモリの差（GDDR5とHBM2）なんだろうと思っている。P100のFP32スループット 9.3TFLOPSって、GTX1080Tiのカタログスペック10TFLOPSオーバーと比べると明らかに見劣りしているけども、P100のほうが速い。,ja,[],[],[],1,47,84,[],[],https://twitter.com/hasegaw/status/944727150178877440,False,,0,,,,,,,,[],,,,
