id,conversation_id,created_at,date,time,timezone,user_id,username,name,place,tweet,language,mentions,urls,photos,replies_count,retweets_count,likes_count,hashtags,cashtags,link,retweet,quote_url,video,thumbnail,near,geo,source,user_rt_id,user_rt,retweet_id,reply_to,retweet_date,translate,trans_src,trans_dest
907734290292768770,907734290292768770,2017-09-12 22:34:54 UTC,2017-09-12,22:34:54,+0000,16638685,lilduval,lil duval,,"All y'all worried bout gas, u wouldn't have this problem if u had a Prius or tesla. 🤷‍♂️",en,[],[],[],7,30,98,[],[],https://twitter.com/lilduval/status/907734290292768770,False,,0,,,,,,,,[],,,,
907706461693898753,907705707251761152,2017-09-12 20:44:19 UTC,2017-09-12,20:44:19,+0000,246261903,roxabbe,Merisü,,Ahhx axx bunu yapabilecek tek bir adam vardi dunyada onu da kimse ciddiye almadi yasasa suan ucan arabaya binerdik ruhun saad olsun tesla,tr,[],[],[],2,7,262,[],[],https://twitter.com/Roxabbe/status/907706461693898753,False,,0,,,,,,,,[],,,,
907702871004676100,907702871004676100,2017-09-12 20:30:03 UTC,2017-09-12,20:30:03,+0000,807095,nytimes,The New York Times,,One NYT reader's reaction to Tesla's decision to remotely boost battery capacity for drivers during Hurricane Irma  https://t.co/9CEWtu2mZe  https://t.co/4XwVIZ33uR,en,[],['http://nyti.ms/2f48ckm'],['https://pbs.twimg.com/media/DJjO8x4VwAAD0b7.jpg'],18,51,104,[],[],https://twitter.com/nytimes/status/907702871004676100,False,,1,https://pbs.twimg.com/media/DJjO8x4VwAAD0b7.jpg,,,,,,,[],,,,
907697926687936513,907697926687936513,2017-09-12 20:10:24 UTC,2017-09-12,20:10:24,+0000,5392522,npr,NPR,,The move came at the request of a Tesla owner worried about traffic &amp; range b/w charging stations during evacuations  https://t.co/NrB4NChUCt,en,[],['http://n.pr/2jmeMEc'],[],5,43,69,[],[],https://twitter.com/NPR/status/907697926687936513,False,,0,,,,,,,,[],,,,
907694864262946816,907694864262946816,2017-09-12 19:58:14 UTC,2017-09-12,19:58:14,+0000,96676063,satrayni,Muhteşem Satrayni,,edison ampülü bulduğunda tesla iphone x kullanıyordu,tr,[],[],[],7,126,1399,[],[],https://twitter.com/satrayni/status/907694864262946816,False,,0,,,,,,,,[],,,,
907690156387381248,907690156387381248,2017-09-12 19:39:32 UTC,2017-09-12,19:39:32,+0000,704835627183788032,model3owners,Trev Page,,Model 3 multi-level production line went live just over a week ago. Ramp up over the next few months has begun #tesla #mode3  https://t.co/nNf6ObKMYp,en,[],[],['https://pbs.twimg.com/media/DJjDXg2VAAAGo3W.jpg'],9,64,259,"['tesla', 'mode3']",[],https://twitter.com/Model3Owners/status/907690156387381248,False,,1,https://pbs.twimg.com/media/DJjDXg2VAAAGo3W.jpg,,,,,,,[],,,,
907682744443924480,907682744443924480,2017-09-12 19:10:04 UTC,2017-09-12,19:10:04,+0000,5392522,npr,NPR,,"Tesla Remotely Expanded Car Batteries Near Irma's Path, And Questions Linger  https://t.co/1w9qYf6HCc",en,[],['http://n.pr/2vSwIIe'],[],7,44,66,[],[],https://twitter.com/NPR/status/907682744443924480,False,,0,,,,,,,,[],,,,
907679328766488577,907679328766488577,2017-09-12 18:56:30 UTC,2017-09-12,18:56:30,+0000,21606690,rebeccapahle,Rebecca Pahle,,"No casting has ever been as perfect as David Bowie playing Tesla in The Prestige. That's it, the end.",en,[],[],[],2,6,54,[],[],https://twitter.com/RebeccaPahle/status/907679328766488577,False,,0,,,,,,,,[],,,,
907676483933614081,907676483933614081,2017-09-12 18:45:12 UTC,2017-09-12,18:45:12,+0000,807095,nytimes,The New York Times,,"Tesla remotely boosted battery capacity for drivers during Hurricane Irma, drawing both praise and criticism  https://t.co/OYv4kEeISJ",en,[],['http://nyti.ms/2wYu5pW'],[],11,82,167,[],[],https://twitter.com/nytimes/status/907676483933614081,False,,0,,,,,,,,[],,,,
907657689466945536,907657689466945536,2017-09-12 17:30:31 UTC,2017-09-12,17:30:31,+0000,308795969,dmc_ryan,Ryan McCaffrey,,I'd been waiting for an untethered Apple Watch. This will be super tempting -- particularly when Tesla does Knight Rider KITT stuff with it.,en,[],[],[],7,5,71,[],[],https://twitter.com/DMC_Ryan/status/907657689466945536,False,,0,,,,,,,,[],,,,
907625873125371905,907625873125371905,2017-09-12 15:24:05 UTC,2017-09-12,15:24:05,+0000,94543804,tansuyegen,Tansu YEĞEN,,"Tesla, fırtınada yaşanan benzin sıkıntısına karşı, bölgedeki arabaların yazılımlarını geçici güncelleyerek ek 48km sürüş mesafesi kazandırdı  https://t.co/IRLRyvcfxo",tr,[],[],[],6,219,438,[],[],https://twitter.com/TansuYegen/status/907625873125371905,False,,1,https://pbs.twimg.com/ext_tw_video_thumb/907625759497379840/pu/img/xegrSONTDlaDX4W7.jpg,,,,,,,[],,,,
907612781712695297,907612781712695297,2017-09-12 14:32:04 UTC,2017-09-12,14:32:04,+0000,120881495,laurbudd,lauren budd,,Dismaying that there's not one person on Elon Musk's staff brave enough to tell him that the Tesla logo looks like an IUD,en,[],[],[],5,13,83,[],[],https://twitter.com/laurbudd/status/907612781712695297,False,,0,,,,,,,,[],,,,
907581930455097344,907581930455097344,2017-09-12 12:29:28 UTC,2017-09-12,12:29:28,+0000,704835627183788032,model3owners,Trev Page,,Tesla is definitely starting low volume deliveries. Photos by forum member PTFI #tesla #model3  https://t.co/A9LZIbMcr6,en,[],[],"['https://pbs.twimg.com/media/DJhg8bEVwAUsIzo.jpg', 'https://pbs.twimg.com/media/DJhg8bFVAAAt4_w.jpg', 'https://pbs.twimg.com/media/DJhg8bEUQAAn1Mx.jpg', 'https://pbs.twimg.com/media/DJhg8bEV4AAGmSp.jpg']",15,40,207,"['tesla', 'model3']",[],https://twitter.com/Model3Owners/status/907581930455097344,False,,1,https://pbs.twimg.com/media/DJhg8bEVwAUsIzo.jpg,,,,,,,[],,,,
907576618528514048,907576618528514048,2017-09-12 12:08:22 UTC,2017-09-12,12:08:22,+0000,704835627183788032,model3owners,Trev Page,,First Model 3 delivered to one of our forum members! #tesla #model3  https://t.co/1zsPNQEguE  https://t.co/ZVqmTFJyNk,en,[],['https://model3ownersclub.com/threads/1st-time-ev-tesla-owner-soon.4727/page-4#post-44293'],['https://pbs.twimg.com/media/DJhcHq-WsAUs95N.jpg'],11,27,263,"['tesla', 'model3']",[],https://twitter.com/Model3Owners/status/907576618528514048,False,,1,https://pbs.twimg.com/media/DJhcHq-WsAUs95N.jpg,,,,,,,[],,,,
907569510030434304,907568501354790912,2017-09-12 11:40:07 UTC,2017-09-12,11:40:07,+0000,6484432,destraynor,Des Traynor,,@paulg Equally important:  *Purchase* one of your company's cars as (a normal customer would) and then purchase a Tesla.,en,[],[],[],2,14,125,[],[],https://twitter.com/destraynor/status/907569510030434304,False,,0,,,,,,,,"[{'screen_name': 'paulg', 'name': 'Paul Graham', 'id': '183749519'}]",,,,
907551767554134019,907551767554134019,2017-09-12 10:29:37 UTC,2017-09-12,10:29:37,+0000,19962363,rolandtichy,Roland Tichy,,Stell Dir vor es ist Hurrikan und Du hast nur einen Tesla. Wie das Auto zur ferngesteuerten Falle wird.  https://t.co/MX6hzrwnzl,de,[],['https://www.tichyseinblick.de/meinungen/tesla-und-der-hurrikan/'],[],18,57,82,[],[],https://twitter.com/RolandTichy/status/907551767554134019,False,,0,,,,,,,,[],,,,
907495812468322305,907495812468322305,2017-09-12 06:47:16 UTC,2017-09-12,06:47:16,+0000,1102984189,sirjadeja,Sir Jadeja fan,,RT If You Can Spot Two ZEROes In The Pic. 🙃🙈😂  Rahul Gandhi #RahulGandhi #RGinUS #Tesla #Berkeley  https://t.co/DiPzkZxima,en,[],[],['https://pbs.twimg.com/media/DJgSeusUEAAFDg5.jpg'],29,88,214,"['rahulgandhi', 'rginus', 'tesla', 'berkeley']",[],https://twitter.com/SirJadeja/status/907495812468322305,False,,1,https://pbs.twimg.com/media/DJgSeusUEAAFDg5.jpg,,,,,,,[],,,,
907462283521085440,907462283521085440,2017-09-12 04:34:02 UTC,2017-09-12,04:34:02,+0000,275686563,verge,The Verge,,Tesla reveals smaller Supercharger stations made for cities  https://t.co/HoWeaI6uy5  https://t.co/bFkWoQ8lIN,en,[],['https://www.theverge.com/2017/9/11/16287606/tesla-city-supercharger-stations-charging?utm_campaign=theverge&utm_content=chorus&utm_medium=social&utm_source=twitter'],['https://pbs.twimg.com/media/DJf0IuKUEAAwLI9.jpg'],1,57,180,[],[],https://twitter.com/verge/status/907462283521085440,False,,1,https://pbs.twimg.com/media/DJf0IuKUEAAwLI9.jpg,,,,,,,[],,,,
907448615186128896,907448615186128896,2017-09-12 03:39:44 UTC,2017-09-12,03:39:44,+0000,15105606,joesteel,Joe Rosensteel 🏳️‍🌈,,"iPhone SE, X  Take that, Tesla.",en,[],[],[],3,44,194,[],[],https://twitter.com/joesteel/status/907448615186128896,False,,0,,,,,,,,[],,,,
907424068269334528,907424068269334528,2017-09-12 02:02:11 UTC,2017-09-12,02:02:11,+0000,24598091,hannahrayninja,Hannah,,Had to break in the tesla with EXO.  https://t.co/dFKU5hGiTu,en,[],[],['https://pbs.twimg.com/media/DJfRYGeUIAAIEN5.jpg'],6,3,76,[],[],https://twitter.com/HannahRayNinja/status/907424068269334528,False,,1,https://pbs.twimg.com/media/DJfRYGeUIAAIEN5.jpg,,,,,,,[],,,,
907422409439006727,907422409439006727,2017-09-12 01:55:36 UTC,2017-09-12,01:55:36,+0000,2494636442,bananabillll,Bill 🍌,,I just want an eco friendly home with a Tesla in the front 🙏🏾,en,[],[],[],1,39,117,[],[],https://twitter.com/bananabillll/status/907422409439006727,False,,0,,,,,,,,[],,,,
907421762182414336,907421762182414336,2017-09-12 01:53:01 UTC,2017-09-12,01:53:01,+0000,5120691,wef,World Economic Forum,,This drone footage shows just how huge Tesla's Gigafactory really is  https://t.co/CqohEFobRZ  https://t.co/1dGqvKmaUc,en,[],['http://wef.ch/2vGSjrj'],['https://pbs.twimg.com/media/DJfPSFIUIAAUKHs.jpg'],2,56,73,[],[],https://twitter.com/wef/status/907421762182414336,False,,1,https://pbs.twimg.com/media/DJfPSFIUIAAUKHs.jpg,,,,,,,[],,,,
907407428966404101,907407428966404101,2017-09-12 00:56:04 UTC,2017-09-12,00:56:04,+0000,816653,techcrunch,TechCrunch,,Tesla begins Supercharger network city expansion with Chicago and Boston  https://t.co/HDrWidB8sF  https://t.co/ztcbtBnPPh,en,[],['http://tcrn.ch/2vPRlVE'],['https://pbs.twimg.com/media/DJfCPtHUIAUCERz.jpg'],4,34,72,[],[],https://twitter.com/TechCrunch/status/907407428966404101,False,,1,https://pbs.twimg.com/media/DJfCPtHUIAUCERz.jpg,,,,,,,[],,,,
907398095964704768,907398095964704768,2017-09-12 00:18:59 UTC,2017-09-12,00:18:59,+0000,292625424,wallace_design,Mike Wallace,"{'type': 'Point', 'coordinates': [28.51, -81.32]}",A huge thank you to @solarcity tesla_energy and @elonmusk .  In the  blackout aftermath of…  https://t.co/UFCS96MbFb,en,"[{'screen_name': 'solarcity', 'name': 'solarcity', 'id': '17824922'}, {'screen_name': 'elonmusk', 'name': 'elon musk', 'id': '44196397'}]",['https://www.instagram.com/p/BY66u5rFQfH/'],[],12,147,823,[],[],https://twitter.com/Wallace_Design/status/907398095964704768,False,,0,,,,,,,,[],,,,
