id,conversation_id,created_at,date,time,timezone,user_id,username,name,place,tweet,language,mentions,urls,photos,replies_count,retweets_count,likes_count,hashtags,cashtags,link,retweet,quote_url,video,thumbnail,near,geo,source,user_rt_id,user_rt,retweet_id,reply_to,retweet_date,translate,trans_src,trans_dest
851928773830234112,851928773830234112,2017-04-11 22:43:42 UTC,2017-04-11,22:43:42,+0000,275732971,g_quadri,Gabriel Quadri,,"Fin de la era del petróleo. Tesla vale más que General Motors en Wall Street.  Electricidad, el futuro. Reforma Energética abre el camino...",es,[],[],[],18,201,376,[],[],https://twitter.com/g_quadri/status/851928773830234112,False,,0,,,,,,,,[],,,,
851898049219768322,851898049219768322,2017-04-11 20:41:37 UTC,2017-04-11,20:41:37,+0000,768576067821010944,markadanisman,Marka Danışmanı,,"Piyasa değeri 51,75 milyar dolara yükselen Tesla, General Motors'u geride bırakarak, ABD’nin en değerli otomobil markası oldu.  https://t.co/SZCpnIlp00",tr,[],[],"['https://pbs.twimg.com/media/C9KMv68UQAAUkDH.jpg', 'https://pbs.twimg.com/media/C9KMv6_UAAAxu72.jpg']",0,30,69,[],[],https://twitter.com/markadanisman/status/851898049219768322,False,,1,https://pbs.twimg.com/media/C9KMv68UQAAUkDH.jpg,,,,,,,[],,,,
851866480375463936,851866480375463936,2017-04-11 18:36:10 UTC,2017-04-11,18:36:10,+0000,3342603327,tedaselectricas,⚡,,Nikola TESLA'nın Askerleriyiz!,tr,[],[],[],9,76,1008,[],[],https://twitter.com/tedaselectricas/status/851866480375463936,False,,0,,,,,,,,[],,,,
851846792501239812,851846792501239812,2017-04-11 17:17:56 UTC,2017-04-11,17:17:56,+0000,2467791,washingtonpost,The Washington Post,,"Tesla’s ""crazy"" climb to America’s most valuable car company  https://t.co/AI81AU2cMj",en,[],['http://wapo.st/2omGzU2'],[],5,61,102,[],[],https://twitter.com/washingtonpost/status/851846792501239812,False,,0,,,,,,,,[],,,,
851839889868034048,851839889868034048,2017-04-11 16:50:30 UTC,2017-04-11,16:50:30,+0000,95740980,ed_crooks,Ed Crooks,,"Imagine Nikola Tesla, dying in poverty in NYC in 1943, being told that in 75 years a company named after him would be worth more than GM  https://t.co/7BmlY8Uk6V",en,[],['https://twitter.com/FT/status/851837567951671298'],[],5,54,75,[],[],https://twitter.com/Ed_Crooks/status/851839889868034048,False,https://twitter.com/FT/status/851837567951671298,0,,,,,,,,[],,,,
851839776999305216,851839776999305216,2017-04-11 16:50:03 UTC,2017-04-11,16:50:03,+0000,3108351,wsj,The Wall Street Journal,,Elon Musk has an awkward problem at Tesla: employee parking  https://t.co/mYLxleFgDC  https://t.co/CIITeJMr8G,en,[],['http://on.wsj.com/2omNgVQ'],['https://pbs.twimg.com/media/C9JXwrjXgAAUqof.jpg'],14,42,76,[],[],https://twitter.com/WSJ/status/851839776999305216,False,,1,https://pbs.twimg.com/media/C9JXwrjXgAAUqof.jpg,,,,,,,[],,,,
851823371981639681,851823371981639681,2017-04-11 15:44:52 UTC,2017-04-11,15:44:52,+0000,1652541,reuters,Reuters,,"Tesla becomes most valuable U.S. car maker, edges out GM  https://t.co/MrSSMUQtnF  https://t.co/BecyshtBAD",en,[],['http://reut.rs/2ppIrdN'],['https://pbs.twimg.com/media/C9JI12LXYAgLqgR.jpg'],9,131,201,[],[],https://twitter.com/Reuters/status/851823371981639681,False,,1,https://pbs.twimg.com/media/C9JI12LXYAgLqgR.jpg,,,,,,,[],,,,
851819344149565441,851819344149565441,2017-04-11 15:28:52 UTC,2017-04-11,15:28:52,+0000,18856867,zerohedge,zerohedge,,"Tesla’s Valuation Is ‘Inexplicable,’ Autonation CEO Says  someone didnt read the Piper ""analysis""  https://t.co/vo2OBTxIvm",en,[],[],['https://pbs.twimg.com/media/C9JFHQLV0AAhapI.jpg'],10,57,102,[],[],https://twitter.com/zerohedge/status/851819344149565441,False,,1,https://pbs.twimg.com/media/C9JFHQLV0AAhapI.jpg,,,,,,,[],,,,
851782199921848320,851782199921848320,2017-04-11 13:01:16 UTC,2017-04-11,13:01:16,+0000,18762875,matteorenzi,Matteo Renzi,,"Ambiente, Tesla, G7 e i bonus dei #millegiorni. #avanti  https://t.co/cNjfmvkZMv",pt,[],['https://www.facebook.com/matteorenziufficiale/posts/10154772480039915'],[],56,136,358,"['millegiorni', 'avanti']",[],https://twitter.com/matteorenzi/status/851782199921848320,False,,0,,,,,,,,[],,,,
851723462917967872,851723462917967872,2017-04-11 09:07:52 UTC,2017-04-11,09:07:52,+0000,759251,cnn,CNN,,"Tesla surpasses GM to become most valuable car company in US, despite selling far fewer cars than older competitors  https://t.co/wGIZxgUITE  https://t.co/TIKd6CqUOl",en,[],['http://cnn.it/2p2fKUR'],['https://pbs.twimg.com/media/C9Ht-ZgXoAAsTpT.jpg'],20,211,410,[],[],https://twitter.com/CNN/status/851723462917967872,False,,1,https://pbs.twimg.com/media/C9Ht-ZgXoAAsTpT.jpg,,,,,,,[],,,,
851678099553038336,851678099553038336,2017-04-11 06:07:37 UTC,2017-04-11,06:07:37,+0000,60867983,michaeljordaan,Michael Jordaan,,Most exciting part of Tesla becoming most valuable car company in US is that competitors will respond by also building electric cars  https://t.co/w86PDxKGkd,en,[],[],['https://pbs.twimg.com/media/C9HEtUvXgAAx7Xt.jpg'],6,40,75,[],[],https://twitter.com/MichaelJordaan/status/851678099553038336,False,,1,https://pbs.twimg.com/media/C9HEtUvXgAAx7Xt.jpg,,,,,,,[],,,,
851663606865313795,851663606865313795,2017-04-11 05:10:01 UTC,2017-04-11,05:10:01,+0000,2097571,cnni,CNN International,,"Tesla surpasses GM to become most valuable car company in US, despite selling far fewer cars than older competitors  https://t.co/B2PA8MITMD  https://t.co/vkYt23NIXI",en,[],['http://cnn.it/2oZO0mR'],['https://pbs.twimg.com/media/C9G3iRyUIAAkPu6.jpg'],1,87,115,[],[],https://twitter.com/cnni/status/851663606865313795,False,,1,https://pbs.twimg.com/media/C9G3iRyUIAAkPu6.jpg,,,,,,,[],,,,
851663606483750912,851663606483750912,2017-04-11 05:10:01 UTC,2017-04-11,05:10:01,+0000,759251,cnn,CNN,,"Tesla surpasses GM to become most valuable car company in US, despite selling far fewer cars than older competitors  https://t.co/xdN8VNjm2S  https://t.co/jgFJCYkkt2",en,[],['http://cnn.it/2oZEuzS'],['https://pbs.twimg.com/media/C9G3iQ4VYAAcKQS.jpg'],30,335,818,[],[],https://twitter.com/CNN/status/851663606483750912,False,,1,https://pbs.twimg.com/media/C9G3iQ4VYAAcKQS.jpg,,,,,,,[],,,,
851630483935039488,851630483935039488,2017-04-11 02:58:24 UTC,2017-04-11,02:58:24,+0000,25053299,fortunemagazine,FORTUNE,,Tesla overtakes GM as America's most valuable automaker  https://t.co/mlCyEZfalU,en,[],['http://for.tn/2oSXa4Q'],[],8,76,81,[],[],https://twitter.com/FortuneMagazine/status/851630483935039488,False,,0,,,,,,,,[],,,,
851593967972098048,851593967972098048,2017-04-11 00:33:18 UTC,2017-04-11,00:33:18,+0000,2467791,washingtonpost,The Washington Post,,"Tesla has yet to turn a profit, but it just passed GM as the most valuable American car company  https://t.co/2FtJl11BhZ",en,[],['http://wapo.st/2okYHxv'],[],30,181,327,[],[],https://twitter.com/washingtonpost/status/851593967972098048,False,,0,,,,,,,,[],,,,
851589362542419969,851589362542419969,2017-04-11 00:15:00 UTC,2017-04-11,00:15:00,+0000,14372486,engadget,Engadget,,Tesla overtakes GM to become the most valuable US car maker  https://t.co/DZ1wmqPvoW,en,[],['http://engt.co/2oRMdQP'],[],5,69,120,[],[],https://twitter.com/engadget/status/851589362542419969,False,,0,,,,,,,,[],,,,
