id,conversation_id,created_at,date,time,timezone,user_id,username,name,place,tweet,language,mentions,urls,photos,replies_count,retweets_count,likes_count,hashtags,cashtags,link,retweet,quote_url,video,thumbnail,near,geo,source,user_rt_id,user_rt,retweet_id,reply_to,retweet_date,translate,trans_src,trans_dest
1032045042519732229,1032045042519732229,2018-08-21 23:21:27 UTC,2018-08-21,23:21:27,+0000,14171401,mayemusk,Maye Musk,,.@LenosGarage Looks like fun🤩 @Tesla #roadster #EV #CleanEnergy #Thursday @CNBC,en,"[{'screen_name': 'lenosgarage', 'name': ""jay leno's garage"", 'id': '133420513'}, {'screen_name': 'tesla', 'name': 'tesla', 'id': '13298072'}, {'screen_name': 'cnbc', 'name': 'cnbc', 'id': '20402945'}]",[],[],6,32,147,"['roadster', 'ev', 'cleanenergy', 'thursday']",[],https://twitter.com/mayemusk/status/1032045042519732229,False,https://twitter.com/LenosGarage/status/1031982905059422208,0,,,,,,,,[],,,,
1032043139496722433,1032042656040251392,2018-08-21 23:13:53 UTC,2018-08-21,23:13:53,+0000,92356429,djsnm,Scott Manley,,@elonmusk Does anyone have the relevant derivatives of Tesla motion to quantify Snap/Crackle/Pop (or even Jerk for that matter),en,[],[],[],8,2,124,[],[],https://twitter.com/DJSnM/status/1032043139496722433,False,,0,,,,,,,,"[{'screen_name': 'elonmusk', 'name': 'Elon Musk', 'id': '44196397'}]",,,,
1032030853554155520,1032030853554155520,2018-08-21 22:25:04 UTC,2018-08-21,22:25:04,+0000,115735573,patoborghetti,Patricio Borghetti,,"Hola @thalia , oye, qué me gané por el #ThaliaChallenge ???? Aquí algunas ideas de premios : 3: Una Licuadora (y ver el Tesla de lejos) 2: Dar una vuelta en el Tesla 1: Conocerte en persona y dar una vuelta en el Tesla",es,"[{'screen_name': 'thalia', 'name': 'thalia', 'id': '4101221'}]",[],[],33,78,682,['thaliachallenge'],[],https://twitter.com/patoborghetti/status/1032030853554155520,False,,0,,,,,,,,[],,,,
1032029112322277377,1032029112322277377,2018-08-21 22:18:09 UTC,2018-08-21,22:18:09,+0000,13298072,tesla,Tesla,,Model 3 arrives in Australia 🇦🇺  https://t.co/1YhjoSLHAl,ca,[],['https://cards.twitter.com/cards/7x0uw/642zt'],[],211,738,7846,[],[],https://twitter.com/Tesla/status/1032029112322277377,False,,0,,,,,,,,[],,,,
1032026910002491392,1032026910002491392,2018-08-21 22:09:24 UTC,2018-08-21,22:09:24,+0000,4852289459,theteslalife,TheTeslaLife,,"Tesla continues to get more and more efficient with the #Model3 production, reducing man hours and cost per car  https://t.co/YyZra34zaM  https://t.co/PrhPXAs60G",en,[],['https://electrek.co/2018/08/21/tesla-model-3-production-labor-improvement-rework-most-cars/'],['https://pbs.twimg.com/media/DlJ_AGKXcAAdBMC.jpg'],1,14,80,['model3'],[],https://twitter.com/TheTeslaLife/status/1032026910002491392,False,,1,https://pbs.twimg.com/media/DlJ_AGKXcAAdBMC.jpg,,,,,,,[],,,,
1032026093698592774,1032026093698592774,2018-08-21 22:06:09 UTC,2018-08-21,22:06:09,+0000,436103176,teslaband,TESLA™,,"TESLA have added Huntington, NY @TheParamountNY ​on October 25 to their fall headline dates. General Tickets &amp; VIP packages go on sale August 24.  Info at:  https://t.co/KfLXGBCsDV  https://t.co/e8mj1svb17",en,"[{'screen_name': 'theparamountny', 'name': 'the paramount', 'id': '300984169'}]",['http://TeslaTheBand.com'],[],8,15,104,[],[],https://twitter.com/TeslaBand/status/1032026093698592774,False,,1,https://pbs.twimg.com/ext_tw_video_thumb/1032025720497876992/pu/img/6IRp4hVVm34qkQ22.jpg,,,,,,,[],,,,
1032024618670936065,1032024618670936065,2018-08-21 22:00:17 UTC,2018-08-21,22:00:17,+0000,553713584,wu_tang_finance,Wu-Tang Financial 🥑,,RIP HOOTERS RIP PAUL MANAFORT RIP ARETHA FRANKLIN RIP MICHAEL COHEN RIP “A CANDIDATE FOR FEDERAL OFFICE” RIP OLD DIRTY BASTARD (dirty dirty) RIP TESLA,en,[],[],[],20,152,954,[],[],https://twitter.com/Wu_Tang_Finance/status/1032024618670936065,False,,0,,,,,,,,[],,,,
1032021080968507392,1032021080968507392,2018-08-21 21:46:14 UTC,2018-08-21,21:46:14,+0000,272961747,daveb_vt,DaveB in VT,,RT @LenosGarage: Tesla or fighter plane?  Don't miss #JayLenosGarage Thursday at 10p ET/PT on CNBC!  https://t.co/qXjdgL4jNY,en,"[{'screen_name': 'lenosgarage', 'name': ""jay leno's garage"", 'id': '133420513'}]",[],[],9,37,141,['jaylenosgarage'],[],https://twitter.com/daveb_vt/status/1032021080968507392,False,,1,https://pbs.twimg.com/amplify_video_thumb/1031982705200779264/img/rQD-VERb-0JH7T68.jpg,,,,,,,[],,,,
1032002985784684544,1032002985784684544,2018-08-21 20:34:20 UTC,2018-08-21,20:34:20,+0000,1015952550925914112,bourcastle,bourcastle,,Wouldn’t be surprised if #Tesla would still trade above $300 even AFTER the company has filed chapter 11. $TSLA $TSLAQ,en,[],[],[],2,3,61,['tesla'],"['tsla', 'tslaq']",https://twitter.com/bourcastle/status/1032002985784684544,False,,0,,,,,,,,[],,,,
1031996658697957376,1031996658697957376,2018-08-21 20:09:11 UTC,2018-08-21,20:09:11,+0000,15199539,markmilian,Mark Milian,,Grimes is like Yoko for Tesla nerds.,en,[],[],[],9,47,302,[],[],https://twitter.com/markmilian/status/1031996658697957376,False,,0,,,,,,,,[],,,,
1031985312275283968,1031985312275283968,2018-08-21 19:24:06 UTC,2018-08-21,19:24:06,+0000,1308211178,teslarati,TESLARATI,,Reimagining Tesla's next-gen Roadster in Matte Black following @MKBHD's interview w/ Musk and his thoughts on matte paint  https://t.co/JuzoZVuaZZ,en,"[{'screen_name': 'mkbhd', 'name': 'marques brownlee', 'id': '29873662'}]",['https://www.teslarati.com/tesla-next-gen-roadster-matte-black-paint-color/'],[],17,53,378,[],[],https://twitter.com/Teslarati/status/1031985312275283968,False,,0,,,,,,,,[],,,,
1031982905059422208,1031982905059422208,2018-08-21 19:14:32 UTC,2018-08-21,19:14:32,+0000,133420513,lenosgarage,Jay Leno's Garage,,Tesla or fighter plane?  Don't miss #JayLenosGarage Thursday at 10p ET/PT on CNBC!  https://t.co/gtjFhCDzO4,en,[],[],[],137,1482,7245,['jaylenosgarage'],[],https://twitter.com/LenosGarage/status/1031982905059422208,False,,1,https://pbs.twimg.com/amplify_video_thumb/1031982705200779264/img/rQD-VERb-0JH7T68.jpg,,,,,,,[],,,,
1031979407026601984,1031979407026601984,2018-08-21 19:00:38 UTC,2018-08-21,19:00:38,+0000,2148233600,electrekco,Electrek.co,,Tesla expands solar roof tile installations to the Northeast | by @fredericlambert  https://t.co/Nw8Iv0dg6S  https://t.co/IUB54f38va,en,"[{'screen_name': 'fredericlambert', 'name': 'fred lambert', 'id': '38253449'}]",['https://electrek.co/2018/08/21/tesla-solar-roof-tile-expand-installation-northeast/'],['https://pbs.twimg.com/media/DlJTzRjU4AABRsy.jpg'],3,69,311,[],[],https://twitter.com/ElectrekCo/status/1031979407026601984,False,,1,https://pbs.twimg.com/media/DlJTzRjU4AABRsy.jpg,,,,,,,[],,,,
1031967565499645952,1031967565499645952,2018-08-21 18:13:35 UTC,2018-08-21,18:13:35,+0000,980554784133427200,barkmsmeagol,Bark 👀,,$TSLAQ : “We are so smart(ish)! We are expert 10K readers and interpreters!! We know what’s “really” going on with Tesla! $TSLA IS A ZERO!!!”  Reality: The $TSLAQ cult are the flat earthers of the stock market 😂👇🏼,en,[],[],[],2,18,55,[],"['tslaq', 'tsla', 'tslaq']",https://twitter.com/BarkMSmeagol/status/1031967565499645952,False,https://twitter.com/SnoozeThroughF1/status/1031892312765358081,0,,,,,,,,[],,,,
1031962473128067072,1031962473128067072,2018-08-21 17:53:21 UTC,2018-08-21,17:53:21,+0000,1019034318566449152,davidro19158533,David Roberts,,"$TSLA Breaking news for everyone following Tesla.  Other car companies keep cars ""rotting"" and ""melting"" in parking lots! I had to do a lot of surveillance to find this lot looking like this. They call them dealerships and they have tons of USELESS inventory sitting out. Tsk tsk  https://t.co/TlEhzRxSjx",en,[],[],['https://pbs.twimg.com/media/DlJEOapUUAAWQAE.jpg'],4,11,53,[],['tsla'],https://twitter.com/DavidRo19158533/status/1031962473128067072,False,,1,https://pbs.twimg.com/media/DlJEOapUUAAWQAE.jpg,,,,,,,[],,,,
1031961677435219968,1031959950870945793,2018-08-21 17:50:11 UTC,2018-08-21,17:50:11,+0000,229232438,lexiheft,Lexi Heft,,"@elonmusk @wuhfel Elon, we’d like Tesla nav to allow waypoints instead of just one destination (in the car’s native nav).   And trip planning with origin other than current location.  Also, being able to prep the nav via Tesla app and get in the car and go with all destinations set.   Thanks!  https://t.co/d5TqRCr1CO",en,[],[],['https://pbs.twimg.com/media/DlJDrEuU8AAmDHL.jpg'],16,7,110,[],[],https://twitter.com/lexiheft/status/1031961677435219968,False,,1,https://pbs.twimg.com/media/DlJDrEuU8AAmDHL.jpg,,,,,,,"[{'screen_name': 'elonmusk', 'name': 'Elon Musk', 'id': '44196397'}]",,,,
1031960997714649088,1031960997714649088,2018-08-21 17:47:29 UTC,2018-08-21,17:47:29,+0000,75067369,oomenberlin,Matthias Oomen 🏳️‍🌈🇪🇺,,"Geld für Autobahnneubau: ""Arbeitsplätze!"" Geld für Autokauf: ""Arbeitsplätze!"" Geld für Elektroautokauf: ""Arbeitsplätze!"" Geld für neues Tesla-Werk: ""Arbeitsplätze!"" Geld für Air Berlin-Pleite: ""Arbeitsplätze!"" Geld für Bus- und Bahn auf dem Land: ""Was daaaaaaaaas kostet!!!""",de,[],[],[],13,225,718,[],[],https://twitter.com/OomenBerlin/status/1031960997714649088,False,,0,,,,,,,,[],,,,
1031960462609412096,1031960462609412096,2018-08-21 17:45:21 UTC,2018-08-21,17:45:21,+0000,95438524,androidauth,Android Authority,,You could buy a Tesla Model 3 instead of this luxury Galaxy Note 9 Gold Edition  https://t.co/76O9ZuvRAB #smartphone #galaxynote9,en,[],['https://trib.al/WaQVnfa'],[],9,21,177,"['smartphone', 'galaxynote9']",[],https://twitter.com/AndroidAuth/status/1031960462609412096,False,,0,,,,,,,,[],,,,
1031956719050485760,1031956719050485760,2018-08-21 17:30:29 UTC,2018-08-21,17:30:29,+0000,14707666,madmagazine,MAD Magazine,,"With brilliant but erratic Elon Musk as CEO, Tesla is at risk of going broke and fading into obscurity. Note to self: Don’t name company after brilliant but erratic guy who went broke and faded into obscurity.",en,[],[],[],4,35,140,[],[],https://twitter.com/MADmagazine/status/1031956719050485760,False,,0,,,,,,,,[],,,,
1031946022904320001,1031946022904320001,2018-08-21 16:47:59 UTC,2018-08-21,16:47:59,+0000,75618393,petrovchris,Chris P,,"Four months with my Model 3. The best car I have ever driven, by far. Can't stop smiling during drives. Everyone that rides it wants one. Kudos to @elonmusk and the @Tesla team! $TSLA",en,"[{'screen_name': 'elonmusk', 'name': 'elon musk', 'id': '44196397'}, {'screen_name': 'tesla', 'name': 'tesla', 'id': '13298072'}]",[],[],2,7,78,[],['tsla'],https://twitter.com/petrovchris/status/1031946022904320001,False,,0,,,,,,,,[],,,,
1031945579067260929,1031945579067260929,2018-08-21 16:46:13 UTC,2018-08-21,16:46:13,+0000,3167257102,erdayastronaut,Everyday Astronaut,,Just found out it's not too late to change our interior color choice for our @Tesla #model3... So which looks better? White or black? (Vote in the next tweet)  https://t.co/UpzC1YXs3p,en,"[{'screen_name': 'tesla', 'name': 'tesla', 'id': '13298072'}]",[],"['https://pbs.twimg.com/media/DlI0-u9U4AA6SPY.jpg', 'https://pbs.twimg.com/media/DlI0-u-VsAAQf54.jpg']",30,4,101,['model3'],[],https://twitter.com/Erdayastronaut/status/1031945579067260929,False,,1,https://pbs.twimg.com/media/DlI0-u9U4AA6SPY.jpg,,,,,,,[],,,,
1031938516320567296,1031938516320567296,2018-08-21 16:18:09 UTC,2018-08-21,16:18:09,+0000,349249475,gerberkawasaki,Ross Gerber,,Trying to get @Gfilche to come to Santa Monica and do a #tesla talk in my #TeslaModel3 on autopilot. If you’re a Tesla fan and want to see the ultimate full $tsla talk. RT.,en,"[{'screen_name': 'gfilche', 'name': 'gali', 'id': '348844712'}]",[],[],10,92,241,"['tesla', 'teslamodel3']",['tsla'],https://twitter.com/GerberKawasaki/status/1031938516320567296,False,,0,,,,,,,,[],,,,
1031935648905744385,1031935648905744385,2018-08-21 16:06:45 UTC,2018-08-21,16:06:45,+0000,2148233600,electrekco,Electrek.co,,"Tesla says labor hours have decreased by 30% on Model 3 production, reportedly had to 'rework' most cars in record week | by @fredericlambert  https://t.co/tpK1GK3zJ9  https://t.co/0geBgVmrEx",en,"[{'screen_name': 'fredericlambert', 'name': 'fred lambert', 'id': '38253449'}]",['https://electrek.co/2018/08/21/tesla-model-3-production-labor-improvement-rework-most-cars/'],['https://pbs.twimg.com/media/DlIsAOnV4AEddKM.jpg'],6,22,153,[],[],https://twitter.com/ElectrekCo/status/1031935648905744385,False,,1,https://pbs.twimg.com/media/DlIsAOnV4AEddKM.jpg,,,,,,,[],,,,
1031928193400238080,1031928193400238080,2018-08-21 15:37:08 UTC,2018-08-21,15:37:08,+0000,349249475,gerberkawasaki,Ross Gerber,,I’m not suggesting Tim leave Apple. If Apple bought part of Tesla. Tim could help Elon with many operational issues as well as speed up development with more capital.  It’s win win. Apple gets on the screen. Elon gets help from a master. Yoda. But it’s a dream. $tsla $aapl,en,[],[],[],34,25,163,[],"['tsla', 'aapl']",https://twitter.com/GerberKawasaki/status/1031928193400238080,False,,0,,,,,,,,[],,,,
1031923419250475010,1031923419250475010,2018-08-21 15:18:10 UTC,2018-08-21,15:18:10,+0000,1009930493381341184,teslaoptimist,TeslaOptimist,,"Tesla Model 3 in Australia: ""Staff were shocked at the demand and couldn't believe some people drove 8hrs just to be there"" #NoDemand $TSLA $TSLAP",en,[],[],[],11,84,315,['nodemand'],"['tsla', 'tslap']",https://twitter.com/TeslaOptimist/status/1031923419250475010,False,https://twitter.com/S_Padival/status/1031859805919490048,0,,,,,,,,[],,,,
1031916172357193729,1031916172357193729,2018-08-21 14:49:22 UTC,2018-08-21,14:49:22,+0000,349249475,gerberkawasaki,Ross Gerber,,Tesla up $12 today rebounding as Morgan Stanley pulls its Tesla ratings. Probably advising on the deal no one believes is real. Elon has always worked with Goldman and Morgan. No way Jonas getting in the way of $60 mil in fees. $tsla $ms $gs,en,[],[],[],16,34,151,[],"['tsla', 'ms', 'gs']",https://twitter.com/GerberKawasaki/status/1031916172357193729,False,,0,,,,,,,,[],,,,
1031909991526137857,1031909991526137857,2018-08-21 14:24:48 UTC,2018-08-21,14:24:48,+0000,898021206967951360,teslapodcast,Rob Maurer,,This matters.  #Tesla #Model3 #Australia #Sydney $TSLA $TSLAQ,en,[],[],[],7,20,118,"['tesla', 'model3', 'australia', 'sydney']","['tsla', 'tslaq']",https://twitter.com/TeslaPodcast/status/1031909991526137857,False,https://twitter.com/TexWalkerRanger/status/1031712604748537856,0,,,,,,,,[],,,,
1031908706579935232,1031908706579935232,2018-08-21 14:19:42 UTC,2018-08-21,14:19:42,+0000,65545420,cfischer6,Chris Fischer,,Tesla Fire Sale going on.  https://t.co/CKltkAdH16   Probably nothing.  https://t.co/VVcBBcmgoc,en,[],['https://teslainventory.com/'],"['https://pbs.twimg.com/media/DlITde4UwAANqbr.jpg', 'https://pbs.twimg.com/media/DlITde5UcAAjb7m.jpg']",8,22,77,[],[],https://twitter.com/cfischer6/status/1031908706579935232,False,,1,https://pbs.twimg.com/media/DlITde4UwAANqbr.jpg,,,,,,,[],,,,
1031899657213890561,1031899657213890561,2018-08-21 13:43:44 UTC,2018-08-21,13:43:44,+0000,932181684,mattelif,Elif,,Tesla müzesindeyim Tesla’nın botlar aşırı iyiymiş nerden aldı acaba  https://t.co/TO4Kv4C8H1,tr,[],[],['https://pbs.twimg.com/media/DlILPcQW4AAdVtR.jpg'],1,2,257,[],[],https://twitter.com/mattelif/status/1031899657213890561,False,,1,https://pbs.twimg.com/media/DlILPcQW4AAdVtR.jpg,,,,,,,[],,,,
1031896951829098496,1031896951829098496,2018-08-21 13:32:59 UTC,2018-08-21,13:32:59,+0000,2148233600,electrekco,Electrek.co,,"Tesla could go to Apple for take-private deal, says investor – does it make sense?  https://t.co/S7amjusU3L by @FredericLambert  https://t.co/VcaJI9lieF",en,"[{'screen_name': 'fredericlambert', 'name': 'fred lambert', 'id': '38253449'}]",['https://electrek.co/2018/08/21/tesla-tsla-apple-take-private-deal-investor/'],['https://pbs.twimg.com/media/DlIIv3rUYAEE5Uk.jpg'],28,39,193,[],[],https://twitter.com/ElectrekCo/status/1031896951829098496,False,,1,https://pbs.twimg.com/media/DlIIv3rUYAEE5Uk.jpg,,,,,,,[],,,,
1031895167828148224,1031895167828148224,2018-08-21 13:25:54 UTC,2018-08-21,13:25:54,+0000,568621669,insideevs,InsideEVs,,"No Demand Though, Right? Massive Lines Form For @Tesla #Model3 Debut In Australia  https://t.co/amKpUKt5px",en,"[{'screen_name': 'tesla', 'name': 'tesla', 'id': '13298072'}]",['https://insideevs.com/massive-lines-form-tesla-model-3-australia/'],[],3,27,58,['model3'],[],https://twitter.com/InsideEVs/status/1031895167828148224,False,,0,,,,,,,,[],,,,
1031891669208072192,1031891669208072192,2018-08-21 13:12:00 UTC,2018-08-21,13:12:00,+0000,922306317292773377,model3vins,Model 3 VINs,,#Tesla registered 538 new #Model3 VINs. ~61% estimated to be dual motor. Highest VIN is 108729.  https://t.co/M1r7mmU9Cn,en,[],['https://www.nhtsa.gov/recalls?vin=5YJ3E1EA8JF108729#vin'],[],5,16,132,"['tesla', 'model3']",[],https://twitter.com/Model3VINs/status/1031891669208072192,False,,0,,,,,,,,[],,,,
1031888375689736194,1031888375689736194,2018-08-21 12:58:54 UTC,2018-08-21,12:58:54,+0000,998140573008695296,28delayslater,🇺🇦 🦊 Earl of FrunkPuppy 🇺🇦,,"Sick of reading these insane @tesla fan posts about a giant line to see the #model3 in Australia 🇦🇺.   As a #parkinglottruther, I snapped this pic of the #teslakiller @ChevyElectric #Bolt crowd.   $TSLAQ $TSLA #shortyairforce  https://t.co/Y3yHZIiRHG",en,"[{'screen_name': 'tesla', 'name': 'tesla', 'id': '13298072'}, {'screen_name': 'chevyelectric', 'name': 'chevy electric', 'id': '26335328'}]",[],['https://pbs.twimg.com/media/DlIBAb_XsAAi-dL.jpg'],9,15,65,"['model3', 'parkinglottruther', 'teslakiller', 'bolt', 'shortyairforce']","['tslaq', 'tsla']",https://twitter.com/28delayslater/status/1031888375689736194,False,,1,https://pbs.twimg.com/media/DlIBAb_XsAAi-dL.jpg,,,,,,,[],,,,
1031885501060534272,1031885501060534272,2018-08-21 12:47:29 UTC,2018-08-21,12:47:29,+0000,3255290759,gabehoff,Gabe Hoffman,,"Morgan Stanley suspends coverage, removes target price on $TSLA  Greater chance MS would dump Elon's stock to close out his massive margin loan, than there is of any I- Bank underwriting an offering for a company like Tesla, under SEC investigation for lying to investors",en,[],[],[],6,14,75,[],['tsla'],https://twitter.com/GabeHoff/status/1031885501060534272,False,,0,,,,,,,,[],,,,
1031882655871197184,1031882655871197184,2018-08-21 12:36:11 UTC,2018-08-21,12:36:11,+0000,33792634,andrewrsorkin,Andrew Ross Sorkin,,"Whether you're a bull or bear on Tesla, this is pretty funny...",en,[],[],[],14,21,135,[],[],https://twitter.com/andrewrsorkin/status/1031882655871197184,False,https://twitter.com/FUD_Sheriff/status/1031881699163037697,0,,,,,,,,[],,,,
1031881902297239553,1031875942313025537,2018-08-21 12:33:11 UTC,2018-08-21,12:33:11,+0000,383833528,zaboutine,Zaboutine,,"@Millenium J'arrive pas a croire que vous êtes encore en poste.  Vous arrivez à faire passer les mêmes ""celui dont la lettre commence par P doit t'offrir une tesla"" de Facebook pour du contenu créatif.  A ce niveau c'est une perf.",fr,[],[],[],6,5,222,[],[],https://twitter.com/Zaboutine/status/1031881902297239553,False,,0,,,,,,,,[],,,,
1031877897404002304,1031877897404002304,2018-08-21 12:17:16 UTC,2018-08-21,12:17:16,+0000,18856867,zerohedge,zerohedge,,"Here comes the stock offering:  TESLA MOVED TO NOT RATED AT MORGAN STANLEY, PT REMOVED",en,[],[],[],11,40,89,[],[],https://twitter.com/zerohedge/status/1031877897404002304,False,,0,,,,,,,,[],,,,
1031867428584611841,1031867428584611841,2018-08-21 11:35:40 UTC,2018-08-21,11:35:40,+0000,91560792,jonohill_,Jono,,When I see this video it blows my mind that American citizens (or anyone for that matter) would focus so much energy on trying to bring @Tesla down. There was a time when there would have been nothing but pride and support for this kind of grit and ingenuity. $TSLA,en,"[{'screen_name': 'tesla', 'name': 'tesla', 'id': '13298072'}]",[],[],17,62,216,[],['tsla'],https://twitter.com/JonoHill_/status/1031867428584611841,False,https://twitter.com/MKBHD/status/1031649200176615427,0,,,,,,,,[],,,,
1031856251263766529,1031856251263766529,2018-08-21 10:51:15 UTC,2018-08-21,10:51:15,+0000,3890831236,meyman_ol,Meyman,,"O kadar cahilsiniz ki, dininiz var diye ahlaka ihtiyacınız kalmadığını sanıyorsunuz.    Nikola Tesla",tr,[],[],[],1,2,94,[],[],https://twitter.com/meyman_ol/status/1031856251263766529,False,,0,,,,,,,,[],,,,
1031854954040971265,1031854954040971265,2018-08-21 10:46:06 UTC,2018-08-21,10:46:06,+0000,889261315,proandroid,Pro Android 🥝,,"Tesla está fabricando actualmente más de 1000 coches AL DÍA (incluido sábado y domingo xDD):  - 800 Model 3 - 250 Model S y X  Mañana otros 1000 Teslas, pasado mañana otros 1000 Teslas...  Cada km recorrido con esos coches = 1km menos consumiendo petróleo.  https://t.co/puVCJlBfQ0",es,[],[],['https://pbs.twimg.com/media/DlHimoRW4AAm_is.jpg'],8,27,175,[],[],https://twitter.com/ProAndroid/status/1031854954040971265,False,,1,https://pbs.twimg.com/media/DlHimoRW4AAm_is.jpg,,,,,,,[],,,,
1031845562738458625,1031845562738458625,2018-08-21 10:08:47 UTC,2018-08-21,10:08:47,+0000,2148233600,electrekco,Electrek.co,,"Tesla Gigafactory 1 now employs over 3,000 workers as it becomes biggest battery factory in the world | by @fredericlambert  https://t.co/32dmb1nT3u  https://t.co/a0KyLFXO4D",en,"[{'screen_name': 'fredericlambert', 'name': 'fred lambert', 'id': '38253449'}]",['https://electrek.co/2018/08/21/tesla-gigafactory-1-3000-workers/'],['https://pbs.twimg.com/media/DlHaEiGUwAEem6l.jpg'],9,163,728,[],[],https://twitter.com/ElectrekCo/status/1031845562738458625,False,,1,https://pbs.twimg.com/media/DlHaEiGUwAEem6l.jpg,,,,,,,[],,,,
1031814699623620608,1031814699623620608,2018-08-21 08:06:09 UTC,2018-08-21,08:06:09,+0000,1308211178,teslarati,TESLARATI,,Elon Musk candidly shows how Tesla’s factory is balancing the Alien Dreadnought and human work   https://t.co/DBm60RTuZx,en,[],['https://www.teslarati.com/tesla-elon-musk-walkthrough-alien-dreadnought-human-work/'],[],5,69,436,[],[],https://twitter.com/Teslarati/status/1031814699623620608,False,,0,,,,,,,,[],,,,
1031792246734053378,1031792246734053378,2018-08-21 06:36:56 UTC,2018-08-21,06:36:56,+0000,1009930493381341184,teslaoptimist,TeslaOptimist,,Tesla FUD tracker 😄   https://t.co/CE7ElU2Z2I   $TSLA $TSLAP  https://t.co/T0wWTQlC6G,sv,[],['http://www.teslafudtracker.com'],['https://pbs.twimg.com/media/DlGplDmUUAMeaSq.jpg'],10,34,149,[],"['tsla', 'tslap']",https://twitter.com/TeslaOptimist/status/1031792246734053378,False,,1,https://pbs.twimg.com/media/DlGplDmUUAMeaSq.jpg,,,,,,,[],,,,
1031780454943342592,1031780454943342592,2018-08-21 05:50:04 UTC,2018-08-21,05:50:04,+0000,1729564622,laughlovelindy,🔴LIVE | LaughLoveLindy on Twitch📽️,,"#BeyondTheTable I'm a 26 year old extrovert who rarely leaves the house, have a fantastic hubby, and a Tesla kitty. I adore swing/latin/ballroom dancing and sewing/cosplay as hobbies. Went to college for IT and graphic design but fell in love with old house restoration for work.",en,[],[],[],1,1,50,['beyondthetable'],[],https://twitter.com/Laughlovelindy/status/1031780454943342592,False,,0,,,,,,,,[],,,,
1031772411740471296,1031772411740471296,2018-08-21 05:18:07 UTC,2018-08-21,05:18:07,+0000,275686563,verge,The Verge,,Tesla challenger Lucid Motors also in talks with Saudi Arabia for reported $1 billion funding  https://t.co/cxCjLkzVRy  https://t.co/UID0uglZX3,en,[],['https://www.theverge.com/2018/8/20/17757218/lucid-motors-saudi-arabia-funding-tesla-billion?utm_campaign=theverge&utm_content=chorus&utm_medium=social&utm_source=twitter'],['https://pbs.twimg.com/media/DlGXimOXcAAKxdI.jpg'],3,31,116,[],[],https://twitter.com/verge/status/1031772411740471296,False,,1,https://pbs.twimg.com/media/DlGXimOXcAAKxdI.jpg,,,,,,,[],,,,
1031759460811689984,1031759460811689984,2018-08-21 04:26:39 UTC,2018-08-21,04:26:39,+0000,349249475,gerberkawasaki,Ross Gerber,,Love it. Tesla Bull Has ‘Dream’ Tim Cook Will Help Elon Musk Run Company $tsla   https://t.co/JppysBHOeL,en,[],['https://www.bloomberg.com/news/articles/2018-08-20/tesla-bull-has-dream-tim-cook-will-help-elon-musk-run-company'],[],28,14,100,[],['tsla'],https://twitter.com/GerberKawasaki/status/1031759460811689984,False,,0,,,,,,,,[],,,,
1031755260476280832,1031755260476280832,2018-08-21 04:09:57 UTC,2018-08-21,04:09:57,+0000,1009930493381341184,teslaoptimist,TeslaOptimist,,"Tesla Model 3 viewing line in Sydney, Australia $TSLA $TSLAP  https://t.co/xz7kelBVJ9",de,[],[],['https://pbs.twimg.com/media/DlGH8O8U8AE8_4b.jpg'],19,52,191,[],"['tsla', 'tslap']",https://twitter.com/TeslaOptimist/status/1031755260476280832,False,,1,https://pbs.twimg.com/media/DlGH8O8U8AE8_4b.jpg,,,,,,,[],,,,
1031752765448577024,1031752765448577024,2018-08-21 04:00:02 UTC,2018-08-21,04:00:02,+0000,568621669,insideevs,InsideEVs,,"The new Roadster from #Tesla is expected to hit the market in 2020 at the earliest (pending no delays) and just like the first Roadster, it will be an eye-opener for EV doubters.  https://t.co/S7KduvYtQE  https://t.co/3vfDtPY5eN",en,[],['http://bit.ly/2wdCaXR'],['https://pbs.twimg.com/media/DlGFrCOXgAAGpvt.jpg'],0,29,102,['tesla'],[],https://twitter.com/InsideEVs/status/1031752765448577024,False,,1,https://pbs.twimg.com/media/DlGFrCOXgAAGpvt.jpg,,,,,,,[],,,,
1031723317399576582,1031723317399576582,2018-08-21 02:03:02 UTC,2018-08-21,02:03:02,+0000,33737369,pictureplane,🪄PICTUREPLANE🌙,,I wonder what Nikola Tesla would think about the company that uses his name now,en,[],[],[],4,10,72,[],[],https://twitter.com/pictureplane/status/1031723317399576582,False,,0,,,,,,,,[],,,,
1031723013073526784,1031723013073526784,2018-08-21 02:01:49 UTC,2018-08-21,02:01:49,+0000,944604607,briilynchh,Bri Lynch,,"No one cares that your truck is loud, it’s 2018 we want men in Tesla’s",en,[],[],[],1,54,186,[],[],https://twitter.com/briilynchh/status/1031723013073526784,False,,0,,,,,,,,[],,,,
