id,conversation_id,created_at,date,time,timezone,user_id,username,name,place,tweet,language,mentions,urls,photos,replies_count,retweets_count,likes_count,hashtags,cashtags,link,retweet,quote_url,video,thumbnail,near,geo,source,user_rt_id,user_rt,retweet_id,reply_to,retweet_date,translate,trans_src,trans_dest
1033192774093307904,1033191002033381376,2018-08-25 03:22:07 UTC,2018-08-25,03:22:07,+0000,66710003,stellarhewes,Matt Hewes,,@JayMassaro @Tesla He should not be on Twitter period.,en,[],[],[],18,4,150,[],[],https://twitter.com/stellarhewes/status/1033192774093307904,False,,0,,,,,,,,"[{'screen_name': 'Tesla', 'name': 'Tesla', 'id': '13298072'}]",,,,
1033192280977494016,1033192280977494016,2018-08-25 03:20:10 UTC,2018-08-25,03:20:10,+0000,2859448331,sarahtaber_bww,Dr Sarah Taber,,"It's late but you best believe I'll have some things to say on this tomorrow.  For now: a teaser: This isn't a fluke. The Tesla factory has a chronic ""whoops we caught on fire"" problem due to leadership negligence.   https://t.co/6sF7WYOKi8",en,[],['https://www.cnbc.com/2018/06/01/tesla-factory-paint-shop-fires-worse-than-revealed-workers.html'],[],8,25,76,[],[],https://twitter.com/SarahTaber_bww/status/1033192280977494016,False,https://twitter.com/nbcbayarea/status/1032789597644836864,0,,,,,,,,[],,,,
1033191700955639808,1033191700955639808,2018-08-25 03:17:51 UTC,2018-08-25,03:17:51,+0000,26574283,cnbcnow,CNBC Now,,"BREAKING: Tesla board, CEO Elon Musk announce that they have agreed to remain a public company.  https://t.co/jn8limUSe7",en,[],['http://cnbc.com'],[],71,301,432,[],[],https://twitter.com/CNBCnow/status/1033191700955639808,False,,0,,,,,,,,[],,,,
1033191002033381376,1033191002033381376,2018-08-25 03:15:05 UTC,2018-08-25,03:15:05,+0000,13298072,tesla,Tesla,,Staying Public  https://t.co/gUrAnInBOu,en,[],['https://www.tesla.com/blog/staying-public'],[],1022,4561,26931,[],[],https://twitter.com/Tesla/status/1033191002033381376,False,,0,,,,,,,,[],,,,
1033161503711670274,1033161503711670274,2018-08-25 01:17:52 UTC,2018-08-25,01:17:52,+0000,751445019207360512,lehtomita,Suemi,,"Se alguem do platao, do nobel ou do integral quiser manda dm (sou do tesla)  https://t.co/WtxrThYQeg",pt,[],[],['https://pbs.twimg.com/media/DlaG45pW0AAtk4k.jpg'],6,9,62,[],[],https://twitter.com/lehtomita/status/1033161503711670274,False,,1,https://pbs.twimg.com/media/DlaG45pW0AAtk4k.jpg,,,,,,,[],,,,
1033146445069672449,1033146445069672449,2018-08-25 00:18:02 UTC,2018-08-25,00:18:02,+0000,2405508338,metacrosa,Ale,,Este hilo es tremendo. El otro día un amigo (que tiene un amigo) que trabaja en la fábrica de Tesla model 3 me dijo que nunca compraría el auto si vieras el pipeline de construcción.,es,[],[],[],7,9,80,[],[],https://twitter.com/metacrosa/status/1033146445069672449,False,https://twitter.com/atomicthumbs/status/1032939617404645376,0,,,,,,,,[],,,,
1033141911874285568,1033141911874285568,2018-08-25 00:00:01 UTC,2018-08-25,00:00:01,+0000,565198801,teslainventory,Erik in DÆrik,,Matte black performance Tesla Model 3. Tesla solar. Tesla powerwalls. Tesla everything! #tesla #teslamotors #elonmusk #matteblack #teslamodel3 #performance @Tesla @elonmusk @mkbhd does this car fit your matte black everything stance? 😉  https://t.co/KbOZUwz7DX,en,"[{'screen_name': 'tesla', 'name': 'tesla', 'id': '13298072'}, {'screen_name': 'elonmusk', 'name': 'elon musk', 'id': '44196397'}, {'screen_name': 'mkbhd', 'name': 'marques brownlee', 'id': '29873662'}]",[],['https://pbs.twimg.com/media/DlZ1FB6VsAA_t9m.jpg'],5,8,97,"['tesla', 'teslamotors', 'elonmusk', 'matteblack', 'teslamodel3', 'performance']",[],https://twitter.com/teslainventory/status/1033141911874285568,False,,1,https://pbs.twimg.com/media/DlZ1FB6VsAA_t9m.jpg,,,,,,,[],,,,
