,id,conversation_id,created_at,date,time,timezone,user_id,username,name,place,tweet,language,mentions,urls,photos,replies_count,retweets_count,likes_count,hashtags,cashtags,link,retweet,quote_url,video,thumbnail,near,geo,source,user_rt_id,user_rt,retweet_id,reply_to,retweet_date,translate,trans_src,trans_dest,negative,neutral,positive
0,1013933432538267648,1013933432538267648,2018-07-02 23:52:22 UTC,2018-07-02,23:52:22,0,2148233600,electrekco,Electrek.co,,Ford mocks Tesla’s Model 3 production achievement despite lagging behind in electric vehicles  https://t.co/8QGJNnYEdG,en,[],['https://wp.me/pa0wC0-ihV'],[],41,57,244,[],[],https://twitter.com/ElectrekCo/status/1013933432538267648,False,,0,,,,,,,,[],,,,,0.090443954,0.7829149,0.1266411
1,1013932906337710081,1013932906337710081,2018-07-02 23:50:17 UTC,2018-07-02,23:50:17,0,63082578,aaronbastani,Aaron Bastani,,"Elon Musk, a billionaire entertaining fatuous nonsense “I’m going to shoot a Tesla into space”   JK Rowling, a billionaire entertaining fatuous nonsense “I’m going to get involved in the bizarre Eddie Marsan beef”  https://t.co/dnLRG6VgRI",en,[],['https://twitter.com/jk_rowling/status/1013757807500414979'],[],15,33,129,[],[],https://twitter.com/AaronBastani/status/1013932906337710081,False,https://twitter.com/jk_rowling/status/1013757807500414979,0,,,,,,,,[],,,,,0.41000977,0.5260179,0.063972354
2,1013918361137213440,1013918361137213440,2018-07-02 22:52:29 UTC,2018-07-02,22:52:29,0,34713362,business,Bloomberg,,"Tesla ""just became a real car company,"" Elon Musk says after hitting a critical milestone  https://t.co/NQP5A4iBiM  https://t.co/ij4N7amNHi",en,[],['https://bloom.bg/2MEJna1'],[],11,42,90,[],[],https://twitter.com/business/status/1013918361137213440,False,,1,https://pbs.twimg.com/media/DhIpXvzVAAEJUZX.jpg,,,,,,,[],,,,,0.00247309,0.12069707,0.8768298
3,1013916490721087490,1013916490721087490,2018-07-02 22:45:03 UTC,2018-07-02,22:45:03,0,154311445,stevewestly,Steve Westly,,"Elon Musk announced that Tesla Model 3 delivered 7,000 cars in one week.  If they sustain that, the Model 3 will be the largest selling car in the US!!   https://t.co/qBiF1rwk7K",en,[],['http://ow.ly/xh1930kLTAG'],[],6,18,93,[],[],https://twitter.com/SteveWestly/status/1013916490721087490,False,,0,,,,,,,,[],,,,,0.0025172383,0.036553048,0.96092975
4,1013915232144674816,1013915232144674816,2018-07-02 22:40:03 UTC,2018-07-02,22:40:03,0,1344951,wired,WIRED,,"In the final week of June, Tesla built 5,031 Model 3 cars. Its next goal? 6,000 in a week  https://t.co/xQzFoCfsNH",en,[],['https://wired.trib.al/EllwpkK'],[],3,31,110,[],[],https://twitter.com/WIRED/status/1013915232144674816,False,,0,,,,,,,,[],,,,,0.002827462,0.28569737,0.7114752
5,1013913492808716288,1013913492808716288,2018-07-02 22:33:08 UTC,2018-07-02,22:33:08,0,351143962,ballaban,Michael Ballaban,,IMPORTANT: We just had to issue a correction on one of our Tesla blogs.  https://t.co/mFrpiXh0L8  https://t.co/A5fflyHTzA,en,[],['https://jalopnik.com/teslas-top-engineer-is-out-1827296574'],"['https://pbs.twimg.com/media/DhIk6lsX4AIONnX.jpg', 'https://pbs.twimg.com/media/DhIk7eOXcAA_Euh.jpg']",22,76,304,[],[],https://twitter.com/Ballaban/status/1013913492808716288,False,,1,https://pbs.twimg.com/media/DhIk6lsX4AIONnX.jpg,,,,,,,[],,,,,0.09559356,0.84621096,0.05819549
6,1013910629202132999,1013910629202132999,2018-07-02 22:21:46 UTC,2018-07-02,22:21:46,0,1469603575,qtrresearch,Quoth the Raven 🇺🇦,,"NEW PODCAST: Quoth the Raven #46 - Marc Cohodes talks MiMedix, Overstock, Tesla and Kevin O’Leary  https://t.co/z1803U8JMF $OSTK $TSLA $MDXG",en,[],['https://quoththeraven.podbean.com/e/quoth-the-raven-46-marc-cohodes-talks-mimedix-overstock-tesla-and-kevin-oleary/'],[],15,16,83,[],"['ostk', 'tsla', 'mdxg']",https://twitter.com/QTRResearch/status/1013910629202132999,False,,0,,,,,,,,[],,,,,0.004437168,0.8690755,0.12648743
7,1013910091437887488,1013910091437887488,2018-07-02 22:19:37 UTC,2018-07-02,22:19:37,0,18286505,hypebeast,HYPEBEAST,,".@Tesla is now estimating to make 6,000 models per week by the end of next month.  https://t.co/YeAv8gOTPe",en,"[{'screen_name': 'tesla', 'name': 'tesla', 'id': '13298072'}]",['https://hypb.st/mwnto'],[],0,8,64,[],[],https://twitter.com/HYPEBEAST/status/1013910091437887488,False,,0,,,,,,,,[],,,,,0.004723255,0.59691334,0.39836338
8,1013907632136994816,1013522801834254337,2018-07-02 22:09:51 UTC,2018-07-02,22:09:51,0,2192783682,qwolfblg,Quentin Leon,,"@bawfuls @pobudz @ante_nt @StevenArmstrong It's not Ford v Tesla. It's new growing car company spending money to expand, vs established company with declining sales unable to cover operating costs. Growing vs sustaining are 2 very different ""phases"".",en,[],[],[],1,1,100,[],[],https://twitter.com/Qwolfblg/status/1013907632136994816,False,,0,,,,,,,,"[{'screen_name': 'bawfuls', 'name': 'Bawfuls', 'id': '25403007'}, {'screen_name': 'pobudz', 'name': 'pobudz', 'id': '15141000'}, {'screen_name': 'StevenArmstrong', 'name': 'Steven Armstrong', 'id': '2476746624'}]",,,,,0.31752932,0.64686394,0.03560681
9,1013899626477473792,1012151776391454722,2018-07-02 21:38:02 UTC,2018-07-02,21:38:02,0,44196397,elonmusk,Elon Musk,,"@WillFealey @Tesla @RadioFlyer No problem, happy to donate some personally",en,[],[],[],54,66,1645,[],[],https://twitter.com/elonmusk/status/1013899626477473792,False,,0,,,,,,,,"[{'screen_name': 'WillFealey', 'name': 'Will Fealey ☀️⚡️🔋🌍🚗', 'id': '18762152'}, {'screen_name': 'Tesla', 'name': 'Tesla', 'id': '13298072'}, {'screen_name': 'RadioFlyer', 'name': 'Radio Flyer', 'id': '88936240'}]",,,,,0.0070718685,0.1654029,0.8275251
10,1013898304789368833,1012151776391454722,2018-07-02 21:32:47 UTC,2018-07-02,21:32:47,0,18762152,willfealey,Will Fealey ☀️⚡️🔋🌍🚗,,"@elonmusk @Tesla @RadioFlyer Thanks, I’d love to roll this out across Europe so any help from @Tesla and @RadioFlyer would be greatly appreciated. We can do all the ground work.",en,"[{'screen_name': 'tesla', 'name': 'tesla', 'id': '13298072'}, {'screen_name': 'radioflyer', 'name': 'radio flyer', 'id': '88936240'}]",[],[],5,11,311,[],[],https://twitter.com/WillFealey/status/1013898304789368833,False,,0,,,,,,,,"[{'screen_name': 'elonmusk', 'name': 'Elon Musk', 'id': '44196397'}, {'screen_name': 'Tesla', 'name': 'Tesla', 'id': '13298072'}, {'screen_name': 'RadioFlyer', 'name': 'Radio Flyer', 'id': '88936240'}]",,,,,0.002754785,0.026056858,0.9711883
11,1013897145773166595,1012151776391454722,2018-07-02 21:28:11 UTC,2018-07-02,21:28:11,0,44196397,elonmusk,Elon Musk,,@WillFealey @Tesla @RadioFlyer Sure,en,[],[],[],68,216,7323,[],[],https://twitter.com/elonmusk/status/1013897145773166595,False,,0,,,,,,,,"[{'screen_name': 'WillFealey', 'name': 'Will Fealey ☀️⚡️🔋🌍🚗', 'id': '18762152'}, {'screen_name': 'Tesla', 'name': 'Tesla', 'id': '13298072'}, {'screen_name': 'RadioFlyer', 'name': 'Radio Flyer', 'id': '88936240'}]",,,,,0.025091982,0.817922,0.15698606
12,1013886563351187456,1013886563351187456,2018-07-02 20:46:08 UTC,2018-07-02,20:46:08,0,1469603575,qtrresearch,Quoth the Raven 🇺🇦,,*SOME TESLA MODEL 3 PRODUCTION IS SAID TO GO ON BREAK  Well that sure as fuck was short lived LOL,en,[],[],[],7,16,117,[],[],https://twitter.com/QTRResearch/status/1013886563351187456,False,,0,,,,,,,,[],,,,,0.8574779,0.1173312,0.025190804
13,1013883462468677633,1013883462468677633,2018-07-02 20:33:49 UTC,2018-07-02,20:33:49,0,401966166,cyril_mp4,Cyril,,PUTAIN MAIS JE VIENS DE CAPTER ! J'ai fait un vieux dessin animé où le youtuber film un cadavre dans une forêt pour le buzz. C'était il y a plus d'un an. J'ajoute à ça le plagiat de la tesla dans l'espace sur ma liste du génie.  https://t.co/IOR71MRhKl,fr,[],['https://www.youtube.com/watch?v=3lv7hf_L20s'],[],30,76,1197,[],[],https://twitter.com/Cyril_mp4/status/1013883462468677633,False,,0,,,,,,,,[],,,,,0.07701392,0.84583604,0.07714999
14,1013880081415012352,1013880081415012352,2018-07-02 20:20:23 UTC,2018-07-02,20:20:23,0,1308211178,teslarati,TESLARATI,,Tesla Model 3 owner takes on Pikes Peak hill climb to test performance and range -  https://t.co/p7nyPq3zXk  https://t.co/OPD2A5ETnp,en,[],['https://www.teslarati.com/tesla-model-3-pikes-peak-hill-climb-performance-range-test/'],"['https://pbs.twimg.com/media/DhIGj2rU0AA0Egr.jpg', 'https://pbs.twimg.com/media/DhIGj2hVQAID4c6.jpg', 'https://pbs.twimg.com/media/DhIGjzVVAAA9yC2.jpg']",2,28,189,[],[],https://twitter.com/Teslarati/status/1013880081415012352,False,,1,https://pbs.twimg.com/media/DhIGj2rU0AA0Egr.jpg,,,,,,,[],,,,,0.0050631976,0.84392005,0.15101685
15,1013879011695525889,1013879011695525889,2018-07-02 20:16:08 UTC,2018-07-02,20:16:08,0,18856867,zerohedge,zerohedge,,Tesla Confirms Chief Engineer Has Left  https://t.co/nU5NQRadRl,en,[],['https://www.zerohedge.com/news/2018-07-02/tesla-confirms-chief-engineer-has-left'],[],9,59,76,[],[],https://twitter.com/zerohedge/status/1013879011695525889,False,,0,,,,,,,,[],,,,,0.011397644,0.90988314,0.07871905
16,1013873516981125123,1013873516981125123,2018-07-02 19:54:17 UTC,2018-07-02,19:54:17,0,128288109,danahull,Dana “Resilience Fatigue” Hull 👩🏻‍💻,,"CONFIRMED: Doug Field, who's been on leave from Tesla since mid May, is not coming back.",en,[],[],[],8,19,60,[],[],https://twitter.com/danahull/status/1013873516981125123,False,,0,,,,,,,,[],,,,,0.43238553,0.55331016,0.014304305
17,1013867377132523520,1013867377132523520,2018-07-02 19:29:54 UTC,2018-07-02,19:29:54,0,817817720221794305,richardheartwin,Richard Heart FREE AIRDROP! ETH👉PulseChain.com❁,,"How butthurt will #tesla haters be when the roadster comes out with 1.8s 0-60,  8.8s 1/4mile, 1000km range? 4 seat convertible with torque vectoring.",en,[],[],[],19,12,169,['tesla'],[],https://twitter.com/RichardHeartWin/status/1013867377132523520,False,,0,,,,,,,,[],,,,,0.48000067,0.46829385,0.051705427
18,1013867345880625153,1013867345880625153,2018-07-02 19:29:46 UTC,2018-07-02,19:29:46,0,349249475,gerberkawasaki,Ross Gerber,,On #CNBC talking Tesla and their amazing numbers. Tune in. Will be on soon. #Model3 $tsla,en,[],[],[],30,9,77,"['cnbc', 'model3']",['tsla'],https://twitter.com/GerberKawasaki/status/1013867345880625153,False,,0,,,,,,,,[],,,,,0.0015764384,0.028990585,0.969433
19,1013859318561673220,1013859318561673220,2018-07-02 18:57:52 UTC,2018-07-02,18:57:52,0,830122005030694920,hyperchangetv,HyperChange,,"$TSLA Q2 production &amp; deliveries analysis:  https://t.co/eLAGqMSVLz  -5K/week rate is likely not sustainable right away, but will be surpassed soon -backlog of 420K is equivalent to ~$15B in revenue -profit &amp; positive cashflow in Q3 &amp; Q4 confirmed  CONGRATS TO @Tesla &amp; @elonmusk!",en,"[{'screen_name': 'tesla', 'name': 'tesla', 'id': '13298072'}, {'screen_name': 'elonmusk', 'name': 'elon musk', 'id': '44196397'}]",['https://youtu.be/E9di57NrGgM'],[],9,16,102,[],['tsla'],https://twitter.com/HyperChangeTV/status/1013859318561673220,False,,0,,,,,,,,[],,,,,0.06747422,0.31265795,0.6198678
20,1013857175951892483,1013855617038127104,2018-07-02 18:49:21 UTC,2018-07-02,18:49:21,0,57960896,slcuervo,Saul Lopez,,Yessss! La T de Tesla 😉  Ya sólo me falta pintar las pinzas en rojo. Un proyecto para este verano 💪🏻  https://t.co/QlTx5u0A1X,es,[],[],['https://pbs.twimg.com/media/DhHxuOnXcAA7MOO.jpg'],16,4,103,[],[],https://twitter.com/slcuervo/status/1013857175951892483,False,,1,https://pbs.twimg.com/media/DhHxuOnXcAA7MOO.jpg,,,,,,,[],,,,,0.0026604733,0.0375071,0.9598325
21,1013853310967844864,1013853310967844864,2018-07-02 18:34:00 UTC,2018-07-02,18:34:00,0,1413027896,charliebilello,Charlie Bilello,,Tesla Sales: $12 billion  General Motors Sales: $144 billion    Tesla Market Cap: $58 billion  General Motors Market Cap: $55 billion  https://t.co/K5xbvUMOB5,fr,[],[],['https://pbs.twimg.com/media/DhHuNozW4AAfMn6.jpg'],36,179,403,[],[],https://twitter.com/charliebilello/status/1013853310967844864,False,,1,https://pbs.twimg.com/media/DhHuNozW4AAfMn6.jpg,,,,,,,[],,,,,0.01362013,0.7667469,0.21963304
22,1013851138611793920,1013851138611793920,2018-07-02 18:25:22 UTC,2018-07-02,18:25:22,0,2148233600,electrekco,Electrek.co,,Tesla stock price (TSLA) tumbles as Wall Street throws cold water on Model 3 production ramp  https://t.co/6L7cOPLRhd by @FredericLambert  https://t.co/oX2wbMlC1t,en,"[{'screen_name': 'fredericlambert', 'name': 'fred lambert', 'id': '38253449'}]",['https://electrek.co/2018/07/02/tesla-stock-price-tsla-tumbles-wall-street-throws-cold-water-model-3-production-ramp/'],['https://pbs.twimg.com/media/DhHsDu_VAAAM3xv.jpg'],23,26,133,[],[],https://twitter.com/ElectrekCo/status/1013851138611793920,False,,1,https://pbs.twimg.com/media/DhHsDu_VAAAM3xv.jpg,,,,,,,[],,,,,0.4673421,0.500441,0.03221684
23,1013840451575668736,1013840451575668736,2018-07-02 17:42:54 UTC,2018-07-02,17:42:54,0,15110357,reutersbiz,Reuters Business,,"⚡️ Tesla hits Model 3 target, Musk says it's now a 'real car company'   https://t.co/vCsvvwZsxP",en,[],['https://reut.rs/2MFyMLO'],[],3,41,95,[],[],https://twitter.com/ReutersBiz/status/1013840451575668736,False,,0,,,,,,,,[],,,,,0.002430309,0.24414362,0.753426
24,1013839863194370048,1013839863194370048,2018-07-02 17:40:34 UTC,2018-07-02,17:40:34,0,308795969,dmc_ryan,Ryan McCaffrey,,"Great piece by Alex here. It cuts to the core of why I do a podcast about Tesla every week. Do I believe in their mission? Yes. Do I admire what Elon &amp; the team are doing? Yes. But above it all, it comes back to the amazing cars – ever since I first drove the Roadster in 2009.  https://t.co/gojb3hu0ja",en,[],['https://twitter.com/AlexRoy144/status/1013798121342750722'],[],6,6,81,[],[],https://twitter.com/DMC_Ryan/status/1013839863194370048,False,https://twitter.com/AlexRoy144/status/1013798121342750722,0,,,,,,,,[],,,,,0.0041146274,0.029651448,0.96623385
25,1013839358930153473,1013839358930153473,2018-07-02 17:38:34 UTC,2018-07-02,17:38:34,0,15110357,reutersbiz,Reuters Business,,Finally some good news for Tesla after it finally hits its long-elusive Model 3 deadline. @sal19 has been covering the story:  https://t.co/YrLouJNFPI  https://t.co/4KyiNDYuvN,en,"[{'screen_name': 'sal19', 'name': 'sal rodriguez 🕷', 'id': '21983925'}]",['https://reut.rs/2KoFbhG'],[],2,44,133,[],[],https://twitter.com/ReutersBiz/status/1013839358930153473,False,,1,https://pbs.twimg.com/ext_tw_video_thumb/1013838946210639876/pu/img/QJ4OmZtGTr9TTWV1.jpg,,,,,,,[],,,,,0.0017268144,0.033909626,0.9643637
26,1013833889801007104,1013833889801007104,2018-07-02 17:16:50 UTC,2018-07-02,17:16:50,0,8802752,g1,g1,,"Tesla, empresa de carros elétricos, atinge meta de produzir 5 mil unidades do Model 3 em uma semana  https://t.co/OJNRIot9yz #G1  https://t.co/US7W1jKCRd",pt,[],['https://g1.globo.com/carros/noticia/tesla-atinge-meta-de-produzir-5-mil-unidades-do-model-3-em-uma-semana.ghtml'],['https://pbs.twimg.com/media/DhHcih7W4AAxZil.jpg'],4,5,87,['g1'],[],https://twitter.com/g1/status/1013833889801007104,False,,1,https://pbs.twimg.com/media/DhHcih7W4AAxZil.jpg,,,,,,,[],,,,,0.009996939,0.8430567,0.14694633
27,1013829623531044871,1013829623531044871,2018-07-02 16:59:52 UTC,2018-07-02,16:59:52,0,15110357,reutersbiz,Reuters Business,,"Musk said Tesla hit its target of 5,000 Model 3s in a week, according to an email sent to employees on Sunday and seen by @Reuters  https://t.co/9g7Ijzmmz4  https://t.co/kriUKsKLAk",en,"[{'screen_name': 'reuters', 'name': 'reuters', 'id': '1652541'}]",['https://reut.rs/2MIsuLA'],['https://pbs.twimg.com/media/DhHYqzDVQAELTJt.jpg'],7,72,219,[],[],https://twitter.com/ReutersBiz/status/1013829623531044871,False,,1,https://pbs.twimg.com/media/DhHYqzDVQAELTJt.jpg,,,,,,,[],,,,,0.0034609537,0.5216314,0.47490758
28,1013828396357378048,1013828396357378048,2018-07-02 16:55:00 UTC,2018-07-02,16:55:00,0,5392522,npr,NPR,,"Tesla says it has reached its goal of producing 5,000 Model 3 electric cars a week.   https://t.co/XeML2xbJ17",en,[],['https://n.pr/2NkuTgr'],[],10,34,133,[],[],https://twitter.com/NPR/status/1013828396357378048,False,,0,,,,,,,,[],,,,,0.0028939338,0.262031,0.73507506
29,1013826259367759873,1013826259367759873,2018-07-02 16:46:30 UTC,2018-07-02,16:46:30,0,2148233600,electrekco,Electrek.co,,New bill to remove limit for $7.5k electric vehicle federal tax credit introduced as Tesla hits threshold  https://t.co/xQJvOVrukd by @FredericLambert  https://t.co/vBZumVK3af,en,"[{'screen_name': 'fredericlambert', 'name': 'fred lambert', 'id': '38253449'}]",['https://electrek.co/2018/07/02/new-bill-electric-car-federal-tax-credit-tesla-limit/'],['https://pbs.twimg.com/media/DhHVmjyUEAA-OsF.jpg'],3,46,187,[],[],https://twitter.com/ElectrekCo/status/1013826259367759873,False,,1,https://pbs.twimg.com/media/DhHVmjyUEAA-OsF.jpg,,,,,,,[],,,,,0.022320213,0.91400427,0.06367558
30,1013825925719285760,1013825925719285760,2018-07-02 16:45:11 UTC,2018-07-02,16:45:11,0,161418822,nadeshot,100T Nadeshot,,"My Monday kicked off with a bang. A woman slammed my Tesla on the highway merging into my lane. My lower back is tweaked a bit and the damage to my car is significant but still drive-able. Drivers, please look both ways when switching lanes. Accidents like this are avoidable.",en,[],[],[],360,627,14514,[],[],https://twitter.com/Nadeshot/status/1013825925719285760,False,,0,,,,,,,,[],,,,,0.8632639,0.12213315,0.014602863
31,1013821663840894976,1013821663840894976,2018-07-02 16:28:15 UTC,2018-07-02,16:28:15,0,349249475,gerberkawasaki,Ross Gerber,,"Ok it’s confirmed. Tesla debate. 12:30 PM pst on @CNBCClosingBell me versus some short seller. Gloves off.                                             Quintus: People should know when they're conquered. Gen. Maximus: Would you, Quintus? Would I?  $tsla @elonmusk",en,"[{'screen_name': 'cnbcclosingbell', 'name': ""cnbc's closing bell"", 'id': '21778391'}, {'screen_name': 'elonmusk', 'name': 'elon musk', 'id': '44196397'}]",[],[],26,27,199,[],['tsla'],https://twitter.com/GerberKawasaki/status/1013821663840894976,False,,0,,,,,,,,[],,,,,0.035509773,0.79821306,0.16627711
32,1013819695491739650,1013819695491739650,2018-07-02 16:20:25 UTC,2018-07-02,16:20:25,0,349249475,gerberkawasaki,Ross Gerber,,I’m being told #CNBC wants a super Tesla debate today. I’m being called in for the bull side. This could get bloody. LOL. #tesla @elonmusk $tsla,en,"[{'screen_name': 'elonmusk', 'name': 'elon musk', 'id': '44196397'}]",[],[],36,28,252,"['cnbc', 'tesla']",['tsla'],https://twitter.com/GerberKawasaki/status/1013819695491739650,False,,0,,,,,,,,[],,,,,0.050489776,0.34616223,0.6033479
33,1013819100815155201,1013819100815155201,2018-07-02 16:18:04 UTC,2018-07-02,16:18:04,0,2369652488,teslaliving,Teslaliving,,'We just became a real car company:' Read what Elon Musk said after Tesla churned out 5000 Model 3s  https://t.co/wOwDvDD8HY  https://t.co/TQzbq7kwj2,en,[],['https://buff.ly/2yZeivJ'],['https://pbs.twimg.com/media/DhHPGSZX4AIod4R.jpg'],2,17,79,[],[],https://twitter.com/teslaliving/status/1013819100815155201,False,,1,https://pbs.twimg.com/media/DhHPGSZX4AIod4R.jpg,,,,,,,[],,,,,0.004446191,0.5700792,0.4254747
34,1013816351012610054,1013816351012610054,2018-07-02 16:07:08 UTC,2018-07-02,16:07:08,0,1469603575,qtrresearch,Quoth the Raven 🇺🇦,,Seems like a good time to revisit some Tesla long emails I got about 12 hours ago,en,[],[],[],5,6,89,[],[],https://twitter.com/QTRResearch/status/1013816351012610054,False,,0,,,,,,,,[],,,,,0.038650125,0.57632935,0.38502046
35,1013809690332094466,1013809690332094466,2018-07-02 15:40:40 UTC,2018-07-02,15:40:40,0,18856867,zerohedge,zerohedge,,"TESLA TURNS NEGATIVE, ERASING EARLIER GAIN OF AS MUCH AS 6.4%",en,[],[],[],5,30,58,[],[],https://twitter.com/zerohedge/status/1013809690332094466,False,,0,,,,,,,,[],,,,,0.24297372,0.6897745,0.06725182
36,1013805995317817344,1013805995317817344,2018-07-02 15:25:59 UTC,2018-07-02,15:25:59,0,704835627183788032,model3owners,Trev Page,,Everyone I know personally who’s negative about Tesla has never driven one.  Talk is cheap  https://t.co/5xiy1TM2Cm,en,[],['https://twitter.com/alexroy144/status/1013798121342750722'],[],8,28,305,[],[],https://twitter.com/Model3Owners/status/1013805995317817344,False,https://twitter.com/alexroy144/status/1013798121342750722,0,,,,,,,,[],,,,,0.6398746,0.31486,0.045265373
37,1013805230843138048,1013805230843138048,2018-07-02 15:22:57 UTC,2018-07-02,15:22:57,0,2992395456,vexmark,Mark Constantine,,2018: Tesla builds new Model 3 in a tent 2019: Tesla builds new Model 3 in a teepee 2020: Tesla builds new Model 3 in a gazebo  2021: Tesla builds new Model 3 in a pillow fort,en,[],[],[],4,15,118,[],[],https://twitter.com/vexmark/status/1013805230843138048,False,,0,,,,,,,,[],,,,,0.060272396,0.8746028,0.06512479
38,1013805218687926277,1013805218687926277,2018-07-02 15:22:54 UTC,2018-07-02,15:22:54,0,349249475,gerberkawasaki,Ross Gerber,,On another note Tesla is replacing every #model3 sold with a new order. Reservations continue to hold at 420000 backlog. This is awesome. Not one dollar spent on ads. Except #Siliconvalley on @HBO which was great. $tsla,en,"[{'screen_name': 'hbo', 'name': 'hbo', 'id': '15635604'}]",[],[],9,12,77,"['model3', 'siliconvalley']",['tsla'],https://twitter.com/GerberKawasaki/status/1013805218687926277,False,,0,,,,,,,,[],,,,,0.0051536984,0.032309514,0.96253675
39,1013805101847203840,1013805101847203840,2018-07-02 15:22:26 UTC,2018-07-02,15:22:26,0,842824397496836096,skabooshka,skabooshka,,"Daily production update.   On July 1, 2018 Tesla produced approximately:   Model 3: 370  Model S: 115 Model X: 160",en,[],[],[],19,10,63,[],[],https://twitter.com/skabooshka/status/1013805101847203840,False,,0,,,,,,,,[],,,,,0.0063903015,0.8650504,0.12855928
40,1013805064018800640,1013805064018800640,2018-07-02 15:22:17 UTC,2018-07-02,15:22:17,0,2148233600,electrekco,Electrek.co,,Panasonic is open to increasing its investment in Tesla Gigafactory 1  https://t.co/ajb3F9xz7f by @FredericLambert  https://t.co/10xRPWpYTK,en,"[{'screen_name': 'fredericlambert', 'name': 'fred lambert', 'id': '38253449'}]",['https://electrek.co/2018/07/02/panasonic-open-increase-its-investment-tesla-gigafactory-1/'],['https://pbs.twimg.com/media/DhHCQtXUcAABHFD.jpg'],1,45,237,[],[],https://twitter.com/ElectrekCo/status/1013805064018800640,False,,1,https://pbs.twimg.com/media/DhHCQtXUcAABHFD.jpg,,,,,,,[],,,,,0.0031412784,0.6149294,0.3819292
41,1013804767506763776,1013804767506763776,2018-07-02 15:21:06 UTC,2018-07-02,15:21:06,0,3108351,wsj,The Wall Street Journal,,"Tesla is revving its engines: Next month it plans to make 6,000 Model 3 sedans each week  https://t.co/JIRP3bcpBZ",en,[],['https://on.wsj.com/2KpttUi'],[],10,28,98,[],[],https://twitter.com/WSJ/status/1013804767506763776,False,,0,,,,,,,,[],,,,,0.0023947675,0.30711594,0.6904894
42,1013804507011141635,1013804507011141635,2018-07-02 15:20:04 UTC,2018-07-02,15:20:04,0,18200793,teslamotorsclub,Tesla Motors Club,,"Musk Says Tesla Made 7,000 Cars Last Week  https://t.co/IGgR6iRqIq #Tesla #Model3  https://t.co/27ka24mAkh",en,[],['https://teslamotorsclub.com/blog/2018/07/02/musk-says-tesla-made-7000-cars-last-week/'],['https://pbs.twimg.com/media/DhHBvyGWkAE0kMf.jpg'],2,25,204,"['tesla', 'model3']",[],https://twitter.com/TeslaMotorsClub/status/1013804507011141635,False,,1,https://pbs.twimg.com/media/DhHBvyGWkAE0kMf.jpg,,,,,,,[],,,,,0.0041717677,0.4743485,0.52147985
43,1013798576550379521,1013798576550379521,2018-07-02 14:56:30 UTC,2018-07-02,14:56:30,0,34713362,business,Bloomberg,,"Tesla ""just became a real car company,"" Elon Musk says after hitting a critical milestone  https://t.co/NQP5A4iBiM  https://t.co/zTvIM33Kps",en,[],['https://bloom.bg/2MEJna1'],[],6,47,94,[],[],https://twitter.com/business/status/1013798576550379521,False,,1,https://pbs.twimg.com/media/DhG8bbDUYAEZJBH.jpg,,,,,,,[],,,,,0.00247309,0.12069707,0.8768298
44,1013796994090000386,1013796994090000386,2018-07-02 14:50:13 UTC,2018-07-02,14:50:13,0,16598957,firstadopter,tae kim,,"The fact Tesla met its one week 5,000 Model 3 production goal, but missed the Q2 Wall Street consensus delivery estimate by nearly 10,000 cars shows you how back end loaded production was in the quarter $TSLA  https://t.co/lFdtbwn0iX",en,[],['https://www.cnbc.com/2018/07/02/tesla-second-quarter-production-totaled-53339-vehicles.html'],[],6,16,52,[],['tsla'],https://twitter.com/firstadopter/status/1013796994090000386,False,,0,,,,,,,,[],,,,,0.53773046,0.40270942,0.059559967
45,1013796973105774594,1013796973105774594,2018-07-02 14:50:08 UTC,2018-07-02,14:50:08,0,759251,cnn,CNN,,"Elon Musk says Tesla met its 5,000-car Model 3 production target ... and then some  https://t.co/Y4qPOpBu0C  https://t.co/4oAKPUkDkN",en,[],['https://cnn.it/2MDPRWq'],['https://pbs.twimg.com/media/DhG6-VIW0AAWn35.jpg'],31,54,263,[],[],https://twitter.com/CNN/status/1013796973105774594,False,,1,https://pbs.twimg.com/media/DhG6-VIW0AAWn35.jpg,,,,,,,[],,,,,0.006099637,0.46440542,0.5294949
46,1013796828750348288,1013796828750348288,2018-07-02 14:49:34 UTC,2018-07-02,14:49:34,0,349249475,gerberkawasaki,Ross Gerber,,Tesla hits every number and doubles down. Again we called every number right. 30k model3 in q2 ramp continuing to grow. At 7k total cars a week. We estimate $20 bil rev in 12 months. Tesla higher in a bad market. $tsla,en,[],[],[],6,13,90,[],['tsla'],https://twitter.com/GerberKawasaki/status/1013796828750348288,False,,0,,,,,,,,[],,,,,0.20501634,0.5206473,0.27433637
