,id,conversation_id,created_at,date,time,timezone,user_id,username,name,place,tweet,language,mentions,urls,photos,replies_count,retweets_count,likes_count,hashtags,cashtags,link,retweet,quote_url,video,thumbnail,near,geo,source,user_rt_id,user_rt,retweet_id,reply_to,retweet_date,translate,trans_src,trans_dest,negative,neutral,positive
46,962853071415062528,962853071415062528,2018-02-12 00:57:15 UTC,2018-02-12,00:57:15,0,20402945,cnbc,CNBC,,Elon Musk shares the epic last photo of 'Starman' in the red Tesla he shot into space  https://t.co/eQbB2WNgkk,en,[],['http://cnb.cx/2EdNpq4'],[],4,49,110,[],[],https://twitter.com/CNBC/status/962853071415062528,False,,0,,,,,,,,[],,,,,0.0043629142,0.56047976,0.43515742
47,962850962313564160,962850962313564160,2018-02-12 00:48:52 UTC,2018-02-12,00:48:52,0,628776007,officialjoelf,Joel Franco,,WATCH: Tesla Roadster spotted in space via telescope (@SPACEdotcom)  https://t.co/0KcU3Yh1yN,en,"[{'screen_name': 'spacedotcom', 'name': 'space.com', 'id': '15431856'}]",[],[],0,47,123,[],[],https://twitter.com/OfficialJoelF/status/962850962313564160,False,,1,https://pbs.twimg.com/ext_tw_video_thumb/962849925707972608/pu/img/-zVjDvij4L9C-0kE.jpg,,,,,,,[],,,,,0.0042744735,0.81837916,0.17734629
48,962850421961363462,962850421961363462,2018-02-12 00:46:44 UTC,2018-02-12,00:46:44,0,2873884138,ipostexoticcars,iPostExotics,,Will I Am's Custom Tesla Model S  https://t.co/b8GY9QYEbS,en,[],[],['https://pbs.twimg.com/media/DVy7TX1VwAEyu38.jpg'],0,17,62,[],[],https://twitter.com/iPostExoticCars/status/962850421961363462,False,,1,https://pbs.twimg.com/media/DVy7TX1VwAEyu38.jpg,,,,,,,[],,,,,0.0069000092,0.8632276,0.12987241
49,962847119840301056,962847119840301056,2018-02-12 00:33:36 UTC,2018-02-12,00:33:36,0,2959459379,fotosdefatos,Fotos de Fatos,,9 Fatos sobre o gênio Nikola Tesla | #BlogFotosDeFatos  Leia aqui ↓→  https://t.co/SyiLwGqC1g | Ajude com RT 👍  https://t.co/Oxf50DLD0z,pt,[],['https://goo.gl/8dNkAB'],['https://pbs.twimg.com/media/DVy4J76W4AEbE7f.jpg'],3,34,150,['blogfotosdefatos'],[],https://twitter.com/FotosDeFatos/status/962847119840301056,False,,1,https://pbs.twimg.com/media/DVy4J76W4AEbE7f.jpg,,,,,,,[],,,,,0.00995711,0.88850343,0.1015393
50,962844013702320128,962844013702320128,2018-02-12 00:21:16 UTC,2018-02-12,00:21:16,0,21447110,mattytalks,rude man,,"If you say “rockets are gay” inside a Tesla, the autopilot takes over and drives you to an Elon Musk re-education center",en,[],[],[],3,6,76,[],[],https://twitter.com/mattytalks/status/962844013702320128,False,,0,,,,,,,,[],,,,,0.37628093,0.5759123,0.0478068
51,962840251793276928,962840251793276928,2018-02-12 00:06:19 UTC,2018-02-12,00:06:19,0,2959459379,fotosdefatos,Fotos de Fatos,,"Nikola Tesla se preocupava profundamente com a velocidade com a qual estamos esgotando os recursos naturais do planeta. Ele chegou a realizar pesquisas sobre novas formas de se obter energia, e queria que a humanidade passasse a utilizar combustíveis renováveis e não fósseis.  https://t.co/wVACTVr0dJ",pt,[],[],['https://pbs.twimg.com/media/DVyyF3qWkAEdE_W.jpg'],17,122,672,[],[],https://twitter.com/FotosDeFatos/status/962840251793276928,False,,1,https://pbs.twimg.com/media/DVyyF3qWkAEdE_W.jpg,,,,,,,[],,,,,0.030680515,0.81048244,0.15883702
