id,conversation_id,created_at,date,time,timezone,user_id,username,name,place,tweet,language,mentions,urls,photos,replies_count,retweets_count,likes_count,hashtags,cashtags,link,retweet,quote_url,video,thumbnail,near,geo,source,user_rt_id,user_rt,retweet_id,reply_to,retweet_date,translate,trans_src,trans_dest
1031712604748537856,1031712604748537856,2018-08-21 01:20:27 UTC,2018-08-21,01:20:27,+0000,63457904,texwalkerranger,Heath Walker,,Queue at Tesla Martin Place to see Tesla Model 3  https://t.co/UbEJ9KC1dc,en,[],[],[],70,427,3948,[],[],https://twitter.com/TexWalkerRanger/status/1031712604748537856,False,,1,https://pbs.twimg.com/ext_tw_video_thumb/1031712515955220480/pu/img/CAlAOd5FcySD9bT4.jpg,,,,,,,[],,,,
1031706253507158017,1031706253507158017,2018-08-21 00:55:13 UTC,2018-08-21,00:55:13,+0000,14171401,mayemusk,Maye Musk,,"@MKBHD Another great interview👍 @elonmusk “10,000 people building electric cars @Tesla factory” 👏👏",en,"[{'screen_name': 'elonmusk', 'name': 'elon musk', 'id': '44196397'}, {'screen_name': 'tesla', 'name': 'tesla', 'id': '13298072'}]",[],[],6,23,136,[],[],https://twitter.com/mayemusk/status/1031706253507158017,False,https://twitter.com/MKBHD/status/1031649200176615427,0,,,,,,,,[],,,,
1031703891572707328,1031703891572707328,2018-08-21 00:45:50 UTC,2018-08-21,00:45:50,+0000,46831005,annzpls,annabelle,,How did my high school friend just put a deposit on a new Tesla when I’m here struggling to pay for less ice in my nuoc mia man what am I doing wrong,en,[],[],[],0,0,86,[],[],https://twitter.com/annzpls/status/1031703891572707328,False,,0,,,,,,,,[],,,,
1031695643851386880,1031695643851386880,2018-08-21 00:13:04 UTC,2018-08-21,00:13:04,+0000,937207076245323776,macrockets,🇺🇦David McLeod,,Thousands of Australians pre order Tesla M3. Channel 9 Brisbane. The shortie short shorts from TSLAQ are having ZERO effect on Aussies. $TSLA.  https://t.co/yHWFqpO0Hh,en,[],[],['https://pbs.twimg.com/media/DlFRuI4UYAIAFXB.jpg'],16,64,281,[],['tsla'],https://twitter.com/macrockets/status/1031695643851386880,False,,1,https://pbs.twimg.com/media/DlFRuI4UYAIAFXB.jpg,,,,,,,[],,,,
1031693976921759745,1031693976921759745,2018-08-21 00:06:26 UTC,2018-08-21,00:06:26,+0000,704835627183788032,model3owners,Trev Page,,Who were the idiots again who claimed there was no yellow or forklifts without horns in the Tesla factory???   https://t.co/jBqqPJ8Dyr,en,[],['https://youtu.be/mr9kK0_7x08'],[],10,15,108,[],[],https://twitter.com/Model3Owners/status/1031693976921759745,False,,0,,,,,,,,[],,,,
