,id,conversation_id,created_at,date,time,timezone,user_id,username,name,place,tweet,language,mentions,urls,photos,replies_count,retweets_count,likes_count,hashtags,cashtags,link,retweet,quote_url,video,thumbnail,near,geo,source,user_rt_id,user_rt,retweet_id,reply_to,retweet_date,translate,trans_src,trans_dest,negative,neutral,positive
0,1128082178724622336,1128082178724622336,2019-05-13 23:38:44 UTC,2019-05-13,23:38:44,0,1689516060,vincent13031925,vincentyu.eth,,Tesla Shanghai Gigafactory GF3 🇨🇳 5-12-2019 update   Via &amp; Credit :  https://t.co/N38AaVpP3E  $TSLA #Tesla #China #TeslaChina #GF3  https://t.co/xps5qqkxvn,en,[],['https://youtu.be/X5aVBrItaYQ'],[],24,78,516,"['tesla', 'china', 'teslachina', 'gf3']",['tsla'],https://twitter.com/vincent13031925/status/1128082178724622336,False,,1,https://pbs.twimg.com/ext_tw_video_thumb/1128080820210520064/pu/img/PuEuLF3piUmxeC9-.jpg,,,,,,,[],,,,,0.0048150397,0.84183955,0.15334553
1,1128080684814426113,1128080684814426113,2019-05-13 23:32:48 UTC,2019-05-13,23:32:48,0,1308211178,teslarati,TESLARATI,,Tesla-approved body shop shares a close look at a Model 3’s repair and restoration process  https://t.co/nEn6Qo1kOE,en,[],['https://www.teslarati.com/tesla-model-3-repair-timelapse-video/'],[],4,28,240,[],[],https://twitter.com/Teslarati/status/1128080684814426113,False,,0,,,,,,,,[],,,,,0.006670596,0.9244758,0.06885366
2,1128071292341456897,1128071292341456897,2019-05-13 22:55:29 UTC,2019-05-13,22:55:29,0,565198801,teslainventory,Erik in DÆrik,,What a gorgeous day here in Colorado!   #tesla #teslamodel3 #windturbine #colorado #elonmusk @tesla @elonmusk  https://t.co/1Llh7KtSbc,en,"[{'screen_name': 'tesla', 'name': 'tesla', 'id': '13298072'}, {'screen_name': 'elonmusk', 'name': 'elon musk', 'id': '44196397'}]",[],['https://pbs.twimg.com/media/D6e23DgU0AAT-rg.jpg'],5,8,172,"['tesla', 'teslamodel3', 'windturbine', 'colorado', 'elonmusk']",[],https://twitter.com/teslainventory/status/1128071292341456897,False,,1,https://pbs.twimg.com/media/D6e23DgU0AAT-rg.jpg,,,,,,,[],,,,,0.0015701967,0.013679874,0.98475
3,1128069341352742917,1128069341352742917,2019-05-13 22:47:44 UTC,2019-05-13,22:47:44,0,2148233600,electrekco,Electrek.co,,Tesla announces final offer to acquire battery company Maxwell  https://t.co/cV64nNeQU3 by @fredericlambert  https://t.co/Olj7yHHUUv,en,"[{'screen_name': 'fredericlambert', 'name': 'fred lambert', 'id': '38253449'}]",['https://electrek.co/2019/05/13/tesla-final-offer-acquire-battery-company-maxwell/'],['https://pbs.twimg.com/media/D6e1Fk9WAAUIQZS.jpg'],1,44,247,[],[],https://twitter.com/ElectrekCo/status/1128069341352742917,False,,1,https://pbs.twimg.com/media/D6e1Fk9WAAUIQZS.jpg,,,,,,,[],,,,,0.0059070317,0.9028593,0.09123373
4,1128056811242782721,1128056811242782721,2019-05-13 21:57:56 UTC,2019-05-13,21:57:56,0,18856867,zerohedge,zerohedge,,When will China re-hikes tariffs on US auto imports (which it suspended for now as a sign of goodwill); will Tesla hike prices again?,en,[],[],[],8,16,64,[],[],https://twitter.com/zerohedge/status/1128056811242782721,False,,0,,,,,,,,[],,,,,0.3591677,0.61552626,0.025306031
5,1128054259675738114,1128054259675738114,2019-05-13 21:47:48 UTC,2019-05-13,21:47:48,0,3170782581,demirdenizchp,Deniz Demir,,Fikrimi çalmaları mühim değil. Asıl mühim olan kendi fikirlerinin olmaması.  🖌Nikola Tesla  #TesekkurlerEkremİmamoğlu #senneymissin,tr,[],[],[],1,145,815,"['tesekkurlerekremi̇mamoğlu', 'senneymissin']",[],https://twitter.com/demirdenizchp/status/1128054259675738114,False,,0,,,,,,,,[],,,,,0.0416767,0.8561484,0.10217485
6,1128052619111542785,1128052619111542785,2019-05-13 21:41:17 UTC,2019-05-13,21:41:17,0,1347840548,strani_placenik,Nemanja Rujević,,"Najbolji su mi ovi što kažu da je ok što Jokić neće u repku jer, pazi sad, SRBIJA MU IONAKO NIŠTA NIJE DALA, pa nije Tesla majku mu nego baca loptu u koš za masne pare, šta da mu Srbija da?",und,[],[],[],17,5,182,[],[],https://twitter.com/strani_placenik/status/1128052619111542785,False,,0,,,,,,,,[],,,,,0.48654896,0.48388767,0.029563412
7,1128048383564951557,1128048383564951557,2019-05-13 21:24:27 UTC,2019-05-13,21:24:27,0,2896006899,mouhammadciss,Mouhammad CISS,,"Voici Amat Cama, jeune consultant et chercheur sénégalais en cyber-sécurité, qui a gagné la somme de 375.000 USD en espèces pour avoir révélé des bugs dans la voiture Tesla Model 3.  Amat et son ami Richard Zhu ont hacké la voiture de Elon Musk lors du concours Pwn2Own Vancouver.  https://t.co/wORc5RDf3A",fr,[],[],['https://pbs.twimg.com/media/D6eiBX-WAAEjr5r.jpg'],0,55,191,[],[],https://twitter.com/mouhammadciss/status/1128048383564951557,False,,1,https://pbs.twimg.com/media/D6eiBX-WAAEjr5r.jpg,,,,,,,[],,,,,0.029607227,0.86976594,0.10062682
8,1128047568464764928,1128047568464764928,2019-05-13 21:21:13 UTC,2019-05-13,21:21:13,0,17451211,alyssajperry,Alyssa Jeong Perry,,"BREAKING: @tesla settled for $13M over a life-altering worker injury. This is the company's first personal injury lawsuit that went into trial, involving a workplace accident. That's according to the worker's lawyer. 1/2  https://t.co/Hul0thquNH",en,"[{'screen_name': 'tesla', 'name': 'tesla', 'id': '13298072'}]",[],['https://pbs.twimg.com/media/D6ec-cvUUAAK25u.jpg'],8,84,171,[],[],https://twitter.com/alyssajperry/status/1128047568464764928,False,,1,https://pbs.twimg.com/media/D6ec-cvUUAAK25u.jpg,,,,,,,[],,,,,0.38000387,0.58796626,0.03202985
9,1128041455707205632,1128039753792856064,2019-05-13 20:56:55 UTC,2019-05-13,20:56:55,0,704413791711264768,szasjade,َ,,@antoniiogarza21 u will buy a tesla  https://t.co/lpggdl6mcd,en,[],[],['https://pbs.twimg.com/media/D6ebuEJWkAYuiIo.jpg'],1,6,376,[],[],https://twitter.com/szasjade/status/1128041455707205632,False,,1,https://pbs.twimg.com/media/D6ebuEJWkAYuiIo.jpg,,,,,,,"[{'screen_name': 'antoniiogarza21', 'name': 'antonio garza', 'id': '737753951697666049'}]",,,,,0.044793516,0.8903679,0.06483855
10,1128030933494398977,1128030933494398977,2019-05-13 20:15:07 UTC,2019-05-13,20:15:07,0,1308211178,teslarati,TESLARATI,,"Tesla’s sketchpad Easter Egg to get animation support, says Elon Musk  https://t.co/8u80p3HVjX",en,[],['https://www.teslarati.com/tesla-sketchpad-easter-egg-gets-animation-support-elon-musk/'],[],1,16,172,[],[],https://twitter.com/Teslarati/status/1128030933494398977,False,,0,,,,,,,,[],,,,,0.0042223744,0.7462667,0.24951084
11,1128030784424742913,1128030784424742913,2019-05-13 20:14:31 UTC,2019-05-13,20:14:31,0,887496444,angel12364,angel,,"Elon Big fan . We own Model 3 and Model x. The X just had a 1 year birthday and this is the roof weather seal . Tesla says not under warranty. $ 4,000.00 to repair. Wouldn't you think this is a Factory Defect.? 2 years old? This can't be just me! Your thoughts please  https://t.co/Xoi8yhXp0E",en,[],[],['https://pbs.twimg.com/media/D6eR-ZxXkAEQmaf.jpg'],42,28,88,[],[],https://twitter.com/angel12364/status/1128030784424742913,False,,1,https://pbs.twimg.com/media/D6eR-ZxXkAEQmaf.jpg,,,,,,,[],,,,,0.17870732,0.41597435,0.40531832
12,1128030383755485189,1128030383755485189,2019-05-13 20:12:55 UTC,2019-05-13,20:12:55,0,436103176,teslaband,TESLA™,,"#MondayMotivation TESLA have added Dallas &amp; San Antonio to their SHOCK tour 2019..   Tickets &amp; special VIP meet &amp; greet packages on sale this Friday May 18 at  https://t.co/KfLXGBCsDV  Sept 27 – Dallas, TX Sept 28 – San Antonio, TX  https://t.co/5zUGYz75I0",en,[],['http://TeslaTheBand.com'],[],8,13,133,['mondaymotivation'],[],https://twitter.com/TeslaBand/status/1128030383755485189,False,,1,https://pbs.twimg.com/ext_tw_video_thumb/1128030244403855360/pu/img/ugS4z9AHtiUpgvi2.jpg,,,,,,,[],,,,,0.005187367,0.6734142,0.3213985
13,1128025384652378112,1128025384652378112,2019-05-13 19:53:04 UTC,2019-05-13,19:53:04,0,1016059981907386368,teslaownerssv,Tesla Owners Silicon Valley,,"So @amarlevine posted a video of the same onramp supposedly committing ""suicide"" in a 2016 model S. I have a model 3 ap2 that handles it seemlessly. I believe it has to do with his ap1. But the FUD and hate is unreal against @tesla @elonmusk  https://t.co/tij9m2HD4k",en,"[{'screen_name': 'amarlevine', 'name': 'pets and politics', 'id': '234178694'}, {'screen_name': 'tesla', 'name': 'tesla', 'id': '13298072'}, {'screen_name': 'elonmusk', 'name': 'elon musk', 'id': '44196397'}]",[],[],17,44,334,[],[],https://twitter.com/teslaownersSV/status/1128025384652378112,False,,1,https://pbs.twimg.com/ext_tw_video_thumb/1128025260236857344/pu/img/XsjUWuaTAgnYpAke.jpg,,,,,,,[],,,,,0.894017,0.10118747,0.004795701
14,1128009774849773569,1128009774849773569,2019-05-13 18:51:02 UTC,2019-05-13,18:51:02,0,1075142947270742016,cj_johnson17th,WealthSquadCJ.eth,,"Tesla Supercharging stations are a networking hub  People naturally ask questions about your car and your experience as a owner, you ask them about theirs, make a few jokes, talk about what Tesla is doing as a company  They ask what you do for a living.. the ball rolls from there",en,[],[],[],2,4,66,[],[],https://twitter.com/CJ_Johnson17th/status/1128009774849773569,False,,0,,,,,,,,[],,,,,0.015732799,0.63735116,0.346916
15,1128005633830055936,1128005633830055936,2019-05-13 18:34:35 UTC,2019-05-13,18:34:35,0,2610464621,artkocapital,ArtkoCapital,,“Hey Mike! Hows the wife? Listen sorry about that Uber IPO thing”  “Oh. Tesla secondary too I guess”  “Oh right. The Lyft thing. Sorry about that. Well anyway. You’re going to love what I have for you next. Have you ever thought about adjusting EBITDA for community expenses?”,en,[],[],[],3,39,265,[],[],https://twitter.com/ArtkoCapital/status/1128005633830055936,False,,0,,,,,,,,[],,,,,0.20390137,0.5410519,0.25504667
16,1128000463373262850,1128000463373262850,2019-05-13 18:14:02 UTC,2019-05-13,18:14:02,0,28167086,wsjheard,Heard on the Street,,"Today's most-read Heard column (and, impressively, most-read markets story on a panicky day for markets), @CGrantWSJ with a gem on Tesla  https://t.co/AKNK7xYaYB $TSLA",en,"[{'screen_name': 'cgrantwsj', 'name': 'charley grant', 'id': '3043828834'}]",['https://www.wsj.com/articles/brother-tesla-cant-spare-a-dime-11557739800'],[],2,11,52,[],['tsla'],https://twitter.com/WSJheard/status/1128000463373262850,False,,0,,,,,,,,[],,,,,0.013434165,0.41059548,0.57597035
17,1127993701739921408,1127993701739921408,2019-05-13 17:47:10 UTC,2019-05-13,17:47:10,0,1469603575,qtrresearch,Quoth the Raven 🇺🇦,,Is Tesla selling insurance yet,en,[],[],[],18,3,84,[],[],https://twitter.com/QTRResearch/status/1127993701739921408,False,,0,,,,,,,,[],,,,,0.06887921,0.87254596,0.058574785
18,1127986411917856768,1127986411917856768,2019-05-13 17:18:12 UTC,2019-05-13,17:18:12,0,977687191202693125,woj_zaremba,Wojciech Zaremba,,I am a believer in Tesla’s approach to self-driving cars. They use data from their 0.5M cars. Such data should be enough to cover every possible case. This approach has to work. Good luck @elonmusk and @karpathy.  https://t.co/Z9F9srwoBu,en,"[{'screen_name': 'elonmusk', 'name': 'elon musk', 'id': '44196397'}, {'screen_name': 'karpathy', 'name': 'andrej karpathy', 'id': '33836629'}]",['https://youtu.be/Ucp0TTmvqOE'],[],44,80,1196,[],[],https://twitter.com/woj_zaremba/status/1127986411917856768,False,,0,,,,,,,,[],,,,,0.003360824,0.030503295,0.96613586
19,1127982039448338433,1127982039448338433,2019-05-13 17:00:49 UTC,2019-05-13,17:00:49,0,1308211178,teslarati,TESLARATI,,"Tesla is a pioneer that drives Volkswagen’s EV initiatives, says CEO Herbert Diess  https://t.co/Mdmdv07LEB",en,[],['https://www.teslarati.com/tesla-drives-volkswagen-herbest-diess'],[],11,75,450,[],[],https://twitter.com/Teslarati/status/1127982039448338433,False,,0,,,,,,,,[],,,,,0.0030688122,0.17811148,0.8188197
20,1127980940519723008,1127980940519723008,2019-05-13 16:56:27 UTC,2019-05-13,16:56:27,0,3424441204,bagholderquotes,Bag Holder,,“I wish I managed a huge fund so I could go all in with tesla.” #TooBadYouManageADennys,en,[],[],[],2,5,84,['toobadyoumanageadennys'],[],https://twitter.com/BagholderQuotes/status/1127980940519723008,False,,0,,,,,,,,[],,,,,0.6655368,0.25230312,0.08215999
21,1127975839394516992,1127975567226281984,2019-05-13 16:36:11 UTC,2019-05-13,16:36:11,0,36690784,sonny5ideup,Sonny Side Up,,@BillRatchet Bruh this tinder X Tesla collab is genius,en,[],[],[],0,1,117,[],[],https://twitter.com/Sonny5ideUp/status/1127975839394516992,False,,0,,,,,,,,"[{'screen_name': 'BillRatchet', 'name': 'billiam', 'id': '500497164'}]",,,,,0.0096985595,0.07500943,0.9152922
22,1127974416057389057,1127974416057389057,2019-05-13 16:30:32 UTC,2019-05-13,16:30:32,0,2543588034,clattner_llvm,Chris Lattner,,"Only Lex could take the discussion through a whole lot of compiler geekery (llvm, gcc, clang, mlir), some of the internal challenges getting swift to market, my opinion of Elon’s secret to Tesla working, up to Google’s incredible lead in AI accelerators: hw/sw co-design on TPUs👍",en,[],[],[],8,67,396,[],[],https://twitter.com/clattner_llvm/status/1127974416057389057,False,https://twitter.com/lexfridman/status/1127969610278604801,0,,,,,,,,[],,,,,0.088047974,0.44997007,0.46198195
23,1127969610278604801,1127969610278604801,2019-05-13 16:11:26 UTC,2019-05-13,16:11:26,0,427089628,lexfridman,Lex Fridman,,"Here's my conversation with Chris Lattner (@clattner_llvm) on the Artificial Intelligence podcast. He is one of the top experts in the world on compilers and powerful software+ML+hardware systems in general, w/ exciting projects at Google, Tesla, &amp; Apple.  https://t.co/c8R4LV1mzK",en,"[{'screen_name': 'clattner_llvm', 'name': 'chris lattner', 'id': '2543588034'}]",['https://www.youtube.com/watch?v=yCd3CzGSte8'],[],7,79,423,[],[],https://twitter.com/lexfridman/status/1127969610278604801,False,,0,,,,,,,,[],,,,,0.00197519,0.06688692,0.9311378
24,1127968320102252545,1127968320102252545,2019-05-13 16:06:18 UTC,2019-05-13,16:06:18,0,452540168,dailyloud,Daily Loud,,Big Bioi gets his son a Tesla  https://t.co/3bYHGX4M7b,en,[],[],[],2,70,486,[],[],https://twitter.com/DailyLoud/status/1127968320102252545,False,,1,https://pbs.twimg.com/ext_tw_video_thumb/1127692742480539649/pu/img/ge8y_rPvro_KdJbI.jpg,,,,,,,[],,,,,0.009930609,0.5938031,0.39626628
25,1127959097440124928,1127959097440124928,2019-05-13 15:29:39 UTC,2019-05-13,15:29:39,0,549414427,jhnyberg,Johanna Nyberg,,No hands! #Tesla #Autopilot is pretty advanced! This self-driving feature of #Model3 really confuses the boundary between driver and car. #autonomousdriving  https://t.co/euAvpuQtQT,en,[],[],[],3,3,58,"['tesla', 'autopilot', 'model3', 'autonomousdriving']",[],https://twitter.com/JHNyberg/status/1127959097440124928,False,,1,https://pbs.twimg.com/ext_tw_video_thumb/1127959005316435968/pu/img/b0oNvIjlBhRbwcQC.jpg,,,,,,,[],,,,,0.004108748,0.05351504,0.9423762
26,1127957255293427713,1127957255293427713,2019-05-13 15:22:20 UTC,2019-05-13,15:22:20,0,448169851,ftjfranklin,Joshua Franklin,,"Quick piece of personal news. my beat @Reuters is shifting to look at the wider US corporate finance space. I’ll still be writing a lot about LBOs &amp; IPOs, but I'll be broadening into new areas like how GE &amp; Tesla fund themselves. Excited to start!",en,"[{'screen_name': 'reuters', 'name': 'reuters', 'id': '1652541'}]",[],[],5,0,49,[],[],https://twitter.com/FTJFranklin/status/1127957255293427713,False,,0,,,,,,,,[],,,,,0.0023035954,0.087369844,0.9103265
27,1127952479646171136,1127952479646171136,2019-05-13 15:03:22 UTC,2019-05-13,15:03:22,0,316068880,ecoheliguy,Walter MacVane👀,,Tesla 🇨🇦  https://t.co/PpGCnc1COz,tr,[],[],['https://pbs.twimg.com/media/D6dKw2SUwAA63Rj.jpg'],3,12,82,[],[],https://twitter.com/EcoHeliGuy/status/1127952479646171136,False,,1,https://pbs.twimg.com/media/D6dKw2SUwAA63Rj.jpg,,,,,,,[],,,,,0.007668099,0.72783256,0.26449937
28,1127950264474963969,1127950264474963969,2019-05-13 14:54:34 UTC,2019-05-13,14:54:34,0,48015202,sypwynia,Syp Wynia,,Is #gasverbod al ingetrokken? Is afgezien #CCS? Zijn miljarden voor Tesla's al ingeslikt? Wordt er afgezien van geothermie omdat die aardbevingen veroorzaakt? Gaan we doen wat verstandiger landen ipv onzinnige #Alleingang? Wat maakt dat u zo gehecht bent aan beleid #RutteDrie?,nl,[],[],[],20,90,203,"['gasverbod', 'ccs', 'alleingang', 'ruttedrie']",[],https://twitter.com/sypwynia/status/1127950264474963969,False,https://twitter.com/VincentDekker4/status/1127834828869722112,0,,,,,,,,[],,,,,0.061623726,0.8637844,0.07459199
29,1127948369366781956,1127948369366781956,2019-05-13 14:47:02 UTC,2019-05-13,14:47:02,0,25069385,edithbrou,⭕️Edithbrou.nft,,"BRAVO à Amat Cama, jeune consultant et chercheur sénégalais en cyber-sécurité, qui a gagné au total la somme de 375.000 USD en espèces pour avoir révélé des bugs dans la voiture Tesla Model 3. Lui et son ami ont hacké la voiture de Elon Musk lors du concours Pwn2Own Vancouver.🔥  https://t.co/tBYrMmHAgG",fr,[],[],['https://pbs.twimg.com/media/D6dHDcYXoAIdQUX.jpg'],42,971,2030,[],[],https://twitter.com/edithbrou/status/1127948369366781956,False,,1,https://pbs.twimg.com/media/D6dHDcYXoAIdQUX.jpg,,,,,,,[],,,,,0.03342089,0.83984035,0.12673879
30,1127942209632854018,1127942209632854018,2019-05-13 14:22:33 UTC,2019-05-13,14:22:33,0,2610464621,artkocapital,ArtkoCapital,,At what stock price does Tesla pivot to fake meat?,en,[],[],[],20,17,215,[],[],https://twitter.com/ArtkoCapital/status/1127942209632854018,False,,0,,,,,,,,[],,,,,0.39123774,0.58618784,0.022574514
31,1127941995802939400,1127941995802939400,2019-05-13 14:21:42 UTC,2019-05-13,14:21:42,0,788294514184249344,realchaozhou,Chao Zhou 🧢 🔥🔥🔥,,"The Tesla gigafactory 3 building is almost completed right now, only waiting for machinery put inside. 😀  $tsla #Tesla #ElonMusk #SpaceX  https://t.co/EtTQHmRsf8",en,[],[],"['https://pbs.twimg.com/media/D6dBBocV4AYlD7y.jpg', 'https://pbs.twimg.com/media/D6dBG4bUEAMb0IQ.jpg', 'https://pbs.twimg.com/media/D6dBKrsUYAEbex4.jpg']",30,22,215,"['tesla', 'elonmusk', 'spacex']",['tsla'],https://twitter.com/realChaoZhou/status/1127941995802939400,False,,1,https://pbs.twimg.com/media/D6dBBocV4AYlD7y.jpg,,,,,,,[],,,,,0.0015514165,0.061231457,0.93721706
32,1127939726370136064,1127939726370136064,2019-05-13 14:12:41 UTC,2019-05-13,14:12:41,0,1308211178,teslarati,TESLARATI,,Tesla Gigafactory 3 starts interior work amid escalating US-China trade war  https://t.co/NOv2ugU4X6,en,[],['https://www.teslarati.com/tesla-gigafactory-3-starts-interior-work-us-china-trade-war/'],[],11,82,630,[],[],https://twitter.com/Teslarati/status/1127939726370136064,False,,0,,,,,,,,[],,,,,0.0944251,0.8391412,0.066433646
33,1127938222322003968,1127831842839613441,2019-05-13 14:06:42 UTC,2019-05-13,14:06:42,0,2603525726,loomdart,loom,,"@justinsuntron @uzgaroth $28000  did the tesla get caught in a flood or something? Did it ""fall off the back of a lorry""  damn man, can you send me your tesla dealers number? I want a $28000 Tesla too",en,[],[],[],16,2,96,[],[],https://twitter.com/loomdart/status/1127938222322003968,False,,0,,,,,,,,"[{'screen_name': 'justinsuntron', 'name': 'H.E. Justin Sun 🅣🌞🇬🇩', 'id': '902839045356744704'}, {'screen_name': 'uzgaroth', 'name': 'XRP_UzGar 🕉️ ⛓BTC', 'id': '83055313'}]",,,,,0.6514542,0.31247342,0.03607241
34,1127937575396741120,1127937575396741120,2019-05-13 14:04:08 UTC,2019-05-13,14:04:08,0,4852289459,theteslalife,TheTeslaLife,,"Elon Musk has been selected as one of the recipients of the 2019 Stephen Hawking Medal for Science Communication. The #SpaceX and #Tesla CEO will be receiving the medal at the Starmus Festival this June in Zurich, Switzerland.  https://t.co/NMvvKRiL7m  https://t.co/4Q6Hf0qKyq",en,[],['https://www.teslarati.com/tesla-spacex-ceo-elon-musk-receives-stephen-hawking-medal/'],['https://pbs.twimg.com/media/D6c9PjeXsAAQUoh.jpg'],6,22,149,"['spacex', 'tesla']",[],https://twitter.com/TheTeslaLife/status/1127937575396741120,False,,1,https://pbs.twimg.com/media/D6c9PjeXsAAQUoh.jpg,,,,,,,[],,,,,0.001765172,0.14380518,0.8544297
35,1127929833273614337,1127929833273614337,2019-05-13 13:33:22 UTC,2019-05-13,13:33:22,0,389979192,nasalahe,Lasse Edvardsen,,"First Official Model 3 was registered in Norway in February. We now have 7133 Model 3 registered. It took Model S 2 years, 2 months and 15 days to reach the same number 🇳🇴👏🔋 https://t.co/ErmRK48DYN #tesla #model3 #teslamodel3 #norway #pev #ev  https://t.co/W4EmCoaAqT",en,[],['https://teslastats.no/'],['https://pbs.twimg.com/media/D6c2LSqX4AEev_t.jpg'],5,27,173,"['tesla', 'model3', 'teslamodel3', 'norway', 'pev', 'ev']",[],https://twitter.com/nasalahe/status/1127929833273614337,False,,1,https://pbs.twimg.com/media/D6c2LSqX4AEev_t.jpg,,,,,,,[],,,,,0.0035263114,0.22478321,0.7716905
36,1127925275579170816,1127925275579170816,2019-05-13 13:15:16 UTC,2019-05-13,13:15:16,0,349249475,gerberkawasaki,Ross Gerber,,That Tesla China factory looking better and better. Going to be nice to get around those import tariffs. Talk about a moat. #china #ev $tsla,en,[],[],[],30,27,260,"['china', 'ev']",['tsla'],https://twitter.com/GerberKawasaki/status/1127925275579170816,False,,0,,,,,,,,[],,,,,0.012329194,0.061549615,0.9261213
37,1127920217609375744,1127920217609375744,2019-05-13 12:55:10 UTC,2019-05-13,12:55:10,0,129935623,bigcheds,Cheds,,I didn’t know you could buy a Tesla $TSLA for 28k.    $TRX,en,[],[],[],33,4,66,[],"['tsla', 'trx']",https://twitter.com/BigCheds/status/1127920217609375744,False,https://twitter.com/uzgaroth/status/1127806619402866688,0,,,,,,,,[],,,,,0.067004144,0.6810109,0.25198495
38,1127911641058816001,1127911641058816001,2019-05-13 12:21:05 UTC,2019-05-13,12:21:05,0,2148233600,electrekco,Electrek.co,,"Tesla Model Y production will create a battery shortage, says Panasonic  https://t.co/b2kcjxWqcu by @fredericlambert  https://t.co/jqoc5wdzI2",en,"[{'screen_name': 'fredericlambert', 'name': 'fred lambert', 'id': '38253449'}]",['https://electrek.co/2019/05/13/tesla-model-y-production-battery-shortage-panasonic/'],['https://pbs.twimg.com/media/D6clqQdX4AIO7QK.jpg'],14,53,243,[],[],https://twitter.com/ElectrekCo/status/1127911641058816001,False,,1,https://pbs.twimg.com/media/D6clqQdX4AIO7QK.jpg,,,,,,,[],,,,,0.43862596,0.53897566,0.022398219
39,1127911489065582593,1127911489065582593,2019-05-13 12:20:29 UTC,2019-05-13,12:20:29,0,962805945020702722,teslacharts,TC,,"Post $TSLAQ I plan to chart all kinds of overpriced junk stocks, but I’m keeping the name TeslaCharts, because ‘Tesla’ will be to overpriced junk stocks what Kleenex is to tissues.",en,[],[],[],20,6,273,[],['tslaq'],https://twitter.com/TESLAcharts/status/1127911489065582593,False,https://twitter.com/laphroaiganddew/status/1127910294624325632,0,,,,,,,,[],,,,,0.37854087,0.5112261,0.110232815
40,1127908504377933824,1127908124256559104,2019-05-13 12:08:37 UTC,2019-05-13,12:08:37,0,7177512,johnrobb,John Robb,,"""and the instruments through which we shall be able to do his will be amazingly simple compared with our present telephone.  A man will be able to carry one in his vest pocket.""  Tesla 1926 cont.    3/3",en,[],[],[],11,17,89,[],[],https://twitter.com/johnrobb/status/1127908504377933824,False,,0,,,,,,,,[],,,,,0.009352483,0.3757855,0.614862
41,1127908277994622978,1127908124256559104,2019-05-13 12:07:43 UTC,2019-05-13,12:07:43,0,7177512,johnrobb,John Robb,,"""Not only this, but through television and telephony we shall see and hear one another as perfectly as though we were face to face, despite intervening distances of thousands of miles; ""  Tesla cont.  2/3",en,[],[],[],1,13,62,[],[],https://twitter.com/johnrobb/status/1127908277994622978,False,,0,,,,,,,,[],,,,,0.005375729,0.3085774,0.68604696
42,1127908124256559104,1127908124256559104,2019-05-13 12:07:06 UTC,2019-05-13,12:07:06,0,7177512,johnrobb,John Robb,,"""When wireless is perfectly applied the whole earth will be converted into a huge brain, which in fact it is, all things being particles of a real and rhythmic whole. We shall be able to communicate with one another instantly, irrespective of distance.""  Nicholas Tesla 1926  1/3",en,[],[],[],10,98,269,[],[],https://twitter.com/johnrobb/status/1127908124256559104,False,,0,,,,,,,,[],,,,,0.0067559634,0.28092808,0.7123159
43,1127900142374477825,1127900142374477825,2019-05-13 11:35:23 UTC,2019-05-13,11:35:23,0,18005415,danproft,Dan Proft,,"""It's outrageous. I thought Illinois was progressive and would want to encourage EV ownership."" - Nicoletta Skarlatos, Tesla owner  Awww, aren't you cute. You thought you were exempt from the rapacious Ruling Class' appetites. Welcome to the party.    https://t.co/Jp3CFklzPF",en,[],['https://www.chicagotribune.com/business/ct-biz-electric-vehicle-fee-illinois-20190509-story.html'],[],46,52,171,[],[],https://twitter.com/DanProft/status/1127900142374477825,False,,0,,,,,,,,[],,,,,0.48999235,0.34141928,0.16858841
44,1127890727009161217,1127890727009161217,2019-05-13 10:57:59 UTC,2019-05-13,10:57:59,0,3043828834,cgrantwsj,Charley Grant,,"Sharpen your pencils, then hide the children. How long can Tesla fresh cash last?   https://t.co/31zQBsFQ4a",en,[],['https://www.wsj.com/articles/brother-tesla-cant-spare-a-dime-11557739800'],[],24,66,217,[],[],https://twitter.com/CGrantWSJ/status/1127890727009161217,False,,0,,,,,,,,[],,,,,0.1147182,0.7699078,0.11537385
45,1127887431125094401,1127887431125094401,2019-05-13 10:44:53 UTC,2019-05-13,10:44:53,0,1049788797506990090,fly4dat,fly4dat,,"It's been over a month since a $TSLA Model S or X has been sold in #Tesla's 3rd (ex-)largest market, the Netherlands.  $TSLAQ  https://t.co/o4v4kfx6gJ",en,[],[],['https://pbs.twimg.com/media/D6cPjTyWAAAdHXY.png'],8,4,62,['tesla'],"['tsla', 'tslaq']",https://twitter.com/fly4dat/status/1127887431125094401,False,,1,https://pbs.twimg.com/media/D6cPjTyWAAAdHXY.png,,,,,,,[],,,,,0.011106814,0.67653376,0.3123594
