id,conversation_id,created_at,date,time,timezone,user_id,username,name,place,tweet,language,mentions,urls,photos,replies_count,retweets_count,likes_count,hashtags,cashtags,link,retweet,quote_url,video,thumbnail,near,geo,source,user_rt_id,user_rt,retweet_id,reply_to,retweet_date,translate,trans_src,trans_dest
1160806400626515968,1160806400626515968,2019-08-12 06:53:07 UTC,2019-08-12,06:53:07,+0000,1153665498543992833,portugaltesla,Tesla news PT 🇵🇹 - Steve Jobs’ ghost approved,,Another autopilot prevented accident. When the car swerved into my lane it slow down and got as far right as it could. It happened to me yesterday! Thanks @Tesla and @elonmusk to make me feel safe and relaxed while driving my kids around!  https://t.co/Ahto9sJD8x,en,"[{'screen_name': 'tesla', 'name': 'tesla', 'id': '13298072'}, {'screen_name': 'elonmusk', 'name': 'elon musk', 'id': '44196397'}]",[],[],3,21,134,[],[],https://twitter.com/PortugalTesla/status/1160806400626515968,False,,1,https://pbs.twimg.com/ext_tw_video_thumb/1160806356028461056/pu/img/toXic0Its3ZpqaMq.jpg,,,,,,,[],,,,
1160798792276488192,1160798792276488192,2019-08-12 06:22:53 UTC,2019-08-12,06:22:53,+0000,732548050728701953,valueanalyst1,Yaman Tasdivar,,"This was in early July, more than a month ago. Tesla did not elaborate on the matter in the Update Letter, and no one asked about it on the call...  https://t.co/TYEL2FS9Up",en,[],['https://www.bloomberg.com/news/articles/2019-07-10/tesla-tells-staff-it-s-preparing-to-lift-output-at-fremont-plant'],[],4,9,56,[],[],https://twitter.com/ValueAnalyst1/status/1160798792276488192,False,,0,,,,,,,,[],,,,
1160794285509206016,1160794285509206016,2019-08-12 06:04:58 UTC,2019-08-12,06:04:58,+0000,1689516060,vincent13031925,vincentyu.eth,,Tesla Navigate on Autopilot changing lanes like a boss to take a crowd exit.   The system keep improving after every OTA update.  Via:  https://t.co/F4O9NbnIWv  $TSLA #Tesla #NoA  https://t.co/CSc4gbFyWi,en,[],['https://www.reddit.com/r/teslamotors/comments/cp24ee/noa_changing_lanes_like_a_boss_to_take_a_crowded/'],[],12,43,409,"['tesla', 'noa']",['tsla'],https://twitter.com/vincent13031925/status/1160794285509206016,False,,1,https://pbs.twimg.com/ext_tw_video_thumb/1160794145767559168/pu/img/O151l0wbt3zFlu07.jpg,,,,,,,[],,,,
1160792550854287360,1160792550854287360,2019-08-12 05:58:05 UTC,2019-08-12,05:58:05,+0000,19199337,m4rko,Mark Foyle,,"London-bound today. Over 3 patient years after making that reservation, today I pick up my @Tesla #Model3 from @Tesla!! To say I’m super excited is an understatement!😁🚘",en,"[{'screen_name': 'tesla', 'name': 'tesla', 'id': '13298072'}, {'screen_name': 'tesla', 'name': 'tesla', 'id': '13298072'}]",[],[],19,8,135,['model3'],[],https://twitter.com/m4rko/status/1160792550854287360,False,,0,,,,,,,,[],,,,
1160784678661414912,1160635604507471872,2019-08-12 05:26:48 UTC,2019-08-12,05:26:48,+0000,308795969,dmc_ryan,Ryan McCaffrey,,"@Ninja Super low-rent of Twitch to conduct their business that way.  Also, nice @Tesla Model S! I've got the white interior as well. 😎👍",en,"[{'screen_name': 'tesla', 'name': 'tesla', 'id': '13298072'}]",[],[],5,2,238,[],[],https://twitter.com/DMC_Ryan/status/1160784678661414912,False,,0,,,,,,,,"[{'screen_name': 'Ninja', 'name': 'Ninja', 'id': '214201922'}]",,,,
1160778278396923910,1160778278396923910,2019-08-12 05:01:22 UTC,2019-08-12,05:01:22,+0000,17060015,cleantechnica,CleanTechnica,,"Tesla Master Plan In Action … Tesla Battery R&amp;D … Elon Musk’s $2,000 Start — #CleanTechnica Top 20  https://t.co/4hJFtC59FA",en,[],['https://cleantechnica.com/2019/08/12/tesla-master-plan-in-action-tesla-battery-rd-elon-musks-2000-start-cleantechnica-top-20/'],[],4,16,90,['cleantechnica'],[],https://twitter.com/cleantechnica/status/1160778278396923910,False,,0,,,,,,,,[],,,,
1160777733825150976,1160777733825150976,2019-08-12 04:59:12 UTC,2019-08-12,04:59:12,+0000,5620032,paulmaric,Paul Maric,,1/2...Fun fact from a guy (very) in the know at @Tesla. Why is the sound system in Model 3 the best we've ever tested fitted to a car? They hired ex-B&amp;O engineers that were tasked with designing and sourcing the best speakers and amplifiers on the market. The end result is a...  https://t.co/ffyrl7vYrQ,en,"[{'screen_name': 'tesla', 'name': 'tesla', 'id': '13298072'}]",[],['https://pbs.twimg.com/media/EBvpMVCUcAA6GzD.jpg'],26,126,534,[],[],https://twitter.com/PaulMaric/status/1160777733825150976,False,,1,https://pbs.twimg.com/media/EBvpMVCUcAA6GzD.jpg,,,,,,,[],,,,
1160773730043420673,1160773730043420673,2019-08-12 04:43:18 UTC,2019-08-12,04:43:18,+0000,1141693706627624961,savedtesla,TESLA_saves_lives,,"Today, a driver on his phone started to drift into @tesla_truth’s lane  AutoPilot immediately swerved to avoid a crash, but he was shocked and disengaged, steering straight off the road.  Lane Departure Avoidance corrected his course :  https://t.co/Ou6U8rBQXU",en,"[{'screen_name': 'tesla_truth', 'name': 'steve jobs ghost 👻', 'id': '1067553335970955264'}]",[],[],6,26,121,[],[],https://twitter.com/SavedTesla/status/1160773730043420673,False,,1,https://pbs.twimg.com/ext_tw_video_thumb/1160773407790813184/pu/img/hnmCxMupUudquOlD.jpg,,,,,,,[],,,,
1160764413407879169,1160764413407879169,2019-08-12 04:06:16 UTC,2019-08-12,04:06:16,+0000,17060015,cleantechnica,CleanTechnica,,Tesla Model 3 = 3% of US Car Sales in 1st Half of 2019  https://t.co/xhvsWfKrYe  https://t.co/Qf0SKfxYXD,en,[],['https://cleantechnica.com/2019/08/11/tesla-model-3-3-of-us-car-sales-in-1st-half-of-2019/'],['https://pbs.twimg.com/media/EBvdFS1WsAE_MwU.jpg'],2,14,101,[],[],https://twitter.com/cleantechnica/status/1160764413407879169,False,,1,https://pbs.twimg.com/media/EBvdFS1WsAE_MwU.jpg,,,,,,,[],,,,
1160761734921015296,1160761734921015296,2019-08-12 03:55:38 UTC,2019-08-12,03:55:38,+0000,1793790607,thirstknow,Nole,,"""MY WIFE ( DRIVER FOR OVER 40 YEARS, NO ACCIDENTS, NO TICKETS) WAS STOPPED AT A TRAFFIC LIGHT ON A DOWNGRADE, FOOT ON THE BRAKE, IN OUR BRAND NEW TESLA MODEL 3 WHEN IT SUDDENLY BEGAN TO MOVE FORWARD AND CRASHED INTO CARS""  https://t.co/SaQ04MRKi8 #TeslaModel3 #TeslaQualityIssues",en,[],['https://www.nhtsa.gov/vehicle/2018/TESLA/MODEL%2525203/4%252520DR/RWD'],[],6,11,59,"['teslamodel3', 'teslaqualityissues']",[],https://twitter.com/ThirstKnow/status/1160761734921015296,False,,0,,,,,,,,[],,,,
1160756028578783232,1160756028578783232,2019-08-12 03:32:57 UTC,2019-08-12,03:32:57,+0000,1689516060,vincent13031925,vincentyu.eth,,Tesla Model 3 arrived in Brishane for test drive.   $TSLA #Model3,no,[],[],[],3,5,118,['model3'],['tsla'],https://twitter.com/vincent13031925/status/1160756028578783232,False,https://twitter.com/VedaPrime/status/1160742197521600512,0,,,,,,,,[],,,,
1160755839218536448,1160755839218536448,2019-08-12 03:32:12 UTC,2019-08-12,03:32:12,+0000,323839489,bhak_sala,Rahul Raj,,The man who stated 10 years befoe Einstein that mass and energy are correlated with Nikola Tesla.   https://t.co/ov70rbrRbG  https://t.co/uwB4Px9jVx,en,[],['https://www.teslasociety.com/tesla_and_swami.htm'],['https://pbs.twimg.com/media/EBvVRmgUYAE1trG.png'],2,29,125,[],[],https://twitter.com/bhak_sala/status/1160755839218536448,False,,1,https://pbs.twimg.com/media/EBvVRmgUYAE1trG.png,,,,,,,[],,,,
1160741830524309505,1160741830524309505,2019-08-12 02:36:32 UTC,2019-08-12,02:36:32,+0000,1160729158785339392,tesla_knight,Tesla Knight,,"One thing I rarely see mentioned in these articles.  federal tax credit for Tesla vehicles was already cut in half in Q2, that means people literally paid $3750 MORE than the they would for another EV. How many other car makers could still dominate with an almost 4K disadvantage?",en,[],[],[],5,7,64,[],[],https://twitter.com/tesla_knight/status/1160741830524309505,False,https://twitter.com/cleantechnica/status/1160407594474844160,0,,,,,,,,[],,,,
1160740777355444225,1160740777355444225,2019-08-12 02:32:21 UTC,2019-08-12,02:32:21,+0000,1689516060,vincent13031925,vincentyu.eth,,Epic Tesla Model 3 pictures 👏  #Tesla #Model3,ca,[],[],[],2,8,102,"['tesla', 'model3']",[],https://twitter.com/vincent13031925/status/1160740777355444225,False,https://twitter.com/TeslaMidMO/status/1160713010274607104,0,,,,,,,,[],,,,
1160734842851454976,1160734842851454976,2019-08-12 02:08:46 UTC,2019-08-12,02:08:46,+0000,2881142534,tailosivetech,Tailosive Tech,,Video Title: “Why I’m not ordering the Tesla Roadster”  What everyone heard: “TESLA ROADSTER IS COMPLETELY USELESS AND SERVES NO PURPOSE ABSOLUTELY NO ONE SHOULD BUY IT”,en,[],[],[],14,1,193,[],[],https://twitter.com/TailosiveTech/status/1160734842851454976,False,,0,,,,,,,,[],,,,
1160720365355536385,1160720365355536385,2019-08-12 01:11:14 UTC,2019-08-12,01:11:14,+0000,1074073695939813377,mymodl3,mymodl3,,Special photo treat! 25 Roadsters met up at the Tesla Design Studio to celebrate the 10th Teslaversary of the Roadster. Photos credited to @TeslaClubLA via Facebook.  https://t.co/B4cq8F42O1,en,"[{'screen_name': 'teslaclubla', 'name': 'teslaclubla', 'id': '3012789296'}]",[],"['https://pbs.twimg.com/media/EBu1AngU8AA9nMK.jpg', 'https://pbs.twimg.com/media/EBu1AndUIAAJpSP.jpg', 'https://pbs.twimg.com/media/EBu1AneUwAIxqVR.jpg']",10,24,159,[],[],https://twitter.com/mymodl3/status/1160720365355536385,False,,1,https://pbs.twimg.com/media/EBu1AngU8AA9nMK.jpg,,,,,,,[],,,,
1160713517722415105,1160713517722415105,2019-08-12 00:44:02 UTC,2019-08-12,00:44:02,+0000,976129699058475008,n_arashiro,Nicholas Arashiro,,Quero um tesla,pt,[],[],[],14,9,365,[],[],https://twitter.com/n_arashiro/status/1160713517722415105,False,,0,,,,,,,,[],,,,
1160713010274607104,1160713010274607104,2019-08-12 00:42:01 UTC,2019-08-12,00:42:01,+0000,1086781095599853568,teslamidmo,Tesla Mid-Missouri,,Charging &amp; paddle boarding ❤️  Will post video later   #Model3  #Tesla  https://t.co/SFCkD1N0jM,en,[],[],"['https://pbs.twimg.com/media/EBuuUsnW4AwYq7P.jpg', 'https://pbs.twimg.com/media/EBuuUsnXUAYZNMN.jpg']",4,11,118,"['model3', 'tesla']",[],https://twitter.com/TeslaMidMO/status/1160713010274607104,False,,1,https://pbs.twimg.com/media/EBuuUsnW4AwYq7P.jpg,,,,,,,[],,,,
1160711530922553345,1160711530922553345,2019-08-12 00:36:08 UTC,2019-08-12,00:36:08,+0000,704835627183788032,model3owners,Trev Page,,"I have to agree, Tesla developed the best sounding audio system I’ve ever heard in a stock car, all in-house too   https://t.co/Qhy4irb2qg",en,[],['https://techau.com.au/tesla-model-3s-premium-interior-audio-turns-the-car-into-a-cinema-on-wheels/'],[],10,29,380,[],[],https://twitter.com/Model3Owners/status/1160711530922553345,False,,0,,,,,,,,[],,,,
1160710722512400385,1160710722512400385,2019-08-12 00:32:55 UTC,2019-08-12,00:32:55,+0000,801879369442541568,coachjetha,dave,,every day at 18:30 my dad drives his tesla down to the nearest kumon math &amp; reading center to spend 75 minutes savagely wrecking a bunch of 8 yr olds at mental math. then he picks up 3 filet-o-fish and drives home just in time for the 8 pm law &amp; order SVU re-run,en,[],[],[],1,4,74,[],[],https://twitter.com/coachjetha/status/1160710722512400385,False,,0,,,,,,,,[],,,,
1160705837368795141,1160705837368795141,2019-08-12 00:13:31 UTC,2019-08-12,00:13:31,+0000,188490744,johnbrougeux,John Rougeux,,Fun having a Tesla gathering  https://t.co/zknozYIPH3,en,[],[],"['https://pbs.twimg.com/media/EBunzl_X4AED5w7.jpg', 'https://pbs.twimg.com/media/EBunzl-XkAExKaK.jpg']",9,13,153,[],[],https://twitter.com/JohnBRougeux/status/1160705837368795141,False,,1,https://pbs.twimg.com/media/EBunzl_X4AED5w7.jpg,,,,,,,[],,,,
1160704766860619776,1160704766860619776,2019-08-12 00:09:15 UTC,2019-08-12,00:09:15,+0000,31250788,kawikatt,💛🔥🖤 Free Radical 🖤🔥💛,,Just found this on my @Tesla Model 3. So sweet and true and thoughtful. Omg I’m still crying. 💨🧠🔌❤️🔌🧠💨  https://t.co/Ju5mMAM3cp,en,"[{'screen_name': 'tesla', 'name': 'tesla', 'id': '13298072'}]",[],"['https://pbs.twimg.com/media/EBum1M7U4AAnAS4.jpg', 'https://pbs.twimg.com/media/EBum1M7UcAAr_yS.jpg']",27,122,666,[],[],https://twitter.com/kawikatt/status/1160704766860619776,False,,1,https://pbs.twimg.com/media/EBum1M7U4AAnAS4.jpg,,,,,,,[],,,,
