id,conversation_id,created_at,date,time,timezone,user_id,username,name,place,tweet,language,mentions,urls,photos,replies_count,retweets_count,likes_count,hashtags,cashtags,link,retweet,quote_url,video,thumbnail,near,geo,source,user_rt_id,user_rt,retweet_id,reply_to,retweet_date,translate,trans_src,trans_dest
1119019072979709952,1119019072979709952,2019-04-18 23:25:12 UTC,2019-04-18,23:25:12,+0000,4808581,alexroy144,Alex Roy,,In which the world’s dumbest Tesla fan claims a Porsche GT3 PDK “is basically a self-driving racecar.”  https://t.co/ybxc5f7yrr,en,[],[],['https://pbs.twimg.com/media/D4eN6QOW0AAV33n.jpg'],13,7,72,[],[],https://twitter.com/AlexRoy144/status/1119019072979709952,False,,1,https://pbs.twimg.com/media/D4eN6QOW0AAV33n.jpg,,,,,,,[],,,,
1119018755445727237,1119018755445727237,2019-04-18 23:23:56 UTC,2019-04-18,23:23:56,+0000,961787597990387713,pivotal_capital,Pivotal Capital,,"Tesla $TSLA says they have sold 550K cars that have driven about 10B miles. That comes out to about 18,182 miles per car. I guess you can’t drive your car very much if it’s always in the service center....",en,[],[],[],13,2,69,[],['tsla'],https://twitter.com/Pivotal_Capital/status/1119018755445727237,False,,0,,,,,,,,[],,,,
1119010486828376069,1119010486828376069,2019-04-18 22:51:04 UTC,2019-04-18,22:51:04,+0000,17264476,briannawu,Brianna Wu,,Electric cars aren’t just better for the environment- they are a better investment than ICE cars.   We need all American car companies to make a commitment to EVs. We cannot move forward if it’s just Tesla.,en,[],[],[],11,6,53,[],[],https://twitter.com/BriannaWu/status/1119010486828376069,False,https://twitter.com/GerberKawasaki/status/1118989675257978880,0,,,,,,,,[],,,,
1119009282698006528,1119009282698006528,2019-04-18 22:46:17 UTC,2019-04-18,22:46:17,+0000,23502725,jennerator211,⚡JENNerator⚡ Fate ❤ Irony,,Where are all my #Tesla friends? Joules is lonely.  💔  https://t.co/gB5LXmGC0L,en,[],[],['https://pbs.twimg.com/media/D4eE_--U4AEFEtJ.jpg'],14,6,129,['tesla'],[],https://twitter.com/Jennerator211/status/1119009282698006528,False,,1,https://pbs.twimg.com/media/D4eE_--U4AEFEtJ.jpg,,,,,,,[],,,,
1119007232778174466,1119007232778174466,2019-04-18 22:38:09 UTC,2019-04-18,22:38:09,+0000,67701944,bombero1394,Boris Ortiz ⚡️⚡️⚡️🚀🇵🇷 🇺🇸,,So this happened today 😁😁😁 I’m officially an Model 3 owner after waiting forever for the right car!!! The P3D adventures begin! @Model3Owners @elonmusk  @Tesla  https://t.co/9Jn1gjkbQk,en,"[{'screen_name': 'model3owners', 'name': 'trev page', 'id': '704835627183788032'}, {'screen_name': 'elonmusk', 'name': 'elon musk', 'id': '44196397'}, {'screen_name': 'tesla', 'name': 'tesla', 'id': '13298072'}]",[],['https://pbs.twimg.com/media/D4eDJM8XsAAHfAm.jpg'],10,8,153,[],[],https://twitter.com/bombero1394/status/1119007232778174466,False,,1,https://pbs.twimg.com/media/D4eDJM8XsAAHfAm.jpg,,,,,,,[],,,,
1118999389895159808,1118999389895159808,2019-04-18 22:06:59 UTC,2019-04-18,22:06:59,+0000,128288109,danahull,Dana “Resilience Fatigue” Hull 👩🏻‍💻,,Next Week: Monday: Tesla Autonomy Day for Investors Wednesday: TSLA reports Q1 earnings Thursday: deadline to report back to Judge Nathan,en,[],[],[],19,10,96,[],[],https://twitter.com/danahull/status/1118999389895159808,False,,0,,,,,,,,[],,,,
1118997614962176000,1118997614962176000,2019-04-18 21:59:56 UTC,2019-04-18,21:59:56,+0000,18199493,stephenpallotta,∩,,"Sister's husband just took my @Tesla Model 3 out for a drive... his words: ""That's not a car!!!!!"" ""I made a big mistake getting a Maserati...""",en,"[{'screen_name': 'tesla', 'name': 'tesla', 'id': '13298072'}]",[],[],10,33,352,[],[],https://twitter.com/stephenpallotta/status/1118997614962176000,False,,0,,,,,,,,[],,,,
1118993962126192644,1118993962126192644,2019-04-18 21:45:25 UTC,2019-04-18,21:45:25,+0000,906850310307696641,prawakl,Profesor Prawak für Deutschland,,"Stwierdzenie, że w kwestii nauczania konkurujemy już z Finlandią i Koreą, jest równie prawdziwe, jak to, że w kwestii aut elektrycznych konkurujemy z Teslą i BMW. Dobranoc.",pl,[],[],[],3,8,111,[],[],https://twitter.com/PrawakL/status/1118993962126192644,False,,0,,,,,,,,[],,,,
1118991612565180417,1118991612565180417,2019-04-18 21:36:04 UTC,2019-04-18,21:36:04,+0000,79556841,felipepigna,Felipe Pigna,,"La obsesión de Nikola Tesla: el secreto oculto tras los números 3, 6 y 9 | Ancient Origins España y Latinoamérica  https://t.co/qQ6JFHn3CZ",es,[],['https://www.ancient-origins.es/noticias-general-fen%C3%B3menos-inexplicables/la-obsesi%C3%B3n-nikola-tesla-el-secreto-oculto-tras-los-n%C3%BAmeros-3-6-9-004049'],[],8,57,169,[],[],https://twitter.com/FelipePigna/status/1118991612565180417,False,,0,,,,,,,,[],,,,
1118989675257978880,1118989675257978880,2019-04-18 21:28:23 UTC,2019-04-18,21:28:23,+0000,349249475,gerberkawasaki,Ross Gerber,,"If a Tesla saves you $200 a month on gas, you own it for ten years. You take the savings and put it in a balanced fund each month. How much money do you have at the end? (hint: it's the cost of the car) #Teslamodel3 $TSLA",en,[],[],[],520,950,8246,['teslamodel3'],['tsla'],https://twitter.com/GerberKawasaki/status/1118989675257978880,False,,0,,,,,,,,[],,,,
1118983474105540608,1118983474105540608,2019-04-18 21:03:44 UTC,2019-04-18,21:03:44,+0000,430081520,cablepops,Papacito: Edd.,,Ahora que están mame y mame con su Game of Thrones les comparto una lista de cosas que aún no existían cuando se emitió su primer episodio en 2011.   Slack Siri Twitch Tinder Mi Panza  Fortnite Uber Eats Apple Maps Amazon Alexa FB Messenger Apple Music CandyCrush Tesla Model S,es,[],[],[],6,17,191,[],[],https://twitter.com/cablepops/status/1118983474105540608,False,,0,,,,,,,,[],,,,
1118979541748391938,1118979541748391938,2019-04-18 20:48:07 UTC,2019-04-18,20:48:07,+0000,14847096,domenick_y,Domenick,,"Funny. Auto Twitter was adamant when @Tesla delayed the Model 3 ramp up that we'd never see a ""real"" OEMs do something like that.  Well, now... ""Audi E-Tron Production Stalls Out, E-Tron Sportback Delayed""  https://t.co/QPFFWfQpHI  https://t.co/o3keNfom7T",en,"[{'screen_name': 'tesla', 'name': 'tesla', 'id': '13298072'}]",['https://insideevs.com/audi-e-tron-production-stalls-out/'],['https://pbs.twimg.com/media/D4dpYGeXoAEtNUF.jpg'],9,33,144,[],[],https://twitter.com/Domenick_Y/status/1118979541748391938,False,,1,https://pbs.twimg.com/media/D4dpYGeXoAEtNUF.jpg,,,,,,,[],,,,
1118976492250247168,1118976492250247168,2019-04-18 20:35:59 UTC,2019-04-18,20:35:59,+0000,17187345,reinboth,Christian Reinboth,,"Wichtig ist aber auch, dass unser Planet dabei nicht verliert. Und kein Mensch bei Tesla hat die deutsche Autoindustrie zu Tricksereien gezwungen.",de,[],[],[],3,6,72,[],[],https://twitter.com/reinboth/status/1118976492250247168,False,https://twitter.com/CSU/status/1118924794890788865,0,,,,,,,,[],,,,
1118976339128791041,1118976339128791041,2019-04-18 20:35:23 UTC,2019-04-18,20:35:23,+0000,732548050728701953,valueanalyst1,Yaman Tasdivar,,"For those who are not in a position to buy a new car today, and considering FSD price will continue to go up, $2500 order deposit to lock in a Model Y + FSD for purchase one year down the line is probably the best deal a potential @Tesla buyer can wish for: https://t.co/aDApjwSe5Z",en,"[{'screen_name': 'tesla', 'name': 'tesla', 'id': '13298072'}]",['https://www.tesla.com/modely/design'],[],11,12,86,[],[],https://twitter.com/ValueAnalyst1/status/1118976339128791041,False,,0,,,,,,,,[],,,,
1118965442993885187,1118965442993885187,2019-04-18 19:52:05 UTC,2019-04-18,19:52:05,+0000,84950626,orthereaboot,luis carruthers,,Every material talent that has left $tsla - from the recent Ben Fields to former director of Autopilot Sterling Anderson- has chosen to pursue an autonomous strategy using LiDAR.   Tesla’s own employees that know @tesla capabilities dont blv this pseudo science junk. Cue Cathie.,en,"[{'screen_name': 'tesla', 'name': 'tesla', 'id': '13298072'}]",[],[],11,20,120,[],['tsla'],https://twitter.com/orthereaboot/status/1118965442993885187,False,https://twitter.com/CathieDWood/status/1118961601183272960,0,,,,,,,,[],,,,
1118964712748797952,1118897919082602496,2019-04-18 19:49:11 UTC,2019-04-18,19:49:11,+0000,746847255257296896,blackstarcorne1,Ziggypop,,@DouglasDeveny and David Bowie as Nikola Tesla ⚡💡  https://t.co/c4rwmeCNxE,pl,[],[],['https://pbs.twimg.com/media/D4dceKqWAAEzwow.jpg'],2,88,133,[],[],https://twitter.com/BlackstarCorne1/status/1118964712748797952,False,,1,https://pbs.twimg.com/media/D4dceKqWAAEzwow.jpg,,,,,,,"[{'screen_name': 'DouglasDeveny', 'name': 'Douglas Deveny 🏳️\u200d🌈', 'id': '737693711438598146'}]",,,,
1118964669803155456,1118964669803155456,2019-04-18 19:49:01 UTC,2019-04-18,19:49:01,+0000,516898909,laurengiraldo,Lauren Giraldo,,I GOT MY TESLA 😭🤧😍   Autopilot to Coachella?!,en,[],[],[],7,4,457,[],[],https://twitter.com/LaurenGiraldo/status/1118964669803155456,False,,0,,,,,,,,[],,,,
1118964572554178562,1118964572554178562,2019-04-18 19:48:38 UTC,2019-04-18,19:48:38,+0000,789077444938625024,distrughy,Distrughy,,He predicted my tesla.  https://t.co/zlWVa0nHfa,en,[],[],[],10,13,192,[],[],https://twitter.com/distrughy/status/1118964572554178562,False,,1,https://pbs.twimg.com/ext_tw_video_thumb/1118964500001062912/pu/img/aKgkgivvH-SI3P-K.jpg,,,,,,,[],,,,
1118961601183272960,1118961601183272960,2019-04-18 19:36:49 UTC,2019-04-18,19:36:49,+0000,2361631088,cathiedwood,Cathie Wood,,".@ARKInvest’s confidence in $AAPL’s #AutonomousVehicle strategy has gone down based on its LiDAR focus, which #Tesla considers a crutch in an #AI model that is more deterministic than probabilistic, and we agree.",en,"[{'screen_name': 'arkinvest', 'name': 'ark invest', 'id': '2398137084'}]",[],[],58,31,192,"['autonomousvehicle', 'tesla', 'ai']",[],https://twitter.com/CathieDWood/status/1118961601183272960,False,https://twitter.com/TomBamonte/status/1118875424094851072,0,,,,,,,,[],,,,
1118958404435709953,1118958404435709953,2019-04-18 19:24:07 UTC,2019-04-18,19:24:07,+0000,93365814,criscyborg,CrisCyborg.com #Bellator279,,Road trip to Arizona! @Tesla  https://t.co/aw0xOA555u,en,"[{'screen_name': 'tesla', 'name': 'tesla', 'id': '13298072'}]",[],['https://pbs.twimg.com/media/D4dWu3OUYAAT4QS.jpg'],14,9,166,[],[],https://twitter.com/criscyborg/status/1118958404435709953,False,,1,https://pbs.twimg.com/media/D4dWu3OUYAAT4QS.jpg,,,,,,,[],,,,
1118956302523338752,1118956302523338752,2019-04-18 19:15:46 UTC,2019-04-18,19:15:46,+0000,151523137,kiczo,Kristian Lajšić,,"A kako znamo da je Tesla Srbin, to im je osveta za kosovsku zastavu. Case closed ☑️  https://t.co/efTSgWjDpA",sl,[],[],['https://pbs.twimg.com/media/D4dU0vRW0AA4RLg.jpg'],3,16,182,[],[],https://twitter.com/KICZO/status/1118956302523338752,False,,1,https://pbs.twimg.com/media/D4dU0vRW0AA4RLg.jpg,,,,,,,[],,,,
1118955966827859970,1118955966827859970,2019-04-18 19:14:26 UTC,2019-04-18,19:14:26,+0000,883960689584250880,myteslaadventur,My Tesla Adventure,,It’s not as bad as it looks. The officer staged a fake pull over of the #tesla lighting McQueen to post on the CHP Facebook page.🚀😍 @Tesla  https://t.co/ujOtr2WXK7,en,"[{'screen_name': 'tesla', 'name': 'tesla', 'id': '13298072'}]",[],"['https://pbs.twimg.com/media/D4dUgyrU4AESy0c.jpg', 'https://pbs.twimg.com/media/D4dUgytUIAUQw-s.jpg']",8,11,75,['tesla'],[],https://twitter.com/MyTeslaAdventur/status/1118955966827859970,False,,1,https://pbs.twimg.com/media/D4dUgyrU4AESy0c.jpg,,,,,,,[],,,,
1118954408434442246,1118954408434442246,2019-04-18 19:08:14 UTC,2019-04-18,19:08:14,+0000,2835161549,sigaramcamel,Kapheros,,"Çağın çok ötesinde bir Bilim Adamı olan Nikola Tesla’nın buluşları bugün hala bilim adamları tarafından yeni keşfedilmektedir. Birçok buluşu çalınmış, birçok projesi engellenmiş bir bilim adamı olan Tesla hakkı yenmiş bir dahidir.  https://t.co/EtvahXfAyH",tr,[],[],['https://pbs.twimg.com/media/D4dSrZkWwAEOj5b.jpg'],34,244,1172,[],[],https://twitter.com/sigaramcamel/status/1118954408434442246,False,,1,https://pbs.twimg.com/media/D4dSrZkWwAEOj5b.jpg,,,,,,,[],,,,
1118952768696229888,1118952768696229888,2019-04-18 19:01:43 UTC,2019-04-18,19:01:43,+0000,45353985,yanquetino,Mark Larsen,,"For over 7 years I've worn hats and shirts to promote EVs, but rarely did anyone ever stop to ask me about it until… I got my #Model3 last year. Now, not a day goes by without someone approaching me to know more about my @Tesla. 😃👍  https://t.co/jokFE2dbZr",en,"[{'screen_name': 'tesla', 'name': 'tesla', 'id': '13298072'}]",[],['https://pbs.twimg.com/media/D4dRTQMUcAAvhEQ.jpg'],3,6,99,['model3'],[],https://twitter.com/yanquetino/status/1118952768696229888,False,,1,https://pbs.twimg.com/media/D4dRTQMUcAAvhEQ.jpg,,,,,,,[],,,,
1118950007908884480,1118950007908884480,2019-04-18 18:50:45 UTC,2019-04-18,18:50:45,+0000,349249475,gerberkawasaki,Ross Gerber,,What product can you buy and it gets better every month?  #Tesla $TSLA,en,[],[],[],48,26,293,['tesla'],['tsla'],https://twitter.com/GerberKawasaki/status/1118950007908884480,False,,0,,,,,,,,[],,,,
1118943904433360897,1118924794890788865,2019-04-18 18:26:30 UTC,2019-04-18,18:26:30,+0000,818582768972156928,chrifeu,Christian Feuring,,"@CSU @CDU @ManfredWeber Unsere Autoindustrie verliert weil sie durch die Betrugsaktionen viel Vertrauen verspielt hat. Außerdem hat man das Thema “Elektromobilität“ jahrelang weitergehend ignoriert. „Tesla gewinnt“, tja, das nennt man „Markt“...",de,[],[],[],2,7,117,[],[],https://twitter.com/chrifeu/status/1118943904433360897,False,,0,,,,,,,,"[{'screen_name': 'CSU', 'name': 'CSU', 'id': '21107582'}, {'screen_name': 'CDU', 'name': 'CDU Deutschlands', 'id': '20429858'}, {'screen_name': 'ManfredWeber', 'name': 'Manfred Weber', 'id': '20399735'}]",,,,
1118940789109690368,1118662703109722112,2019-04-18 18:14:07 UTC,2019-04-18,18:14:07,+0000,234178694,amarlevine,Pets and Politics,,"@GerberKawasaki @WillemKadijk .@tesla just offered me $40k for my 2016 Model S, which I bought for $116k. And you claim it does not depreciate? You are providing false and misleading information to your investors.  $tsla $tslaq",en,"[{'screen_name': 'tesla', 'name': 'tesla', 'id': '13298072'}]",[],[],28,46,253,[],"['tsla', 'tslaq']",https://twitter.com/amarlevine/status/1118940789109690368,False,,0,,,,,,,,"[{'screen_name': 'GerberKawasaki', 'name': 'Ross Gerber', 'id': '349249475'}, {'screen_name': 'WillemKadijk', 'name': 'Mr Blue', 'id': '315783277'}]",,,,
1118938035754635264,1118938022412574722,2019-04-18 18:03:11 UTC,2019-04-18,18:03:11,+0000,842824397496836096,skabooshka,skabooshka,,"As with all things Tesla, particularly with regard to its apparent technological prowess, the “Autonomy Investor Day” will be saturated with false promises, misleading suggestions, and lures to credulity.",en,[],[],[],16,9,140,[],[],https://twitter.com/skabooshka/status/1118938035754635264,False,,0,,,,,,,,[],,,,
1118938034315993089,1118938022412574722,2019-04-18 18:03:10 UTC,2019-04-18,18:03:10,+0000,842824397496836096,skabooshka,skabooshka,,"It later became apparent that the demo was doctored, and required numerous attempts with instructions tailored specifically for that route.   Note: the only autonomous testing miles reported by Tesla in 2016 were in the week that it took to run that demo:   https://t.co/wgbCNOB7Rc",en,[],['https://www.dmv.ca.gov/portal/wcm/connect/f1873c87-4f21-4beb-b665-050cada6db7a/Tesla_disengage_report_2016.pdf?MOD=AJPERES&CVID='],[],2,8,118,[],[],https://twitter.com/skabooshka/status/1118938034315993089,False,,0,,,,,,,,[],,,,
1118938029966544896,1118938022412574722,2019-04-18 18:03:09 UTC,2019-04-18,18:03:09,+0000,842824397496836096,skabooshka,skabooshka,,"Here’s what I will be looking for on Tesla’s “Autonomy Investor Day”.  a) Does Tesla use this specific footage for its autonomy demonstration? If not, we will know that the company will have needed multiple runs to demonstrate its “capabilities”?",en,[],[],[],4,3,84,[],[],https://twitter.com/skabooshka/status/1118938029966544896,False,,0,,,,,,,,[],,,,
1118936919658782720,1118936919658782720,2019-04-18 17:58:45 UTC,2019-04-18,17:58:45,+0000,1038817610085806081,cyberhusky7,Ed C,,Pulled the trigger on my new Model Y Performance with FSD👌😉 @Tesla @elonmusk $TSLA  https://t.co/Y0kDLv9icc,en,"[{'screen_name': 'tesla', 'name': 'tesla', 'id': '13298072'}, {'screen_name': 'elonmusk', 'name': 'elon musk', 'id': '44196397'}]",[],['https://pbs.twimg.com/media/D4dBP-LUIAA5h_r.jpg'],12,14,226,[],['tsla'],https://twitter.com/CyberHusky7/status/1118936919658782720,False,,1,https://pbs.twimg.com/media/D4dBP-LUIAA5h_r.jpg,,,,,,,[],,,,
1118936395828088833,1118936395828088833,2019-04-18 17:56:40 UTC,2019-04-18,17:56:40,+0000,3075110878,presnijet,peni boom moreno🍒,,ZAMIJENILA SIJALICU CALL ME TESLA  https://t.co/lM7AKdlpM5,und,[],[],['https://pbs.twimg.com/media/D4dCt1gXoAAsOtA.jpg'],0,2,71,[],[],https://twitter.com/presnijet/status/1118936395828088833,False,,1,https://pbs.twimg.com/media/D4dCt1gXoAAsOtA.jpg,,,,,,,[],,,,
1118929688074838016,1118929688074838016,2019-04-18 17:30:01 UTC,2019-04-18,17:30:01,+0000,1308211178,teslarati,TESLARATI,,"The Audi e-tron, once-hailed as a ‘Tesla Killer,’ reportedly slows down production in its Brussels plant to just 6 hrs/day: report  https://t.co/gLNfVtDrck",en,[],['https://www.teslarati.com/tesla-killer-audi-etron-battery-production-update'],[],30,81,388,[],[],https://twitter.com/Teslarati/status/1118929688074838016,False,,0,,,,,,,,[],,,,
1118927316183388160,1118927316183388160,2019-04-18 17:20:35 UTC,2019-04-18,17:20:35,+0000,14165170,binarybits,Timothy B. Lee,,"Something that drives me crazy: Tesla fans talking about regulatory approval as an obstacle to driverless cars. In the US, at least, self-driving cars are basically unregulated at the federal level. Tesla could push out a full self-driving software update tomorrow.",en,[],[],[],9,4,64,[],[],https://twitter.com/binarybits/status/1118927316183388160,False,,0,,,,,,,,[],,,,
1118924794890788865,1118924794890788865,2019-04-18 17:10:34 UTC,2019-04-18,17:10:34,+0000,21107582,csu,CSU,,".@ManfredWeber: Beim Klimaschutz sind wir uns einig, dass wir Ambition brauchen. Aber SPD und Grüne riskieren mit ihren überzogenen Forderungen Arbeitsplätze. Es kann nicht sein, dass unsere Autoindustrie verliert und Tesla gewinnt. #BRextra #DeinEuropa",de,"[{'screen_name': 'manfredweber', 'name': 'manfred weber', 'id': '20399735'}]",[],[],1125,48,206,"['brextra', 'deineuropa']",[],https://twitter.com/CSU/status/1118924794890788865,False,,0,,,,,,,,[],,,,
1118921119526817792,1118921119526817792,2019-04-18 16:55:58 UTC,2019-04-18,16:55:58,+0000,1059953449586982912,drivingslate,Driving Slate,,Cliff #tesla #model3  https://t.co/PU9UXmnihJ  https://t.co/iOgEIHz67u,en,[],['https://www.instagram.com/p/BwZ4L5_gT7X/?utm_source=ig_share_sheet&igshid=1mro0vwefhlqx'],['https://pbs.twimg.com/media/D4c00tPUIAAY8OA.jpg'],5,5,60,"['tesla', 'model3']",[],https://twitter.com/DrivingSlate/status/1118921119526817792,False,,1,https://pbs.twimg.com/media/D4c00tPUIAAY8OA.jpg,,,,,,,[],,,,
1118919868194140160,1118919868194140160,2019-04-18 16:50:59 UTC,2019-04-18,16:50:59,+0000,2828216402,netzoeko,Stefan Fritz,,Gerade noch einen Ladeplatz ergattert auf dem Weg nach Hamburg. Die Anzahl der Elektro-Autos in Deutschland steigt spürbar an. 😉 #elektromobilitaet #emobility #tesla  https://t.co/UsfydEzhMc,de,[],[],['https://pbs.twimg.com/media/D4czpJOXsAIC7L_.jpg'],24,40,1140,"['elektromobilitaet', 'emobility', 'tesla']",[],https://twitter.com/Netzoeko/status/1118919868194140160,False,,1,https://pbs.twimg.com/media/D4czpJOXsAIC7L_.jpg,,,,,,,[],,,,
1118908444017348608,1118908444017348608,2019-04-18 16:05:36 UTC,2019-04-18,16:05:36,+0000,84950626,orthereaboot,luis carruthers,,"Monday, $TSLA will pump its FSD delusions.   In reality, $TSLA won't even claim emergency breaking works. Owner on AP has total loss of car, Tesla responds we never promised Emergency Breaking worked, in fact, it worked consistently with our warnings it doesn't.  Just unreal!  https://t.co/Jr30fvAcbU",en,[],[],"['https://pbs.twimg.com/media/D4coqEkW0AACeeQ.png', 'https://pbs.twimg.com/media/D4cpPkHXkAcNSdQ.png']",8,14,61,[],"['tsla', 'tsla']",https://twitter.com/orthereaboot/status/1118908444017348608,False,,1,https://pbs.twimg.com/media/D4coqEkW0AACeeQ.png,,,,,,,[],,,,
1118904757995941889,1118904757995941889,2019-04-18 15:50:57 UTC,2019-04-18,15:50:57,+0000,824107409723588608,itskimjava,It’s Kim Java,,Can’t believe its been a week since the Falcon Heavy launch &amp; to celebrate we‘re posting our video. SO much good behind the scenes with the Tesla community in this vid. Go watch &amp; tag someone you recognize! 🧐#LikeTesla #Tesla #SpaceX #FalconHeavy LINK:   https://t.co/Z8O4iLP4GF  https://t.co/bOgHCzyr2n,en,[],['https://youtu.be/LbiI0rYrcZo'],['https://pbs.twimg.com/media/D4cl8h3WwAYeOAd.jpg'],5,10,142,"['liketesla', 'tesla', 'spacex', 'falconheavy']",[],https://twitter.com/ItsKimJava/status/1118904757995941889,False,,1,https://pbs.twimg.com/media/D4cl8h3WwAYeOAd.jpg,,,,,,,[],,,,
1118904020372869120,1118904020372869120,2019-04-18 15:48:01 UTC,2019-04-18,15:48:01,+0000,2564597449,elonmusknewsorg,Elon Musk News,,"Tesla Impact Report: 4 million tons of CO2 saved, 13.25 TWh solar electricity generated    https://t.co/BnB2bSNlju",en,[],['https://www.teslarati.com/tesla-impact-report-2018-results/'],[],4,34,103,[],[],https://twitter.com/ElonMuskNewsOrg/status/1118904020372869120,False,,0,,,,,,,,[],,,,
1118897461278466048,1118897461278466048,2019-04-18 15:21:57 UTC,2019-04-18,15:21:57,+0000,1308211178,teslarati,TESLARATI,,Tesla shares show resilience amid longtime $TSLA bull's more conservative outlook  https://t.co/9ocHaH4jZK,en,[],['https://www.teslarati.com/tesla-tsla-price-target-ben-kallo-model-3-growth/'],[],3,7,130,[],['tsla'],https://twitter.com/Teslarati/status/1118897461278466048,False,,0,,,,,,,,[],,,,
1118894973490012160,1118894973490012160,2019-04-18 15:12:04 UTC,2019-04-18,15:12:04,+0000,1651403384,chrisdungeon,Christopher Dungeon,,"I've given 2 test drives in my @Tesla #Model3 Performance. One currently owns a @BMW #3Series and the other an @Audi A3 #etron. Both drove my #Tesla for about 30 minutes and I probably spent another 30 going over settings, functions, and superchargers.  Both WANT a Model 3 now :)  https://t.co/RSQxca5uOf",en,"[{'screen_name': 'tesla', 'name': 'tesla', 'id': '13298072'}, {'screen_name': 'bmw', 'name': 'bmw', 'id': '1545994664'}, {'screen_name': 'audi', 'name': 'audi usa', 'id': '27650674'}]",[],['https://pbs.twimg.com/media/D4cdC9bWAAEPKnE.jpg'],41,106,1833,"['model3', '3series', 'etron', 'tesla']",[],https://twitter.com/ChrisDungeon/status/1118894973490012160,False,,1,https://pbs.twimg.com/media/D4cdC9bWAAEPKnE.jpg,,,,,,,[],,,,
1118893205389316097,1118893205389316097,2019-04-18 15:05:02 UTC,2019-04-18,15:05:02,+0000,13931922,fromwhereichg,Craig Coker,,Go green my friends. 👌 #model3 @Tesla @elonmusk  https://t.co/H6kxDUBWlY,en,"[{'screen_name': 'tesla', 'name': 'tesla', 'id': '13298072'}, {'screen_name': 'elonmusk', 'name': 'elon musk', 'id': '44196397'}]",[],['https://pbs.twimg.com/media/D4cbb5-UcAE_NlQ.jpg'],6,17,86,['model3'],[],https://twitter.com/FromWhereICHG/status/1118893205389316097,False,,1,https://pbs.twimg.com/media/D4cbb5-UcAE_NlQ.jpg,,,,,,,[],,,,
1118891355919536130,1118891355919536130,2019-04-18 14:57:41 UTC,2019-04-18,14:57:41,+0000,114782468,carlquintanilla,Carl Quintanilla,,"142 S&amp;P earnings next week, including:  Kimberly-Clark Whirlpool Coke Lockheed P&amp;G Verizon UTX Hasbro Harley Twitter JetBlue eBay AT&amp;T Boeing Cat Norfolk Domino's Facebook Microsoft PayPal Tesla Visa Chipotle 3M Comcast UPS Southwest Amazon Ford Starbucks Mattel Chevron Sony",en,[],[],[],5,15,71,[],[],https://twitter.com/carlquintanilla/status/1118891355919536130,False,,0,,,,,,,,[],,,,
1118887039120764928,1118887039120764928,2019-04-18 14:40:32 UTC,2019-04-18,14:40:32,+0000,16572109,laurie_march,Laurie March,,"For those of you considering buying a @Tesla, $tsla #teslaqualityissues will dim the glow of your #EV. Owners can look forward to over a month wait for repair parts, and stock holders can look forward to being blocked by #elonmusk on here for constructive criticism. @elonmusk",en,"[{'screen_name': 'tesla', 'name': 'tesla', 'id': '13298072'}, {'screen_name': 'elonmusk', 'name': 'elon musk', 'id': '44196397'}]",[],[],15,41,152,"['teslaqualityissues', 'ev', 'elonmusk']",['tsla'],https://twitter.com/Laurie_March/status/1118887039120764928,False,,0,,,,,,,,[],,,,
1118879189887848450,1118879189887848450,2019-04-18 14:09:21 UTC,2019-04-18,14:09:21,+0000,732548050728701953,valueanalyst1,Yaman Tasdivar,,"The BEST AND ONLY ubiquitous fast-charging network is built by @Tesla; there is nothing else like it.  Before ""competition"" even wakes up, Tesla is upgrading its stations with Supercharger Version 3, allowing charging rate of 1000 mph!  The future is here:  https://t.co/p7tydUM6Et",en,"[{'screen_name': 'tesla', 'name': 'tesla', 'id': '13298072'}]",['https://twitter.com/Tesla/status/1118563299832913921'],[],3,4,64,[],[],https://twitter.com/ValueAnalyst1/status/1118879189887848450,False,https://twitter.com/Tesla/status/1118563299832913921,0,,,,,,,,[],,,,
1118876983214080000,1118876983214080000,2019-04-18 14:00:35 UTC,2019-04-18,14:00:35,+0000,885089248013148161,teslaopinion,🇺🇦 Tesla Opinion 🇺🇦 👀,,Why #Tesla:  SELF DRIVING updates NO fuel SAFEST Amazing drive Quiet FUN (farts!) Looks Over Air Updates ~0 regular servicing Life ~1 million miles Battery 500K (+cheap) Dog &amp; Sentry modes Storage Build quality Community Remote control Low &amp; ethical cobalt Recycling  $TSLA $tslaq,en,[],[],[],4,12,77,['tesla'],"['tsla', 'tslaq']",https://twitter.com/TeslaOpinion/status/1118876983214080000,False,,0,,,,,,,,[],,,,
