,id,conversation_id,created_at,date,time,timezone,user_id,username,name,place,tweet,language,mentions,urls,photos,replies_count,retweets_count,likes_count,hashtags,cashtags,link,retweet,quote_url,video,thumbnail,near,geo,source,user_rt_id,user_rt,retweet_id,reply_to,retweet_date,translate,trans_src,trans_dest,negative,neutral,positive
128,1210059619369918465,1210059619369918465,2019-12-26 04:47:49 UTC,2019-12-26,04:47:49,0,368148234,sdinwiddie_25,Spencer Dinwiddie,,2020 Tesla roadster (RT) vs Porsche taycan turbo s (Like)?  Spencer Dinwiddie #NBAVote,en,[],[],[],26,150,410,['nbavote'],[],https://twitter.com/SDinwiddie_25/status/1210059619369918465,False,,0,,,,,,,,[],,,,,0.007932045,0.92544895,0.06661903
129,1210057803043356672,1210057803043356672,2019-12-26 04:40:36 UTC,2019-12-26,04:40:36,0,368148234,sdinwiddie_25,Spencer Dinwiddie,,Y’all know ima Tesla guy but that Porsche Taycan is intriguing to say the least...,en,[],[],[],14,13,237,[],[],https://twitter.com/SDinwiddie_25/status/1210057803043356672,False,,0,,,,,,,,[],,,,,0.011288254,0.15487245,0.83383924
130,1210054454990360578,1210054454990360578,2019-12-26 04:27:18 UTC,2019-12-26,04:27:18,0,959168599519764480,ray4tesla,Ray4Tesla⚡️🚘☀️🔋,,JUST IN: Chinese owners like to show off their Smart Summon in action. I particularly like this clip because the #Model3 is summoned out of its parallel parking spot. Smart Summon footages are going viral in China. Other automakers are jealous of #Tesla getting all free ads. 😂  https://t.co/c4JxGPzZAa,en,[],[],[],12,93,731,"['model3', 'tesla']",[],https://twitter.com/ray4tesla/status/1210054454990360578,False,,1,https://pbs.twimg.com/ext_tw_video_thumb/1210054428838907906/pu/img/0NiPot15q2YfHOPG.jpg,,,,,,,[],,,,,0.005757986,0.05739215,0.9368498
131,1210044052030144512,1210044052030144512,2019-12-26 03:45:58 UTC,2019-12-26,03:45:58,0,2403074547,lilsasquatch66,Lil Sasquatch,,I’m sorry I lied about getting a new Tesla but babe like I really thought I was gonna win that Instagram competition I have no idea what happened,en,[],[],[],11,1079,12472,[],[],https://twitter.com/lilsasquatch66/status/1210044052030144512,False,,0,,,,,,,,[],,,,,0.77104634,0.18949951,0.039454058
132,1210043723557433344,1210043723557433344,2019-12-26 03:44:39 UTC,2019-12-26,03:44:39,0,1909232666,fortelabs,Tiago Forte,,"Why is all Tesla advertising about how many seconds it goes 0-60 and other macho BS?  I want to know how much it reduces environmental impact, how much it protects my family, and how much more convenient it makes my life  Anyone published their findings on those?",en,[],[],[],18,5,82,[],[],https://twitter.com/fortelabs/status/1210043723557433344,False,,0,,,,,,,,[],,,,,0.5051271,0.3978707,0.09700228
133,1210035054606536704,1210035054606536704,2019-12-26 03:10:13 UTC,2019-12-26,03:10:13,0,885089248013148161,teslaopinion,🇺🇦 Tesla Opinion 🇺🇦 👀,,"Tesla May Soon Have a Battery That Can Last 1 Million Miles.  This paper details batteries that can be charged &amp; depleted &gt; 4,000 X &amp; lose only ~10% of capacity.  Publishing this suggests $Tsla already has better tech.  #BestServiceIsNOService $tslaq  https://t.co/H8ipeDhWqP",en,[],['https://www.wired.com/story/tesla-may-soon-have-a-battery-that-can-last-a-million-miles/'],[],1,15,59,['bestserviceisnoservice'],"['tsla', 'tslaq']",https://twitter.com/TeslaOpinion/status/1210035054606536704,False,,0,,,,,,,,[],,,,,0.0073910323,0.13540988,0.8571991
134,1210034535133376513,1210034535133376513,2019-12-26 03:08:09 UTC,2019-12-26,03:08:09,0,5865072,shinojapan,Takaya Shinozuka / 令和トラベル CEO,,20年前のクリスマスには存在してなかったものすごい。  iPhone Facebook YouTube Twitter Instagram Android iPad Gmail Netflix Wikipedia Google Maps Amazon Prime App Store SpaceX Reddit Snapchat Skype Spotify Airbnb Uber Xbox Waze iTunes Hashtag Chrome Tesla Bitcoin LinkedIn,ja,[],[],[],0,19,99,[],[],https://twitter.com/shinojapan/status/1210034535133376513,False,https://twitter.com/JonErlichman/status/1209884385740238848,0,,,,,,,,[],,,,,0.01104665,0.9096053,0.079347834
135,1210031904046510081,1210030419602657282,2019-12-26 02:57:41 UTC,2019-12-26,02:57:41,0,15746580,jacksondahl,Jackson,,This is after David gave away a Tesla earlier this week with @SeatGeek (SeatGeek now has 2M followers on Instagram and David’s post has 4.3M likes). Not bad for a YouTuber  Creators and influencers have unbelievable power and it’s just getting started. Own audience and you win.,en,"[{'screen_name': 'seatgeek', 'name': 'seatgeek', 'id': '58865001'}]",[],[],6,2,113,[],[],https://twitter.com/jacksondahl/status/1210031904046510081,False,,0,,,,,,,,[],,,,,0.0068946616,0.1542275,0.83887786
136,1210024390269620224,1210024390269620224,2019-12-26 02:27:50 UTC,2019-12-26,02:27:50,0,1055976489022193664,sfteslaclub,SF TESLA CLUB,,This just in—Model Y sighting in #SanFrancisco on Christmas Day..#tesla people don’t take holidays off!  https://t.co/EwCs8Sz0lQ,en,[],[],[],26,92,799,"['sanfrancisco', 'tesla']",[],https://twitter.com/sfteslaclub/status/1210024390269620224,False,,1,https://pbs.twimg.com/ext_tw_video_thumb/1210023868032675840/pu/img/y5vHUeGMlTN9H_dQ.jpg,,,,,,,[],,,,,0.03083945,0.7063369,0.2628235
137,1210022809591828480,1210022809591828480,2019-12-26 02:21:33 UTC,2019-12-26,02:21:33,0,3022831822,jennaawolf,jenna,,can't believe i just saw someone get a tesla for christmas on instagram. suddenly my cotton balls and toothpaste don't look so glam 🤧,en,[],[],[],1,1,87,[],[],https://twitter.com/jennaawolf/status/1210022809591828480,False,,0,,,,,,,,[],,,,,0.79571795,0.17968847,0.024593526
138,1210020608727244808,1210020608727244808,2019-12-26 02:12:48 UTC,2019-12-26,02:12:48,0,1374059611,teslany,Tesla New York,,"Tesla Model 3 AWD with $2,000 ‘Acceleration Boost’ Upgrade → 0-60 mph in 3.56 secs 🚘📶⏱  https://t.co/0bvp2CEHQT $TSLA #Tesla #EV #OTA  https://t.co/H8uAy7dQNA",en,[],['https://m.youtube.com/watch?feature=youtu.be&v=9BZLJ81IA6I'],['https://pbs.twimg.com/media/EMrbU96WkAAszj1.jpg'],1,13,65,"['tesla', 'ev', 'ota']",['tsla'],https://twitter.com/TeslaNY/status/1210020608727244808,False,,1,https://pbs.twimg.com/media/EMrbU96WkAAszj1.jpg,,,,,,,[],,,,,0.0034493448,0.36095014,0.6356007
139,1210019377816322050,1210019374054002688,2019-12-26 02:07:55 UTC,2019-12-26,02:07:55,0,1139310453987745792,thirdrowtesla,Third Row Tesla Podcast,,"Douche: Yeah, but all of Wall Street went bankrupt and needed a bailout that year!  Me: Okay; as Tesla was getting started all of Wall Street went bankrupt. Has Tesla ever gone bankrupt?  Douche: Not yet but any day now I know it!!  Me: this is why you guys keep going bankrupt",en,[],[],[],3,6,92,[],[],https://twitter.com/thirdrowtesla/status/1210019377816322050,False,,0,,,,,,,,[],,,,,0.6734677,0.27228928,0.05424313
140,1210019374054002688,1210019374054002688,2019-12-26 02:07:54 UTC,2019-12-26,02:07:54,0,1139310453987745792,thirdrowtesla,Third Row Tesla Podcast,,Wall St Douche: I’m a WALL STREET GUY and I think Tesla is going to go BANKRUPT! It’s a fraud held up by government subsidies.   Me: Where were you working 10 years ago when Tesla was getting started   Douche: Bear Stearns  Me: Didn’t they go bankrupt and need a govt bailout?,en,[],[],[],5,18,189,[],[],https://twitter.com/thirdrowtesla/status/1210019374054002688,False,,0,,,,,,,,[],,,,,0.7732919,0.2040032,0.022704944
141,1210018943236132864,1210018943236132864,2019-12-26 02:06:11 UTC,2019-12-26,02:06:11,0,44267502,insurmountabl1,GiddyUpTesla 🇺🇦❤️,,"If you look at to the best performing stocks of all time Apple (600x) and Amazon (1200x) since IPO and Tesla currently sits at 25x. If Tesla 600x it’s price would be $10,200/sh. If it 1200x it’s price would be $20,400/sh. Tons of upside...",en,[],[],[],4,11,85,[],[],https://twitter.com/Insurmountabl1/status/1210018943236132864,False,,0,,,,,,,,[],,,,,0.0068513877,0.17637953,0.8167691
142,1210016775934488576,1210016775934488576,2019-12-26 01:57:35 UTC,2019-12-26,01:57:35,0,888392745517277185,lilsamsquanch66,lilsamsquanch,,So I just talked to David dobrik and he said he’s giving everyone who likes rts and follows this tweet/account a Tesla! Sound good? I think it does 😅🤚,en,[],[],[],4,10,315,[],[],https://twitter.com/lilsamsquanch66/status/1210016775934488576,False,,0,,,,,,,,[],,,,,0.0050413036,0.08351475,0.911444
143,1210004115482271744,1210004115482271744,2019-12-26 01:07:16 UTC,2019-12-26,01:07:16,0,980554784133427200,barkmsmeagol,Bark 👀,,Tesla merch packaging is pretty dope.  https://t.co/adC9kxdWOB,en,[],[],['https://pbs.twimg.com/media/EMrMU9FVAAAw9om.jpg'],14,26,365,[],[],https://twitter.com/BarkMSmeagol/status/1210004115482271744,False,,1,https://pbs.twimg.com/media/EMrMU9FVAAAw9om.jpg,,,,,,,[],,,,,0.0034501133,0.022446904,0.97410303
144,1209995881484668928,1209995881484668928,2019-12-26 00:34:33 UTC,2019-12-26,00:34:33,0,346454921,ayobrobro,⚔️brodiereed⚔️,,My cousin who is thinking about buying a Tesla got me an amazon gift card and told me he loves Andrew Yang. Seasons greetings from my problematic family to yours!,en,[],[],[],1,0,60,[],[],https://twitter.com/ayobrobro/status/1209995881484668928,False,,0,,,,,,,,[],,,,,0.0063811056,0.048864122,0.9447547
145,1209989776838942721,1209989776838942721,2019-12-26 00:10:17 UTC,2019-12-26,00:10:17,0,2564261545,sammm_camm,Samantha,,Got my parents @DavidDobrik merch for Christmas and they love it...they would’ve preferred the Tesla though! Lol we love watching the vlogs!  https://t.co/UXYzMdN6cy,en,"[{'screen_name': 'daviddobrik', 'name': 'david dobrik', 'id': '325306055'}]",[],['https://pbs.twimg.com/media/EMq_RkJX0AAjOSq.jpg'],0,5,84,[],[],https://twitter.com/Sammm_Camm/status/1209989776838942721,False,,1,https://pbs.twimg.com/media/EMq_RkJX0AAjOSq.jpg,,,,,,,[],,,,,0.0023960893,0.013212431,0.98439157
