,id,conversation_id,created_at,date,time,timezone,user_id,username,name,place,tweet,language,mentions,urls,photos,replies_count,retweets_count,likes_count,hashtags,cashtags,link,retweet,quote_url,video,thumbnail,near,geo,source,user_rt_id,user_rt,retweet_id,reply_to,retweet_date,translate,trans_src,trans_dest,negative,neutral,positive
0,1135333758435962880,1135333758435962880,2019-06-02 23:53:56 UTC,2019-06-02,23:53:56,0,1074073695939813377,mymodl3,mymodl3,,"In a Tesla, you feel like you can touch the moon.  Oh, how I love this picture! Model S in Auvergne, France as posted by qorz via Instagram. #Tesla #ModelS #TeslaModelS  https://t.co/zERJHMkBRx",en,[],[],['https://pbs.twimg.com/media/D8GECJBU0AAaY9g.jpg'],9,20,178,"['tesla', 'models', 'teslamodels']",[],https://twitter.com/mymodl3/status/1135333758435962880,False,,1,https://pbs.twimg.com/media/D8GECJBU0AAaY9g.jpg,,,,,,,[],,,,,0.0024849083,0.0167886,0.9807265
1,1135329571795021828,1135329571795021828,2019-06-02 23:37:17 UTC,2019-06-02,23:37:17,0,568621669,insideevs,InsideEVs,,Tesla Model Y Electric Range Just 8-10% Less Than Model 3  https://t.co/MQNuqTEDBq via @insideevs.com,ca,"[{'screen_name': 'insideevs', 'name': 'insideevs', 'id': '568621669'}]",['https://insideevs.com/news/352625/tesla-model-y-range-model-3/amp/'],[],5,16,100,[],[],https://twitter.com/InsideEVs/status/1135329571795021828,False,,0,,,,,,,,[],,,,,0.022673301,0.7444793,0.23284738
2,1135326880779739136,1135326880779739136,2019-06-02 23:26:36 UTC,2019-06-02,23:26:36,0,229502009,mjg59,Matthew Garrett,,Sitting on BART listening to a bunch of Tesla employees talking about how they deliberately avoid being in situations where they'd have to talk to Elon,en,[],[],[],5,22,250,[],[],https://twitter.com/mjg59/status/1135326880779739136,False,,0,,,,,,,,[],,,,,0.25947744,0.66188294,0.07863973
3,1135318933869944838,1135318933869944838,2019-06-02 22:55:01 UTC,2019-06-02,22:55:01,0,2564597449,elonmusknewsorg,Elon Musk News,,"Tesla Pickup truck to cost less than $50,000, ‘be better than F150’, says Elon Musk   https://t.co/za2xrclqTT",en,[],['https://electrek.co/2019/06/02/tesla-pickup-truck-price-f150-elon-musk/'],[],20,58,194,[],[],https://twitter.com/ElonMuskNewsOrg/status/1135318933869944838,False,,0,,,,,,,,[],,,,,0.005998446,0.275316,0.71868557
4,1135314986019053581,1135314986019053581,2019-06-02 22:39:20 UTC,2019-06-02,22:39:20,0,216644462,fullychargeddan,FullyChargedDanCæsar🗯,,"“Tesla Pickup truck to cost less than $50,000, 'be better than F150', says Elon Musk.”  https://t.co/GNPishMKBm",en,[],['https://electrek.co/2019/06/02/tesla-pickup-truck-price-f150-elon-musk/'],[],15,49,233,[],[],https://twitter.com/FullyChargedDan/status/1135314986019053581,False,,0,,,,,,,,[],,,,,0.004781085,0.18729988,0.80791914
5,1135314135980347394,1135314135980347394,2019-06-02 22:35:57 UTC,2019-06-02,22:35:57,0,2148233600,electrekco,Electrek.co,,"Tesla Pickup truck to cost less than $50,000, 'be better than F150', says Elon Musk  https://t.co/Qhls93HFVK by @fredericlambert  https://t.co/5SASFuVB5G",en,"[{'screen_name': 'fredericlambert', 'name': 'fred lambert', 'id': '38253449'}]",['https://electrek.co/2019/06/02/tesla-pickup-truck-price-f150-elon-musk/'],['https://pbs.twimg.com/media/D8FyMHwXUAADrWB.jpg'],53,215,947,[],[],https://twitter.com/ElectrekCo/status/1135314135980347394,False,,1,https://pbs.twimg.com/media/D8FyMHwXUAADrWB.jpg,,,,,,,[],,,,,0.005938612,0.2927078,0.7013536
6,1135309699455356928,1135309699455356928,2019-06-02 22:18:20 UTC,2019-06-02,22:18:20,0,568621669,insideevs,InsideEVs,,Tesla Model 3 Acts Fast To Avoid Coal Rolling Pickup Truck: Video  https://t.co/MhwACmqCXf via @insideevs.com,en,"[{'screen_name': 'insideevs', 'name': 'insideevs', 'id': '568621669'}]",['https://insideevs.com/news/352549/video-pickup-truck-roll-coal-tesla/amp/'],[],11,23,409,[],[],https://twitter.com/InsideEVs/status/1135309699455356928,False,,0,,,,,,,,[],,,,,0.0067586927,0.8472354,0.146006
7,1135306530234880000,1135306530234880000,2019-06-02 22:05:44 UTC,2019-06-02,22:05:44,0,1689516060,vincent13031925,vincentyu.eth,,"Base on the TSLAQ 🐻🐻’s theory, anyday from year 2010 can be the day of Tesla bankruptcy.   I will like to congratulate to all $TSLA shareholders &amp; followers, we have been thru more than 3200+ times of bankruptcies &amp; we still here 😂😂😂",en,[],[],[],16,37,398,[],['tsla'],https://twitter.com/vincent13031925/status/1135306530234880000,False,,0,,,,,,,,[],,,,,0.028602116,0.243869,0.7275288
8,1135305851126894592,1135305851126894592,2019-06-02 22:03:02 UTC,2019-06-02,22:03:02,0,962805945020702722,teslacharts,TC,,"563 days ago, the biggest huckster of our time started taking deposits for the Tesla Semi. Here’s what he says about it now. $TSLAQ  https://t.co/IVeqt2JVvT",en,[],[],['https://pbs.twimg.com/media/D8FqptgX4AEQNfN.jpg'],8,10,65,[],['tslaq'],https://twitter.com/TESLAcharts/status/1135305851126894592,False,,1,https://pbs.twimg.com/media/D8FqptgX4AEQNfN.jpg,,,,,,,[],,,,,0.55533683,0.39181972,0.05284355
9,1135305499883319296,1135305499883319296,2019-06-02 22:01:38 UTC,2019-06-02,22:01:38,0,998140573008695296,28delayslater,🇺🇦 🦊 Earl of FrunkPuppy 🇺🇦,,Just got back from a FUD planning meeting.According to them the Tesla Pickup is:  -simply a stock pump -ugly and unbuildable -only selling to a few fans  -almost done massive backlog  -sales numbers are fake / or Elon bought them all -sales will plummet soon -imminent bankruptcy  https://t.co/ecX7e5aMTL,en,[],[],['https://pbs.twimg.com/tweet_video_thumb/D8FqU8NXoAEHYED.jpg'],12,1,47,[],[],https://twitter.com/28delayslater/status/1135305499883319296,False,,1,https://pbs.twimg.com/tweet_video_thumb/D8FqU8NXoAEHYED.jpg,,,,,,,[],,,,,0.85327274,0.134883,0.011844235
10,1135301570508271618,1135301570508271618,2019-06-02 21:46:01 UTC,2019-06-02,21:46:01,0,275686563,verge,The Verge,,Tesla opens Chinese preorders for cheaper Model 3s made in China  https://t.co/dYk82M7xRE  https://t.co/6twXivjsHU,en,[],['https://www.theverge.com/2019/5/31/18646986/tesla-model-3-made-in-china-chinese-preorders-price-release-date-shanghai-gigafactory?utm_campaign=theverge&utm_content=chorus&utm_medium=social&utm_source=twitter'],['https://pbs.twimg.com/media/D8Fmwq8XUAAvvei.jpg'],2,17,96,[],[],https://twitter.com/verge/status/1135301570508271618,False,,1,https://pbs.twimg.com/media/D8Fmwq8XUAAvvei.jpg,,,,,,,[],,,,,0.004602626,0.71403176,0.2813655
11,1135300850622971904,1135300850622971904,2019-06-02 21:43:10 UTC,2019-06-02,21:43:10,0,71077864,megangale,Megan #ChasingSunsets,,#chasingsunsets in my @Tesla #performancemodel3 @elonmusk  https://t.co/4DxEp2rXDV,en,"[{'screen_name': 'tesla', 'name': 'tesla', 'id': '13298072'}, {'screen_name': 'elonmusk', 'name': 'elon musk', 'id': '44196397'}]",[],['https://pbs.twimg.com/media/D8FmGbwUwAUgVL3.jpg'],2,2,68,"['chasingsunsets', 'performancemodel3']",[],https://twitter.com/megangale/status/1135300850622971904,False,,1,https://pbs.twimg.com/media/D8FmGbwUwAUgVL3.jpg,,,,,,,[],,,,,0.0069148373,0.93575466,0.05733049
12,1135299973719965711,1135169193433866240,2019-06-02 21:39:41 UTC,2019-06-02,21:39:41,0,704835627183788032,model3owners,Trev Page,,"@DMC_Ryan @Tesla @elonmusk Congrats Ryan, so glad you asked all the right questions 👍🏼👍🏼",en,[],[],[],2,1,118,[],[],https://twitter.com/Model3Owners/status/1135299973719965711,False,,0,,,,,,,,"[{'screen_name': 'DMC_Ryan', 'name': 'Ryan McCaffrey', 'id': '308795969'}, {'screen_name': 'Tesla', 'name': 'Tesla', 'id': '13298072'}, {'screen_name': 'elonmusk', 'name': 'Elon Musk', 'id': '44196397'}]",,,,,0.0026908794,0.012293689,0.9850153
13,1135298949152149504,1135298949152149504,2019-06-02 21:35:36 UTC,2019-06-02,21:35:36,0,704835627183788032,model3owners,Trev Page,,@DMC_Ryan’s interview with @elonmusk finally cleared up once and for all that the Tesla pickup image is indeed the front. I had a feeling that’s what it was  https://t.co/eNfZGSLKQG,en,"[{'screen_name': 'elonmusk', 'name': 'elon musk', 'id': '44196397'}]",[],['https://pbs.twimg.com/media/D8FkYDjW4AYCQU5.jpg'],5,7,70,[],[],https://twitter.com/Model3Owners/status/1135298949152149504,False,,1,https://pbs.twimg.com/media/D8FkYDjW4AYCQU5.jpg,,,,,,,[],,,,,0.029958142,0.8362487,0.1337931
14,1135296202289713157,1135296202289713157,2019-06-02 21:24:42 UTC,2019-06-02,21:24:42,0,16258534,hamids,Hamid Shojaee,,"The new @Ferrari SF90 is the brand new, $1 Million, 1,000HP, flagship Ferrari - the creme of the crop of supercars! It's sooo close to beating the @Tesla Model S's 2.4s 0-60 time.  Just for fun, how does it compare to the Tesla Roadster 2?  Can't come soon enough @elonmusk!  https://t.co/9UcVqhdJdH",en,"[{'screen_name': 'ferrari', 'name': 'ferrari', 'id': '2650413864'}, {'screen_name': 'tesla', 'name': 'tesla', 'id': '13298072'}, {'screen_name': 'elonmusk', 'name': 'elon musk', 'id': '44196397'}]",[],['https://pbs.twimg.com/media/D8Fgk5yVUAET89S.jpg'],83,335,2653,[],[],https://twitter.com/hamids/status/1135296202289713157,False,,1,https://pbs.twimg.com/media/D8Fgk5yVUAET89S.jpg,,,,,,,[],,,,,0.003694473,0.042040523,0.9542652
15,1135287592407224322,1135287592407224322,2019-06-02 20:50:29 UTC,2019-06-02,20:50:29,0,1108027439589007360,teslaownersofma,🔋 TeslaOwnersofMA 🔋,,Who’s ready to do 3 G’s in the #Tesla #Roadster #ElonMusk #2020Roadster  https://t.co/0uMp3sLDAB,en,[],[],['https://pbs.twimg.com/media/D8FaC23WsAAiuAM.jpg'],1,7,86,"['tesla', 'roadster', 'elonmusk', '2020roadster']",[],https://twitter.com/TeslaOwnersofMA/status/1135287592407224322,False,,1,https://pbs.twimg.com/media/D8FaC23WsAAiuAM.jpg,,,,,,,[],,,,,0.0061976872,0.67685026,0.31695205
16,1135284593890799616,1135284593890799616,2019-06-02 20:38:34 UTC,2019-06-02,20:38:34,0,27386419,vividvivka,VividVivka,,"Tesla got her teeth cleaned today, and bloodwork. The vet freaks her out.  ...She pooped in the handlers pocket. Tesla panic-shit a nugget into a pocket.  I’m fucking crying, I’m laughing so hard.",en,[],[],[],20,6,331,[],[],https://twitter.com/VividVivka/status/1135284593890799616,False,,0,,,,,,,,[],,,,,0.5831942,0.28621152,0.13059422
17,1135281915366445058,1135281915366445058,2019-06-02 20:27:55 UTC,2019-06-02,20:27:55,0,1308211178,teslarati,TESLARATI,,"Tesla CEO Elon Musk details Model Y manufacturing improvements, gives insight on design in fantastic podcast interview by @DMC_Ryan  https://t.co/XlqROLGnep",en,"[{'screen_name': 'dmc_ryan', 'name': 'ryan mccaffrey', 'id': '308795969'}]",['https://www.teslarati.com/elon-musk-talks-tesla-model-y-manufacturing-design/'],[],8,116,1149,[],[],https://twitter.com/Teslarati/status/1135281915366445058,False,,0,,,,,,,,[],,,,,0.0017604934,0.080669604,0.91757
18,1135281334845419529,1135281334845419529,2019-06-02 20:25:37 UTC,2019-06-02,20:25:37,0,568621669,insideevs,InsideEVs,,New Tesla Roadster Images Emerge  https://t.co/PEylpJynV4 via @insideevs.com,en,"[{'screen_name': 'insideevs', 'name': 'insideevs', 'id': '568621669'}]",['https://insideevs.com/news/352262/tesla-roadster-images-new/amp/'],[],4,18,144,[],[],https://twitter.com/InsideEVs/status/1135281334845419529,False,,0,,,,,,,,[],,,,,0.003949835,0.847475,0.14857523
19,1135280049224069120,1135280049224069120,2019-06-02 20:20:30 UTC,2019-06-02,20:20:30,0,17060015,cleantechnica,CleanTechnica,,"Tesla Model S = #1 Large Luxury Car In California, Tesla Model X = #2 Midsize SUV, Chevy Bolt = #2 Subcompact Car  https://t.co/xdb6o0cLpb  https://t.co/F7uBhJU9Ir",ca,[],['https://cleantechnica.com/2019/06/02/tesla-model-s-1-large-luxury-car-in-california-tesla-model-x-2-midsize-suv-chevy-bolt-2-subcompact-car/'],['https://pbs.twimg.com/media/D8FTMDyWwAAaLRU.png'],1,17,93,[],[],https://twitter.com/cleantechnica/status/1135280049224069120,False,,1,https://pbs.twimg.com/media/D8FTMDyWwAAaLRU.png,,,,,,,[],,,,,0.0049840105,0.5637154,0.43130073
20,1135279368505298944,1135279368505298944,2019-06-02 20:17:48 UTC,2019-06-02,20:17:48,0,718747351792398336,alex_avoigt,Alex,,"Fortune: "" this stock is that much overvalued that it will be as a matter of fact cut in half in the next years""  Thats a comment about Tesla, right?!  Nope, thats a comment in 2010 about Amazon.  Amazon SP 2010: about $ 130 2019: about $ 1.950",en,[],[],[],1,24,110,[],[],https://twitter.com/alex_avoigt/status/1135279368505298944,False,,0,,,,,,,,[],,,,,0.61867654,0.330208,0.051115423
21,1135274561686167553,1135274561686167553,2019-06-02 19:58:42 UTC,2019-06-02,19:58:42,0,1581486816,chrismelschleeb,chrismel,,elon musk: how can we give tesla owners actual road rage   tesla worker: i have an idea  https://t.co/QRsxMyhbcA,en,[],[],['https://pbs.twimg.com/media/D8FOMQRW4AIdd-u.jpg'],0,3,105,[],[],https://twitter.com/chrismelSchleeb/status/1135274561686167553,False,,1,https://pbs.twimg.com/media/D8FOMQRW4AIdd-u.jpg,,,,,,,[],,,,,0.15817477,0.7683165,0.073508784
22,1135274321386135552,1135272949144047619,2019-06-02 19:57:45 UTC,2019-06-02,19:57:45,0,22088025,slye,Andy Slye,,I think @Rivian almost nailed it with their design so Tesla really has to perfect theirs as much as possible. Honestly I think Tesla has the advantage since they got to see what Rivian had up their sleeve before finalizing the Tesla pickup. It'll be interesting.,en,"[{'screen_name': 'rivian', 'name': 'rivian', 'id': '260414018'}]",[],[],9,0,77,[],[],https://twitter.com/slye/status/1135274321386135552,False,,0,,,,,,,,[],,,,,0.0076755034,0.06609586,0.92622864
23,1135272949144047619,1135272949144047619,2019-06-02 19:52:18 UTC,2019-06-02,19:52:18,0,22088025,slye,Andy Slye,,I certainly hope the Tesla pickup doesn't look like any of the fan-made mockups I've seen. They all look awful.,en,[],[],[],29,5,195,[],[],https://twitter.com/slye/status/1135272949144047619,False,,0,,,,,,,,[],,,,,0.93929213,0.050681446,0.010026485
24,1135267633505415169,1135267633505415169,2019-06-02 19:31:10 UTC,2019-06-02,19:31:10,0,568621669,insideevs,InsideEVs,,"Tesla Roadster Production Likely Under 10,000: Will Beat All Hypercars  https://t.co/pXdAlzhbmP via @insideevs.com",en,"[{'screen_name': 'insideevs', 'name': 'insideevs', 'id': '568621669'}]",['https://insideevs.com/news/352615/tesla-roadster-production-performance-musk/amp/'],[],3,21,168,[],[],https://twitter.com/InsideEVs/status/1135267633505415169,False,,0,,,,,,,,[],,,,,0.004756781,0.41375327,0.5814901
25,1135266161766096896,1135266161766096896,2019-06-02 19:25:19 UTC,2019-06-02,19:25:19,0,20273398,gameinformer,Game Informer,,"Soon, you'll be able to play Cuphead in certain Tesla cars through the dashboard screen (but thankfully only when the car isn't moving).  https://t.co/9S7No6UjGB  https://t.co/SJFCHz2ALR",en,[],['https://www.gameinformer.com/report/2019/06/02/report-cuphead-to-be-playable-in-tesla-cars'],['https://pbs.twimg.com/media/D8FGjtlXsAMsn8h.jpg'],10,23,162,[],[],https://twitter.com/gameinformer/status/1135266161766096896,False,,1,https://pbs.twimg.com/media/D8FGjtlXsAMsn8h.jpg,,,,,,,[],,,,,0.0039943024,0.24816103,0.74784464
26,1135266050172260352,1135174962359230464,2019-06-02 19:24:53 UTC,2019-06-02,19:24:53,0,15913,majornelson,Larry Hryb 🇺🇦,,@MajaMoldenhauer @Tesla @StudioMDHR This @Tesla owner is excited :),en,"[{'screen_name': 'tesla', 'name': 'tesla', 'id': '13298072'}]",[],[],3,2,173,[],[],https://twitter.com/majornelson/status/1135266050172260352,False,,0,,,,,,,,"[{'screen_name': 'MajaMoldenhauer', 'name': 'Maja Moldenhauer', 'id': '67382376'}, {'screen_name': 'Tesla', 'name': 'Tesla', 'id': '13298072'}, {'screen_name': 'StudioMDHR', 'name': 'Studio MDHR', 'id': '2155513160'}]",,,,,0.0016196662,0.009769235,0.988611
27,1135261981785485312,1135261981785485312,2019-06-02 19:08:43 UTC,2019-06-02,19:08:43,0,85653219,alex_kump,Alex 👀 🇨🇦,,We're in the middle of our first road trip with update 2019.16.2 73d3f3c and I have to say autopilot is amazing. It's finally driving like a human. F****kin Amazing! I need to seriously get more tsla asap. $TSLAQ $TSLA @Tesla  https://t.co/5rSfvokVLE,en,"[{'screen_name': 'tesla', 'name': 'tesla', 'id': '13298072'}]",[],['https://pbs.twimg.com/media/D8FCvxDXYAEOBOr.jpg'],4,9,81,[],"['tslaq', 'tsla']",https://twitter.com/Alex_Kump/status/1135261981785485312,False,,1,https://pbs.twimg.com/media/D8FCvxDXYAEOBOr.jpg,,,,,,,[],,,,,0.005159605,0.0242226,0.9706177
28,1135259549127073798,1135259549127073798,2019-06-02 18:59:03 UTC,2019-06-02,18:59:03,0,316811328,nintenderos,Nintenderos,,"Cuphead será jugable en los modelos 3, S y X de los coches Tesla -  https://t.co/EdQsc29tAN  https://t.co/oynvFuttZb",es,[],['http://www.nintenderos.com/2019/06/cuphead-sera-jugable-en-los-modelos-3-s-y-x-de-los-coches-tesla/'],['https://pbs.twimg.com/media/D8FAikrXUAAi3hs.jpg'],4,20,122,[],[],https://twitter.com/Nintenderos/status/1135259549127073798,False,,1,https://pbs.twimg.com/media/D8FAikrXUAAi3hs.jpg,,,,,,,[],,,,,0.015828153,0.8631169,0.12105489
29,1135256073839960064,1135256073839960064,2019-06-02 18:45:14 UTC,2019-06-02,18:45:14,0,1689516060,vincent13031925,vincentyu.eth,,Tesla Shanghai Gigafactory 3 China 🇨🇳 June 2nd 2019. Thx Chao!   #Tesla #China #TeslaChina #GF3,en,[],[],[],4,17,169,"['tesla', 'china', 'teslachina', 'gf3']",[],https://twitter.com/vincent13031925/status/1135256073839960064,False,https://twitter.com/realChaoZhou/status/1135143619155746817,0,,,,,,,,[],,,,,0.0028091718,0.09210611,0.9050847
30,1135251838498934786,1135251838498934786,2019-06-02 18:28:24 UTC,2019-06-02,18:28:24,0,1052869334509469696,teslahistorian,The Short Shorts Historian,,THE MUDFACTORY REVISITED  $TSLAQ's experts on building factories had a lot to say about Tesla's Gigafactory 3's aggressive timeline early this year. Recently they've been very quiet for some reason.🤔 Let's look at few of those older tweets...  https://t.co/aTNxeeqKPj,en,[],[],['https://pbs.twimg.com/media/D8E5dyMXUAAdogd.png'],25,80,322,[],['tslaq'],https://twitter.com/TeslaHistorian/status/1135251838498934786,False,,1,https://pbs.twimg.com/media/D8E5dyMXUAAdogd.png,,,,,,,[],,,,,0.1744678,0.7807539,0.044778183
31,1135251205934931968,1135251205934931968,2019-06-02 18:25:54 UTC,2019-06-02,18:25:54,0,1016059981907386368,teslaownerssv,Tesla Owners Silicon Valley,,.@tesla truck will start at $49k. It won't look like a normal truck but it will look kind of sci-fi. It's going to be a truck that is more capable than f150 and a better sports car than a 911.,en,"[{'screen_name': 'tesla', 'name': 'tesla', 'id': '13298072'}]",[],[],2,12,130,[],[],https://twitter.com/teslaownersSV/status/1135251205934931968,False,,0,,,,,,,,[],,,,,0.008529882,0.16633064,0.82513946
32,1135244682471124994,1135244682471124994,2019-06-02 17:59:58 UTC,2019-06-02,17:59:58,0,962805945020702722,teslacharts,TC,,"956 days ago, Tesla starting collecting money for full self-driving software that won't ever exist  $TSLAQ",en,[],[],[],7,20,174,[],['tslaq'],https://twitter.com/TESLAcharts/status/1135244682471124994,False,,0,,,,,,,,[],,,,,0.3404483,0.5297532,0.12979858
33,1135244276038717440,1135244276038717440,2019-06-02 17:58:21 UTC,2019-06-02,17:58:21,0,1689516060,vincent13031925,vincentyu.eth,,"“We don’t want it to be really expensive. I think it’s (#Tesla Pickup Truck) got to start at less than $50,000, it’s got to be like $49,000 starting price, maximum, ideally less. … It’s got to be something that’s affordable..” ⁦@elonmusk⁩ mentioned.  https://t.co/EVcJ8LPijh",en,"[{'screen_name': 'elonmusk', 'name': 'elon musk', 'id': '44196397'}]",['https://cleantechnica.com/2019/06/02/tesla-pickup-truck-49000-base-price-or-lower-is-the-aim/'],[],12,23,229,['tesla'],[],https://twitter.com/vincent13031925/status/1135244276038717440,False,,0,,,,,,,,[],,,,,0.12892415,0.70373356,0.16734232
34,1135241966369890305,1135241966369890305,2019-06-02 17:49:11 UTC,2019-06-02,17:49:11,0,17060015,cleantechnica,CleanTechnica,,"Tesla Pickup Truck — $49,000 Base Price (Or Lower) Is The Aim  https://t.co/fXOWy3DAzl  https://t.co/1EXQQQ38Oc",en,[],['https://cleantechnica.com/2019/06/02/tesla-pickup-truck-49000-base-price-or-lower-is-the-aim/'],['https://pbs.twimg.com/media/D8EwjVfXkAADndB.jpg'],2,22,131,[],[],https://twitter.com/cleantechnica/status/1135241966369890305,False,,1,https://pbs.twimg.com/media/D8EwjVfXkAADndB.jpg,,,,,,,[],,,,,0.011974072,0.8806926,0.10733343
35,1135240919605817346,1135240919605817346,2019-06-02 17:45:01 UTC,2019-06-02,17:45:01,0,925794432770887681,teslaparatodos,Tesla Para Todos,,¿Quieres comparar el coste total de un vehículo de combustión con el de un Tesla? Ahora tienes una herramienta justamente para eso en:  https://t.co/UhmRhqvpfv,es,[],['https://www.teslaparatodos.com/'],[],24,32,100,[],[],https://twitter.com/TeslaParaTodos/status/1135240919605817346,False,,0,,,,,,,,[],,,,,0.025263749,0.9052416,0.06949461
36,1135237605484896259,1135237605484896259,2019-06-02 17:31:51 UTC,2019-06-02,17:31:51,0,454340464,polygon,Polygon,,"Elon Musk got Cuphead working on a Tesla, to help make your commute harder.  https://t.co/eAgD2Zl8cn  https://t.co/fAXoeLf83f",en,[],['https://www.polygon.com/2019/6/2/18649515/tesla-cuphead-elon-musk?utm_campaign=polygon&utm_content=chorus&utm_medium=social&utm_source=twitter'],['https://pbs.twimg.com/media/D8EslhbXsAAJDi_.jpg'],4,13,133,[],[],https://twitter.com/Polygon/status/1135237605484896259,False,,1,https://pbs.twimg.com/media/D8EslhbXsAAJDi_.jpg,,,,,,,[],,,,,0.044171855,0.58367544,0.37215272
37,1135231436544520192,1135231436544520192,2019-06-02 17:07:20 UTC,2019-06-02,17:07:20,0,707921493,wcgamingtweets,Windows Central Gaming,,#Cuphead launches on Tesla vehicles this summer. 🚗  https://t.co/E7RYHg3bSN,en,[],['https://www.windowscentral.com/cuphead-launches-tesla-vehicles-summer'],[],9,31,110,['cuphead'],[],https://twitter.com/WCGamingTweets/status/1135231436544520192,False,,0,,,,,,,,[],,,,,0.0034262182,0.784209,0.21236461
38,1135228155843604485,1135228155843604485,2019-06-02 16:54:18 UTC,2019-06-02,16:54:18,0,71077864,megangale,Megan #ChasingSunsets,,Nothing cuter than kids launching in a @tesla #performancemodel3  He giggles and counts every time I put him in my car now. #makingmemories #startingthemearly  https://t.co/36qfaCJ3oQ,en,"[{'screen_name': 'tesla', 'name': 'tesla', 'id': '13298072'}]",[],[],5,8,91,"['performancemodel3', 'makingmemories', 'startingthemearly']",[],https://twitter.com/megangale/status/1135228155843604485,False,,1,https://pbs.twimg.com/ext_tw_video_thumb/1135228109924397056/pu/img/eXKlBKyYj5xZSdV8.jpg,,,,,,,[],,,,,0.0028865165,0.016547747,0.9805657
39,1135225013533937665,1135225013533937665,2019-06-02 16:41:49 UTC,2019-06-02,16:41:49,0,1689516060,vincent13031925,vincentyu.eth,,"Tesla Pickup Truck To Be Priced Below $50,000, Makes Ram Seem Puny  I need one of this ⁦@elonmusk⁩, bring it to the market and my 💰 is ready for you!! $TSLA #Tesla   https://t.co/05UIADfItb",en,"[{'screen_name': 'elonmusk', 'name': 'elon musk', 'id': '44196397'}]",['https://insideevs.com/news/352610/tesla-pickup-truck-price-musk/'],[],41,62,386,['tesla'],['tsla'],https://twitter.com/vincent13031925/status/1135225013533937665,False,,0,,,,,,,,[],,,,,0.014528193,0.11022714,0.8752446
40,1135224446598438913,1135224446598438913,2019-06-02 16:39:34 UTC,2019-06-02,16:39:34,0,54094700,jchybow,Tesla Bot Pilot 🇺🇦🦊🛩🇺🇦,,Sick cars but GTFO.   #ICEd #Tesla  https://t.co/CqZYmGIzvy,en,[],[],['https://pbs.twimg.com/media/D8EgmRlW4AUDr7V.jpg'],12,9,70,"['iced', 'tesla']",[],https://twitter.com/jchybow/status/1135224446598438913,False,,1,https://pbs.twimg.com/media/D8EgmRlW4AUDr7V.jpg,,,,,,,[],,,,,0.7019233,0.26128134,0.036795225
41,1135223300660109313,1135223300660109313,2019-06-02 16:35:00 UTC,2019-06-02,16:35:00,0,2564597449,elonmusknewsorg,Elon Musk News,,"Tesla’s ‘Blade Runner’ pickup truck to start at $49K at most, says Elon Musk   https://t.co/vG51WZljnW",en,[],['https://www.teslarati.com/tesla-pickup-truck-price-elon-musk/'],[],11,23,82,[],[],https://twitter.com/ElonMuskNewsOrg/status/1135223300660109313,False,,0,,,,,,,,[],,,,,0.005852121,0.77305394,0.22109403
42,1135222336691625985,1135222336691625985,2019-06-02 16:31:11 UTC,2019-06-02,16:31:11,0,275686563,verge,The Verge,,Tesla got Cuphead to work in its in-car display  https://t.co/AfDrzufucA  https://t.co/L5fVROZiJj,en,[],['https://www.theverge.com/2019/6/2/18649466/tesla-car-cuphead-elon-musk-interview-summer-release?utm_campaign=theverge&utm_content=chorus&utm_medium=social&utm_source=twitter'],['https://pbs.twimg.com/media/D8EesvmWkAADQr9.jpg'],5,33,199,[],[],https://twitter.com/verge/status/1135222336691625985,False,,1,https://pbs.twimg.com/media/D8EesvmWkAADQr9.jpg,,,,,,,[],,,,,0.004008265,0.56865406,0.42733768
43,1135222030813585416,1135222030813585416,2019-06-02 16:29:58 UTC,2019-06-02,16:29:58,0,16723868,wyatt_privilege,warrior cop,,tesla got cuphead ported over before it got not burning down all the time  https://t.co/sXxgiNMbK1,en,[],[],"['https://pbs.twimg.com/media/D8EeazYW4AYpW35.jpg', 'https://pbs.twimg.com/media/D8EeazkXoAAw3YZ.jpg']",3,26,255,[],[],https://twitter.com/wyatt_privilege/status/1135222030813585416,False,,1,https://pbs.twimg.com/media/D8EeazYW4AYpW35.jpg,,,,,,,[],,,,,0.119013265,0.7929624,0.088024296
44,1135217235499241472,1135217235499241472,2019-06-02 16:10:54 UTC,2019-06-02,16:10:54,0,2800559388,vehicle_finder,The Vehicle Finder,,😮😲 This WIDE Tesla is 🔥🔥  Our IG:  https://t.co/TdBePFfnhQ  https://t.co/osrdJiuBKf,en,[],['http://www.instagram.com/thevehiclefinder'],[],12,347,1131,[],[],https://twitter.com/Vehicle_Finder/status/1135217235499241472,False,,1,https://pbs.twimg.com/ext_tw_video_thumb/1135217138610786304/pu/img/IvCXkN1Nu_TijVae.jpg,,,,,,,[],,,,,0.0026372443,0.02811475,0.96924806
