,id,conversation_id,created_at,date,time,timezone,user_id,username,name,place,tweet,language,mentions,urls,photos,replies_count,retweets_count,likes_count,hashtags,cashtags,link,retweet,quote_url,video,thumbnail,near,geo,source,user_rt_id,user_rt,retweet_id,reply_to,retweet_date,translate,trans_src,trans_dest,negative,neutral,positive
44,1210270586674409472,1210270586674409472,2019-12-26 18:46:08 UTC,2019-12-26,18:46:08,0,349249475,gerberkawasaki,Ross Gerber,,Tesla is far from the biggest energy company on earth.  Not even close. Imagine how many houses we can put solar roofs on. How many utilities need battery mega packs. #tesla $tsla,en,[],[],[],19,46,398,['tesla'],['tsla'],https://twitter.com/GerberKawasaki/status/1210270586674409472,False,,0,,,,,,,,[],,,,,0.5375817,0.35962048,0.10279783
45,1210270551236730880,1210270551236730880,2019-12-26 18:45:59 UTC,2019-12-26,18:45:59,0,44196397,elonmusk,Elon Musk,,"Just swipe down on Tesla nav button for car to automatically navigate to home, work or destination in calendar",en,[],[],[],1066,2021,56039,[],[],https://twitter.com/elonmusk/status/1210270551236730880,False,,0,,,,,,,,[],,,,,0.016575886,0.8426714,0.14075255
46,1210270133949628416,1210270133949628416,2019-12-26 18:44:20 UTC,2019-12-26,18:44:20,0,349249475,gerberkawasaki,Ross Gerber,,Tesla is NOT a car company. Stop comparing it to car companies. It’s a tech energy company. They are revolutionizing how we use energy for homes and transportation. $tsla,en,[],[],[],137,321,1943,[],['tsla'],https://twitter.com/GerberKawasaki/status/1210270133949628416,False,,0,,,,,,,,[],,,,,0.15841912,0.50934756,0.33223337
47,1210270085199355904,1210259648068149255,2019-12-26 18:44:08 UTC,2019-12-26,18:44:08,0,989986448295235586,teslatino,"TesLatino 🚀 Rafael - Lover, not a hater.",,"@elonmusk @teslaownersSV @tesla_unplugged @TeslaOwnersofMA @Tesla @disneyplus @BenSullins For a single destination yes. But here is an example of what we are missing. 2 destinations or more. One is north 500 miles away, 2nd is 700 further west. If I put the final destination, route will miss point of interest 1. Having both with all charges required would be better.",en,[],[],[],4,0,65,[],[],https://twitter.com/TesLatino/status/1210270085199355904,False,,0,,,,,,,,"[{'screen_name': 'elonmusk', 'name': 'Elon Musk', 'id': '44196397'}, {'screen_name': 'teslaownersSV', 'name': 'Tesla Owners Silicon Valley', 'id': '1016059981907386368'}, {'screen_name': 'tesla_unplugged', 'name': 'Gerry Lajeunesse', 'id': '1423346320073441284'}, {'screen_name': 'TeslaOwnersofMA', 'name': '🔋 TeslaOwnersofMA 🔋', 'id': '1108027439589007360'}, {'screen_name': 'Tesla', 'name': 'Tesla', 'id': '13298072'}, {'screen_name': 'disneyplus', 'name': 'Disney+', 'id': '985916593065476096'}]",,,,,0.36071435,0.6105479,0.028737826
48,1210269213174034432,1210259648068149255,2019-12-26 18:40:40 UTC,2019-12-26,18:40:40,0,44196397,elonmusk,Elon Musk,,"@TesLatino @teslaownersSV @tesla_unplugged @TeslaOwnersofMA @Tesla @disneyplus @BenSullins If you enter a longer distance than range, system should autonav to optimal Superchargers along the way. Is it not doing this correctly?",en,[],[],[],172,33,928,[],[],https://twitter.com/elonmusk/status/1210269213174034432,False,,0,,,,,,,,"[{'screen_name': 'TesLatino', 'name': 'TesLatino 🚀 Rafael - Lover, not a hater.', 'id': '989986448295235586'}, {'screen_name': 'teslaownersSV', 'name': 'Tesla Owners Silicon Valley', 'id': '1016059981907386368'}, {'screen_name': 'tesla_unplugged', 'name': 'Gerry Lajeunesse', 'id': '1423346320073441284'}, {'screen_name': 'TeslaOwnersofMA', 'name': '🔋 TeslaOwnersofMA 🔋', 'id': '1108027439589007360'}, {'screen_name': 'Tesla', 'name': 'Tesla', 'id': '13298072'}, {'screen_name': 'disneyplus', 'name': 'Disney+', 'id': '985916593065476096'}]",,,,,0.40451276,0.57588553,0.01960159
49,1210268839507681280,1210259648068149255,2019-12-26 18:39:11 UTC,2019-12-26,18:39:11,0,44196397,elonmusk,Elon Musk,,@teslaownersSV @tesla_unplugged @TeslaOwnersofMA @Tesla @disneyplus @BenSullins Merry Christmas 🎄🎁😀 Hope you’re enjoying latest software update!,en,[],[],[],179,97,1662,[],[],https://twitter.com/elonmusk/status/1210268839507681280,False,,0,,,,,,,,"[{'screen_name': 'teslaownersSV', 'name': 'Tesla Owners Silicon Valley', 'id': '1016059981907386368'}, {'screen_name': 'tesla_unplugged', 'name': 'Gerry Lajeunesse', 'id': '1423346320073441284'}, {'screen_name': 'TeslaOwnersofMA', 'name': '🔋 TeslaOwnersofMA 🔋', 'id': '1108027439589007360'}, {'screen_name': 'Tesla', 'name': 'Tesla', 'id': '13298072'}, {'screen_name': 'disneyplus', 'name': 'Disney+', 'id': '985916593065476096'}]",,,,,0.002314135,0.013018362,0.98466754
50,1210268820138602496,1210259648068149255,2019-12-26 18:39:07 UTC,2019-12-26,18:39:07,0,989986448295235586,teslatino,"TesLatino 🚀 Rafael - Lover, not a hater.",,"@elonmusk @teslaownersSV @tesla_unplugged @TeslaOwnersofMA @Tesla @disneyplus @BenSullins The main reason for this request is to be able to avoid entering multiple destination rounds on road trips (for me). If I don’t want to take a straight trip but end up there, multiple waypoints allow us to just set all destinations and let the onboard nav plot the route with SCs.",en,[],[],[],7,6,220,[],[],https://twitter.com/TesLatino/status/1210268820138602496,False,,0,,,,,,,,"[{'screen_name': 'elonmusk', 'name': 'Elon Musk', 'id': '44196397'}, {'screen_name': 'teslaownersSV', 'name': 'Tesla Owners Silicon Valley', 'id': '1016059981907386368'}, {'screen_name': 'tesla_unplugged', 'name': 'Gerry Lajeunesse', 'id': '1423346320073441284'}, {'screen_name': 'TeslaOwnersofMA', 'name': '🔋 TeslaOwnersofMA 🔋', 'id': '1108027439589007360'}, {'screen_name': 'Tesla', 'name': 'Tesla', 'id': '13298072'}, {'screen_name': 'disneyplus', 'name': 'Disney+', 'id': '985916593065476096'}]",,,,,0.042103697,0.7749464,0.18294996
51,1210267959588864000,1210259648068149255,2019-12-26 18:35:41 UTC,2019-12-26,18:35:41,0,44196397,elonmusk,Elon Musk,,"@teslaownersSV @tesla_unplugged @TeslaOwnersofMA @Tesla @disneyplus @BenSullins Car should autonavigate to destinations based on your calendar. If nothing in calendar, should do work in morning &amp; home in evening. Future versions will guess based on prior patterns (if preference enabled).",en,[],[],[],101,63,1010,[],[],https://twitter.com/elonmusk/status/1210267959588864000,False,,0,,,,,,,,"[{'screen_name': 'teslaownersSV', 'name': 'Tesla Owners Silicon Valley', 'id': '1016059981907386368'}, {'screen_name': 'tesla_unplugged', 'name': 'Gerry Lajeunesse', 'id': '1423346320073441284'}, {'screen_name': 'TeslaOwnersofMA', 'name': '🔋 TeslaOwnersofMA 🔋', 'id': '1108027439589007360'}, {'screen_name': 'Tesla', 'name': 'Tesla', 'id': '13298072'}, {'screen_name': 'disneyplus', 'name': 'Disney+', 'id': '985916593065476096'}]",,,,,0.023563992,0.9066915,0.06974455
52,1210267508164440078,1210267508164440078,2019-12-26 18:33:54 UTC,2019-12-26,18:33:54,0,2148233600,electrekco,Electrek.co,,Tesla Model Y stunning prototype spotted with dual motor badge  https://t.co/tKuDQP5oMa by @fredericlambert,en,"[{'screen_name': 'fredericlambert', 'name': 'fred lambert', 'id': '38253449'}]",['https://electrek.co/2019/12/26/tesla-model-y-performance-prototype-spotted-dual-motor/'],[],25,82,413,[],[],https://twitter.com/ElectrekCo/status/1210267508164440078,False,,0,,,,,,,,[],,,,,0.0020299922,0.09468143,0.9032886
53,1210265714898026496,1210265714898026496,2019-12-26 18:26:46 UTC,2019-12-26,18:26:46,0,1689516060,vincent13031925,vincentyu.eth,,Tesla Autopilot and @ElonMusk's Lidar Stance Discussed by Waymo Founder   https://t.co/2ZUA521pO9,en,"[{'screen_name': 'elonmusk', 'name': 'elon musk', 'id': '44196397'}]",['https://www.tesmanian.com/blogs/tesmanian-blog/tesla-autopilot-and-elon-musks-lidar-opinion-discussed-by-former-google-vp'],[],5,12,73,[],[],https://twitter.com/vincent13031925/status/1210265714898026496,False,,0,,,,,,,,[],,,,,0.005078174,0.93407595,0.06084592
54,1210264254504460295,1210264254504460295,2019-12-26 18:20:58 UTC,2019-12-26,18:20:58,0,718920389603135488,theteslashow,The Tesla Show,,Disney+ coming soon to Tesla Theater.,en,[],[],[],5,9,126,[],[],https://twitter.com/TheTeslaShow/status/1210264254504460295,False,https://twitter.com/elonmusk/status/1210259962598838272,0,,,,,,,,[],,,,,0.0032770303,0.47881338,0.51790965
55,1210263779209928710,1210259648068149255,2019-12-26 18:19:05 UTC,2019-12-26,18:19:05,0,1016059981907386368,teslaownerssv,Tesla Owners Silicon Valley,,@elonmusk @tesla_unplugged @TeslaOwnersofMA @Tesla @disneyplus @BenSullins Any idea why? Is the operating system not compatible? By the way thanks for the response and Merry late Christmas,en,[],[],[],9,10,186,[],[],https://twitter.com/teslaownersSV/status/1210263779209928710,False,,0,,,,,,,,"[{'screen_name': 'elonmusk', 'name': 'Elon Musk', 'id': '44196397'}, {'screen_name': 'tesla_unplugged', 'name': 'Gerry Lajeunesse', 'id': '1423346320073441284'}, {'screen_name': 'TeslaOwnersofMA', 'name': '🔋 TeslaOwnersofMA 🔋', 'id': '1108027439589007360'}, {'screen_name': 'Tesla', 'name': 'Tesla', 'id': '13298072'}, {'screen_name': 'disneyplus', 'name': 'Disney+', 'id': '985916593065476096'}]",,,,,0.381656,0.4953928,0.122951314
56,1210263196457504768,1210259648068149255,2019-12-26 18:16:46 UTC,2019-12-26,18:16:46,0,44196397,elonmusk,Elon Musk,,@teslaownersSV @tesla_unplugged @TeslaOwnersofMA @Tesla @disneyplus @BenSullins No,und,[],[],[],139,40,775,[],[],https://twitter.com/elonmusk/status/1210263196457504768,False,,0,,,,,,,,"[{'screen_name': 'teslaownersSV', 'name': 'Tesla Owners Silicon Valley', 'id': '1016059981907386368'}, {'screen_name': 'tesla_unplugged', 'name': 'Gerry Lajeunesse', 'id': '1423346320073441284'}, {'screen_name': 'TeslaOwnersofMA', 'name': '🔋 TeslaOwnersofMA 🔋', 'id': '1108027439589007360'}, {'screen_name': 'Tesla', 'name': 'Tesla', 'id': '13298072'}, {'screen_name': 'disneyplus', 'name': 'Disney+', 'id': '985916593065476096'}]",,,,,0.03574731,0.9095682,0.05468449
57,1210262421316616198,1210262421316616198,2019-12-26 18:13:41 UTC,2019-12-26,18:13:41,0,25383000,motortrend,motortrend,,". @GM is rumored to be planning a #Hummer revival, and the new SUV brand would be all-electric to take on Tesla, Rivian, and others. https://t.co/pudCl8GJZu",en,"[{'screen_name': 'gm', 'name': 'general motors', 'id': '10850192'}]",['https://www.motortrend.com/news/hummer-ev-rendering-photos-details/'],[],19,48,278,['hummer'],[],https://twitter.com/MotorTrend/status/1210262421316616198,False,,0,,,,,,,,[],,,,,0.0046179728,0.65627587,0.3391061
58,1210261415337975808,1210259648068149255,2019-12-26 18:09:41 UTC,2019-12-26,18:09:41,0,1016059981907386368,teslaownerssv,Tesla Owners Silicon Valley,,@elonmusk @tesla_unplugged @TeslaOwnersofMA @Tesla @disneyplus @BenSullins Do you think we could get waypoint with multiple destinations on one trip?,en,[],[],[],15,13,287,[],[],https://twitter.com/teslaownersSV/status/1210261415337975808,False,,0,,,,,,,,"[{'screen_name': 'elonmusk', 'name': 'Elon Musk', 'id': '44196397'}, {'screen_name': 'tesla_unplugged', 'name': 'Gerry Lajeunesse', 'id': '1423346320073441284'}, {'screen_name': 'TeslaOwnersofMA', 'name': '🔋 TeslaOwnersofMA 🔋', 'id': '1108027439589007360'}, {'screen_name': 'Tesla', 'name': 'Tesla', 'id': '13298072'}, {'screen_name': 'disneyplus', 'name': 'Disney+', 'id': '985916593065476096'}]",,,,,0.011005006,0.92069715,0.068297885
59,1210260183219355650,1210259648068149255,2019-12-26 18:04:47 UTC,2019-12-26,18:04:47,0,1108027439589007360,teslaownersofma,🔋 TeslaOwnersofMA 🔋,,@elonmusk @Tesla @disneyplus @BenSullins Thank you! Happy Holidays and Happy New Year! Thanks for all of your hard work.,en,[],[],[],2,3,192,[],[],https://twitter.com/TeslaOwnersofMA/status/1210260183219355650,False,,0,,,,,,,,"[{'screen_name': 'elonmusk', 'name': 'Elon Musk', 'id': '44196397'}, {'screen_name': 'Tesla', 'name': 'Tesla', 'id': '13298072'}, {'screen_name': 'disneyplus', 'name': 'Disney+', 'id': '985916593065476096'}]",,,,,0.0025518353,0.008415971,0.98903227
60,1210259962598838272,1210259648068149255,2019-12-26 18:03:55 UTC,2019-12-26,18:03:55,0,44196397,elonmusk,Elon Musk,,@TeslaOwnersofMA @Tesla @disneyplus @BenSullins Coming soon,en,[],[],[],113,112,2189,[],[],https://twitter.com/elonmusk/status/1210259962598838272,False,,0,,,,,,,,"[{'screen_name': 'TeslaOwnersofMA', 'name': '🔋 TeslaOwnersofMA 🔋', 'id': '1108027439589007360'}, {'screen_name': 'Tesla', 'name': 'Tesla', 'id': '13298072'}, {'screen_name': 'disneyplus', 'name': 'Disney+', 'id': '985916593065476096'}]",,,,,0.006686127,0.8344534,0.15886031
61,1210259648068149255,1210259648068149255,2019-12-26 18:02:40 UTC,2019-12-26,18:02:40,0,1108027439589007360,teslaownersofma,🔋 TeslaOwnersofMA 🔋,,@elonmusk can @tesla add @disneyplus to the #Tesla theatre in a future update? A lot of users would love to have this feature. @BenSullins,en,"[{'screen_name': 'tesla', 'name': 'tesla', 'id': '13298072'}, {'screen_name': 'disneyplus', 'name': 'disney+', 'id': '985916593065476096'}]",[],[],26,37,879,['tesla'],[],https://twitter.com/TeslaOwnersofMA/status/1210259648068149255,False,,0,,,,,,,,[],,,,,0.002944408,0.037674114,0.95938146
62,1210259228587200512,1210259228587200512,2019-12-26 18:01:00 UTC,2019-12-26,18:01:00,0,21200953,roadandtrack,Road & Track,,The Cyberkart is a tiny two-stroke Tesla tribute.  https://t.co/l138Mko5la  https://t.co/LbHkGtoFc4,en,[],['https://www.roadandtrack.com/motorsports/a30336397/ricky-jordan-taylor-cyberkart-tesla/'],['https://pbs.twimg.com/media/EMuoaXvXkAA6GNO.jpg'],4,19,211,[],[],https://twitter.com/RoadandTrack/status/1210259228587200512,False,,1,https://pbs.twimg.com/media/EMuoaXvXkAA6GNO.jpg,,,,,,,[],,,,,0.0099982545,0.627861,0.3621408
63,1210259212053417986,1210259212053417986,2019-12-26 18:00:56 UTC,2019-12-26,18:00:56,0,1308211178,teslarati,TESLARATI,,"First look at Tesla's Camp Mode Easter Egg, complete with warm lights and campfire  https://t.co/aP7AMsh2pU",en,[],['https://www.teslarati.com/tesla-camp-mode-easter-egg-first-look'],[],5,45,419,[],[],https://twitter.com/Teslarati/status/1210259212053417986,False,,0,,,,,,,,[],,,,,0.0031263588,0.5074483,0.48942536
64,1210255874440286209,1210255874440286209,2019-12-26 17:47:40 UTC,2019-12-26,17:47:40,0,36129624,bydavidgardner,David Gardner,,This looks like someone tried to turn the Tesla truck into a stadium  https://t.co/bsIkPEvZwA,en,[],[],[],8,3,72,[],[],https://twitter.com/byDavidGardner/status/1210255874440286209,False,,1,https://pbs.twimg.com/ext_tw_video_thumb/1209157895482298369/pu/img/KNwEU89uxxlRtUoG.jpg,,,,,,,[],,,,,0.58063805,0.3867299,0.032631997
65,1210255807058731010,1210255807058731010,2019-12-26 17:47:24 UTC,2019-12-26,17:47:24,0,157508623,veefroggy,vee,,i knew santa wasn’t real when i didn’t get a tesla for christmas 😫,en,[],[],[],2,3,91,[],[],https://twitter.com/veefroggy/status/1210255807058731010,False,,0,,,,,,,,[],,,,,0.83559024,0.14907597,0.015333807
66,1210255698539556864,1210255698539556864,2019-12-26 17:46:58 UTC,2019-12-26,17:46:58,0,20562637,businessinsider,Business Insider,,A California EV startup unveiled a fully electric semi-truck called 'TORQ' to compete with Tesla and Hyundai  https://t.co/qTlOg2yfJ3,en,[],['http://www.businessinsider.com/neuron-ev-unveiled-first-fully-electric-semi-truck-torq-2019-12'],[],2,28,68,[],[],https://twitter.com/BusinessInsider/status/1210255698539556864,False,,0,,,,,,,,[],,,,,0.0048668524,0.7584334,0.23669972
67,1210249505771282438,1210249505771282438,2019-12-26 17:22:22 UTC,2019-12-26,17:22:22,0,704835627183788032,model3owners,Trev Page,,What’s your single most favourite Tesla voice command??  Mine: set wipers to manual/auto,en,[],[],[],48,4,121,[],[],https://twitter.com/Model3Owners/status/1210249505771282438,False,,0,,,,,,,,[],,,,,0.009288259,0.26581505,0.7248966
68,1210249129974272000,1210249129974272000,2019-12-26 17:20:52 UTC,2019-12-26,17:20:52,0,998140573008695296,28delayslater,🇺🇦 🦊 Earl of FrunkPuppy 🇺🇦,,Name something worse than $TSLAQ 2019 #Tesla stock analysis:  https://t.co/1tP1AWDIjS,en,[],[],['https://pbs.twimg.com/tweet_video_thumb/EMurKlnXUAAgq3t.jpg'],15,4,57,['tesla'],['tslaq'],https://twitter.com/28delayslater/status/1210249129974272000,False,,1,https://pbs.twimg.com/tweet_video_thumb/EMurKlnXUAAgq3t.jpg,,,,,,,[],,,,,0.9190599,0.07237488,0.008565167
69,1210246279722393605,1210246279722393605,2019-12-26 17:09:33 UTC,2019-12-26,17:09:33,0,704835627183788032,model3owners,Trev Page,,Pro tip: look in the owner’s manual for what Tesla calls a function to help with voice commands.  I have found:  “turn on/off windshield vent” “Turn on off/face level vent” “Turn on/off floor vent”  Rear vent doesn’t seem to be addressable yet.   PS “open owners manual” works,en,[],[],[],10,13,155,[],[],https://twitter.com/Model3Owners/status/1210246279722393605,False,,0,,,,,,,,[],,,,,0.12546743,0.7810891,0.09344345
70,1210245522717433856,1210245522717433856,2019-12-26 17:06:32 UTC,2019-12-26,17:06:32,0,43509988,blobyblo,tablo,,RT if you hate the Tesla Truck  RT if you like it like I do   https://t.co/rVIqzypWaK,en,[],['https://youtu.be/BME7C9LcQy8'],[],16,85,413,[],[],https://twitter.com/blobyblo/status/1210245522717433856,False,,0,,,,,,,,[],,,,,0.7032924,0.25986776,0.03683978
71,1210245460117610496,1210245460117610496,2019-12-26 17:06:17 UTC,2019-12-26,17:06:17,0,732548050728701953,valueanalyst1,Yaman Tasdivar,,"One thing I missed: I overestimated the importance of the Model S/X program to Tesla's strategy, future, and mission statement. I love chess, but I was never good at giving up my queen to win the game, and I failed to see that this is what Tesla was about to do.",en,[],[],[],15,11,62,[],[],https://twitter.com/ValueAnalyst1/status/1210245460117610496,False,https://twitter.com/ValueAnalyst1/status/1026537935741616128,0,,,,,,,,[],,,,,0.55667704,0.37041876,0.07290422
72,1210242787024744449,1210239957249527813,2019-12-26 16:55:40 UTC,2019-12-26,16:55:40,0,2241150253,rationaletienne,Pope of Muskanity,,"Analysts and journalists have called @tesla a cult stock.  Can't argue, except I can't wait for it to be considered a religious stock so long-term capital gains aren't being taxed. 🧠  Investing in Tesla should be a religiously-protected right!  Who's with me?🤲  https://t.co/kKCP79IFuc",en,"[{'screen_name': 'tesla', 'name': 'tesla', 'id': '13298072'}]",[],['https://pbs.twimg.com/tweet_video_thumb/EMulZCCW4AcZALh.jpg'],9,5,96,[],[],https://twitter.com/RationalEtienne/status/1210242787024744449,False,,1,https://pbs.twimg.com/tweet_video_thumb/EMulZCCW4AcZALh.jpg,,,,,,,[],,,,,0.27092835,0.34885502,0.38021654
73,1210242197687324672,1210242197687324672,2019-12-26 16:53:19 UTC,2019-12-26,16:53:19,0,760659055719256065,canessos,Steve Canesso,,Maybe it's just me but ever since I started using my Tesla coffee cup the stock has been going up every day. @elonmusk @Tesla  https://t.co/Dt1heT3kf7,en,"[{'screen_name': 'elonmusk', 'name': 'elon musk', 'id': '44196397'}, {'screen_name': 'tesla', 'name': 'tesla', 'id': '13298072'}]",[],['https://pbs.twimg.com/media/EMuk2f5WkAEc8CS.jpg'],20,2,97,[],[],https://twitter.com/canessos/status/1210242197687324672,False,,1,https://pbs.twimg.com/media/EMuk2f5WkAEc8CS.jpg,,,,,,,[],,,,,0.036829367,0.4717662,0.49140444
74,1210241149102968840,1210241149102968840,2019-12-26 16:49:09 UTC,2019-12-26,16:49:09,0,322242639,mudakoff,#MDK,,"Tesla обогнала Роснефть по рыночной стоимости, достигнув уровня в $78 млрд. 7 лет назад она стоила $3 млрд  Как тебе такое, Игорь Сечин?",ru,[],[],[],18,65,1121,[],[],https://twitter.com/mudakoff/status/1210241149102968840,False,,0,,,,,,,,[],,,,,0.05144302,0.8683626,0.0801944
75,1210241073374801922,1210241073374801922,2019-12-26 16:48:51 UTC,2019-12-26,16:48:51,0,15931415,hayleyghoover,hayley,,"My 2019 favorites:  -The Fyre Festival documentaries -Midsommar -Knives Out -Dead To Me -Mrs. Fletcher -When We All Fall Asleep, Where Do We Go? -Lover -30-50 feral hogs -People getting into thrifting -When the Tesla windows broke -Vines from 2012",en,[],[],[],1,10,378,[],[],https://twitter.com/hayleyghoover/status/1210241073374801922,False,,0,,,,,,,,[],,,,,0.09553252,0.7289568,0.17551053
76,1210240046210670593,1210240046210670593,2019-12-26 16:44:46 UTC,2019-12-26,16:44:46,0,1142898912711385091,remithegenius,"Remi, The Genius",,"""Be alone. That's the key to invention..."" -Tesla Nikola",en,[],[],[],1,14,56,[],[],https://twitter.com/Remithegenius/status/1210240046210670593,False,,0,,,,,,,,[],,,,,0.020620044,0.35978752,0.6195925
77,1210239957249527813,1210239957249527813,2019-12-26 16:44:25 UTC,2019-12-26,16:44:25,0,2241150253,rationaletienne,Pope of Muskanity,,"Today, I raised my $TSLA share-target by $100 to $4,300.  ""Worldwide consumer demand for all present and future Models should enable Tesla to comfortably hit its future vehicle delivery guidance of 25m units for 2029 , which represents an increase of 25% per year.""  -Pope Etienne  https://t.co/GJizKe5ebg",en,[],[],['https://pbs.twimg.com/media/EMui041XkAA81-b.jpg'],11,30,246,[],['tsla'],https://twitter.com/RationalEtienne/status/1210239957249527813,False,,1,https://pbs.twimg.com/media/EMui041XkAA81-b.jpg,,,,,,,[],,,,,0.003113419,0.12349889,0.87338775
78,1210238271701291008,1210238271701291008,2019-12-26 16:37:43 UTC,2019-12-26,16:37:43,0,2391799280,segozavr,Гурьянов Сергей,,"Tesla обогнала Роснефть по рыночной стоимости, достигнув уровня в $78 млрд. 7 лет назад Tesla стоила $3 млрд.",ru,[],[],[],10,273,699,[],[],https://twitter.com/Segozavr/status/1210238271701291008,False,,0,,,,,,,,[],,,,,0.04671211,0.8667407,0.08654722
79,1210236358821863425,1210236358821863425,2019-12-26 16:30:07 UTC,2019-12-26,16:30:07,0,1308211178,teslarati,TESLARATI,,Tesla's historic decade makes it the auto industry's best performer -- and it's not even close $TSLA  https://t.co/CjJWN01IvS,en,[],['https://www.teslarati.com/tesla-tsla-auto-sector-best-performer-in-past-decade'],[],15,153,1428,[],['tsla'],https://twitter.com/Teslarati/status/1210236358821863425,False,,0,,,,,,,,[],,,,,0.0029924505,0.026361644,0.9706459
80,1210224001433272323,1210224001433272323,2019-12-26 15:41:01 UTC,2019-12-26,15:41:01,0,82364810,mit_csail,MIT CSAIL,,"Tech launches by year:  2010: Instagram, Uber &amp; the iPad 2011:  Snapchat &amp; the Chromebook 💻 2012: Slack 2013: Google Glass 🕶️ 2014: Amazon Echo 2015: Apple Watch ⌚ 2016: AirPods 2017: TikTok &amp; the Nintendo Switch 2018: SpaceX's Falcon Heavy 🚀 2019: Tesla's Cybertruck  #2010s",en,[],[],[],3,117,370,['2010s'],[],https://twitter.com/MIT_CSAIL/status/1210224001433272323,False,,0,,,,,,,,[],,,,,0.00509999,0.78145194,0.21344809
81,1210223144453189632,1210223144453189632,2019-12-26 15:37:37 UTC,2019-12-26,15:37:37,0,4852289459,theteslalife,TheTeslaLife,,A new patent has been filled at the end of the year by #Tesla for a new chemistry battery... longer life and cheaper to make  https://t.co/EsaWYieeNq  https://t.co/pWrYjJJZtH,en,[],['https://electrek.co/2019/12/26/tesla-patents-battery-chemistry-cheaper/'],['https://pbs.twimg.com/media/EMuTiJSXsAEW_4H.jpg'],2,11,100,['tesla'],[],https://twitter.com/TheTeslaLife/status/1210223144453189632,False,,1,https://pbs.twimg.com/media/EMuTiJSXsAEW_4H.jpg,,,,,,,[],,,,,0.0018820412,0.07499308,0.9231248
82,1210222914416590851,1210222914416590851,2019-12-26 15:36:42 UTC,2019-12-26,15:36:42,0,1123171970,calebotchi,OtchiDaVinchiiii,,I’m getting my Tesla before 25 Speaking into existence,en,[],[],[],1,25,91,[],[],https://twitter.com/calebotchi/status/1210222914416590851,False,,0,,,,,,,,[],,,,,0.02845334,0.5229852,0.44856143
83,1210216692586045440,1210216692586045440,2019-12-26 15:11:58 UTC,2019-12-26,15:11:58,0,390652630,djsbu,#UmoyaMusicVideo,,Things that didn’t exist on Christmas 20 years ago:  iPhone Facebook YouTube Twitter Instagram Android iPad Gmail Netflix streaming Wikipedia Google Maps Amazon Prime App Store SpaceX Reddit Snapchat Skype Spotify Airbnb Uber Xbox Waze iTunes Hashtag Chrome Tesla Bitcoin LinkedIn,en,[],[],[],134,442,1550,[],[],https://twitter.com/djsbu/status/1210216692586045440,False,,0,,,,,,,,[],,,,,0.03357744,0.81861514,0.14780737
84,1210215162667360256,1210215162667360256,2019-12-26 15:05:54 UTC,2019-12-26,15:05:54,0,366181730,familyfirstj,FamilyFirstJ #FrunkMafia,,Who am i... I'm Joe and I'm a Teslaholic but I'm getting better.  @Tesla  https://t.co/z1uuFUdyZt,en,"[{'screen_name': 'tesla', 'name': 'tesla', 'id': '13298072'}]",[],['https://pbs.twimg.com/media/EMuMRsUU0AA6xsy.jpg'],11,6,145,[],[],https://twitter.com/FamilyFirstJ/status/1210215162667360256,False,,1,https://pbs.twimg.com/media/EMuMRsUU0AA6xsy.jpg,,,,,,,[],,,,,0.0070460644,0.15504867,0.83790517
85,1210214698542665728,1210214698542665728,2019-12-26 15:04:03 UTC,2019-12-26,15:04:03,0,14031032,adamsinger,Adam Singer,,Car shopping at Austin @subaru_usa. Wife is probably going with the Forester as her daily. Pretty sweet ride. I'll either get a Tesla or Prius need to find a job first cars ain't free.  https://t.co/aursUuN8p5,en,"[{'screen_name': 'subaru_usa', 'name': 'subaru', 'id': '16529238'}]",[],['https://pbs.twimg.com/media/EMuL2gRX0AI0Hx0.jpg'],40,4,121,[],[],https://twitter.com/AdamSinger/status/1210214698542665728,False,,1,https://pbs.twimg.com/media/EMuL2gRX0AI0Hx0.jpg,,,,,,,[],,,,,0.0073239957,0.06369252,0.92898357
