,id,conversation_id,created_at,date,time,timezone,user_id,username,name,place,tweet,language,mentions,urls,photos,replies_count,retweets_count,likes_count,hashtags,cashtags,link,retweet,quote_url,video,thumbnail,near,geo,source,user_rt_id,user_rt,retweet_id,reply_to,retweet_date,translate,trans_src,trans_dest,negative,neutral,positive
0,1210343259924385792,1210343259924385792,2019-12-26 23:34:54 UTC,2019-12-26,23:34:54,0,223238349,alderlaneeggs,Marc Cohodes,,How Elon Musk Gambled Tesla to Save SolarCity The Stock has more than doubled since this article... Think about that in only 4 months time  https://t.co/W3gpd0tOpq,en,[],['https://www.vanityfair.com/news/2019/08/how-elon-musk-gambled-tesla-to-save-solarcity'],[],12,26,92,[],[],https://twitter.com/AlderLaneEggs/status/1210343259924385792,False,,0,,,,,,,,[],,,,,0.010879096,0.3702376,0.6188834
1,1210341095068045314,1210341095068045314,2019-12-26 23:26:18 UTC,2019-12-26,23:26:18,0,2148233600,electrekco,Electrek.co,,Tesla confirms it secured $1.6 billion in financing for Gigafactory Shanghai  https://t.co/nbqNWhyZlT by @fredericlambert,en,"[{'screen_name': 'fredericlambert', 'name': 'fred lambert', 'id': '38253449'}]",['https://electrek.co/2019/12/26/tesla-secures-billion-financing-gigafactory-china/'],[],5,44,336,[],[],https://twitter.com/ElectrekCo/status/1210341095068045314,False,,0,,,,,,,,[],,,,,0.0039390824,0.604851,0.39121008
2,1210340245117366272,1210340245117366272,2019-12-26 23:22:56 UTC,2019-12-26,23:22:56,0,415794343,tweetermeyer,E.W. Niedermeyer,,"TIL that A) a sad Tesla obsessive is reporting my tweets (no surprise there), B) I violated the Twitter rules at some point recently (news to me), and C) you can violate the Twitter rules without ever being told by Twitter what rule you violated (also news to me).  Good times!  https://t.co/tCLCtVuDUj",en,[],[],['https://pbs.twimg.com/media/EMv-CZbUwAAd9wj.jpg'],7,7,75,[],[],https://twitter.com/Tweetermeyer/status/1210340245117366272,False,,1,https://pbs.twimg.com/media/EMv-CZbUwAAd9wj.jpg,,,,,,,[],,,,,0.14720364,0.37487367,0.47792277
3,1210338221210701829,1210338221210701829,2019-12-26 23:14:53 UTC,2019-12-26,23:14:53,0,1063252578878803968,teslaforthe_win,SomePeopleCallMeTheSpaceCowboy 🌻 🇺🇦 💪,,Larry Ellison. 4th richest man in the USA at $69 billion.He is the Founder of Oracle...in May of 2019 he bought 1 billion $ worth TSLA at it’s market low $176.99 he bought 3 million shares. Today TSLA hit $432 he is No. 2nd shareholder Tesla only behind Elon himself.  https://t.co/klfkP9zxiQ,en,[],[],['https://pbs.twimg.com/media/EMv8MVgX0AIb-7m.jpg'],6,43,251,[],[],https://twitter.com/TeslaForThe_Win/status/1210338221210701829,False,,1,https://pbs.twimg.com/media/EMv8MVgX0AIb-7m.jpg,,,,,,,[],,,,,0.0053839916,0.2841228,0.710493
4,1210332406877577216,1210332406877577216,2019-12-26 22:51:47 UTC,2019-12-26,22:51:47,0,1076276451471585280,teslastraya,TeslaStraya,,"So my wife’s ICE car is in for service, slight noise on acceleration = split turbo hose. $871 in parts/labour to replace it, $259 for the service give me an $1130 day. @elonmusk, can you please open @Tesla Model Y orders in Australia? You’ll have my deposit today. Thanks! #tesla",en,"[{'screen_name': 'elonmusk', 'name': 'elon musk', 'id': '44196397'}, {'screen_name': 'tesla', 'name': 'tesla', 'id': '13298072'}]",[],[],8,13,114,['tesla'],[],https://twitter.com/TeslaStraya/status/1210332406877577216,False,,0,,,,,,,,[],,,,,0.55579704,0.3899963,0.05420657
5,1210331889585684481,1210331889585684481,2019-12-26 22:49:44 UTC,2019-12-26,22:49:44,0,438645558,two_hand_luke,Luke Ehlert,,Day 1 with air pods. I have transcended to a new state of being. Any money that is not a $100 bill has been destroyed. Warren Buffet is begging me for my financial advice. I’m giving away a free Tesla on my Instagram. I am truly living the highest of lives!,en,[],[],[],1,3,75,[],[],https://twitter.com/two_hand_Luke/status/1210331889585684481,False,,0,,,,,,,,[],,,,,0.014553793,0.106812075,0.87863404
6,1210330599128473601,1210330599128473601,2019-12-26 22:44:36 UTC,2019-12-26,22:44:36,0,767498349931028480,dillonloomis22,Electrified,,"If you like #Tesla, raise your hand 🙋🏻‍♂️🙋🏼‍♀️🙋🏻‍♂️🙋🏼‍♀️🙋🏻‍♂️🙋🏼‍♀️🙋🏻‍♂️🙋🏼‍♀️🙋🏻‍♂️🙋🏼‍♀️🙋🏻‍♂️🙋🏼‍♀️  🔹 🔹 🔹 🔹 🔹 🔹 🔹 🔹 🔹 🔹  If you don’t...  🔹 🔹 🔹 🔹 🔹 🔹 🔹 🔹 🔹 🔹  Raise your standards‼️😜  #ElonMusk $TSLA",en,[],[],[],16,18,178,"['tesla', 'elonmusk']",['tsla'],https://twitter.com/DillonLoomis22/status/1210330599128473601,False,,0,,,,,,,,[],,,,,0.007393348,0.11381472,0.8787919
7,1210328819111878656,1210328819111878656,2019-12-26 22:37:31 UTC,2019-12-26,22:37:31,0,1116353841908158464,spotted_model,@spotted_model,,Hey @businessinsider let me fix this headline for you: “Jeep and 2 Chevrolets Top Least Reliable Car List” But you go ahead and lead with number 8. I get it. #Tesla = clicks. @elonmusk  https://t.co/sZAYRPFSgd,en,"[{'screen_name': 'businessinsider', 'name': 'business insider', 'id': '20562637'}, {'screen_name': 'elonmusk', 'name': 'elon musk', 'id': '44196397'}]",[],"['https://pbs.twimg.com/media/EMvzn_7UwAA58Ir.jpg', 'https://pbs.twimg.com/media/EMvzoADUwAE1V-Q.jpg']",15,17,113,['tesla'],[],https://twitter.com/spotted_model/status/1210328819111878656,False,,1,https://pbs.twimg.com/media/EMvzn_7UwAA58Ir.jpg,,,,,,,[],,,,,0.41738027,0.52480984,0.057809833
8,1210325801675063296,1210325801675063296,2019-12-26 22:25:32 UTC,2019-12-26,22:25:32,0,52370117,jpr007,JPR007,,WHEN TESLA LAUNCHED THE CYBERTRUCK AN ENTIRE INDUSTRY CAME TO AN ABRUPT HALT  And for a while there was talk of nothing else  Tesla launches revolutionary products that change the rules of the game  And those who ridicule them fall over themselves to copy   https://t.co/ciiz4n9KBA,en,[],['https://www.forbes.com/sites/enriquedans/2019/12/26/tesla-theres-none-so-blind-as-those-who-will-notsee/'],[],11,36,197,[],[],https://twitter.com/jpr007/status/1210325801675063296,False,,0,,,,,,,,[],,,,,0.17343745,0.66093934,0.16562332
9,1210323212208357376,1210322875233820672,2019-12-26 22:15:15 UTC,2019-12-26,22:15:15,0,86127900,alizshaikha,Ali Shaikha,,@MKBHD Gold plated Tesla with diamond rims,en,[],[],[],1,3,228,[],[],https://twitter.com/AliZShaikha/status/1210323212208357376,False,,0,,,,,,,,"[{'screen_name': 'MKBHD', 'name': 'Marques Brownlee', 'id': '29873662'}]",,,,,0.010147387,0.6609368,0.32891586
10,1210322755176022016,1210322031562174465,2019-12-26 22:13:26 UTC,2019-12-26,22:13:26,0,3476387116,kot4q,KENNY BEECHAM,,@KennardSZN @liv_cowherd Thanks for helping me buy my Tesla. Youre a really great guy.,en,[],[],[],1,7,183,[],[],https://twitter.com/KOT4Q/status/1210322755176022016,False,,0,,,,,,,,"[{'screen_name': 'kennardszn', 'name': 'jack', 'id': '1227676627469029381'}, {'screen_name': 'liv_cowherd', 'name': 'liv', 'id': '2701162612'}]",,,,,0.0036337613,0.013228258,0.9831379
11,1210319486114500608,1210319486114500608,2019-12-26 22:00:26 UTC,2019-12-26,22:00:26,0,1308211178,teslarati,TESLARATI,,Tesla starts activating HW3’s Autopilot Dual Redundancy in latest update  https://t.co/TgyYKMhVjN,en,[],['https://www.teslarati.com/tesla-hw3-autopilot-dual-redundancy-activated'],[],17,94,1480,[],[],https://twitter.com/Teslarati/status/1210319486114500608,False,,0,,,,,,,,[],,,,,0.0030421093,0.75217557,0.2447822
12,1210312701173387264,1210312701173387264,2019-12-26 21:33:29 UTC,2019-12-26,21:33:29,0,52370117,jpr007,JPR007,,"TIME FOR THE SEC TO ISSUE $20 MILLION REFUNDS TO TESLA AND ELON MUSK  - why penalize shareholders for something that turned out to be true ?  - this company is worth more than $420 per share, privatized or not  Just saying . . . “the truth will out”  https://t.co/DCfKTJMP8t",en,[],[],['https://pbs.twimg.com/media/EMvk-1-UYAEO93c.jpg'],9,20,145,[],[],https://twitter.com/jpr007/status/1210312701173387264,False,,1,https://pbs.twimg.com/media/EMvk-1-UYAEO93c.jpg,,,,,,,[],,,,,0.56370693,0.40755615,0.028736949
13,1210312499632971776,1210312499632971776,2019-12-26 21:32:41 UTC,2019-12-26,21:32:41,0,143136354,supermantibody,🇱🇹~Tesladorian~🇺🇦,,#tesla 🍩 🍩  https://t.co/jjeL2pDza1,und,[],[],[],14,11,138,['tesla'],[],https://twitter.com/Supermantibody/status/1210312499632971776,False,,1,https://pbs.twimg.com/ext_tw_video_thumb/1210312439654301697/pu/img/GpO2PpAMrh8t2744.jpg,,,,,,,[],,,,,0.00730038,0.75379366,0.23890606
14,1210310485007986688,1210310485007986688,2019-12-26 21:24:40 UTC,2019-12-26,21:24:40,0,23502725,jennerator211,⚡JENNerator⚡ Fate ❤ Irony,,Joules is getting her tires rotated and aired up. And this is the first time since owning her that anyone but me had ever been behind the wheel... Low maintenance #Tesla  https://t.co/jSy2Uh8aF7,en,[],[],[],5,5,84,['tesla'],[],https://twitter.com/Jennerator211/status/1210310485007986688,False,,1,https://pbs.twimg.com/ext_tw_video_thumb/1210310417471303680/pu/img/SQgY_OHXspm1r-Ha.jpg,,,,,,,[],,,,,0.06678006,0.3537474,0.5794726
15,1210310250223550464,1210310250223550464,2019-12-26 21:23:44 UTC,2019-12-26,21:23:44,0,2241150253,rationaletienne,Pope of Muskanity,,"So you think you’re already a hardcore Tesla fan, but have you joined the Podcast?  Please contact @thirdrowtesla, the Podcast of Muskanity, to be blessed &amp; if you would like to be formally educated!",en,"[{'screen_name': 'thirdrowtesla', 'name': 'third row tesla podcast', 'id': '1139310453987745792'}]",[],[],2,3,54,[],[],https://twitter.com/RationalEtienne/status/1210310250223550464,False,,0,,,,,,,,[],,,,,0.0052211564,0.33273575,0.6620431
16,1210309991804092417,1210309991804092417,2019-12-26 21:22:43 UTC,2019-12-26,21:22:43,0,188358180,motor1argentina,Motor1.com Argentina,,Primicia exclusiva total: Tesla prueba su Cybertruck en Tierra del Fuego.  Más info acá:  https://t.co/YtrTOYb2ez  https://t.co/dSC4PdqLTz,es,[],['https://autoblog.com.ar/tag/cybertruck/'],['https://pbs.twimg.com/media/EMvifqXUEAE374U.jpg'],30,51,387,[],[],https://twitter.com/Motor1argentina/status/1210309991804092417,False,,1,https://pbs.twimg.com/media/EMvifqXUEAE374U.jpg,,,,,,,[],,,,,0.008268817,0.8473648,0.14436619
17,1210308469959647246,1210308469959647246,2019-12-26 21:16:40 UTC,2019-12-26,21:16:40,0,1957568797,johnnacrider1,Johnna Crider,,"Linette Lopez claimed that the NTSB ruled ""that the kids who died"" died ""because of the battery fire"" in a 2018 Tesla crash, but the NTSB really didn't say that. Here's what they actually said. $tsla  cc @elonmusk   https://t.co/eUPIsx0yk8",en,"[{'screen_name': 'elonmusk', 'name': 'elon musk', 'id': '44196397'}]",['https://evobsession.com/what-did-the-ntsb-really-say-about-that-2018-tesla-crash/'],[],21,55,261,[],['tsla'],https://twitter.com/JohnnaCrider1/status/1210308469959647246,False,,0,,,,,,,,[],,,,,0.2635765,0.71166706,0.024756312
18,1210308296340410369,1210308296340410369,2019-12-26 21:15:58 UTC,2019-12-26,21:15:58,0,740946180,minimalduck,Arash Malek 🦆,,Last minute LA/SD trip because #TeslaModel3 @Tesla @elonmusk make it too easy!! @BenSullins wanna 🍻?  https://t.co/ppm0cUQTYy,en,"[{'screen_name': 'tesla', 'name': 'tesla', 'id': '13298072'}, {'screen_name': 'elonmusk', 'name': 'elon musk', 'id': '44196397'}]",[],[],6,6,91,['teslamodel3'],[],https://twitter.com/MinimalDuck/status/1210308296340410369,False,,1,https://pbs.twimg.com/ext_tw_video_thumb/1210308260227469312/pu/img/L2OBi1ALLxxfOb23.jpg,,,,,,,[],,,,,0.00534968,0.074270435,0.92038
19,1210307792478838785,1210307792478838785,2019-12-26 21:13:58 UTC,2019-12-26,21:13:58,0,437094039,portugaltheshan,Shanny DeVito,,90s were 30 years ago. We were doing Tesla’s at the beginning of the decade too.,en,[],[],[],1,6,55,[],[],https://twitter.com/PortugalTheShan/status/1210307792478838785,False,https://twitter.com/VSHTRAY/status/1209959728777818112,0,,,,,,,,[],,,,,0.031590514,0.8031919,0.16521755
20,1210307520532664320,1210307520532664320,2019-12-26 21:12:53 UTC,2019-12-26,21:12:53,0,1128696334284804096,bridgiecasey,Bridget Casey,,not actually getting a Tesla this year u guys there is nowhere to charge it at my apartment also I just bought my current car 1.5 years ago and it seems a little quick to break up with it don't u think,en,[],[],[],14,0,56,[],[],https://twitter.com/BridgieCasey/status/1210307520532664320,False,,0,,,,,,,,[],,,,,0.6573732,0.31490517,0.027721606
21,1210305250445316096,1210305250445316096,2019-12-26 21:03:52 UTC,2019-12-26,21:03:52,0,1139310453987745792,thirdrowtesla,Third Row Tesla Podcast,,"Isn’t it funny how @tesla and @elonmusk sell 0.2% of the worlds cars but have 100% of the auto industry’s attention?  Tesla is defining the vision for the future of the car, and everyone is watching.   This is what “accelerating the transition to sustainable transport” means",en,"[{'screen_name': 'tesla', 'name': 'tesla', 'id': '13298072'}, {'screen_name': 'elonmusk', 'name': 'elon musk', 'id': '44196397'}]",[],[],11,49,379,[],[],https://twitter.com/thirdrowtesla/status/1210305250445316096,False,,0,,,,,,,,[],,,,,0.037746135,0.39932337,0.56293046
22,1210302222585618432,1210302222585618432,2019-12-26 20:51:50 UTC,2019-12-26,20:51:50,0,13083622,techau,techAU,,"Some new Tesla's being delivered in Richmond, Melbourne. #model3au  https://t.co/8iigKczrkA",en,[],[],[],8,24,199,['model3au'],[],https://twitter.com/techAU/status/1210302222585618432,False,,1,https://pbs.twimg.com/ext_tw_video_thumb/1210302178402766849/pu/img/RBeIHZgKB6CrYKTU.jpg,,,,,,,[],,,,,0.0037824675,0.73393667,0.2622808
23,1210298603014676480,1210298603014676480,2019-12-26 20:37:27 UTC,2019-12-26,20:37:27,0,25360971,powerlunch,Power Lunch,,"""Elon proved the doubters wrong.""  Former @Tesla board member @SteveWestly credits the auto company's stock surge to @elonmusk - even going as far as comparing him to Thomas Edison and Steve Jobs.  $TSLA  https://t.co/jQcraMChRl",en,"[{'screen_name': 'tesla', 'name': 'tesla', 'id': '13298072'}, {'screen_name': 'stevewestly', 'name': 'steve westly', 'id': '154311445'}, {'screen_name': 'elonmusk', 'name': 'elon musk', 'id': '44196397'}]",[],[],19,83,222,[],['tsla'],https://twitter.com/PowerLunch/status/1210298603014676480,False,,1,https://pbs.twimg.com/media/EMvYKVTXYAQfMPe.jpg,,,,,,,[],,,,,0.002696215,0.06751925,0.92978466
24,1210295363132907521,1210295363132907521,2019-12-26 20:24:35 UTC,2019-12-26,20:24:35,0,813686613372993536,tslaownerzurich,srossini,,"What an awesome car @tesla @elonmusk 🙏🏼Today we did the longest part of our roadtrip, from karsruhe germany to copenhagen denmark, 950km in 11 hours, so easy and relaxed. 98% #autopilot, 4 #supercharger breaks, perfect for doggywalks🐶 and also matched the toiletrythmus from🙋🏽‍♀️😜  https://t.co/0hyFQQQrsL",en,"[{'screen_name': 'tesla', 'name': 'tesla', 'id': '13298072'}, {'screen_name': 'elonmusk', 'name': 'elon musk', 'id': '44196397'}]",[],['https://pbs.twimg.com/media/EMvVNivXsAAmXvD.jpg'],9,17,164,"['autopilot', 'supercharger']",[],https://twitter.com/tslaownerzurich/status/1210295363132907521,False,,1,https://pbs.twimg.com/media/EMvVNivXsAAmXvD.jpg,,,,,,,[],,,,,0.0024914932,0.010073213,0.9874354
25,1210294856632786944,1210294856632786944,2019-12-26 20:22:34 UTC,2019-12-26,20:22:34,0,2281370629,nahamsec,Ben Sadeghipour,,In a tesla?? 😂,tr,[],[],[],4,1,126,[],[],https://twitter.com/NahamSec/status/1210294856632786944,False,https://twitter.com/11xuxx/status/1210292133552373762,0,,,,,,,,[],,,,,0.11877094,0.7478288,0.13340017
26,1210294347511582722,1210270551236730880,2019-12-26 20:20:33 UTC,2019-12-26,20:20:33,0,3167257102,erdayastronaut,Everyday Astronaut,,"@elonmusk @flcnhvy @Sofiaan Maybe there are some things the community could do to improve cars that wouldn’t soak up engineering time and resources? I know there’s probably safety risks to crowd sourcing, but I think Tesla has the most loyal and potentially capable crowd that would LOVE to contribute 👍",en,[],[],[],11,8,304,[],[],https://twitter.com/Erdayastronaut/status/1210294347511582722,False,,0,,,,,,,,"[{'screen_name': 'elonmusk', 'name': 'Elon Musk', 'id': '44196397'}, {'screen_name': 'flcnhvy', 'name': 'Viv ✶', 'id': '1060180551544528897'}, {'screen_name': 'Sofiaan', 'name': 'Sofiaan Fraval', 'id': '49417006'}]",,,,,0.027688142,0.25442967,0.71788216
27,1210294128375980047,1210294128375980047,2019-12-26 20:19:41 UTC,2019-12-26,20:19:41,0,101689439,tbatuhanyasar,Batuhan Yaşar,,"Yarın Tesla ve Jaguar (elektrikli) ile boy ölçüşecek bir otomobil geliyor.. İçi, dışı ve gösterge panelleri en lüks otomobillerle taş çıkartır cinsten.. #TOGG #DoğustanElektirikli  https://t.co/w695AiRbVa",tr,[],[],['https://pbs.twimg.com/media/EMvUFwRUYAAKfOF.jpg'],3,29,131,"['togg', 'doğustanelektirikli']",[],https://twitter.com/tbatuhanyasar/status/1210294128375980047,False,,1,https://pbs.twimg.com/media/EMvUFwRUYAAKfOF.jpg,,,,,,,[],,,,,0.04430523,0.8511181,0.10457675
28,1210293100616151040,1210270551236730880,2019-12-26 20:15:36 UTC,2019-12-26,20:15:36,0,44196397,elonmusk,Elon Musk,,@flcnhvy @Sofiaan @Erdayastronaut The overarching goal of Tesla engineering is maximize area under user happiness curve,en,[],[],[],106,158,2194,[],[],https://twitter.com/elonmusk/status/1210293100616151040,False,,0,,,,,,,,"[{'screen_name': 'flcnhvy', 'name': 'Viv ✶', 'id': '1060180551544528897'}, {'screen_name': 'Sofiaan', 'name': 'Sofiaan Fraval', 'id': '49417006'}, {'screen_name': 'Erdayastronaut', 'name': 'Everyday Astronaut', 'id': '3167257102'}]",,,,,0.025611466,0.40400153,0.5703871
29,1210292978520076289,1210292978520076289,2019-12-26 20:15:06 UTC,2019-12-26,20:15:06,0,898021206967951360,teslapodcast,Rob Maurer,,Matt and I took a shot at breaking down #Cybertruck specs by piecing together a few different data points. $TSLA #Tesla @matty_mogul @tesla  Thread ⬇️,en,"[{'screen_name': 'matty_mogul', 'name': 'matt joyce', 'id': '1112492846970490882'}, {'screen_name': 'tesla', 'name': 'tesla', 'id': '13298072'}]",[],[],6,11,100,"['cybertruck', 'tesla']",['tsla'],https://twitter.com/TeslaPodcast/status/1210292978520076289,False,https://twitter.com/matty_mogul/status/1210278953061093376,0,,,,,,,,[],,,,,0.0074028233,0.85459965,0.13799746
30,1210289358093406208,1210289358093406208,2019-12-26 20:00:43 UTC,2019-12-26,20:00:43,0,1014749474546241538,heavenpowersys,Heaven Power Systems,,Do you agree with @elonmusk that more than 50% of all new vehicles will be EVs by 2027? ⚡🚘  #electricvehicles #tesla #model3 #modelx #electricvehicle,en,"[{'screen_name': 'elonmusk', 'name': 'elon musk', 'id': '44196397'}]",[],[],24,7,96,"['electricvehicles', 'tesla', 'model3', 'modelx', 'electricvehicle']",[],https://twitter.com/HeavenPowerSys/status/1210289358093406208,False,,0,,,,,,,,[],,,,,0.0046888543,0.45032763,0.5449835
31,1210289354171703296,1210289354171703296,2019-12-26 20:00:42 UTC,2019-12-26,20:00:42,0,1308211178,teslarati,TESLARATI,,Tesla's new electrolyte solvent patent is a step towards a 1 million-mile battery  https://t.co/tXsan3vFMa,en,[],['https://www.teslarati.com/tesla-electrolyte-patent-1-million-mile-battery'],[],45,381,2702,[],[],https://twitter.com/Teslarati/status/1210289354171703296,False,,0,,,,,,,,[],,,,,0.00440554,0.28534284,0.71025175
32,1210289254879940609,1210289254879940609,2019-12-26 20:00:19 UTC,2019-12-26,20:00:19,0,732548050728701953,valueanalyst1,Yaman Tasdivar,,Imagine the number of smiles that @Tesla has induced:,en,"[{'screen_name': 'tesla', 'name': 'tesla', 'id': '13298072'}]",[],[],2,5,75,[],[],https://twitter.com/ValueAnalyst1/status/1210289254879940609,False,https://twitter.com/cvanderstock/status/1210060426194513920,0,,,,,,,,[],,,,,0.0072473097,0.110480964,0.88227177
33,1210289178392453120,1210289178392453120,2019-12-26 20:00:00 UTC,2019-12-26,20:00:00,0,64643056,rt_com,RT,,"Russian Tesla copy is for sale for just…666,666 rubles (~$10,000)!   https://t.co/UFx4ae2iWn  https://t.co/2kSyXrtHdY",en,[],['https://on.rt.com/a7xc'],[],12,47,131,[],[],https://twitter.com/RT_com/status/1210289178392453120,False,,1,https://pbs.twimg.com/media/EMd7whhX0AAt_B0.jpg,,,,,,,[],,,,,0.0067673316,0.7957989,0.1974339
34,1210288273010176001,1210288273010176001,2019-12-26 19:56:25 UTC,2019-12-26,19:56:25,0,316155198,tomi,Tomi,,"Tesla is up $175/share (~69%, or $32bn) since October 23 on effectively no real news beyond a $140mm profit in Q3.  Beyond continuous momentum buying, what are the potential positive catalysts not yet priced in? $TSLAQ",en,[],[],[],21,5,103,[],['tslaq'],https://twitter.com/tomi/status/1210288273010176001,False,,0,,,,,,,,[],,,,,0.018460272,0.3834117,0.59812796
35,1210285675121184769,1210285675121184769,2019-12-26 19:46:05 UTC,2019-12-26,19:46:05,0,30745844,chrisg_nsf,Chris G - NSF,,"Major THANK YOU to @Tesla team in Jacksonville, FL. Due to a shipping error, my car is still in California, but they are paying to fly me (ironic, I know) 1,500 miles away &amp; giving free supercharging so can get my car in time for the 2019 tax credit! SUPER HAPPY! #TeslaRoadTrip  https://t.co/Bx5Gj7smnT",en,"[{'screen_name': 'tesla', 'name': 'tesla', 'id': '13298072'}]",[],['https://pbs.twimg.com/tweet_video_thumb/EMvMZzBVUAAV62v.jpg'],54,37,752,['teslaroadtrip'],[],https://twitter.com/ChrisG_NSF/status/1210285675121184769,False,,1,https://pbs.twimg.com/tweet_video_thumb/EMvMZzBVUAAV62v.jpg,,,,,,,[],,,,,0.015704641,0.0535119,0.9307834
36,1210281717027627008,1210281717027627008,2019-12-26 19:30:21 UTC,2019-12-26,19:30:21,0,959168599519764480,ray4tesla,Ray4Tesla⚡️🚘☀️🔋,,"With the recent OTA, Chinese #Tesla owners are carried away with all kinds of crazy Smart Summon ideas🤣  https://t.co/dOsFknvvE7",en,[],[],[],4,15,102,['tesla'],[],https://twitter.com/ray4tesla/status/1210281717027627008,False,,1,https://pbs.twimg.com/ext_tw_video_thumb/1210281664900780033/pu/img/HY-GBAoAx15xvh4j.jpg,,,,,,,[],,,,,0.13000643,0.54902565,0.32096803
37,1210280850597789696,1210280850597789696,2019-12-26 19:26:55 UTC,2019-12-26,19:26:55,0,1147869944220127234,dowageramafakir,Hewal Fakır,,"Flörtüme tesla mi edison mu diye sordum. Bağıra bağıra edisoncuyuz dedi, bağıra bağıraaaaa! Tesla'nın ve benim kemiklerim katır kutur yer değiştirdi.  https://t.co/AfdND7lCZ2",tr,[],[],['https://pbs.twimg.com/media/EMvIBEJU4AAIb5h.jpg'],0,0,182,[],[],https://twitter.com/DowagerAmaFakir/status/1210280850597789696,False,,1,https://pbs.twimg.com/media/EMvIBEJU4AAIb5h.jpg,,,,,,,[],,,,,0.070599586,0.59994626,0.32945412
38,1210280346115334144,1210196160956293121,2019-12-26 19:24:55 UTC,2019-12-26,19:24:55,0,92727851,mrjamesmay,James May,,@embaachu @Tesla Go on then.,en,[],[],[],17,1,300,[],[],https://twitter.com/MrJamesMay/status/1210280346115334144,False,,0,,,,,,,,"[{'screen_name': 'embaachu', 'name': 'Ekechukwu Mbaachu', 'id': '379776373'}, {'screen_name': 'Tesla', 'name': 'Tesla', 'id': '13298072'}]",,,,,0.040086437,0.8510418,0.108871646
39,1210279091003248641,1210279091003248641,2019-12-26 19:19:55 UTC,2019-12-26,19:19:55,0,1689516060,vincent13031925,vincentyu.eth,,Tesla's Navigate on Autopilot and Full Self-Driving Suite Now Available for Australian Owners   https://t.co/pvrH9MdL0Q,en,[],['https://www.tesmanian.com/blogs/tesmanian-blog/tesla-austrlaia-autopilot-fsd-preview-2019-40-50-update'],[],6,24,163,[],[],https://twitter.com/vincent13031925/status/1210279091003248641,False,,0,,,,,,,,[],,,,,0.0046663918,0.80696076,0.18837273
40,1210276117065674758,1210276117065674758,2019-12-26 19:08:06 UTC,2019-12-26,19:08:06,0,180637155,teaseshyt,tea sesh,,David Dobrik fans are not happy with the outcome of the tesla giveaway.  -The winner was David’s friend who also lives in cali  -she didn’t even follow seatgeek which was one of the rules -she’s a wealthy influencer who travel the world.  https://t.co/KKCMfwf3VL,en,[],[],"['https://pbs.twimg.com/media/EMvDtP1XUAAW8eK.jpg', 'https://pbs.twimg.com/media/EMvDtPuXYAEvfA5.jpg', 'https://pbs.twimg.com/media/EMvDtP4XYAAdeSZ.jpg', 'https://pbs.twimg.com/media/EMvDtP1WwAgcnJ-.jpg']",16,17,236,[],[],https://twitter.com/TeaSeshYT/status/1210276117065674758,False,,1,https://pbs.twimg.com/media/EMvDtP1XUAAW8eK.jpg,,,,,,,[],,,,,0.7905793,0.19648343,0.01293721
41,1210274226722131968,1210274226722131968,2019-12-26 19:00:36 UTC,2019-12-26,19:00:36,0,145701603,ymt3d,3D人-3dnchu- CG情報ブログ,,開閉機構入れたよー  #UE4 #b3d #tesla #Cybertruck #テスラ #サイバートラック #TeslaCyberTruck  https://t.co/iyBdgUU0DX,ja,[],[],[],5,65,269,"['ue4', 'b3d', 'tesla', 'cybertruck', 'テスラ', 'サイバートラック', 'teslacybertruck']",[],https://twitter.com/ymt3d/status/1210274226722131968,False,,1,https://pbs.twimg.com/ext_tw_video_thumb/1210273861704409088/pu/img/-292W_eC1ZLGFuVO.jpg,,,,,,,[],,,,,0.009909365,0.911861,0.07822955
42,1210271564853321729,1210269043216863233,2019-12-26 18:50:01 UTC,2019-12-26,18:50:01,0,3907258996,ahmet__akis,Ahmet Akış 🔺,,Otomobilimizin tasarımı oldukça güzel. Ha bir Tesla değil ama elektrikli ve 4*4 olması beğendiğim yanları.   Bu arada  Iphone Çin'de üretiliyor ama Amerikan markası. Geçelim artık bu sığ muhalefeti.,tr,[],[],[],8,20,133,[],[],https://twitter.com/ahmet__akis/status/1210271564853321729,False,,0,,,,,,,,[],,,,,0.06698515,0.83672315,0.0962916
43,1210270962148683779,1210270551236730880,2019-12-26 18:47:37 UTC,2019-12-26,18:47:37,0,1100100471744839680,spongbob_facts,SpongeBob Facts!,,@elonmusk SPONGEBOB FACT: When are you going to make an undersea Tesla boat Elon? SpongeBob could really use that feature!!  https://t.co/rR9Iwy9Ey3,en,[],[],['https://pbs.twimg.com/media/EMu_BdPUYAAdhnC.jpg'],14,13,632,[],[],https://twitter.com/spongbob_facts/status/1210270962148683779,False,,1,https://pbs.twimg.com/media/EMu_BdPUYAAdhnC.jpg,,,,,,,"[{'screen_name': 'elonmusk', 'name': 'Elon Musk', 'id': '44196397'}]",,,,,0.004606257,0.07989857,0.9154952
