id,conversation_id,created_at,date,time,timezone,user_id,username,name,place,tweet,language,mentions,urls,photos,replies_count,retweets_count,likes_count,hashtags,cashtags,link,retweet,quote_url,video,thumbnail,near,geo,source,user_rt_id,user_rt,retweet_id,reply_to,retweet_date,translate,trans_src,trans_dest
1118867882807635974,1118867882807635974,2019-04-18 13:24:25 UTC,2019-04-18,13:24:25,+0000,1308211178,teslarati,TESLARATI,,Tesla's first Impact Report gets nod of respect from corporate sustainability firm: 'this is kind of a step above most first sustainability reports we see'  https://t.co/fuzgLz0Edh,en,[],['https://www.teslarati.com/tesla-environmental-impact-report-corporate-sustainability-review/'],[],1,56,421,[],[],https://twitter.com/Teslarati/status/1118867882807635974,False,,0,,,,,,,,[],,,,
1118864410611716096,1118662703109722112,2019-04-18 13:10:37 UTC,2019-04-18,13:10:37,+0000,22681424,jordan_mcrae_,Jordan McRae,,"@GerberKawasaki @WillemKadijk Depreciation is not ""wear and tear"". Depreciation is the reduction in value over time. You really think if you bought a Tesla today that in 3-5 years its fair market value would be greater than the amount you bought it for??",en,[],[],[],2,1,122,[],[],https://twitter.com/jordan_mcrae_/status/1118864410611716096,False,,0,,,,,,,,"[{'screen_name': 'GerberKawasaki', 'name': 'Ross Gerber', 'id': '349249475'}, {'screen_name': 'WillemKadijk', 'name': 'Mr Blue', 'id': '315783277'}]",,,,
1118856898722144256,1118856898722144256,2019-04-18 12:40:46 UTC,2019-04-18,12:40:46,+0000,349249475,gerberkawasaki,Ross Gerber,,Every gas station destroys the land under it. It takes a decade to clean up the tanks put in the ground to hold gas.  Every gas station that you see is an environmental disaster. And they only make money by selling you gum and lottery tickets. #EV #Tesla $tsla,en,[],[],[],39,75,360,"['ev', 'tesla']",['tsla'],https://twitter.com/GerberKawasaki/status/1118856898722144256,False,,0,,,,,,,,[],,,,
1118853686590152706,1118853686590152706,2019-04-18 12:28:00 UTC,2019-04-18,12:28:00,+0000,568621669,insideevs,InsideEVs,,Tesla Captures 45% Of Electric Car Sales In Europe In March  https://t.co/vgOvWdCxEf,en,[],['https://insideevs.com/march-ev-sales-europe-40000-tesla/amp/'],[],2,16,100,[],[],https://twitter.com/InsideEVs/status/1118853686590152706,False,,0,,,,,,,,[],,,,
1118853429298778112,1118853429298778112,2019-04-18 12:26:59 UTC,2019-04-18,12:26:59,+0000,349249475,gerberkawasaki,Ross Gerber,,People talk about Tesla and cash burn but Tesla will be cash flow positive this year while Netflix will be CF negative by over $3.5 bil. With no end in sight.  But nice #Beyonce video. $tsla $nflx,en,[],[],[],26,17,190,['beyonce'],"['tsla', 'nflx']",https://twitter.com/GerberKawasaki/status/1118853429298778112,False,,0,,,,,,,,[],,,,
1118829803539501057,1118829803539501057,2019-04-18 10:53:06 UTC,2019-04-18,10:53:06,+0000,1002616999267262465,troyteslike,Troy Teslike,,"Here is the timing I'd expect for Model S/X design refresh:  ~25 Jun 2019, Model S/X prod will switch to new design  ~18 Jul 2019, Tesla will announce the switch  This change will enable: • Supercharger V3 • Track Mode • Model 3 style center console + touchscreen + air vents",en,[],[],[],17,11,121,[],[],https://twitter.com/TroyTeslike/status/1118829803539501057,False,,0,,,,,,,,[],,,,
1118826460519763969,1118826460519763969,2019-04-18 10:39:49 UTC,2019-04-18,10:39:49,+0000,998140573008695296,28delayslater,🇺🇦 🦊 Earl of FrunkPuppy 🇺🇦,,🐻: Tesla bulls are all 🐑 and lemmings who can’t think independently   🤡 : (profile pic changed)   🐶: that’s white nationalist propoganda   🤡: but everyone else did it. I didn’t know.,en,[],[],[],8,9,82,[],[],https://twitter.com/28delayslater/status/1118826460519763969,False,,0,,,,,,,,[],,,,
1118825122612293632,1118825122612293632,2019-04-18 10:34:30 UTC,2019-04-18,10:34:30,+0000,2148233600,electrekco,Electrek.co,,Tesla gets the nod from VW for 'proving electric cars are here to stay'  https://t.co/WHXfviQ5yF by @fredericlambert  https://t.co/EPRVyjrsuD,en,"[{'screen_name': 'fredericlambert', 'name': 'fred lambert', 'id': '38253449'}]",['https://electrek.co/2019/04/18/tesla-nod-vw-electric-cars/'],['https://pbs.twimg.com/media/D4bdhQ9W4AE63rH.jpg'],9,56,355,[],[],https://twitter.com/ElectrekCo/status/1118825122612293632,False,,1,https://pbs.twimg.com/media/D4bdhQ9W4AE63rH.jpg,,,,,,,[],,,,
1118807705836249088,1118807705836249088,2019-04-18 09:25:18 UTC,2019-04-18,09:25:18,+0000,1374059611,teslany,Tesla New York,,4/18/19 Update: #Tesla Shanghai #Gigafactory3 – Top architecture installation &amp; roof paving 🏣🔋🇨🇳  https://t.co/Xgs3SKWO1G $TSLA #EV #ElectricVehicle  https://t.co/Vb6aSe1LyU,en,[],['https://youtu.be/m34SFFGGhlk'],"['https://pbs.twimg.com/media/D4bNqEXWkAAaJrB.jpg', 'https://pbs.twimg.com/media/D4bNqEXW4AACYzs.jpg', 'https://pbs.twimg.com/media/D4bNqEUWwAIf2EC.jpg', 'https://pbs.twimg.com/media/D4bNqEeXsAEmFzf.jpg']",6,19,76,"['tesla', 'gigafactory3', 'ev', 'electricvehicle']",['tsla'],https://twitter.com/TeslaNY/status/1118807705836249088,False,,1,https://pbs.twimg.com/media/D4bNqEXWkAAaJrB.jpg,,,,,,,[],,,,
1118806405379690497,1118806405379690497,2019-04-18 09:20:08 UTC,2019-04-18,09:20:08,+0000,1308211178,teslarati,TESLARATI,,Tesla owners in Portugal escape fuel shortage hell due to truck drivers’ strike  https://t.co/KNYoDpZqX1,en,[],['https://www.teslarati.com/tesla-owners-portugal-fuel-shortage-truck-drivers-strike/'],[],13,55,500,[],[],https://twitter.com/Teslarati/status/1118806405379690497,False,,0,,,,,,,,[],,,,
1118792692023078913,1118792692023078913,2019-04-18 08:25:38 UTC,2019-04-18,08:25:38,+0000,2497973221,fmossotto,Franco Mossotto,,A load of #Tesla #Model3 coming to Italy seen today near Villafranca di Verona.  https://t.co/hx9IvUTVw0,en,[],[],['https://pbs.twimg.com/media/D4a_4-JW4AE2en5.jpg'],3,16,118,"['tesla', 'model3']",[],https://twitter.com/FMossotto/status/1118792692023078913,False,,1,https://pbs.twimg.com/media/D4a_4-JW4AE2en5.jpg,,,,,,,[],,,,
1118781692104384512,1118781692104384512,2019-04-18 07:41:56 UTC,2019-04-18,07:41:56,+0000,72241630,nikolasilic,Nikola Silic,,"Ortakinja iz Zagreba pizdi što nemaju starbaks, tako da je starbaks sada najbolja stvar na svetu. Tesla 2.0",und,[],[],[],3,1,85,[],[],https://twitter.com/NikolaSilic/status/1118781692104384512,False,,0,,,,,,,,[],,,,
1118780876131852288,1118780876131852288,2019-04-18 07:38:41 UTC,2019-04-18,07:38:41,+0000,4763391,skallen,Anders Karlsson,,Will Sales Numbers Explode? | @Tesla Model 3 SR+ In Denmark Now Taxed @ 0%  https://t.co/3lgty2raZp via @YouTube,en,"[{'screen_name': 'tesla', 'name': 'tesla', 'id': '13298072'}, {'screen_name': 'youtube', 'name': 'youtube', 'id': '10228272'}]",['https://youtu.be/a5a1l5_O924'],[],1,22,77,[],[],https://twitter.com/skallen/status/1118780876131852288,False,,0,,,,,,,,[],,,,
1118763675203047424,1118763675203047424,2019-04-18 06:30:20 UTC,2019-04-18,06:30:20,+0000,19023470,gbuhnici,George Buhnici 🇪🇺 🇷🇴 🇺🇦,,"Dear @elonmusk, Romanian Environmental Agency invites @Tesla to register and make use of the highest incentives in the world for new EV registrations, up to 13.000$ for every plug-in car sold in 2019. There's also big incentives for charging stations and solar. Interested?",en,"[{'screen_name': 'elonmusk', 'name': 'elon musk', 'id': '44196397'}, {'screen_name': 'tesla', 'name': 'tesla', 'id': '13298072'}]",[],[],49,136,541,[],[],https://twitter.com/gbuhnici/status/1118763675203047424,False,,0,,,,,,,,[],,,,
1118761700067561472,1118761700067561472,2019-04-18 06:22:29 UTC,2019-04-18,06:22:29,+0000,32318850,calvinayre,Calvin Ayre,,I am going all electric this year...buying a Tesla in Antigua.     https://t.co/k8n7TsP5pV,en,[],['https://mashable.com/article/tesla-battery-charge-max/?europe=true&utm_campaign=FEED+BLAST-Mashable+Top+Stories+Daily-20190417T170000%2B0000&utm_source=newsletter'],[],10,1,63,[],[],https://twitter.com/CalvinAyre/status/1118761700067561472,False,,0,,,,,,,,[],,,,
1118756674066477056,1118756674066477056,2019-04-18 06:02:31 UTC,2019-04-18,06:02:31,+0000,18366419,artemr,Artem Russakovskii 🇺🇦,,"A standing still @Tesla Model X got hit at 65mph and a mother and her 5 week old son walked away unharmed.  Thanks for the 🌟🌟🌟🌟🌟 safety rating, @elonmusk.   https://t.co/aBAUulcT45  cc @FredericLambert @ElectrekCo @llsethj  https://t.co/g9cssjLdLB",en,"[{'screen_name': 'tesla', 'name': 'tesla', 'id': '13298072'}, {'screen_name': 'elonmusk', 'name': 'elon musk', 'id': '44196397'}, {'screen_name': 'fredericlambert', 'name': 'fred lambert', 'id': '38253449'}, {'screen_name': 'electrekco', 'name': 'electrek.co', 'id': '2148233600'}, {'screen_name': 'llsethj', 'name': 'seth weintraub', 'id': '1006521'}]",['https://www.reddit.com/r/teslamotors/comments/begdpv/5_star_for_a_reason'],[],87,363,3289,[],[],https://twitter.com/ArtemR/status/1118756674066477056,False,,1,https://pbs.twimg.com/ext_tw_video_thumb/1118756632412872704/pu/img/GoKANTfwYd3sG82H.jpg,,,,,,,[],,,,
1118728334404284422,1118728334404284422,2019-04-18 04:09:54 UTC,2019-04-18,04:09:54,+0000,1082181922606858241,jayinshanghai,Jay in Shanghai 🇨🇳,,Breaking News from Tesla China at Auto Shanghai 2019. @robinren told news reporters that Tesla will integrated QQ Music (QQ音乐) to Tesla Vehicles in China via OTA. Similar to how Spotify is available in Tesla’s outside of US. Thank you @Tesla for listening to Chinese Owners.  https://t.co/d3Gt6qaptE,en,"[{'screen_name': 'robinren', 'name': 'robin ren', 'id': '81539596'}, {'screen_name': 'tesla', 'name': 'tesla', 'id': '13298072'}]",[],[],5,14,135,[],[],https://twitter.com/JayinShanghai/status/1118728334404284422,False,,1,https://pbs.twimg.com/ext_tw_video_thumb/1118728306331795456/pu/img/4kWbG4IiX6mhV_1S.jpg,,,,,,,[],,,,
1118726597094203392,1118726597094203392,2019-04-18 04:03:00 UTC,2019-04-18,04:03:00,+0000,701725963,nowthisnews,NowThis,,This Tesla driver appears to be sound asleep at 75 mph 😴  https://t.co/0YvG3wtkhs,en,[],[],[],80,282,602,[],[],https://twitter.com/nowthisnews/status/1118726597094203392,False,,1,https://pbs.twimg.com/amplify_video_thumb/1103729772016910338/img/VpEfK_Grvpd6ItBN.jpg,,,,,,,[],,,,
1118722683905069056,1118722683905069056,2019-04-18 03:47:27 UTC,2019-04-18,03:47:27,+0000,1072009236,polkameister,Bill Brasky,,"""The cheapest Tesla starts at $39,000. That is perhaps cheap for someone like the Minister which makes over a quarter of a million through his government salary alone, but it is certainly not in the affordable range for a large portion of Canadians.""   https://t.co/sh2LQ3u7Mn",en,[],['https://www.thepostmillennial.com/why-is-this-liberal-mp-poor-shaming-canadians-on-twitter/?fbclid=IwAR0y13LPWuYuj4eWniK-23yJVxzBlHkpKDQcinvsN9KAUSXGw7Gr7rMjOok'],[],17,43,93,[],[],https://twitter.com/Polkameister/status/1118722683905069056,False,,0,,,,,,,,[],,,,
1118714170730586118,1118714170730586118,2019-04-18 03:13:37 UTC,2019-04-18,03:13:37,+0000,980554784133427200,barkmsmeagol,Bark 👀,,$TSLAQ #DumDums: “Tesla’s Model 3 is DOA in Europe!! Why even bother?! It’s a total failure!!! $TSLA IS A ZERO!!!!!!”  REALITY:,en,[],[],[],4,12,75,['dumdums'],"['tslaq', 'tsla']",https://twitter.com/BarkMSmeagol/status/1118714170730586118,False,https://twitter.com/cleantechnica/status/1118695759501766657,0,,,,,,,,[],,,,
1118701707783884800,1118701707783884800,2019-04-18 02:24:06 UTC,2019-04-18,02:24:06,+0000,63457904,texwalkerranger,Heath Walker,,Open for 15 minutes and already packed in the Tesla stand here in Shanghai  https://t.co/2dQG2FHnen,en,[],[],[],4,17,84,[],[],https://twitter.com/TexWalkerRanger/status/1118701707783884800,False,,1,https://pbs.twimg.com/ext_tw_video_thumb/1118701577328451584/pu/img/YdYms5GSpqMXh_aB.jpg,,,,,,,[],,,,
1118695759501766657,1118695759501766657,2019-04-18 02:00:28 UTC,2019-04-18,02:00:28,+0000,17060015,cleantechnica,CleanTechnica,,"Tesla Model 3 = Best Selling Car (Of Any Type) In Netherlands, Norway, &amp; Switzerland  https://t.co/R5nwbrA0sC  https://t.co/WaOayH8zdn",en,[],['https://cleantechnica.com/2019/04/17/tesla-model-3-best-selling-car-of-any-type-in-netherlands-norway-switzerland/'],['https://pbs.twimg.com/media/D4Zn3WeXkAMvLZ1.png'],7,76,272,[],[],https://twitter.com/cleantechnica/status/1118695759501766657,False,,1,https://pbs.twimg.com/media/D4Zn3WeXkAMvLZ1.png,,,,,,,[],,,,
1118695649187377152,1118695649187377152,2019-04-18 02:00:01 UTC,2019-04-18,02:00:01,+0000,2244340904,recode,Recode,,Ford CTO Ken Washington explains to @karaswisher why Tesla’s so-called Autopilot features are not really “self-driving” on the latest Recode Decode:  https://t.co/NO7v3LFeyB,en,"[{'screen_name': 'karaswisher', 'name': 'kara swisher', 'id': '5763262'}]",['https://www.recode.net/podcasts/2019/4/17/18411242/ken-washington-ford-self-driving-car-artificial-intelligence-kara-swisher-decode-podcast-interview?utm_campaign=recode.social&utm_content=recode&utm_medium=social&utm_source=twitter'],[],12,35,86,[],[],https://twitter.com/Recode/status/1118695649187377152,False,,0,,,,,,,,[],,,,
1118680314652626945,1118680314652626945,2019-04-18 00:59:05 UTC,2019-04-18,00:59:05,+0000,378206995,weird_hist,Weird History,,Nikola Tesla hated pearls so much that he refused to talk to women wearing them.  https://t.co/OioUXiwuXM,en,[],[],['https://pbs.twimg.com/media/D4ZZ0WGXkAAu2qp.jpg'],17,74,298,[],[],https://twitter.com/weird_hist/status/1118680314652626945,False,,1,https://pbs.twimg.com/media/D4ZZ0WGXkAAu2qp.jpg,,,,,,,[],,,,
1118669653813764096,1118669653813764096,2019-04-18 00:16:44 UTC,2019-04-18,00:16:44,+0000,1007337323636318209,teslainvernon,teslainvernon,,These young lads giving the thumbs up when they notice my Tesla Model 3. This happens regularly and It seems many kids recognize and love Teslas. @elonmusk and @Tesla have already primed the sales pipeline for years to come.  https://t.co/Ftfjrd89d4,en,"[{'screen_name': 'elonmusk', 'name': 'elon musk', 'id': '44196397'}, {'screen_name': 'tesla', 'name': 'tesla', 'id': '13298072'}]",[],"['https://pbs.twimg.com/media/D4ZPU2WU4AEnm6y.png', 'https://pbs.twimg.com/media/D4ZPU2WU4AAyhe1.png']",13,14,161,[],[],https://twitter.com/teslainvernon/status/1118669653813764096,False,,1,https://pbs.twimg.com/media/D4ZPU2WU4AEnm6y.png,,,,,,,[],,,,
1118666086025760768,1118666086025760768,2019-04-18 00:02:33 UTC,2019-04-18,00:02:33,+0000,998140573008695296,28delayslater,🇺🇦 🦊 Earl of FrunkPuppy 🇺🇦,,Omg $TSLAQ - found this at my parent’s house   $TSLA #Tesla  https://t.co/6m14Vsf8Yt,en,[],[],['https://pbs.twimg.com/media/D4ZM36EXoAAs5oH.jpg'],13,0,52,['tesla'],"['tslaq', 'tsla']",https://twitter.com/28delayslater/status/1118666086025760768,False,,1,https://pbs.twimg.com/media/D4ZM36EXoAAs5oH.jpg,,,,,,,[],,,,
1118665720382930944,1118665720382930944,2019-04-18 00:01:06 UTC,2019-04-18,00:01:06,+0000,1689516060,vincent13031925,vincentyu.eth,,Another real story about how Tesla Autopilot prevent accident happen. Thanks Kenny sharing the great story.   $TSLA #Tesla,en,[],[],[],3,8,86,['tesla'],['tsla'],https://twitter.com/vincent13031925/status/1118665720382930944,False,https://twitter.com/kenny_wu76/status/1118664493305868288,0,,,,,,,,[],,,,
1118665705698877440,1118665705698877440,2019-04-18 00:01:02 UTC,2019-04-18,00:01:02,+0000,17060015,cleantechnica,CleanTechnica,,"Tesla Model 3 Is Cheaper Than Toyota Camry, ARK Analysis Concludes  https://t.co/WwIkbC3C6j  https://t.co/ZMYJVWN81R",en,[],['https://cleantechnica.com/2019/04/17/tesla-model-3-is-cheaper-than-toyota-camry-ark-analysis-concludes/'],['https://pbs.twimg.com/media/D4ZMh_dX4AEoaSt.png'],4,40,145,[],[],https://twitter.com/cleantechnica/status/1118665705698877440,False,,1,https://pbs.twimg.com/media/D4ZMh_dX4AEoaSt.png,,,,,,,[],,,,
