,id,conversation_id,created_at,date,time,timezone,user_id,username,name,place,tweet,language,mentions,urls,photos,replies_count,retweets_count,likes_count,hashtags,cashtags,link,retweet,quote_url,video,thumbnail,near,geo,source,user_rt_id,user_rt,retweet_id,reply_to,retweet_date,translate,trans_src,trans_dest,negative,neutral,positive
43,1108413269872541697,1108413269872541697,2019-03-20 17:01:31 UTC,2019-03-20,17:01:31,0,2929175472,dhiyanasaid,Dhiyana 🎈?🌹,,"My twelve year old introduced me to Elon Musk, adores him, talks endlessly of Tesla and is a huge fan of the SpaceX mission. He dreams of building spacecrafts someday.    So allow me to say,  from your lips to God's ears, Aameen.  https://t.co/KpiGdlzvjy",en,[],[],['https://pbs.twimg.com/media/D2Hf_ZTVYAAo3LL.jpg'],15,17,157,[],[],https://twitter.com/dhiyanasaid/status/1108413269872541697,False,,1,https://pbs.twimg.com/media/D2Hf_ZTVYAAo3LL.jpg,,,,,,,[],,,,,0.0031444195,0.027239868,0.9696158
44,1108411462047932418,1108409944963870720,2019-03-20 16:54:20 UTC,2019-03-20,16:54:20,0,563996390,tradrfloridafil,Lady Tesla,,"@Tesla Hi Tesla, Id like to report a bug.  https://t.co/N02X0Rmqnh",en,[],[],['https://pbs.twimg.com/media/D2HeVgkXgAoay4E.jpg'],4,7,289,[],[],https://twitter.com/TradrFloridaFIL/status/1108411462047932418,False,,1,https://pbs.twimg.com/media/D2HeVgkXgAoay4E.jpg,,,,,,,"[{'screen_name': 'Tesla', 'name': 'Tesla', 'id': '13298072'}]",,,,,0.40932238,0.5637663,0.026911298
45,1108410305875345409,1108410305875345409,2019-03-20 16:49:44 UTC,2019-03-20,16:49:44,0,954705154707808256,starscream_scv,Shaun Cassidy,,Every drive makes me love this car even more. Thank you @Tesla &amp; @elonmusk for creating such an incredible experience all around. #tesla #model3 #elonmusk  https://t.co/IegibG9BKK,en,"[{'screen_name': 'tesla', 'name': 'tesla', 'id': '13298072'}, {'screen_name': 'elonmusk', 'name': 'elon musk', 'id': '44196397'}]",[],['https://pbs.twimg.com/media/D2HdS6zUkAAv8ka.jpg'],106,163,3972,"['tesla', 'model3', 'elonmusk']",[],https://twitter.com/Starscream_SCV/status/1108410305875345409,False,,1,https://pbs.twimg.com/media/D2HdS6zUkAAv8ka.jpg,,,,,,,[],,,,,0.0028652498,0.008256288,0.9888786
46,1108409944963870720,1108409944963870720,2019-03-20 16:48:18 UTC,2019-03-20,16:48:18,0,13298072,tesla,Tesla,,Pwn2Own starts today - we’ve invited the brightest minds in security research to share their findings on Model 3. Happy hunting!   https://t.co/d3j4WBy76b,en,[],['https://cards.twitter.com/cards/7x0uw/72obt'],[],75,595,6085,[],[],https://twitter.com/Tesla/status/1108409944963870720,False,,0,,,,,,,,[],,,,,0.0014905661,0.0469346,0.9515749
47,1108407962740187142,1108407962740187142,2019-03-20 16:40:26 UTC,2019-03-20,16:40:26,0,998140573008695296,28delayslater,🇺🇦 🦊 Earl of FrunkPuppy 🇺🇦,,BMW has hit a demand cliff and sales are not coming back.   $TSLA #Tesla   https://t.co/4PwEdM6UBk,en,[],['https://europe.autonews.com/automakers/bmw-will-step-cost-cutting-after-warning-profit-decline'],[],8,8,58,['tesla'],['tsla'],https://twitter.com/28delayslater/status/1108407962740187142,False,,0,,,,,,,,[],,,,,0.6493826,0.31919464,0.031422745
48,1108404548572463106,1108397787950075905,2019-03-20 16:26:52 UTC,2019-03-20,16:26:52,0,1003431381668716546,teslahab,Chris Ⓥ,,@madelineheller2 @dodo The inside temperature is constantly updated on your Tesla app on your phone.,en,[],[],[],1,0,115,[],[],https://twitter.com/TeslaHab/status/1108404548572463106,False,,0,,,,,,,,"[{'screen_name': 'madelineheller2', 'name': 'madeline heller', 'id': '951512805210955776'}, {'screen_name': 'dodo', 'name': 'The Dodo', 'id': '1604444052'}]",,,,,0.007839596,0.910808,0.081352316
49,1108404032291266560,1108404032291266560,2019-03-20 16:24:49 UTC,2019-03-20,16:24:49,0,1689516060,vincent13031925,vincentyu.eth,,"Tesla Model 3 Preview Night in South Korea 🇰🇷, March 28th 2019  $TSLA #Tesla #Model3 #Korea",en,[],[],[],2,13,62,"['tesla', 'model3', 'korea']",['tsla'],https://twitter.com/vincent13031925/status/1108404032291266560,False,https://twitter.com/whaqlqkqh/status/1108273108148903936,0,,,,,,,,[],,,,,0.0026791147,0.5876347,0.40968633
50,1108403642254524416,1108403642254524416,2019-03-20 16:23:16 UTC,2019-03-20,16:23:16,0,38253449,fredericlambert,Fred Lambert,,I feel like Tesla doesn’t want to offer a HUD display for Model 3 because it would ruin the clean dash line but what about something retractable similar to the one in the Kona EV? yay or nay?  https://t.co/to7jHsMjUX,en,[],[],[],127,21,267,[],[],https://twitter.com/FredericLambert/status/1108403642254524416,False,,1,https://pbs.twimg.com/ext_tw_video_thumb/1108403530828648448/pu/img/sKdlNd7QfEQXMNf0.jpg,,,,,,,[],,,,,0.5216808,0.45680848,0.021510731
51,1108401589017022465,1108401589017022465,2019-03-20 16:15:06 UTC,2019-03-20,16:15:06,0,1308211178,teslarati,TESLARATI,,"Nikola can ‘easily’ do all-electric trucks like Tesla Semi, says exec in interview: ""Their truck is our truck with a bigger battery""  https://t.co/h02v20tDbu",en,[],['https://www.teslarati.com/tesla-semi-rival-nikola-president-interview'],[],54,27,167,[],[],https://twitter.com/Teslarati/status/1108401589017022465,False,,0,,,,,,,,[],,,,,0.0049088844,0.31188157,0.6832095
52,1108400585445949440,1108132977274433536,2019-03-20 16:11:07 UTC,2019-03-20,16:11:07,0,2305868575,ani_seh,Aniseh Sharifi,,@LoxieeLoxx @Tesla @elonmusk Wicked Wrap! 👊🏼,en,[],[],[],0,0,157,[],[],https://twitter.com/ani_seh/status/1108400585445949440,False,,0,,,,,,,,"[{'screen_name': 'LoxieeLoxx', 'name': 'Loxy', 'id': '162481234'}, {'screen_name': 'Tesla', 'name': 'Tesla', 'id': '13298072'}, {'screen_name': 'elonmusk', 'name': 'Elon Musk', 'id': '44196397'}]",,,,,0.012309679,0.058422066,0.9292683
53,1108398519461666821,1108398519461666821,2019-03-20 16:02:54 UTC,2019-03-20,16:02:54,0,704835627183788032,model3owners,Trev Page,,"It's my birthday today! Just like getting older we're also growing, I'm happy to announce that Model 3 Owners Club is now Tesla Global Owners Club! Pardon the dust while we update our forum and thanks for all the support!    https://t.co/4f0quivocR",en,[],['https://www.youtube.com/watch?v=jq5Gj_6VNiQ'],[],52,11,237,[],[],https://twitter.com/Model3Owners/status/1108398519461666821,False,,0,,,,,,,,[],,,,,0.0014505584,0.00957045,0.988979
54,1108397977029304325,1108397977029304325,2019-03-20 16:00:45 UTC,2019-03-20,16:00:45,0,926168449042219008,dealer_of_happy,Dealer of Happiness,,"In order to get a license for vehicle in China, you have to win a lottery - out of 1000 applications 3 gets selected.    EV cars exempt from this rule - this  is one reason why @Tesla will always have huge demand there. Other EV on Chinese market cannot compete. @vincent13031925",en,"[{'screen_name': 'tesla', 'name': 'tesla', 'id': '13298072'}, {'screen_name': 'vincent13031925', 'name': 'vincentyu.eth', 'id': '1689516060'}]",[],[],5,27,143,[],[],https://twitter.com/dealer_of_happy/status/1108397977029304325,False,,0,,,,,,,,[],,,,,0.08743209,0.6820905,0.23047748
55,1108397533070422016,1108397533070422016,2019-03-20 15:58:59 UTC,2019-03-20,15:58:59,0,366181730,familyfirstj,FamilyFirstJ #FrunkMafia,,"Im baffled that this company doesn't get looked at as an American success story but instead are ridiculed and wished by many to fail. buy local,  #buyAmerican $tsla @elonmusk @Tesla thank you for keeping the American dream alive  https://t.co/4pjq4deHOy",en,"[{'screen_name': 'elonmusk', 'name': 'elon musk', 'id': '44196397'}, {'screen_name': 'tesla', 'name': 'tesla', 'id': '13298072'}]",[],['https://pbs.twimg.com/media/D2HRrPMUYAAsLMv.jpg'],9,22,72,['buyamerican'],['tsla'],https://twitter.com/FamilyFirstJ/status/1108397533070422016,False,,1,https://pbs.twimg.com/media/D2HRrPMUYAAsLMv.jpg,,,,,,,[],,,,,0.4575639,0.27342978,0.26900625
56,1108396968806629376,1108396968806629376,2019-03-20 15:56:45 UTC,2019-03-20,15:56:45,0,27370707,superbeeny,🏴󠁧󠁢󠁳󠁣󠁴󠁿 Nicky B 🏴󠁧󠁢󠁳󠁣󠁴󠁿,,"My #Model3 was delivered to my house this morning, soooooo excited. Thanks @Tesla @elonmusk  https://t.co/MaWtcRoBpO",en,"[{'screen_name': 'tesla', 'name': 'tesla', 'id': '13298072'}, {'screen_name': 'elonmusk', 'name': 'elon musk', 'id': '44196397'}]",[],['https://pbs.twimg.com/media/D2HRKhpXcAAoMED.jpg'],20,19,513,['model3'],[],https://twitter.com/superbeeny/status/1108396968806629376,False,,1,https://pbs.twimg.com/media/D2HRKhpXcAAoMED.jpg,,,,,,,[],,,,,0.0016791937,0.0066480446,0.9916728
57,1108396428886532097,1108396428886532097,2019-03-20 15:54:36 UTC,2019-03-20,15:54:36,0,2148233600,electrekco,Electrek.co,,Ford teases Mustang-inspired electric SUV as Tesla Model Y competitor  https://t.co/qjGkzuFs0t by @fredericlambert  https://t.co/hX3NFj8e3f,en,"[{'screen_name': 'fredericlambert', 'name': 'fred lambert', 'id': '38253449'}]",['https://electrek.co/2019/03/20/ford-tease-mustang-inspired-electric-suv-tesla-model-y-competitor/'],['https://pbs.twimg.com/media/D2HQraSWoAEkBPn.jpg'],10,31,112,[],[],https://twitter.com/ElectrekCo/status/1108396428886532097,False,,1,https://pbs.twimg.com/media/D2HQraSWoAEkBPn.jpg,,,,,,,[],,,,,0.0035140745,0.7557616,0.24072422
58,1108395186554634242,1108395186554634242,2019-03-20 15:49:40 UTC,2019-03-20,15:49:40,0,1023266600223481856,polixenes13,Polixenes,,"Adam Jonas of $MS is out with (yet another) $TSLA note. Summary: he's praying someone will acquire Tesla. Apple, Google, Amazon, or (worst case) SpaceX. He shares with readers another analyst's fantasy about Tesla as the clear technology leader. $260 PT (205 auto/55 ""mobility"")",en,[],[],[],15,3,62,[],"['ms', 'tsla']",https://twitter.com/Polixenes13/status/1108395186554634242,False,,0,,,,,,,,[],,,,,0.015959844,0.438776,0.5452641
59,1108388375910907906,1108388375910907906,2019-03-20 15:22:36 UTC,2019-03-20,15:22:36,0,950471510266871810,kulpability,“Mary”,,Given that I live 2 hours from my service center this is a game changer if it’s for real.... thanks @Tesla #model3  https://t.co/ocKoGvQMQp,en,"[{'screen_name': 'tesla', 'name': 'tesla', 'id': '13298072'}]",[],['https://pbs.twimg.com/media/D2HJWKXWwAMNMHR.jpg'],8,7,109,['model3'],[],https://twitter.com/kulpability/status/1108388375910907906,False,,1,https://pbs.twimg.com/media/D2HJWKXWwAMNMHR.jpg,,,,,,,[],,,,,0.0030492516,0.024102652,0.9728481
60,1108386455301312512,1108386455301312512,2019-03-20 15:14:58 UTC,2019-03-20,15:14:58,0,857693619406467072,gualestrit,Gualestrit,,Titulares que leeremos en 2030: - Estados Unidos y China a punto de cerrar el acuerdo comercial - Nueva votación en el parlamento británico - Musk anuncia que Tesla presentará beneficios el próximo trimestre,es,[],[],[],10,34,123,[],[],https://twitter.com/gualestrit/status/1108386455301312512,False,,0,,,,,,,,[],,,,,0.055401012,0.891679,0.05292
61,1108383301348270082,1108383301348270082,2019-03-20 15:02:26 UTC,2019-03-20,15:02:26,0,77786418,chris75sf,Christophe HUBERT,,My Tesla Solar Roof &amp; Powerwall  https://t.co/dfhQmuraxd via @YouTube,en,"[{'screen_name': 'youtube', 'name': 'youtube', 'id': '10228272'}]",['https://youtu.be/zMR10vbo3A0'],[],21,35,414,[],[],https://twitter.com/chris75sf/status/1108383301348270082,False,,0,,,,,,,,[],,,,,0.004912659,0.85278296,0.1423044
62,1108380831465136129,1108380831465136129,2019-03-20 14:52:37 UTC,2019-03-20,14:52:37,0,23502725,jennerator211,⚡JENNerator⚡ Fate ❤ Irony,,"Feel like a first time parent, taking hundreds of photos and doting over my baby's milestones and ""firsts"". #Tesla #PNW #love 😍  https://t.co/EAQFkZeEDZ",en,[],[],['https://pbs.twimg.com/media/D2HCfKuU8AEGAKm.jpg'],9,4,109,"['tesla', 'pnw', 'love']",[],https://twitter.com/Jennerator211/status/1108380831465136129,False,,1,https://pbs.twimg.com/media/D2HCfKuU8AEGAKm.jpg,,,,,,,[],,,,,0.0025535808,0.014069011,0.9833775
63,1108379669206888450,1108379669206888450,2019-03-20 14:48:00 UTC,2019-03-20,14:48:00,0,701725963,nowthisnews,NowThis,,"Elon Musk unveiled Tesla’s newest vehicle, an electric car with a top speed of up to 150 mph  https://t.co/enJvYTAL65",en,[],[],[],4,32,115,[],[],https://twitter.com/nowthisnews/status/1108379669206888450,False,,1,https://pbs.twimg.com/amplify_video_thumb/1107755744265408512/img/SBXsxfcK9KzU0XH1.jpg,,,,,,,[],,,,,0.0019976855,0.14996915,0.8480332
64,1108374173909319680,1108374173909319680,2019-03-20 14:26:10 UTC,2019-03-20,14:26:10,0,33201124,arundhatis,Arundhati Sawant,,I was promised 2 weeks and got the delivery in 2 weeks.What an amazing delivery experience!Thank you @Tesla and @elonmusk for making everything about my first car so special! 😊 Big shout out to Patrick at Tesla for answering the million qns I had so promptly! #excited #model3  https://t.co/UXg60k161X,en,"[{'screen_name': 'tesla', 'name': 'tesla', 'id': '13298072'}, {'screen_name': 'elonmusk', 'name': 'elon musk', 'id': '44196397'}]",[],['https://pbs.twimg.com/media/D2G8bb_UwAAmshZ.jpg'],362,280,9676,"['excited', 'model3']",[],https://twitter.com/arundhatiS/status/1108374173909319680,False,,1,https://pbs.twimg.com/media/D2G8bb_UwAAmshZ.jpg,,,,,,,[],,,,,0.0027875793,0.0076162443,0.9895963
65,1108372691176820736,1108372691176820736,2019-03-20 14:20:16 UTC,2019-03-20,14:20:16,0,1000210855957540865,teslabros,TESBROS,,Minimum distance when parking your #tesla. Am I right?  https://t.co/LapgZtnovF,en,[],[],['https://pbs.twimg.com/media/D2G7FWaX0AAfUMc.jpg'],7,2,102,['tesla'],[],https://twitter.com/teslabros/status/1108372691176820736,False,,1,https://pbs.twimg.com/media/D2G7FWaX0AAfUMc.jpg,,,,,,,[],,,,,0.02402323,0.8580353,0.117941335
66,1108372205518249985,1108372205518249985,2019-03-20 14:18:21 UTC,2019-03-20,14:18:21,0,1689516060,vincent13031925,vincentyu.eth,,This is amazing!!  $TSLA #Tesla #Semi,en,[],[],[],3,20,113,"['tesla', 'semi']",['tsla'],https://twitter.com/vincent13031925/status/1108372205518249985,False,https://twitter.com/CALSTART/status/1108052304593211392,0,,,,,,,,[],,,,,0.002785586,0.009746971,0.9874673
67,1108370127861485568,1108370127861485568,2019-03-20 14:10:05 UTC,2019-03-20,14:10:05,0,1308211178,teslarati,TESLARATI,,"Tesla's long-term play gets vote of confidence from 23-year finance veteran: ""$TSLA will prosper, and patient shareholders will be rewarded'  https://t.co/EKmXzsrDtr",en,[],['https://www.teslarati.com/tesla-tsla-q1-2019-outlook-gene-munster-model-y-concerns'],[],7,84,546,[],[],https://twitter.com/Teslarati/status/1108370127861485568,False,,0,,,,,,,,[],,,,,0.003369367,0.051507942,0.94512266
68,1108364547507789824,1108364547507789824,2019-03-20 13:47:55 UTC,2019-03-20,13:47:55,0,142441415,canitti,can gurses,,"Bugün bilim tarihinde, - Einstein'ın Genel Görelilik Kuramını ortaya koyduğu (1915) - Tesla'nın kablosuz elektrik gücü iletimine dair patent aldığı (1900) - Volta'nın pili bulduğunu ilan ettiği (1800) gün...",tr,[],[],[],9,176,1225,[],[],https://twitter.com/canitti/status/1108364547507789824,False,,0,,,,,,,,[],,,,,0.05231491,0.86430866,0.083376475
69,1108363103190712320,1108363103190712320,2019-03-20 13:42:10 UTC,2019-03-20,13:42:10,0,349249475,gerberkawasaki,Ross Gerber,,MS Jonas note compares Tesla to the dog race and Tesla is the rabbit. All the other OEMs just want to beat each other. But none will catch the rabbit. MS wondering what the strategic value of Tesla is. $tsla,en,[],[],[],20,7,97,[],['tsla'],https://twitter.com/GerberKawasaki/status/1108363103190712320,False,,0,,,,,,,,[],,,,,0.3757208,0.540548,0.083731085
70,1108362755629826050,1108362446694162434,2019-03-20 13:40:47 UTC,2019-03-20,13:40:47,0,725053067914317828,frydasole,FryDasOle,,@MrBeastYT That's exactly what a Tesla owner would say!,en,[],[],[],4,3,134,[],[],https://twitter.com/FryDasOle/status/1108362755629826050,False,,0,,,,,,,,[],,,,,0.11712404,0.5916928,0.29118326
71,1108358777491939329,1108358777491939329,2019-03-20 13:24:59 UTC,2019-03-20,13:24:59,0,2148233600,electrekco,Electrek.co,,"Tesla Model Y production at Gigafactory 1 in 2020 could result in higher profits, says Wedbush after factory tour  https://t.co/BmhbgRo5Gb by @fredericlambert  https://t.co/r1fTqDgDaA",en,"[{'screen_name': 'fredericlambert', 'name': 'fred lambert', 'id': '38253449'}]",['https://electrek.co/2019/03/20/tesla-model-y-gigafactory-2020-wedbush/'],['https://pbs.twimg.com/media/D2GubzeXgAE04Nv.jpg'],2,49,354,[],[],https://twitter.com/ElectrekCo/status/1108358777491939329,False,,1,https://pbs.twimg.com/media/D2GubzeXgAE04Nv.jpg,,,,,,,[],,,,,0.004453596,0.36797425,0.6275721
72,1108357383389089792,1108357383389089792,2019-03-20 13:19:27 UTC,2019-03-20,13:19:27,0,275295731,davidtayar5,David Tayar,,Traditional auto makers are trying to catch up to Tesla when it comes to software updates | WSJ  $TSLA  https://t.co/nyCQuWs7JG,en,[],['https://www.wsj.com/articles/auto-makers-steer-in-teslas-direction-on-wireless-updates-11553083202'],[],6,15,72,[],['tsla'],https://twitter.com/davidtayar5/status/1108357383389089792,False,,0,,,,,,,,[],,,,,0.01464248,0.8166924,0.168665
73,1108356328068505601,1108356328068505601,2019-03-20 13:15:15 UTC,2019-03-20,13:15:15,0,349249475,gerberkawasaki,Ross Gerber,,Got my OTA update for more range. This is AWESOME! Tesla added to my range overnight. No other car can do this. It’s amazing. The car is better than the iPhone when it came out. $tsla #Model3,en,[],[],[],6,26,206,['model3'],['tsla'],https://twitter.com/GerberKawasaki/status/1108356328068505601,False,,0,,,,,,,,[],,,,,0.0039004763,0.010510151,0.9855894
74,1108355292666855424,1108355292666855424,2019-03-20 13:11:08 UTC,2019-03-20,13:11:08,0,349249475,gerberkawasaki,Ross Gerber,,The legacy car markets are just starting to feel the pain... #tesla is the only growing car company at this point. $tsla,en,[],[],[],11,29,157,['tesla'],['tsla'],https://twitter.com/GerberKawasaki/status/1108355292666855424,False,https://twitter.com/business/status/1108303960409063424,0,,,,,,,,[],,,,,0.10184721,0.37256932,0.5255835
75,1108342812200833025,1108132977274433536,2019-03-20 12:21:33 UTC,2019-03-20,12:21:33,0,430992325,smoking_hobbit,Donald,,@LoxieeLoxx @Tesla @elonmusk There s only one problem. It is addictive. You don’t want to go back. Like when you get a company rental or during holidays. Or you drive a car from a friend.  It feels so outdated. Like going from a modern computer to a typewriter.,en,[],[],[],8,8,193,[],[],https://twitter.com/smoking_hobbit/status/1108342812200833025,False,,0,,,,,,,,"[{'screen_name': 'LoxieeLoxx', 'name': 'Loxy', 'id': '162481234'}, {'screen_name': 'Tesla', 'name': 'Tesla', 'id': '13298072'}, {'screen_name': 'elonmusk', 'name': 'Elon Musk', 'id': '44196397'}]",,,,,0.84230626,0.14486042,0.0128331585
76,1108341540869550080,1108341540869550080,2019-03-20 12:16:29 UTC,2019-03-20,12:16:29,0,1077971,bobbyllew,Robert Llewellyn,,Tesla CCS charger. 150 kilowatts  https://t.co/uH7GscThDc,es,[],[],['https://pbs.twimg.com/media/D2GewI-WwAAqPsv.jpg'],33,25,572,[],[],https://twitter.com/bobbyllew/status/1108341540869550080,False,,1,https://pbs.twimg.com/media/D2GewI-WwAAqPsv.jpg,,,,,,,[],,,,,0.009219972,0.8569117,0.13386811
77,1108338475898671107,1108338475898671107,2019-03-20 12:04:19 UTC,2019-03-20,12:04:19,0,2241150253,rationaletienne,Pope of Muskanity,,CNN: Tesla can be described as loosely organized chaos.  @GerberKawasaki interrupts: That's just not true. I've just spent hours and hours through their entire factory. Tesla was kind enough to give me a full tour of all their operation at Fremont and I was super impressed!  ❤️🙏🏽  https://t.co/S4mnZdO4TS,en,"[{'screen_name': 'gerberkawasaki', 'name': 'ross gerber', 'id': '349249475'}]",[],['https://pbs.twimg.com/media/D2Gb7JvWsAA-5hb.png'],4,12,80,[],[],https://twitter.com/RationalEtienne/status/1108338475898671107,False,,1,https://pbs.twimg.com/media/D2Gb7JvWsAA-5hb.png,,,,,,,[],,,,,0.097774886,0.23364455,0.6685805
78,1108332186791563264,1108332186791563264,2019-03-20 11:39:19 UTC,2019-03-20,11:39:19,0,563996390,tradrfloridafil,Lady Tesla,,"If you’re worried about #ResaleValue of a #Tesla #Model3 purchase, worry no more.    https://t.co/ttjaRAmrhO says - After 3 yrs it retains “a whopping 64.3% of original cost”  The #2 car not just in EVs but among ICE too!  OTA updates continue to improve your $tsla over time!",en,[],['http://KBB.com'],[],3,15,69,"['resalevalue', 'tesla', 'model3']",['tsla'],https://twitter.com/TradrFloridaFIL/status/1108332186791563264,False,https://twitter.com/cleantechnica/status/1108171537675362304,0,,,,,,,,[],,,,,0.0065274793,0.13579817,0.85767436
79,1108330567567851520,1108330567567851520,2019-03-20 11:32:53 UTC,2019-03-20,11:32:53,0,1216683854,stetopinini,stef,,Today we ha sold our last petrol engine.  Now we are all @Tesla . With the money... just bought more $TSLA  😂😂. Thanks @elonmusk and Tesla team for the awesome job!  https://t.co/Nif0g7sD7k,en,"[{'screen_name': 'tesla', 'name': 'tesla', 'id': '13298072'}, {'screen_name': 'elonmusk', 'name': 'elon musk', 'id': '44196397'}]",[],['https://pbs.twimg.com/media/D2GUusqXcAENTAB.jpg'],6,18,139,[],['tsla'],https://twitter.com/stetopinini/status/1108330567567851520,False,,1,https://pbs.twimg.com/media/D2GUusqXcAENTAB.jpg,,,,,,,[],,,,,0.004373207,0.041029744,0.9545969
80,1108292078008717312,1108292078008717312,2019-03-20 08:59:57 UTC,2019-03-20,08:59:57,0,718747351792398336,alex_avoigt,Alex,,"🇩🇪 Media ""The #3 is the best car that Tesla ever build. Its the most mature vehicle with this drive train worldwide. In it electro-mobility works with an ease that makes fun. To compare to it the 🇪🇺 manufacturers are lacking with their compromise EVs at least a decade behind""",en,[],[],[],7,29,125,[],[],https://twitter.com/alex_avoigt/status/1108292078008717312,False,,0,,,,,,,,[],,,,,0.007251752,0.03955583,0.95319235
81,1108280781254856704,1108280781254856704,2019-03-20 08:15:03 UTC,2019-03-20,08:15:03,0,1308211178,teslarati,TESLARATI,,Tesla Model Y vs Audi e-tron vs Jaguar I-PACE: price and specs comparison  https://t.co/ho78lrRx6C,fr,[],['https://www.teslarati.com/tesla-model-y-vs-audi-e-tron-vs-jaguar-i-pace-price-specs-comparison'],[],8,45,258,[],[],https://twitter.com/Teslarati/status/1108280781254856704,False,,0,,,,,,,,[],,,,,0.0071475976,0.92513657,0.067715794
82,1108278540133240832,1108278540133240832,2019-03-20 08:06:09 UTC,2019-03-20,08:06:09,0,788294514184249344,realchaozhou,Chao Zhou 🧢 🔥🔥🔥,,"Guys, I bought 17 shares Tesla stock at 364.20, now it's 269.06, any suggestions?  I believe the price is going to be higher than 3000 after a few years.  $tsla $tslaq #Tesla  https://t.co/IrXczzftyn",en,[],[],['https://pbs.twimg.com/media/D2FkW9RU0AAfepF.jpg'],105,9,123,['tesla'],"['tsla', 'tslaq']",https://twitter.com/realChaoZhou/status/1108278540133240832,False,,1,https://pbs.twimg.com/media/D2FkW9RU0AAfepF.jpg,,,,,,,[],,,,,0.051752664,0.54734164,0.40090558
83,1108275095045312512,1108275095045312512,2019-03-20 07:52:28 UTC,2019-03-20,07:52:28,0,588284880,ultimogt,Ultimo GT,,British Motor Oil @YouLikeCarsUK @AutomotiveAsset @CarKeys_UK @screamingcars @Gandalfwasme @AVC_Leasing @JA_Autos @AdmarkUK @zdravkost @rafredarrows @realDonaldTrump @RunnerService @bgmotogp  @FormulaOneWorld @CrienaLDavies @Imperialcar @my_hpi @tesla @bmw  https://t.co/nix2a2Dolb  https://t.co/O598gFkJss,en,"[{'screen_name': 'youlikecarsuk', 'name': '👍 you like cars', 'id': '1361521788'}, {'screen_name': 'automotiveasset', 'name': 'david', 'id': '2501242953'}, {'screen_name': 'carkeys_uk', 'name': 'car keys', 'id': '52448048'}, {'screen_name': 'screamingcars', 'name': 'screaming cars', 'id': '43073061'}, {'screen_name': 'gandalfwasme', 'name': '🏁 🚘 gandalf was me 🚘 🏁', 'id': '518678187'}, {'screen_name': 'avc_leasing', 'name': 'allvehiclecontracts', 'id': '182420100'}, {'screen_name': 'ja_autos', 'name': 'ja autos ltd', 'id': '1201103592'}, {'screen_name': 'admarkuk', 'name': 'admark advertising', 'id': '1649830164'}, {'screen_name': 'zdravkost', 'name': 'zdravko', 'id': '575725973'}, {'screen_name': 'rafredarrows', 'name': 'red arrows', 'id': '587397179'}, {'screen_name': 'realdonaldtrump', 'name': 'donald j. trump', 'id': '25073877'}, {'screen_name': 'runnerservice', 'name': 'roadrunner service', 'id': '501907431'}, {'screen_name': 'bgmotogp', 'name': 'motogp fan zone', 'id': '1528860228'}, {'screen_name': 'formulaoneworld', 'name': 'formula one world', 'id': '39764991'}, {'screen_name': 'crienaldavies', 'name': 'criena', 'id': '386038955'}, {'screen_name': 'imperialcar', 'name': 'imperial car care', 'id': '1445380083749896198'}, {'screen_name': 'my_hpi', 'name': 'hpi', 'id': '123919696'}, {'screen_name': 'tesla', 'name': 'tesla', 'id': '13298072'}, {'screen_name': 'bmw', 'name': 'bmw', 'id': '1545994664'}]",['http://www.ultimogt.com'],['https://pbs.twimg.com/media/D2FiUgMXcAEQcJX.jpg'],1,13,84,[],[],https://twitter.com/UltimoGT/status/1108275095045312512,False,,1,https://pbs.twimg.com/media/D2FiUgMXcAEQcJX.jpg,,,,,,,[],,,,,0.020574786,0.94559264,0.03383256
84,1108261838444212224,1108261838444212224,2019-03-20 06:59:47 UTC,2019-03-20,06:59:47,0,770933216870076416,fullychargedshw,Fully Charged Show,,Driving from Copenhagen to Oslo for the Nordic EV summit. Report coming soon on #FullyChargedShow !! #teslamodel3 #tesla  https://t.co/BCaZQKgnC7,en,[],[],"['https://pbs.twimg.com/media/D2FWQqVX0AEQcbP.jpg', 'https://pbs.twimg.com/media/D2FWQ-zWkAAcWCN.jpg']",2,7,79,"['fullychargedshow', 'teslamodel3', 'tesla']",[],https://twitter.com/FullyChargedShw/status/1108261838444212224,False,,1,https://pbs.twimg.com/media/D2FWQqVX0AEQcbP.jpg,,,,,,,[],,,,,0.003406658,0.7166656,0.27992764
