,id,conversation_id,created_at,date,time,timezone,user_id,username,name,place,tweet,language,mentions,urls,photos,replies_count,retweets_count,likes_count,hashtags,cashtags,link,retweet,quote_url,video,thumbnail,near,geo,source,user_rt_id,user_rt,retweet_id,reply_to,retweet_date,translate,trans_src,trans_dest,negative,neutral,positive
0,1108514684469239810,1108514684469239810,2019-03-20 23:44:30 UTC,2019-03-20,23:44:30,0,962805945020702722,teslacharts,TC,,"“We continue to see Tesla as fundamentally overvalued but strategically undervalued,” Morgan Stanley analyst Adam Jonas wrote in a note to clients, wondering at what point “might strategic alternatives enter the discussion.”  $TSLA $TSLAQ  https://t.co/x2smaiBDtv",en,[],[],['https://pbs.twimg.com/media/D2I8M6FWoAEQAj3.jpg'],8,2,59,[],"['tsla', 'tslaq']",https://twitter.com/TESLAcharts/status/1108514684469239810,False,,1,https://pbs.twimg.com/media/D2I8M6FWoAEQAj3.jpg,,,,,,,[],,,,,0.25795725,0.7064442,0.03559861
1,1108512071103193088,1108512071103193088,2019-03-20 23:34:07 UTC,2019-03-20,23:34:07,0,1517025524,falco_lol,Falco,,My baby 🥰🥰   Cómo voy a echar de menos que todos me miren al conducir y el ruido cuando seas remplazado por un Tesla (de adulto aburrido) o por un Taycan (de adulto guay pero aburrido en el fondo) ;_;  https://t.co/VBrAqDLwUp,es,[],[],['https://pbs.twimg.com/media/D2I52RVWsAE7jQy.jpg'],8,6,103,[],[],https://twitter.com/Falco_lol/status/1108512071103193088,False,,1,https://pbs.twimg.com/media/D2I52RVWsAE7jQy.jpg,,,,,,,[],,,,,0.003664057,0.07426875,0.9220671
2,1108511514011398144,1108504188638523394,2019-03-20 23:31:54 UTC,2019-03-20,23:31:54,0,539427670,marvelwonderkat,🌟 Stella Vitae 🌟,,"@Tesla @elonmusk @Hagerty Last week, I took my car obsessed friend out in my Model 3 Performance. I floored it; he was literally stunned! He said: “You know I’m going to have to buy one of these now. Nothing else will satisfy me after experiencing that insane torque &amp; speed.” He’s getting a Model S P100D!",en,[],[],[],11,15,205,[],[],https://twitter.com/marvelwonderkat/status/1108511514011398144,False,,0,,,,,,,,"[{'screen_name': 'Tesla', 'name': 'Tesla', 'id': '13298072'}, {'screen_name': 'elonmusk', 'name': 'Elon Musk', 'id': '44196397'}, {'screen_name': 'Hagerty', 'name': 'Hagerty', 'id': '22834635'}]",,,,,0.008883215,0.05240442,0.93871224
3,1108504188638523394,1108504188638523394,2019-03-20 23:02:48 UTC,2019-03-20,23:02:48,0,13298072,tesla,Tesla,,"""The exacting nature of that single pedal combined with that razor-sharp steering, and mountains of torque, make the Model 3 one of the most fun cars I’ve ever owned” @Hagerty  https://t.co/W48FsLb6Iy",en,"[{'screen_name': 'hagerty', 'name': 'hagerty', 'id': '22834635'}]",['https://www.hagerty.com/articles-videos/articles/2019/03/14/gearheads-enjoy-tesla-model-3'],[],160,741,8138,[],[],https://twitter.com/Tesla/status/1108504188638523394,False,,0,,,,,,,,[],,,,,0.0033548167,0.020355674,0.9762895
4,1108501817502113792,1108501817502113792,2019-03-20 22:53:22 UTC,2019-03-20,22:53:22,0,1469603575,qtrresearch,Quoth the Raven 🇺🇦,,"You used to have to drive your car into road barriers manually, but now thanks to the futuristic software at Tesla, that has all been automated. Think of the time you’ll save!  https://t.co/rxAD6PqUBV",en,[],['https://twitter.com/bobby_tips/status/1108394630691938305/video/1'],[],15,21,142,[],[],https://twitter.com/QTRResearch/status/1108501817502113792,False,,0,,,,,,,,[],,,,,0.012541439,0.15085506,0.8366036
5,1108492758426234881,1108492758426234881,2019-03-20 22:17:23 UTC,2019-03-20,22:17:23,0,568621669,insideevs,InsideEVs,,"In 20 Days Of March, Tesla Delivered Over 2,500 Model 3 In Norway  https://t.co/9QECYYQtL0",en,[],['https://insideevs.com/march-tesla-delivered-model-3-norway/amp/'],[],1,17,94,[],[],https://twitter.com/InsideEVs/status/1108492758426234881,False,,0,,,,,,,,[],,,,,0.0034832715,0.53358936,0.46292746
6,1108491711863574528,1108491711863574528,2019-03-20 22:13:13 UTC,2019-03-20,22:13:13,0,175855913,jmcphillipsjr,John,,"The car buying experience has changed forever… Order online, delivery is scheduled, paperwork over in five minutes at the dealership and presto, you own a Tesla. The experience couldn’t be better or easier!!  thank you!! ⁦@elonmusk⁩ and entire ⁦@Tesla⁩ team!!!  https://t.co/x3pqe6NsUC",en,"[{'screen_name': 'elonmusk', 'name': 'elon musk', 'id': '44196397'}, {'screen_name': 'tesla', 'name': 'tesla', 'id': '13298072'}]",[],['https://pbs.twimg.com/media/D2InVHcWwAAcXNN.jpg'],22,40,801,[],[],https://twitter.com/jmcphillipsjr/status/1108491711863574528,False,,1,https://pbs.twimg.com/media/D2InVHcWwAAcXNN.jpg,,,,,,,[],,,,,0.0032475805,0.010890639,0.9858618
7,1108491078179553280,1108491078179553280,2019-03-20 22:10:42 UTC,2019-03-20,22:10:42,0,14561327,dhh,DHH,,"Whenever I hear Tesla fans defend Autopilot, I always think of Dick Jones, ""he didn't hear the gun drop"", and ""I'm sure it's only a glitch... a temporary setback""  https://t.co/yLtHOINT7Q",en,[],['https://www.youtube.com/watch?v=A9l9wxGFl4k'],[],10,19,61,[],[],https://twitter.com/dhh/status/1108491078179553280,False,,0,,,,,,,,[],,,,,0.6677876,0.3082267,0.023985766
8,1108489306853773317,1108489306853773317,2019-03-20 22:03:40 UTC,2019-03-20,22:03:40,0,998140573008695296,28delayslater,🇺🇦 🦊 Earl of FrunkPuppy 🇺🇦,,As filmed by Norman   #tesla #model3 #dogmode  https://t.co/NZyw8j75d8,en,[],[],[],33,181,3000,"['tesla', 'model3', 'dogmode']",[],https://twitter.com/28delayslater/status/1108489306853773317,False,,1,https://pbs.twimg.com/ext_tw_video_thumb/1108489264248033284/pu/img/Jkw6rmlW8cSGLUFA.jpg,,,,,,,[],,,,,0.004499377,0.91509616,0.08040435
9,1108482824728793088,1108482824728793088,2019-03-20 21:37:54 UTC,2019-03-20,21:37:54,0,395052957,yoshi_sudarso,Yoshi Sudarso 🐉,,I love selfies in my @Tesla that glass sunroof is just so beautiful!! 😍  https://t.co/gALlP3ABFi,en,"[{'screen_name': 'tesla', 'name': 'tesla', 'id': '13298072'}]",[],['https://pbs.twimg.com/media/D2IfP6wU0AAOdWy.jpg'],3,10,156,[],[],https://twitter.com/yoshi_sudarso/status/1108482824728793088,False,,1,https://pbs.twimg.com/media/D2IfP6wU0AAOdWy.jpg,,,,,,,[],,,,,0.003309221,0.0067761852,0.98991466
10,1108480619732819973,1108480192975011841,2019-03-20 21:29:08 UTC,2019-03-20,21:29:08,0,14561327,dhh,DHH,,"You're risking your life if you take your eyes or hands off the road when driving a Tesla with autopilot. And Elon's promises of just how close they are to letting drivers be ""fully asleep while the car drives to the destination"" is grossly irresponsible marketing nonsense.",en,[],[],[],10,40,281,[],[],https://twitter.com/dhh/status/1108480619732819973,False,,0,,,,,,,,[],,,,,0.7608073,0.22100037,0.018192329
11,1108480192975011841,1108480192975011841,2019-03-20 21:27:27 UTC,2019-03-20,21:27:27,0,14561327,dhh,DHH,,"Watch how an update to Tesla's autopilot software changed the behavior on one driver's common route from ""isn't this cool!"" to ""omg I almost died"". Talk about high criticality software updates.  https://t.co/mZLqLEsMlW",en,[],['https://np.reddit.com/r/teslamotors/comments/b36x27/its_back_after_6_months_of_working_fine_2019515/'],[],17,62,279,[],[],https://twitter.com/dhh/status/1108480192975011841,False,,0,,,,,,,,[],,,,,0.07640449,0.29070637,0.63288915
12,1108479412498886657,1108478869860868096,2019-03-20 21:24:21 UTC,2019-03-20,21:24:21,0,2598916640,africlandpost,AfricaDigest,,"Africans do not travel to US to undermine blacks, we do because companies you benefit from like Boeing, Apple, Lockheed Martin, Dell, Tesla get their resources from Africa for free. Africans will continue coming to benefit, get over it #ADOS But we love African Americans.",en,[],[],[],66,38,99,['ados'],[],https://twitter.com/africlandpost/status/1108479412498886657,False,,0,,,,,,,,[],,,,,0.20396617,0.56622344,0.2298103
13,1108473015917072384,1108473015917072384,2019-03-20 20:58:56 UTC,2019-03-20,20:58:56,0,998140573008695296,28delayslater,🇺🇦 🦊 Earl of FrunkPuppy 🇺🇦,,-Fred has turned into $TSLAQ  -Gali is in a #Tesla bear themed panic!  -Trevor is changing his name to hide!   Stay tuned to this twitter account for pro-Tesla news reporting.   Also  https://t.co/rLBjRFwUdn   THE most trusted Tesla news source for lemmings / cult members.  https://t.co/Y1QxaY8Q2e,en,[],['http://Frunkpuppy.com'],['https://pbs.twimg.com/tweet_video_thumb/D2IWU0vWkAAv2Yy.jpg'],17,6,110,['tesla'],['tslaq'],https://twitter.com/28delayslater/status/1108473015917072384,False,,1,https://pbs.twimg.com/tweet_video_thumb/D2IWU0vWkAAv2Yy.jpg,,,,,,,[],,,,,0.2840889,0.52542716,0.19048382
14,1108471999859515394,1108471999859515394,2019-03-20 20:54:53 UTC,2019-03-20,20:54:53,0,1308211178,teslarati,TESLARATI,,Tesla is inspiring the auto industry and traditional carmakers to adopt over-the-air software updates  https://t.co/CskyVASCfM,en,[],['https://www.teslarati.com/gm-over-the-air-software-update-tesla/'],[],6,48,357,[],[],https://twitter.com/Teslarati/status/1108471999859515394,False,,0,,,,,,,,[],,,,,0.0030486905,0.11936613,0.8775853
15,1108470511355527169,1108470511355527169,2019-03-20 20:48:58 UTC,2019-03-20,20:48:58,0,1023266600223481856,polixenes13,Polixenes,,"I'm blocked by him, but understand @tsrandall is shocked that Norway has record high $TSLA Q1 delivery numbers. He can't possibly be unaware that Tesla is delivering all three years of order backlog in one quarter, can he?  https://t.co/r2Vw32OQFF",en,"[{'screen_name': 'tsrandall', 'name': 'tom randall', 'id': '40303245'}]",[],['https://pbs.twimg.com/media/D2IUDKyW0AIfbgF.jpg'],12,5,56,[],['tsla'],https://twitter.com/Polixenes13/status/1108470511355527169,False,,1,https://pbs.twimg.com/media/D2IUDKyW0AIfbgF.jpg,,,,,,,[],,,,,0.644806,0.31862938,0.03656449
16,1108466185107107841,1108466185107107841,2019-03-20 20:31:47 UTC,2019-03-20,20:31:47,0,389979192,nasalahe,Lasse Edvardsen,,"New record for Norway 🇳🇴 Tesla Model 3 is the most registered car, of any kind, in one month, ever 🎉👏🔋🍾 Pure electric ⚡️ beats hybrid and ICE 🏭  https://t.co/P6B9E7DoVb and  https://t.co/RCpRAa4kY1 #tesla #model3 #teslamodel3 #norway @elonmusk @Tesla  https://t.co/PdIoMnaG18",en,"[{'screen_name': 'elonmusk', 'name': 'elon musk', 'id': '44196397'}, {'screen_name': 'tesla', 'name': 'tesla', 'id': '13298072'}]","['https://teslastats.no', 'https://elbilstatistikk.no']",['https://pbs.twimg.com/media/D2IQHl_XgAE-3Re.jpg'],38,396,3559,"['tesla', 'model3', 'teslamodel3', 'norway']",[],https://twitter.com/nasalahe/status/1108466185107107841,False,,1,https://pbs.twimg.com/media/D2IQHl_XgAE-3Re.jpg,,,,,,,[],,,,,0.0014729307,0.025051009,0.9734762
17,1108465741941092352,1108465741941092352,2019-03-20 20:30:01 UTC,2019-03-20,20:30:01,0,3764301,ryanholiday,Ryan Holiday,,"""One must be sane to think clearly, but one can think deeply and be quite insane."" Tesla",en,[],[],[],0,20,136,[],[],https://twitter.com/RyanHoliday/status/1108465741941092352,False,,0,,,,,,,,[],,,,,0.17749543,0.61170286,0.21080166
18,1108465314570952708,1108465314570952708,2019-03-20 20:28:19 UTC,2019-03-20,20:28:19,0,15650636,leilanimunter,Leilani Münter 🇺🇦,,"Love this! @Tesla leading the way, again.",en,"[{'screen_name': 'tesla', 'name': 'tesla', 'id': '13298072'}]",[],[],2,12,92,[],[],https://twitter.com/LeilaniMunter/status/1108465314570952708,False,https://twitter.com/dodo/status/1108397787950075905,0,,,,,,,,[],,,,,0.004126259,0.008468464,0.9874051
19,1108465203698720768,1108465203698720768,2019-03-20 20:27:53 UTC,2019-03-20,20:27:53,0,2148233600,electrekco,Electrek.co,,"Tesla Model 3 breaks delivery record in Norway, putting pressure on other EVs  https://t.co/IM7lshZ4VB by @fredericlambert  https://t.co/u73ODIy2Q8",en,"[{'screen_name': 'fredericlambert', 'name': 'fred lambert', 'id': '38253449'}]",['https://electrek.co/2019/03/20/tesla-model-3-delivery-record-norway-pressure-other-evs/'],['https://pbs.twimg.com/media/D2IPOnKX4AAi4O1.jpg'],4,62,359,[],[],https://twitter.com/ElectrekCo/status/1108465203698720768,False,,1,https://pbs.twimg.com/media/D2IPOnKX4AAi4O1.jpg,,,,,,,[],,,,,0.0030692643,0.3477115,0.6492193
20,1108457118066241540,1108457118066241540,2019-03-20 19:55:45 UTC,2019-03-20,19:55:45,0,2347049341,voxdotcom,Vox,,"A new contest to make the best science-themed Peep diorama is currently ongoing, and you can vote in it.  The “Peeple’s Choice Awards,"" presented by a science journalism nonprofit, includes a diorama of Peepola Tesla and a Museum of Natural Peepstory.   https://t.co/6AoKrbo7MR  https://t.co/Y4xrQwg71c",en,[],['https://bit.ly/2FneHrw'],"['https://pbs.twimg.com/media/D2IGtTMXgAEMPW2.jpg', 'https://pbs.twimg.com/media/D2IGuH-WkAAqdFy.jpg']",1,26,61,[],[],https://twitter.com/voxdotcom/status/1108457118066241540,False,,1,https://pbs.twimg.com/media/D2IGtTMXgAEMPW2.jpg,,,,,,,[],,,,,0.003964432,0.3874404,0.6085952
21,1108456539839434757,1108374173909319680,2019-03-20 19:53:27 UTC,2019-03-20,19:53:27,0,16159002,jam2000,Jam2000,,@arundhatiS @Tesla @elonmusk More than 35k for the first car? Richkids,en,[],[],[],5,0,206,[],[],https://twitter.com/Jam2000/status/1108456539839434757,False,,0,,,,,,,,"[{'screen_name': 'arundhatiS', 'name': 'Arundhati Sawant', 'id': '33201124'}, {'screen_name': 'Tesla', 'name': 'Tesla', 'id': '13298072'}, {'screen_name': 'elonmusk', 'name': 'Elon Musk', 'id': '44196397'}]",,,,,0.24462073,0.6565259,0.09885342
22,1108448791831601152,1108448791831601152,2019-03-20 19:22:40 UTC,2019-03-20,19:22:40,0,1007337323636318209,teslainvernon,teslainvernon,,"hey @Tesla owners, if you haven't already, I highly recommend you book a tour to visit Telsa's Fremont Factory.   1. It's free 2. It's awesome 3. Robots  As an owner you can book by sending an e-mail to FactoryTours@tesla.com - they suggest you book at least 2 -4 weeks ahead.",en,"[{'screen_name': 'tesla', 'name': 'tesla', 'id': '13298072'}]",[],[],27,52,430,[],[],https://twitter.com/teslainvernon/status/1108448791831601152,False,https://twitter.com/teslainvernon/status/1108095268291919872,0,,,,,,,,[],,,,,0.0021648728,0.028529031,0.969306
23,1108446796949282816,1108446796949282816,2019-03-20 19:14:44 UTC,2019-03-20,19:14:44,0,17174309,diplo,diplo,,trying to disavow my worldly possessions but I'm going to keep my tesla,en,[],[],[],29,98,1321,[],[],https://twitter.com/diplo/status/1108446796949282816,False,,0,,,,,,,,[],,,,,0.22787127,0.6788513,0.09327752
24,1108445689724444672,1108445689724444672,2019-03-20 19:10:21 UTC,2019-03-20,19:10:21,0,56503351,kvapilmaki,Marinela Kvapil,,"Moja omiljena radnica u kulturi, direktorka muzeja Nikole Tesle tvrdi da u depou čuvaju 200 000 njegovih ličnih predmeta. Uskoro postavka: Tesla - kako sam postao horder",und,[],[],[],5,6,246,[],[],https://twitter.com/KvapilMaki/status/1108445689724444672,False,,0,,,,,,,,[],,,,,0.051364563,0.88697314,0.06166224
25,1108443317010743296,1108443317010743296,2019-03-20 19:00:55 UTC,2019-03-20,19:00:55,0,565198801,teslainventory,Erik in DÆrik,,"My Tesla Semi was delivered yesterday! Collection complete, until the Y or Roadster come out!  😁 @Tesla @elonmusk  https://t.co/mHMBkmOovc",en,"[{'screen_name': 'tesla', 'name': 'tesla', 'id': '13298072'}, {'screen_name': 'elonmusk', 'name': 'elon musk', 'id': '44196397'}]",[],['https://pbs.twimg.com/media/D2H7UbRU8AA4CfX.jpg'],13,12,187,[],[],https://twitter.com/teslainventory/status/1108443317010743296,False,,1,https://pbs.twimg.com/media/D2H7UbRU8AA4CfX.jpg,,,,,,,[],,,,,0.0015792885,0.03841727,0.96000344
26,1108436459936272386,1108436459936272386,2019-03-20 18:33:40 UTC,2019-03-20,18:33:40,0,1029291846,istoeserio,Manuel Cardoso,,"O meu carro está a arranjar e, só porque sim, fui pesquisar preços de automóveis. Resultados da pesquisa: Tesla - caro FIAT - acessível Dacia - dão-te o carro, beijam-te e erguem-te uma estátua em Pitești na Roménia por teres demonstrado interesse por tamanha merda de automóvel",pt,[],[],[],9,54,570,[],[],https://twitter.com/istoeserio/status/1108436459936272386,False,,0,,,,,,,,[],,,,,0.06716729,0.8490957,0.08373702
27,1108432016037556224,1108424472879656963,2019-03-20 18:16:00 UTC,2019-03-20,18:16:00,0,40303245,tsrandall,Tom Randall,,"Cumulatively in Norway, Netherlands, and Spain, Tesla is now easily the best-selling EV brand—though its market share is nowhere close to being as lopsided as in the U.S.  https://t.co/4uDon4SoPp  https://t.co/dZOPr2v2h0",en,[],['http://eu-evs.com'],['https://pbs.twimg.com/media/D2Hvhl5WwAEJAGW.jpg'],7,17,80,[],[],https://twitter.com/tsrandall/status/1108432016037556224,False,,1,https://pbs.twimg.com/media/D2Hvhl5WwAEJAGW.jpg,,,,,,,[],,,,,0.00652125,0.115316175,0.87816256
28,1108427028020240384,1108427028020240384,2019-03-20 17:56:11 UTC,2019-03-20,17:56:11,0,330774080,vivvchy,🔗🌹Vivian Okoy,,"First year with Model S, an incredible adventure | Tesla Europe,  https://t.co/lGIVWeyoXL",en,[],[],['https://pbs.twimg.com/media/D2HsfcyX0AIA9kk.jpg'],25,37,1985,[],[],https://twitter.com/vivvchy/status/1108427028020240384,False,,1,https://pbs.twimg.com/media/D2HsfcyX0AIA9kk.jpg,,,,,,,[],,,,,0.0017247918,0.023601985,0.97467303
29,1108424625220800512,1108397787950075905,2019-03-20 17:46:38 UTC,2019-03-20,17:46:38,0,539427670,marvelwonderkat,🌟 Stella Vitae 🌟,,"@dodo @elonmusk Love this! Please make more showing Tesla’s endless stelllar features: Sentry, Fart, &amp; Romance Modes, fun TeslaAtari, the beauty &amp; safety of glass roof, the shocking amount of storage space, the stain proof vegan leather seats, the insane/torque/speed, the magic of OTA’s, &amp; more!",en,[],[],[],3,7,80,[],[],https://twitter.com/marvelwonderkat/status/1108424625220800512,False,,0,,,,,,,,"[{'screen_name': 'dodo', 'name': 'The Dodo', 'id': '1604444052'}, {'screen_name': 'elonmusk', 'name': 'Elon Musk', 'id': '44196397'}]",,,,,0.0032162992,0.020331431,0.97645223
30,1108424472879656963,1108424472879656963,2019-03-20 17:46:02 UTC,2019-03-20,17:46:02,0,40303245,tsrandall,Tom Randall,,"Tesla has just exceeded its best quarter ever in Norway, where registrations are reported in realtime. With ~10 days to go, it should exceed the previous record by a wide margin. Interestingly, this may also vie for Tesla's worst quarter ever for both the Model S and Model X 1/  https://t.co/ZBanqBmfDp",en,[],[],['https://pbs.twimg.com/media/D2HlwcnWwAIhMsi.jpg'],12,58,263,[],[],https://twitter.com/tsrandall/status/1108424472879656963,False,,1,https://pbs.twimg.com/media/D2HlwcnWwAIhMsi.jpg,,,,,,,[],,,,,0.02244086,0.14785947,0.82969964
31,1108424107064999936,1108424107064999936,2019-03-20 17:44:35 UTC,2019-03-20,17:44:35,0,1928116742,timo_bader,TB,,Just took delivery of this beautiful @Tesla Model 3 in Vienna. Incredible car! Especially the acceleration and the premium sound system really blew my mind.  @elonmusk and the Tesla Team really did some great work! #Tesla #Model3 #ElonMusk  https://t.co/y9gJWzJI6p,en,"[{'screen_name': 'tesla', 'name': 'tesla', 'id': '13298072'}, {'screen_name': 'elonmusk', 'name': 'elon musk', 'id': '44196397'}]",[],['https://pbs.twimg.com/media/D2Hp2CIX4AE_sjs.jpg'],64,133,3515,"['tesla', 'model3', 'elonmusk']",[],https://twitter.com/timo_bader/status/1108424107064999936,False,,1,https://pbs.twimg.com/media/D2Hp2CIX4AE_sjs.jpg,,,,,,,[],,,,,0.003269626,0.008536559,0.9881937
32,1108423542503362560,1108423542503362560,2019-03-20 17:42:20 UTC,2019-03-20,17:42:20,0,57960896,slcuervo,Saul Lopez,,"Estoy viendo cómo, cada vez más, en redes sociales y foros de Francia hay gente indignada que comenta que comerciales de marcas como Kia, Hyundai, Jaguar, Audi, Renault, BMW... etc, afirman a sus clientes que se puede cargar en la red de Superchargers de Tesla!!",es,[],[],[],20,40,147,[],[],https://twitter.com/slcuervo/status/1108423542503362560,False,,0,,,,,,,,[],,,,,0.0353172,0.79423654,0.17044622
33,1108421528641855488,1108421528641855488,2019-03-20 17:34:20 UTC,2019-03-20,17:34:20,0,1079907211818745856,denivojvoda,Deni Vojvoda,,- Kako se zovete?  - Nikola Tesla!  - Pa dobro. Kod nas u bolnici ima dosta naučnika. - Nisam ja naučnik.  - Ja sam aerodrom!,und,[],[],[],3,7,118,[],[],https://twitter.com/DeniVojvoda/status/1108421528641855488,False,,0,,,,,,,,[],,,,,0.02744596,0.784064,0.18849005
34,1108420693215961088,1108420693215961088,2019-03-20 17:31:01 UTC,2019-03-20,17:31:01,0,704835627183788032,model3owners,Trev Page,,"I'd like to make it clear we're strictly an online enthusiast ""club"" with no affiliation to Tesla or official Tesla Owner's clubs around the world. We love everyone in the community!",en,[],[],[],5,3,89,[],[],https://twitter.com/Model3Owners/status/1108420693215961088,False,,0,,,,,,,,[],,,,,0.005983163,0.06636548,0.9276514
35,1108419227394801664,1108419227394801664,2019-03-20 17:25:11 UTC,2019-03-20,17:25:11,0,913449108798455808,elonaccessories,Elon Accessories,,"Trevor at @Model3Owners is undeniably one of the top contributors in Tesla community. Today is his 49th birthday. We could give him a birthday present by reaching 50,000 YouTube subscribers. If you haven’t already, join thousands of other Tesla owners here  https://t.co/GR1SC2T6cg",en,"[{'screen_name': 'model3owners', 'name': 'trev page', 'id': '704835627183788032'}]",['https://www.youtube.com/channel/UCry4jW5bcj9DIs7ZwA95Ylw'],[],12,18,139,[],[],https://twitter.com/ElonAccessories/status/1108419227394801664,False,,0,,,,,,,,[],,,,,0.0024335494,0.020923445,0.97664297
36,1108418998193012736,1108132977274433536,2019-03-20 17:24:17 UTC,2019-03-20,17:24:17,0,1574217925,synhdz_,SynHDz,,@AndrewDzula @LoxieeLoxx @Tesla @elonmusk This reminds me of @burnie Tesla,en,"[{'screen_name': 'burnie', 'name': 'burnie burns', 'id': '14503124'}]",[],[],3,0,93,[],[],https://twitter.com/SynHDz_/status/1108418998193012736,False,,0,,,,,,,,"[{'screen_name': 'AndrewDzula', 'name': 'Andrew Dzula', 'id': '1308193223064449024'}, {'screen_name': 'LoxieeLoxx', 'name': 'Loxy', 'id': '162481234'}, {'screen_name': 'Tesla', 'name': 'Tesla', 'id': '13298072'}, {'screen_name': 'elonmusk', 'name': 'Elon Musk', 'id': '44196397'}]",,,,,0.030359419,0.8145161,0.15512446
37,1108417401979322368,1108397787950075905,2019-03-20 17:17:56 UTC,2019-03-20,17:17:56,0,16048952,davidshek,David Shek,,"@RamLover69 @dodo @elonmusk Tesla's Model 3 not only achieved a perfect 5-star safety rating in every category and sub-category, but NHTSA’s tests also showed that it has the lowest probability of injury of any car the safety agency has ever tested.",en,[],[],[],5,7,523,[],[],https://twitter.com/davidshek/status/1108417401979322368,False,,0,,,,,,,,"[{'screen_name': 'RamLover69', 'name': 'Dodge Ram Owner', 'id': '1091399247705006081'}, {'screen_name': 'dodo', 'name': 'The Dodo', 'id': '1604444052'}, {'screen_name': 'elonmusk', 'name': 'Elon Musk', 'id': '44196397'}]",,,,,0.012949733,0.15183894,0.8352113
38,1108415984585465857,1108397787950075905,2019-03-20 17:12:18 UTC,2019-03-20,17:12:18,0,934961176408133632,thx4alldafish,Starling,,"@11kelleyk @dodo Interior climate temp and controls are on the Tesla app, so you can see what’s happening with your car. This feature isn’t meant to allow ppl to leave dogs in the car for hours and hours...it’s meant for safe comfortable outings and to prevent ppl from breaking the windows",en,[],[],[],1,2,144,[],[],https://twitter.com/thx4alldafish/status/1108415984585465857,False,,0,,,,,,,,"[{'screen_name': '11kelleyk', 'name': 'Kelley', 'id': '965975026381086723'}, {'screen_name': 'dodo', 'name': 'The Dodo', 'id': '1604444052'}]",,,,,0.13339701,0.80573815,0.060864866
39,1108415177903489025,1108397787950075905,2019-03-20 17:09:06 UTC,2019-03-20,17:09:06,0,429114492,gio_tbilisi,George Shonia,,@11kelleyk @dodo Car will notifes you trough the Tesla app,en,[],[],[],1,1,329,[],[],https://twitter.com/gio_tbilisi/status/1108415177903489025,False,,0,,,,,,,,"[{'screen_name': '11kelleyk', 'name': 'Kelley', 'id': '965975026381086723'}, {'screen_name': 'dodo', 'name': 'The Dodo', 'id': '1604444052'}]",,,,,0.037699476,0.9195594,0.04274123
40,1108413612295704576,1108413612295704576,2019-03-20 17:02:53 UTC,2019-03-20,17:02:53,0,881198763519471617,k05t4_,k05t4,,Today I got the opportunity to drive a Tesla for the first time. I love it ❤️🏎 It’s been a long time since I had so much fun driving a car.  Thank you @elonmusk @Tesla  Well done 😜👍  https://t.co/cVOi1dvSnP,en,"[{'screen_name': 'elonmusk', 'name': 'elon musk', 'id': '44196397'}, {'screen_name': 'tesla', 'name': 'tesla', 'id': '13298072'}]",[],['https://pbs.twimg.com/media/D2HgTWiWoAIvY4K.jpg'],3,31,846,[],[],https://twitter.com/k05t4_/status/1108413612295704576,False,,1,https://pbs.twimg.com/media/D2HgTWiWoAIvY4K.jpg,,,,,,,[],,,,,0.0027665126,0.0073467516,0.98988676
41,1108413513993723904,1108413513993723904,2019-03-20 17:02:29 UTC,2019-03-20,17:02:29,0,946990190693842944,anders__ask,Anders Ask,,20 års körning med en elbil innan den är miljömässigt bättre än en nyare dieselbil.   Men en tesla är subventionerad med 60.000 ur statskassan. Hur tänker genierna i MP?  https://t.co/FHYxr3WCDC,sv,[],[],"['https://pbs.twimg.com/media/D2HgNoYX0AYD__-.jpg', 'https://pbs.twimg.com/media/D2HgNonWsAAGnxM.jpg']",8,19,68,[],[],https://twitter.com/Anders__Ask/status/1108413513993723904,False,,1,https://pbs.twimg.com/media/D2HgNoYX0AYD__-.jpg,,,,,,,[],,,,,0.039287295,0.9044162,0.056296542
42,1108413364600889344,1108409944963870720,2019-03-20 17:01:54 UTC,2019-03-20,17:01:54,0,13298072,tesla,Tesla,,@TradrFloridaFIL Thank you for reporting this bug 😁,en,[],[],[],5,11,459,[],[],https://twitter.com/Tesla/status/1108413364600889344,False,,0,,,,,,,,"[{'screen_name': 'TradrFloridaFIL', 'name': 'Lady Tesla', 'id': '563996390'}]",,,,,0.012469805,0.10396339,0.8835666
