,id,conversation_id,created_at,date,time,timezone,user_id,username,name,place,tweet,language,mentions,urls,photos,replies_count,retweets_count,likes_count,hashtags,cashtags,link,retweet,quote_url,video,thumbnail,near,geo,source,user_rt_id,user_rt,retweet_id,reply_to,retweet_date,translate,trans_src,trans_dest,negative,neutral,positive
0,1086406692244520970,1086406692244520970,2019-01-18 23:35:14 UTC,2019-01-18,23:35:14,0,3033856429,jrob32_,Jermaine Robinson,,@elonmusk listen to that @1future album legit make me want to ride in a Tesla,en,"[{'screen_name': '1future', 'name': 'future/freebandz', 'id': '51742969'}]",[],[],0,20,133,[],[],https://twitter.com/Jrob32_/status/1086406692244520970,False,,0,,,,,,,,[],,,,,0.010605426,0.09838687,0.89100766
1,1086402033710620673,1086402033710620673,2019-01-18 23:16:43 UTC,2019-01-18,23:16:43,0,349249475,gerberkawasaki,Ross Gerber,,Tesla getting lean and mean in its drive for long term profitability and sustainability. #TeslaModel3 $tsla #climatechange  https://t.co/PLFqwWMw3t,en,[],['https://www.latimes.com/business/la-fi-tesla-cuts-20190118-story.html'],[],16,8,79,"['teslamodel3', 'climatechange']",['tsla'],https://twitter.com/GerberKawasaki/status/1086402033710620673,False,,0,,,,,,,,[],,,,,0.0070208367,0.25026926,0.74270976
2,1086401286574993408,1086255399890812928,2019-01-18 23:13:45 UTC,2019-01-18,23:13:45,0,44196397,elonmusk,Elon Musk,,"@thirionremi @Tesla Thanks, good idea!",en,[],[],[],98,96,5317,[],[],https://twitter.com/elonmusk/status/1086401286574993408,False,,0,,,,,,,,"[{'screen_name': 'thirionremi', 'name': '🔋Thirion Rémi⚡️🇪🇺🇧🇪', 'id': '320264153'}, {'screen_name': 'Tesla', 'name': 'Tesla', 'id': '13298072'}]",,,,,0.004547191,0.034860235,0.9605925
3,1086401257789640705,1086401257789640705,2019-01-18 23:13:38 UTC,2019-01-18,23:13:38,0,17893558,samantar,Sam E. Antar,,How many jobs could’ve been saved if Tesla didn’t have to pay a separate $20 million fine due to Elon Musk’s reckless behavior? $TSLA $TSLAQ,en,[],[],[],7,10,60,[],"['tsla', 'tslaq']",https://twitter.com/SamAntar/status/1086401257789640705,False,https://twitter.com/WSJ/status/1086205062978916352,0,,,,,,,,[],,,,,0.7004354,0.2592856,0.04027904
4,1086398237601423360,1086398237601423360,2019-01-18 23:01:38 UTC,2019-01-18,23:01:38,0,1013538229092577280,ryanw60508824,R-Dub🧢🌤⚡🌎,,Well.... I am part of the 7%. It still won't stop me from reapplying for future positions or from buying a Model 3 this year. Go Tesla go!,en,[],[],[],41,45,511,[],[],https://twitter.com/RyanW60508824/status/1086398237601423360,False,,0,,,,,,,,[],,,,,0.024523906,0.19573377,0.7797423
5,1086391189170020352,1086391189170020352,2019-01-18 22:33:38 UTC,2019-01-18,22:33:38,0,732548050728701953,valueanalyst1,Yaman Tasdivar,,"Hi @elonmusk, @Tesla fired 8,000 people in 7 months. I understand it's needed to streamline the business to more effectively execute on the mission, but hiring and firing thousands in such a short period also has a large human cost. Is it time to rethink HR management? Thank you.",en,"[{'screen_name': 'elonmusk', 'name': 'elon musk', 'id': '44196397'}, {'screen_name': 'tesla', 'name': 'tesla', 'id': '13298072'}]",[],[],14,5,77,[],[],https://twitter.com/ValueAnalyst1/status/1086391189170020352,False,,0,,,,,,,,[],,,,,0.73315537,0.25202164,0.014822995
6,1086390448871129089,1086390448871129089,2019-01-18 22:30:41 UTC,2019-01-18,22:30:41,0,2148233600,electrekco,Electrek.co,,Tesla Semi is now being used to move Tesla vehicles - spotted with a Model X  https://t.co/BXoHd3ppd0 by @fredericlambert  https://t.co/RCupFQyo7A,en,"[{'screen_name': 'fredericlambert', 'name': 'fred lambert', 'id': '38253449'}]",['https://electrek.co/2019/01/18/tesla-semi-used-move-tesla-vehicles-spotted-model-x/'],['https://pbs.twimg.com/media/DxOiWxgW0AEjJYE.jpg'],12,61,421,[],[],https://twitter.com/ElectrekCo/status/1086390448871129089,False,,1,https://pbs.twimg.com/media/DxOiWxgW0AEjJYE.jpg,,,,,,,[],,,,,0.004695594,0.88734996,0.10795453
7,1086385875900985344,1086385875900985344,2019-01-18 22:12:31 UTC,2019-01-18,22:12:31,0,349249475,gerberkawasaki,Ross Gerber,,My thoughts on @YahooFinance on tesla and the #teslamodel3 Cost cutting is a good thing. That's how you make profits! $TSLA  https://t.co/xAkNz19vfJ,en,"[{'screen_name': 'yahoofinance', 'name': 'yahoo finance', 'id': '19546277'}]",['https://finance.yahoo.com/video/tesla-cut-7-workforce-213628195.html'],[],18,16,84,['teslamodel3'],['tsla'],https://twitter.com/GerberKawasaki/status/1086385875900985344,False,,0,,,,,,,,[],,,,,0.011423069,0.13821502,0.85036194
8,1086382793679093771,1086382793679093771,2019-01-18 22:00:16 UTC,2019-01-18,22:00:16,0,807095,nytimes,The New York Times,,"Tesla will reduce its full-time work force by 7% in an effort to lower the cost of producing its Model 3 sedan and make it a mass-market vehicle, Elon Musk told employees on Friday  https://t.co/pV52fm7ZPT",en,[],['https://nyti.ms/2DkHJbF'],[],19,40,90,[],[],https://twitter.com/nytimes/status/1086382793679093771,False,,0,,,,,,,,[],,,,,0.023547336,0.6853308,0.29112184
9,1086380551823597577,1086380551823597577,2019-01-18 21:51:22 UTC,2019-01-18,21:51:22,0,1010845229182803968,pollstesla,Tesla Polls,,$tsla $tslaq #Tesla #SGF My Boston buddy came through! Tesla storage from Dedham MA Tesla  https://t.co/Hn2PKpWikq,en,[],[],[],38,8,94,"['tesla', 'sgf']","['tsla', 'tslaq']",https://twitter.com/PollsTesla/status/1086380551823597577,False,,1,https://pbs.twimg.com/ext_tw_video_thumb/1086380512028037121/pu/img/-K09b5fPtNUbMy0Z.jpg,,,,,,,[],,,,,0.0029174266,0.1771873,0.8198953
10,1086380407229202434,1086380407229202434,2019-01-18 21:50:47 UTC,2019-01-18,21:50:47,0,950471510266871810,kulpability,“Mary”,,We have progressed to the point where the muscle car husband is unabashedly driving the @Tesla #model3 around in circles looking for drag races. “I had to take the long way to tractor supply because I pulled up along side a mustang and he wanted a go. Of course I won.”,en,"[{'screen_name': 'tesla', 'name': 'tesla', 'id': '13298072'}]",[],[],11,14,219,['model3'],[],https://twitter.com/kulpability/status/1086380407229202434,False,,0,,,,,,,,[],,,,,0.017180288,0.31039342,0.6724262
11,1086380338979459073,1086377186041331713,2019-01-18 21:50:31 UTC,2019-01-18,21:50:31,0,84950626,orthereaboot,luis carruthers,,"@russ1mitchell For clarification because it’s $tsla, Tesla says they have ECWVTA— “European Community Whole Vehicle Type Approval” and not an Individual Vehicle Approval, correct?  Can they confirm?  Thanks",en,[],[],[],3,4,55,[],['tsla'],https://twitter.com/orthereaboot/status/1086380338979459073,False,,0,,,,,,,,"[{'screen_name': 'russ1mitchell', 'name': 'Russ Mitchell', 'id': '2471516070'}]",,,,,0.022853887,0.91024834,0.06689774
12,1086378070993502208,1086378070993502208,2019-01-18 21:41:30 UTC,2019-01-18,21:41:30,0,229232438,lexiheft,Lexi Heft,,Launching into the weekend with @LikeTeslaKim and @HeyAshleyRenne like...  #FridayFeeling #Tesla #modelx #weekendvibes  https://t.co/MIXgnPzMu3,en,"[{'screen_name': 'heyashleyrenne', 'name': 'ashley renne nsonwu', 'id': '780544578'}]",[],[],2,8,83,"['fridayfeeling', 'tesla', 'modelx', 'weekendvibes']",[],https://twitter.com/lexiheft/status/1086378070993502208,False,,1,https://pbs.twimg.com/ext_tw_video_thumb/1086377305579159552/pu/img/tbLgqyBkEv3-lPw4.jpg,,,,,,,[],,,,,0.0020751823,0.20699352,0.7909314
13,1086377630658633729,1086376965722914816,2019-01-18 21:39:45 UTC,2019-01-18,21:39:45,0,320524842,thebubblebubble,Jesse Colombo,,"As much as Tesla has been struggling, Tesla’s struggles are occurring during America's largest wealth bubble.  If they can't make it now, they're probably not going to make it. I'm sorry to be so blunt, but it's the truth.   https://t.co/CWLmtw1eb2",en,[],['https://twitter.com/TheBubbleBubble/status/1086376965722914816'],[],12,25,83,[],[],https://twitter.com/TheBubbleBubble/status/1086377630658633729,False,https://twitter.com/TheBubbleBubble/status/1086376965722914816,0,,,,,,,,[],,,,,0.8224881,0.16093124,0.016580638
14,1086377476215828480,1086377476215828480,2019-01-18 21:39:08 UTC,2019-01-18,21:39:08,0,357753298,derekseattle,Derek Hermsen,,"In July 2012, I saw a @Tesla Model S. On 8/1/12, I bought stock. So proud to finally put that stock to use and just had my dream car delivered! Thank you @elonmusk !  https://t.co/MFv9XWdNxl",en,"[{'screen_name': 'tesla', 'name': 'tesla', 'id': '13298072'}, {'screen_name': 'elonmusk', 'name': 'elon musk', 'id': '44196397'}]",[],['https://pbs.twimg.com/media/DxOWhDlUUAAOA4U.jpg'],158,259,9823,[],[],https://twitter.com/derekseattle/status/1086377476215828480,False,,1,https://pbs.twimg.com/media/DxOWhDlUUAAOA4U.jpg,,,,,,,[],,,,,0.0018206922,0.012406882,0.9857725
15,1086370036569108480,1086370036569108480,2019-01-18 21:09:35 UTC,2019-01-18,21:09:35,0,856861077384175621,rockthesetweets,𝐌𝐲𝐑𝐨𝐜𝐤𝐀𝐧𝐝𝐑𝐨𝐥𝐥𝐇𝐞𝐚𝐯𝐞𝐧,,"New Tesla album on the way!!! Tesla Announce ‘Shock’ LP, Produced by Def Leppard’s Phil Collen  https://t.co/EWu4zJ8f6F @UltClassicRock",en,"[{'screen_name': 'ultclassicrock', 'name': 'ultimateclassicrock', 'id': '288205018'}]",['http://ultimateclassicrock.com/tesla-shock/?trackback=twitter_mobile'],[],5,12,71,[],[],https://twitter.com/RockTheseTweets/status/1086370036569108480,False,,0,,,,,,,,[],,,,,0.001620077,0.22694722,0.7714326
16,1086363715706990593,1086363715706990593,2019-01-18 20:44:28 UTC,2019-01-18,20:44:28,0,15088481,mikehudema,Mike Hudema,,"Tesla is supplying the island of Hawaii with 54,978 #solar panels, hooked up to 272 power packs to help provide 24 hr #solarenergy.  We have solutions to the #climate crisis, let's implement them.  #ActOnClimate #energy #cdnpoli #climatesurvival #greennewdeal #panelsnotpipelines  https://t.co/KR4YqeX8cZ",en,[],[],[],14,294,506,"['solar', 'solarenergy', 'climate', 'actonclimate', 'energy', 'cdnpoli', 'climatesurvival', 'greennewdeal', 'panelsnotpipelines']",[],https://twitter.com/MikeHudema/status/1086363715706990593,False,,1,https://pbs.twimg.com/ext_tw_video_thumb/1086363601949073409/pu/img/TsxMcIXi_i69HMg_.jpg,,,,,,,[],,,,,0.009157278,0.29383746,0.6970054
17,1086362453917675520,1086360398134046720,2019-01-18 20:39:27 UTC,2019-01-18,20:39:27,0,59023203,austinnotduncan,Austin Evans,,@jakerawr @Tesla I need a tour for science,en,[],[],[],1,1,176,[],[],https://twitter.com/austinnotduncan/status/1086362453917675520,False,,0,,,,,,,,"[{'screen_name': 'jakerawr', 'name': 'Jake Roper', 'id': '15810697'}, {'screen_name': 'Tesla', 'name': 'Tesla', 'id': '13298072'}]",,,,,0.024976656,0.7621514,0.21287185
18,1086359514637426688,1086359514637426688,2019-01-18 20:27:46 UTC,2019-01-18,20:27:46,0,349249475,gerberkawasaki,Ross Gerber,,Got a little more of that Tesla stock too. $TSLA,en,[],[],[],22,8,143,[],['tsla'],https://twitter.com/GerberKawasaki/status/1086359514637426688,False,,0,,,,,,,,[],,,,,0.011933448,0.51172256,0.47634402
19,1086353643572346880,1086353643572346880,2019-01-18 20:04:26 UTC,2019-01-18,20:04:26,0,18200793,teslamotorsclub,Tesla Motors Club,,Tesla To Slash Workforce In Effort To Bring Cheapest Model 3 To Market #Tesla #Model3  https://t.co/Wrm7KbX2SK,en,[],['https://teslamotorsclub.com/blog/2019/01/18/tesla-cuts-prior-base-model-3/'],[],7,27,197,"['tesla', 'model3']",[],https://twitter.com/TeslaMotorsClub/status/1086353643572346880,False,,0,,,,,,,,[],,,,,0.1301778,0.7157971,0.15402505
20,1086350403199918080,1086350403199918080,2019-01-18 19:51:34 UTC,2019-01-18,19:51:34,0,14031032,adamsinger,Adam Singer,,Half my friends are short $TSLA the other half are long. Might be the only one in Silicon Valley with no position. I'm surprised there isn't a word for us yet (like nocoiner but for Tesla stock).,en,[],[],[],25,3,79,[],['tsla'],https://twitter.com/AdamSinger/status/1086350403199918080,False,,0,,,,,,,,[],,,,,0.29450423,0.45820922,0.24728653
21,1086348702162272261,1086348702162272261,2019-01-18 19:44:48 UTC,2019-01-18,19:44:48,0,3167257102,erdayastronaut,Everyday Astronaut,,"Episode 17 of our podcast “Our Ludicrous Future” is out!!! - SpaceX Layoffs, Billboards in Space, and Goodbye Tesla Referral Program with @answerswithjoe and @BenSullins! Let us know a good #whydonttheyjust  https://t.co/BY2wCOAmGn",en,"[{'screen_name': 'answerswithjoe', 'name': 'joe scott', 'id': '219353870'}]",['https://youtu.be/oaZ538E8xEs'],[],12,6,114,['whydonttheyjust'],[],https://twitter.com/Erdayastronaut/status/1086348702162272261,False,,0,,,,,,,,[],,,,,0.008493925,0.29775384,0.69375235
22,1086346421853249538,1086346421853249538,2019-01-18 19:35:44 UTC,2019-01-18,19:35:44,0,349249475,gerberkawasaki,Ross Gerber,,"Almost to $300. Amazing to get this opportunity again. You didnt really thinking scaling profitably would be easy. Of course, Elons got this. $TSLA #tesla",en,[],[],[],65,37,303,['tesla'],['tsla'],https://twitter.com/GerberKawasaki/status/1086346421853249538,False,,0,,,,,,,,[],,,,,0.006388157,0.023819786,0.96979195
23,1086344625282080769,1086344625282080769,2019-01-18 19:28:36 UTC,2019-01-18,19:28:36,0,18856867,zerohedge,zerohedge,,"TESLA EXTENDS LOSS TO 14%, BRIEFLY DIPS BELOW $300  Time to announce a teleportation device",en,[],[],[],9,46,254,[],[],https://twitter.com/zerohedge/status/1086344625282080769,False,,0,,,,,,,,[],,,,,0.60225606,0.34824678,0.049497202
24,1086342139456282624,1086342139456282624,2019-01-18 19:18:43 UTC,2019-01-18,19:18:43,0,1570180292,dowdedward,Ed ☯️Free Thinker & Oracle,,$TSLA This has now become institutional FU selling. Tesla is losing institutional sponsorship...very no bueno.,en,[],[],[],6,7,67,[],['tsla'],https://twitter.com/DowdEdward/status/1086342139456282624,False,https://twitter.com/DowdEdward/status/1086322021007384576,0,,,,,,,,[],,,,,0.85956967,0.13089654,0.00953377
25,1086335165255901184,1086335165255901184,2019-01-18 18:51:01 UTC,2019-01-18,18:51:01,0,2564597449,elonmusknewsorg,Elon Musk News,,"Tesla Semi trucks, Powerpacks, and solar to be used in new near zero-emission Frito-Lay facility    https://t.co/XYgxGug8de",en,[],['https://electrek.co/2019/01/18/tesla-semi-truck-powerpacks-solar-near-zero-emission-frito-lay/'],[],4,38,133,[],[],https://twitter.com/ElonMuskNewsOrg/status/1086335165255901184,False,,0,,,,,,,,[],,,,,0.0074993093,0.85156935,0.14093131
26,1086329939597582337,1086329939597582337,2019-01-18 18:30:15 UTC,2019-01-18,18:30:15,0,33097589,gossipbabies,cancela lansbury,,"In this essay , I will get run over by a Tesla",en,[],[],[],0,15,164,[],[],https://twitter.com/gossipbabies/status/1086329939597582337,False,,0,,,,,,,,[],,,,,0.47338432,0.41493547,0.11168015
27,1086329470405898242,1086329470405898242,2019-01-18 18:28:23 UTC,2019-01-18,18:28:23,0,20402945,cnbc,CNBC,,Tesla has $920 million in debt that's coming due — and it could wipe out a large chunk of the company's cash  https://t.co/4FP3rKqIjw,en,[],['https://cnb.cx/2FMYw93'],[],13,30,71,[],[],https://twitter.com/CNBC/status/1086329470405898242,False,,0,,,,,,,,[],,,,,0.7186575,0.26106632,0.020276273
28,1086329056377753600,1086329056377753600,2019-01-18 18:26:44 UTC,2019-01-18,18:26:44,0,154311445,stevewestly,Steve Westly,,"Yes, @Tesla is cutting 7% of its workforce but @elonmusk is smart to push the release of the affordable $35,000 #Model3 this year.   #Tesla needs to focus on winning internationally now.  Just spoke on this for @CNBC on @SquawkAlley    https://t.co/y3tHo4HQpJ",en,"[{'screen_name': 'tesla', 'name': 'tesla', 'id': '13298072'}, {'screen_name': 'elonmusk', 'name': 'elon musk', 'id': '44196397'}, {'screen_name': 'cnbc', 'name': 'cnbc', 'id': '20402945'}]",['http://ow.ly/4ITv30nmSxe'],[],13,19,102,"['model3', 'tesla']",[],https://twitter.com/SteveWestly/status/1086329056377753600,False,,0,,,,,,,,[],,,,,0.054391313,0.49466977,0.4509389
29,1086322158845026304,1086322158845026304,2019-01-18 17:59:20 UTC,2019-01-18,17:59:20,0,1033347878,jeremymclellan,Jeremy McLellan,,Update: Planned Parenthood’s ground troops repelled by Tesla Towers installed early this morning by the Knights of Columbus. #MarchForLife  https://t.co/j0cpBa0v9i,en,[],[],['https://pbs.twimg.com/media/DxNkPNzX4AALtgT.jpg'],8,11,174,['marchforlife'],[],https://twitter.com/JeremyMcLellan/status/1086322158845026304,False,,1,https://pbs.twimg.com/media/DxNkPNzX4AALtgT.jpg,,,,,,,[],,,,,0.23699771,0.73227674,0.030725552
30,1086315414257319937,1086315414257319937,2019-01-18 17:32:32 UTC,2019-01-18,17:32:32,0,478753329,realemirhan,Emir Han,,~Nikola Tesla~  https://t.co/1UD3DRiXXg,eu,[],[],['https://pbs.twimg.com/media/DxNeG8UWwAE7QQV.jpg'],4,15,52,[],[],https://twitter.com/RealEmirHan/status/1086315414257319937,False,,1,https://pbs.twimg.com/media/DxNeG8UWwAE7QQV.jpg,,,,,,,[],,,,,0.010441204,0.8118681,0.1776908
31,1086313819457097729,1086313819457097729,2019-01-18 17:26:11 UTC,2019-01-18,17:26:11,0,2148233600,electrekco,Electrek.co,,GM CEO Mary Barra says 'stay tuned' about something to compete with Tesla Pickup truck  https://t.co/7pYMHURsAw by @fredericlambert  https://t.co/DyDClYdf3N,en,"[{'screen_name': 'fredericlambert', 'name': 'fred lambert', 'id': '38253449'}]",['https://electrek.co/2019/01/18/gm-electric-tesla-pickup-truck/'],['https://pbs.twimg.com/media/DxNcqUfXgAA02-K.jpg'],26,28,128,[],[],https://twitter.com/ElectrekCo/status/1086313819457097729,False,,1,https://pbs.twimg.com/media/DxNcqUfXgAA02-K.jpg,,,,,,,[],,,,,0.004844135,0.88420683,0.11094894
32,1086301503831400453,1086301503831400453,2019-01-18 16:37:15 UTC,2019-01-18,16:37:15,0,77271015,nealboudette,Neal Boudette,,"Here’s the key phrase in @elonmusk email: “While we have made great progress, our products are still too expensive for most people.” If #tesla had unlimited demand, that wouldn’t matter. But they need new mainstream consumers to grow. Not saying they can’t but not a slam dunk",en,"[{'screen_name': 'elonmusk', 'name': 'elon musk', 'id': '44196397'}]",[],[],10,8,57,['tesla'],[],https://twitter.com/nealboudette/status/1086301503831400453,False,,0,,,,,,,,[],,,,,0.3818833,0.5314241,0.08669263
33,1086298242701094912,1086298242701094912,2019-01-18 16:24:18 UTC,2019-01-18,16:24:18,0,164425558,jonerlichman,Jon Erlichman,,"Number of Tesla employees:   2018: 45,000 2017:  37,543 2016:  17,782 2015:  13,058 2014:  10,161 2013:   5,859 2012:   2,964 2011:    1,417 2010:     899 2009:     514 2008:     252  https://t.co/wpZIACKPuJ",en,[],[],[],8,99,452,[],[],https://twitter.com/JonErlichman/status/1086298242701094912,False,,1,https://pbs.twimg.com/media/DxNOfVHUUAMQzBT.jpg,,,,,,,[],,,,,0.022716988,0.9271887,0.050094314
34,1086295464704536576,1086295464704536576,2019-01-18 16:13:15 UTC,2019-01-18,16:13:15,0,704835627183788032,model3owners,Trev Page,,Tesla announces a 7% reduction in workforce in an effort to cut costs. Our best wishes go out to everyone affected by this and also a huge thanks for all of your hard work    https://t.co/0Szo7WRBwy,en,[],['https://www.tesla.com/blog/tesla-company-update'],[],10,21,225,[],[],https://twitter.com/Model3Owners/status/1086295464704536576,False,,0,,,,,,,,[],,,,,0.016342675,0.13512233,0.84853494
35,1086294453529206784,1086294453529206784,2019-01-18 16:09:14 UTC,2019-01-18,16:09:14,0,145265146,timkhiggins,Tim Higgins,,Some personal news via Publishers Marketplace: I’m doing a book about Tesla for @doubleday. My DMs are open if you’ve got any tips.  https://t.co/vCvs5u35Jf  https://t.co/cxHrkmsr0y,en,"[{'screen_name': 'doubleday', 'name': 'lucydoubleday', 'id': '15885608'}]",['https://www.publishersmarketplace.com'],['https://pbs.twimg.com/media/DxNLC78VsAAQjqm.jpg'],29,19,119,[],[],https://twitter.com/timkhiggins/status/1086294453529206784,False,,1,https://pbs.twimg.com/media/DxNLC78VsAAQjqm.jpg,,,,,,,[],,,,,0.004681067,0.65548855,0.33983043
36,1086288792229691393,1086288792229691393,2019-01-18 15:46:44 UTC,2019-01-18,15:46:44,0,1308211178,teslarati,TESLARATI,,"Elon Musk hints at Tesla’s profitable Q4, Mid Range Model 3’s int’l release $TSLA  https://t.co/PjaZELfzUw",ca,[],['https://www.teslarati.com/elon-musk-tesla-profitable-q4-mid-range-model-3-europe-china/'],[],2,17,162,[],['tsla'],https://twitter.com/Teslarati/status/1086288792229691393,False,,0,,,,,,,,[],,,,,0.0036512832,0.26680726,0.72954136
37,1086286718087688192,1086286718087688192,2019-01-18 15:38:30 UTC,2019-01-18,15:38:30,0,750437909224910849,elonbachman,Bachman,,Tesla message boards reflect consensus on two topics:  1) $TSLA service and support is a rapidly spiraling disaster  2) This morning's layoffs are bullish,en,[],[],[],4,19,132,[],['tsla'],https://twitter.com/ElonBachman/status/1086286718087688192,False,,0,,,,,,,,[],,,,,0.78012764,0.19017796,0.029694434
38,1086280728948596736,1086280728948596736,2019-01-18 15:14:42 UTC,2019-01-18,15:14:42,0,1002922606205521925,tesla_bear,FlufferbotResearch,,"The layoffs at Tesla are an indication that there is no financing in sight (no raise, no Larry Ellison).  Layoffs are a REALLY bad signal to the outside world. So if Elon Musk had ANY chance of avoiding them, he would have done it. Especially with the converts being due in march.",en,[],[],[],7,5,68,[],[],https://twitter.com/Tesla_Bear/status/1086280728948596736,False,,0,,,,,,,,[],,,,,0.9001579,0.093495026,0.006346991
39,1086278606098071560,1086278606098071560,2019-01-18 15:06:16 UTC,2019-01-18,15:06:16,0,3043828834,cgrantwsj,Charley Grant,,Shocks are piling up at Tesla  https://t.co/18BSuwMwEj,en,[],['https://www.wsj.com/articles/shocks-are-piling-up-at-tesla-11547823670'],[],8,36,131,[],[],https://twitter.com/CGrantWSJ/status/1086278606098071560,False,,0,,,,,,,,[],,,,,0.7609754,0.22392474,0.015099736
40,1086275781636964352,1086275781636964352,2019-01-18 14:55:03 UTC,2019-01-18,14:55:03,0,1469603575,qtrresearch,Quoth the Raven 🇺🇦,,Boring Co. tunnel unveil an unmitigated farce SpaceX not raising the money it wants SpaceX making staff cuts Tesla making staff cuts Tesla lowering guide Banks and Grimes getting subpoenaed  Yeah things are going just swimmingly for Musk to start 2019,en,[],[],[],5,7,71,[],[],https://twitter.com/QTRResearch/status/1086275781636964352,False,,0,,,,,,,,[],,,,,0.7300038,0.23588766,0.034108486
41,1086259816320897025,1086259816320897025,2019-01-18 13:51:36 UTC,2019-01-18,13:51:36,0,436103176,teslaband,TESLA™,,⚡SHOCK ⚡  New Song + Album Preorder ►  https://t.co/kjQbLOiv2Q #FridayMotivation #fridayfeeling #NewMusicFriday #Tesla  https://t.co/kfa0A5c2mu,en,[],['https://TESLA.lnk.to/SHOCK'],[],28,125,436,"['fridaymotivation', 'fridayfeeling', 'newmusicfriday', 'tesla']",[],https://twitter.com/TeslaBand/status/1086259816320897025,False,,1,https://pbs.twimg.com/ext_tw_video_thumb/1086259737459601409/pu/img/STlnZXNOmHiGnyfj.jpg,,,,,,,[],,,,,0.003220323,0.64883196,0.34794766
42,1086259397070897157,1086259397070897157,2019-01-18 13:49:56 UTC,2019-01-18,13:49:56,0,216644462,fullychargeddan,FullyChargedDanCæsar🗯,,"That’s one angle I suppose... how about “Tesla focus on workforce efficiency to make their cars more affordable.” #Balance  “Elon Musk's Tesla to cut about 3,000 jobs as cars 'too expensive'”  https://t.co/Lg2wPAjptW",en,[],['https://www.bbc.com/news/business-46919489'],[],8,6,60,['balance'],[],https://twitter.com/FullyChargedDan/status/1086259397070897157,False,,0,,,,,,,,[],,,,,0.10812485,0.79062676,0.101248406
43,1086258146639659008,1086258146639659008,2019-01-18 13:44:58 UTC,2019-01-18,13:44:58,0,1074073695939813377,mymodl3,mymodl3,,#365Model3 Photo #18.  I took my husband up to the local make-out spot so I could take pictures of my car.  #Tesla #Model3 #TeslaModel3  https://t.co/VKZTLrgh7m,en,[],[],['https://pbs.twimg.com/media/DxMqBiUUYAA8Er-.jpg'],10,7,75,"['365model3', 'tesla', 'model3', 'teslamodel3']",[],https://twitter.com/mymodl3/status/1086258146639659008,False,,1,https://pbs.twimg.com/media/DxMqBiUUYAA8Er-.jpg,,,,,,,[],,,,,0.0037217576,0.51830703,0.47797123
44,1086256751840681984,1086256751840681984,2019-01-18 13:39:25 UTC,2019-01-18,13:39:25,0,349249475,gerberkawasaki,Ross Gerber,,On top of the fact that Tesla now has 90% of the EV market in the US. With no competition in sight when someone thinks of an EV. It’s a Tesla. Tesla has become a dominant company and now expanding globally.  And profitable. $tsla #TeslaChina,en,[],[],[],29,23,230,['teslachina'],['tsla'],https://twitter.com/GerberKawasaki/status/1086256751840681984,False,,0,,,,,,,,[],,,,,0.008086366,0.09168842,0.90022516
45,1086256286772092928,1086256286772092928,2019-01-18 13:37:35 UTC,2019-01-18,13:37:35,0,349249475,gerberkawasaki,Ross Gerber,,More importantly is that Musk understands the capital markets might not be as generous in the future and he’s focused on Tesla being sustainable and profitable. Versus undisciplined spending. I see this a great news. $tsla,en,[],[],[],10,9,103,[],['tsla'],https://twitter.com/GerberKawasaki/status/1086256286772092928,False,,0,,,,,,,,[],,,,,0.010505406,0.08856915,0.9009255
46,1086255941010391040,1086255941010391040,2019-01-18 13:36:12 UTC,2019-01-18,13:36:12,0,349249475,gerberkawasaki,Ross Gerber,,Tesla has to over hire to get production up and had to use more humans than planed in the ramp. Now Tesla is streamlining the operation as efficiency has been gained. More automation less humans needed. $tsla,en,[],[],[],14,11,86,[],['tsla'],https://twitter.com/GerberKawasaki/status/1086255941010391040,False,,0,,,,,,,,[],,,,,0.10439077,0.5481816,0.34742773
47,1086255652681334784,1086255652681334784,2019-01-18 13:35:03 UTC,2019-01-18,13:35:03,0,349249475,gerberkawasaki,Ross Gerber,,Funny that Tesla is down pre market after saying they will report another profit. That’s good news to me. Elon is streamlining Tesla and SpaceX as one would expect from a disciplined manager. Jack Welch preached firing the bottom 10% of your company every year. $tsla,en,[],[],[],45,31,273,[],['tsla'],https://twitter.com/GerberKawasaki/status/1086255652681334784,False,,0,,,,,,,,[],,,,,0.025334973,0.10976124,0.8649037
