,id,conversation_id,created_at,date,time,timezone,user_id,username,name,place,tweet,language,mentions,urls,photos,replies_count,retweets_count,likes_count,hashtags,cashtags,link,retweet,quote_url,video,thumbnail,near,geo,source,user_rt_id,user_rt,retweet_id,reply_to,retweet_date,translate,trans_src,trans_dest,negative,neutral,positive
86,1210214488915546115,1210214488915546115,2019-12-26 15:03:13 UTC,2019-12-26,15:03:13,0,14823835,digital49r,Marcus 🇺🇸 🦅 🧢 🗳 🧢 🦅 🇺🇸,,Yesss!!! More #Tesla bumper stickers for @AndrewYang!! Love it!!,en,"[{'screen_name': 'andrewyang', 'name': 'andrew yang🧢⬆️🇺🇸', 'id': '2228878592'}]",[],[],0,10,77,['tesla'],[],https://twitter.com/Digital49r/status/1210214488915546115,False,https://twitter.com/nathan66669/status/1210185717269315584,0,,,,,,,,[],,,,,0.0023547548,0.008524601,0.9891207
87,1210213977067851777,1210213977067851777,2019-12-26 15:01:11 UTC,2019-12-26,15:01:11,0,1308211178,teslarati,TESLARATI,,Tesla's hiring ramp in 2019 bucks traditional auto trends as $TSLA continues to soar  https://t.co/SDios28fuw,en,[],['https://www.teslarati.com/tesla-tsla-hiring-ramp-2019-vs-traditional-auto'],[],3,63,483,[],['tsla'],https://twitter.com/Teslarati/status/1210213977067851777,False,,0,,,,,,,,[],,,,,0.0030106674,0.08018002,0.9168092
88,1210212877577183234,1210211655394697216,2019-12-26 14:56:49 UTC,2019-12-26,14:56:49,0,281877818,noahpinion,Noah Smith 🐇🇺🇦,,"Here's a graph showing how important Tesla was for pushing down car battery costs five years ago. Don't know whether other companies have caught up, but seems like the more players in the market the better.  https://t.co/GCkytVp4gY",en,[],[],['https://pbs.twimg.com/media/EMuKIl3XsAEWiA1.png'],5,7,65,[],[],https://twitter.com/Noahpinion/status/1210212877577183234,False,,1,https://pbs.twimg.com/media/EMuKIl3XsAEWiA1.png,,,,,,,[],,,,,0.017045893,0.3001778,0.68277645
89,1210211797531267073,1210211797531267073,2019-12-26 14:52:31 UTC,2019-12-26,14:52:31,0,46910610,terancebaileyjr,Georgia Bred 🇺🇸✊🏿,,"I've read #powernomics and respect Dr.Anderson work but do yall know what year this was published.. like 2000. And he has other work older than me so I get it. But tell me how #powernomics is competing with Google, Amazon, Walmart and Tesla in 2020 and beyond? We're talking..",en,[],[],[],17,10,94,"['powernomics', 'powernomics']",[],https://twitter.com/TeranceBaileyjr/status/1210211797531267073,False,,0,,,,,,,,[],,,,,0.097056955,0.78306764,0.11987544
90,1210211655394697216,1210211655394697216,2019-12-26 14:51:57 UTC,2019-12-26,14:51:57,0,281877818,noahpinion,Noah Smith 🐇🇺🇦,,"Hope this is real. Tesla has done a lot to push forward electric car technology and infrastructure, and I hope they continue.",en,[],[],[],10,6,101,[],[],https://twitter.com/Noahpinion/status/1210211655394697216,False,https://twitter.com/next_china/status/1210204043148251139,0,,,,,,,,[],,,,,0.0047479114,0.037640847,0.9576111
91,1210211115008843776,1210211115008843776,2019-12-26 14:49:49 UTC,2019-12-26,14:49:49,0,349249475,gerberkawasaki,Ross Gerber,,Tesla is higher again. We should get short capitulation soon. $tsla,en,[],[],[],59,38,554,[],['tsla'],https://twitter.com/GerberKawasaki/status/1210211115008843776,False,,0,,,,,,,,[],,,,,0.017602004,0.30062315,0.68177485
92,1210207900406353920,1210207900406353920,2019-12-26 14:37:02 UTC,2019-12-26,14:37:02,0,3060092994,auker_a,Angela Auker,,Tesla family!!! We can do better then this!! We are fine adults raised by fine fam!! We should not add to the filth that is already around us!!! Merch peeps will soon not want to accommodate super chargers if we leave filth like this everyplace! @Tesla  https://t.co/g44xMmfXwH,en,"[{'screen_name': 'tesla', 'name': 'tesla', 'id': '13298072'}]",[],"['https://pbs.twimg.com/media/EMuFp0tWsAEzSjN.jpg', 'https://pbs.twimg.com/media/EMuFp0nWoAYpa1Y.jpg']",39,43,284,[],[],https://twitter.com/auker_a/status/1210207900406353920,False,,1,https://pbs.twimg.com/media/EMuFp0tWsAEzSjN.jpg,,,,,,,[],,,,,0.80351055,0.16121513,0.035274297
93,1210205474403971078,1210205474403971078,2019-12-26 14:27:24 UTC,2019-12-26,14:27:24,0,1100520274200416256,tesmanian_com,Tesmanian.com,,It’s 3.56 seconds 0-60 mph‼️‼️  Tesla Model 3 with $2000 Acceleration Boost Holds Its Own Against Model 3 Performance In Rolling Race  [W/ Video]:  https://t.co/Fju1vuiKYZ,en,[],['https://www.tesmanian.com/blogs/tesmanian-blog/tesla-model-3-with-acceleration-boost-upgrade-does-0-60-mph-in-3-56-secs'],[],1,13,65,[],[],https://twitter.com/Tesmanian_com/status/1210205474403971078,False,,0,,,,,,,,[],,,,,0.015956046,0.7617384,0.22230549
94,1210203276991488000,1210203276991488000,2019-12-26 14:18:40 UTC,2019-12-26,14:18:40,0,2391799280,segozavr,Гурьянов Сергей,,Tesla получила патент на новый химический состав аккумулятора. Столбят поляну перед тем как выкатить акк на 1 миллион миль полета.  https://t.co/XVIQhoc1W1,ru,[],[],['https://pbs.twimg.com/media/EMuBEG2WwAAvVUg.jpg'],2,57,105,[],[],https://twitter.com/Segozavr/status/1210203276991488000,False,,1,https://pbs.twimg.com/media/EMuBEG2WwAAvVUg.jpg,,,,,,,[],,,,,0.064365014,0.8346118,0.1010232
95,1210201072586969089,1210201072586969089,2019-12-26 14:09:54 UTC,2019-12-26,14:09:54,0,2148233600,electrekco,Electrek.co,,"Tesla patents new chemistry for better, longer-lasting and cheaper batteries  https://t.co/TN6eq1HEta by @fredericlambert",en,"[{'screen_name': 'fredericlambert', 'name': 'fred lambert', 'id': '38253449'}]",['https://electrek.co/2019/12/26/tesla-patents-battery-chemistry-cheaper/'],[],20,249,1142,[],[],https://twitter.com/ElectrekCo/status/1210201072586969089,False,,0,,,,,,,,[],,,,,0.0032731735,0.19252509,0.8042016
96,1210196977864126464,1210196977864126464,2019-12-26 13:53:38 UTC,2019-12-26,13:53:38,0,999632398525530114,stevehamel16,Steve Hamel 👀🇺🇦🦊,,Great idea but can you do it WITHOUT using CGI?  $TSLA @Tesla,en,"[{'screen_name': 'tesla', 'name': 'tesla', 'id': '13298072'}]",[],[],17,4,103,[],['tsla'],https://twitter.com/SteveHamel16/status/1210196977864126464,False,https://twitter.com/VWGroup/status/1210154531436273664,0,,,,,,,,[],,,,,0.013686626,0.09388469,0.8924287
97,1210190615905849345,1210190615905849345,2019-12-26 13:28:21 UTC,2019-12-26,13:28:21,0,97530284,awealthofcs,Ben Carlson,,Animal Spirits: The Best Decade in Human History  -A retrospective of the 2018 bear mkt -Why good news makes some ppl so mad -What you can't learn from Peter Lynch -Tesla: braking hearts &amp; brains -Recessionary vs non-recessionary bear mkts &amp; much more   https://t.co/abX7qw0OGj,en,[],['https://awealthofcommonsense.com/2019/12/animal-spirits-the-best-decade-in-human-history/'],[],1,7,52,[],[],https://twitter.com/awealthofcs/status/1210190615905849345,False,,0,,,,,,,,[],,,,,0.21445909,0.4434697,0.3420713
98,1210188362092400648,1210188362092400648,2019-12-26 13:19:24 UTC,2019-12-26,13:19:24,0,52370117,jpr007,JPR007,,"Tesla will deploy a 93 MWh battery in Alaska at the Soldotna Generation Plant, and it is expected to be in service in fall 2021  The BESS will be capable of delivering to the grid at a rate of 46.5 MW   https://t.co/jxwDRt4QqC",en,[],['https://electrek.co/2019/12/17/tesla-big-battery-energy-storage-system-alaska/'],[],2,27,92,[],[],https://twitter.com/jpr007/status/1210188362092400648,False,,0,,,,,,,,[],,,,,0.0034079906,0.6430121,0.35357997
99,1210188041802797057,1210188041802797057,2019-12-26 13:18:08 UTC,2019-12-26,13:18:08,0,1689516060,vincent13031925,vincentyu.eth,,Tesla is already on the way to become the next Tech Giant.,en,[],[],[],13,35,438,[],[],https://twitter.com/vincent13031925/status/1210188041802797057,False,,0,,,,,,,,[],,,,,0.0032701092,0.057671957,0.93905795
100,1210179397556158464,1210179397556158464,2019-12-26 12:43:47 UTC,2019-12-26,12:43:47,0,1689516060,vincent13031925,vincentyu.eth,,It’s 3.56 seconds 0-60 mph‼️‼️  Tesla Model 3 with $2000 Acceleration Boost Holds Its Own Against Model 3 Performance In Rolling Race  [W/ Video]:  https://t.co/CsLMUJBgln  https://t.co/3GeC8ICPGx,en,[],['https://www.tesmanian.com/blogs/tesmanian-blog/tesla-model-3-with-acceleration-boost-upgrade-does-0-60-mph-in-3-56-secs'],['https://pbs.twimg.com/media/EMtrvO6U8AADoHb.jpg'],7,7,90,[],[],https://twitter.com/vincent13031925/status/1210179397556158464,False,,1,https://pbs.twimg.com/media/EMtrvO6U8AADoHb.jpg,,,,,,,[],,,,,0.016606724,0.74464345,0.23874985
101,1210176471278342145,1210176471278342145,2019-12-26 12:32:09 UTC,2019-12-26,12:32:09,0,1689516060,vincent13031925,vincentyu.eth,,YouTube of China Bilibili to be Available for Tesla Owners by Q1 2020  $TSlA #Tesla #China    https://t.co/vhx35YuH71,en,[],['https://www.tesmanian.com/blogs/tesmanian-blog/tesla-bilibili-now-available-multiplayer-games-fsd-preview-smart-summon'],[],3,21,144,"['tesla', 'china']",['tsla'],https://twitter.com/vincent13031925/status/1210176471278342145,False,,0,,,,,,,,[],,,,,0.00648926,0.85641927,0.1370916
102,1210171742343311360,1210171742343311360,2019-12-26 12:13:21 UTC,2019-12-26,12:13:21,0,810726799256809473,tiredearth,Tired Earth,,The Tesla electric vehicle stations in Wokingham are now underwater.  I feel like there is a point about climate change hidden here...   #Tiredearth #ClimateEmergency #ClimateCrisis #ClimateStrike @GretaThunberg #ExtinctionRebellion  https://t.co/n8u2NDVLw5,en,"[{'screen_name': 'gretathunberg', 'name': 'greta thunberg', 'id': '1006419421244678144'}]",[],['https://pbs.twimg.com/media/EMtkyICWsAApMh2.jpg'],12,106,194,"['tiredearth', 'climateemergency', 'climatecrisis', 'climatestrike', 'extinctionrebellion']",[],https://twitter.com/Tiredearth/status/1210171742343311360,False,,1,https://pbs.twimg.com/media/EMtkyICWsAApMh2.jpg,,,,,,,[],,,,,0.7093175,0.27344626,0.01723617
103,1210171678187249664,1210171678187249664,2019-12-26 12:13:06 UTC,2019-12-26,12:13:06,0,1075251170812329984,teslatunnel,Tesla Tunnel,,"Logged on to my $tsla bull burner, saw this, immediately logged off.  Not content with the recent run up, theyre now modeling in Cybercars, Cyberboats, tesla planes and humanoid robot production in 2025 as reasons to buy.  I'm just gonna stick with my $tslaQ goons on Twitter now.  https://t.co/5G7exDkPbL",en,[],[],['https://pbs.twimg.com/media/EMtkuTsWkAAg4UN.jpg'],12,13,75,[],"['tsla', 'tslaq']",https://twitter.com/TeslaTunnel/status/1210171678187249664,False,,1,https://pbs.twimg.com/media/EMtkuTsWkAAg4UN.jpg,,,,,,,[],,,,,0.63694334,0.3224775,0.04057917
104,1210164481864732677,1210164481864732677,2019-12-26 11:44:30 UTC,2019-12-26,11:44:30,0,1614411,edans,Enrique Dans,,"""Tesla: There’s None So Blind As Those Who Will Not See… "", my article on @Forbes   https://t.co/5XlIlYZIVL",en,"[{'screen_name': 'forbes', 'name': 'forbes', 'id': '91478624'}]",['https://www.forbes.com/sites/enriquedans/2019/12/26/tesla-theres-none-so-blind-as-those-who-will-notsee/'],[],13,64,205,[],[],https://twitter.com/edans/status/1210164481864732677,False,,0,,,,,,,,[],,,,,0.052373618,0.80462426,0.14300226
105,1210159320228347904,1210159320228347904,2019-12-26 11:24:00 UTC,2019-12-26,11:24:00,0,1185303145,baba_omoloro,Agboola Peter,,9 movies every ENTREPRENEUR should watch in 2020.   1. Tesla  2. Minari  3. No Bone  4. Coded Bias  5. Like a Boss  6. Red Heaven  7. The Assistant  8. Ford and Ferrari  9. House of Cardin,en,[],[],[],65,1427,3227,[],[],https://twitter.com/baba_Omoloro/status/1210159320228347904,False,,0,,,,,,,,[],,,,,0.00957538,0.49728388,0.49314067
106,1210151643725156352,1210151643725156352,2019-12-26 10:53:30 UTC,2019-12-26,10:53:30,0,258602317,kimpaquette,Kim Paquette 💫🦄 🇺🇦 🕊,,I’ve never understood this logic.   Aren’t you just proving to yourself that you don’t need to lug around that ancient ICE? 🤷‍♀️  Why pay to maintain it? Ditch it and replace with a little more battery. 🔋 🔌 ⚡️ 👍 😎  #ElectricVehicles #BEV #Tesla  $TSLA #PHEVsareobsolete  https://t.co/61xNwOyHFu,en,[],[],['https://pbs.twimg.com/media/EMtSf1wWwAAnFul.jpg'],23,12,189,"['electricvehicles', 'bev', 'tesla', 'phevsareobsolete']",['tsla'],https://twitter.com/kimpaquette/status/1210151643725156352,False,,1,https://pbs.twimg.com/media/EMtSf1wWwAAnFul.jpg,,,,,,,[],,,,,0.64725864,0.3148276,0.03791375
107,1210151574422638592,1210151574422638592,2019-12-26 10:53:13 UTC,2019-12-26,10:53:13,0,2148233600,electrekco,Electrek.co,,10 craziest Tesla Sentry Mode/TeslaCam videos of the year  https://t.co/xqgRIBDazi by @fredericlambert,en,"[{'screen_name': 'fredericlambert', 'name': 'fred lambert', 'id': '38253449'}]",['https://electrek.co/2019/12/26/10-craziest-tesla-sentry-mode-teslacam-videoss/'],[],1,15,86,[],[],https://twitter.com/ElectrekCo/status/1210151574422638592,False,,0,,,,,,,,[],,,,,0.062369008,0.638405,0.2992259
108,1210143282879184896,1210143282879184896,2019-12-26 10:20:16 UTC,2019-12-26,10:20:16,0,999632398525530114,stevehamel16,Steve Hamel 👀🇺🇦🦊,,Shorts are so fucked!  They simply don't comprehend or pretend to not understand the power of Tesla Vision and neural net.  $TSLA @elonmusk  @karpathy   Bravo!,en,"[{'screen_name': 'elonmusk', 'name': 'elon musk', 'id': '44196397'}, {'screen_name': 'karpathy', 'name': 'andrej karpathy', 'id': '33836629'}]",[],[],5,7,53,[],['tsla'],https://twitter.com/SteveHamel16/status/1210143282879184896,False,https://twitter.com/ray4tesla/status/1205903572711301120,0,,,,,,,,[],,,,,0.7233356,0.18400571,0.09265862
109,1210142251512283138,1210142251512283138,2019-12-26 10:16:10 UTC,2019-12-26,10:16:10,0,1132801218424655872,tesla4k,Legacy 🚗 is f**ked,,"I hope Tesla disrupts the housing industry eventually.  I would so love to buy a modular stainless steel house with transparent metal glass that is fireproof, earthquake-proof, is super energy-efficient, and comes with a solar roof.  @elonmusk",en,"[{'screen_name': 'elonmusk', 'name': 'elon musk', 'id': '44196397'}]",[],[],6,11,74,[],[],https://twitter.com/tesla4k/status/1210142251512283138,False,,0,,,,,,,,[],,,,,0.0073078084,0.051640328,0.941052
110,1210131768092712961,1210131768092712961,2019-12-26 09:34:31 UTC,2019-12-26,09:34:31,0,1158945479603806210,amihiro44,あみひろ@旅する管理栄養士🐈,,"テスラのブーブー 666,666 RUB 🇷🇺  日本円で 118万...  安いの高いの？  🥺🚗  Russian-Style 'Tesla Cybertruck' to be Sold for 666,666 Roubles - Reports:   https://t.co/FelWJBBgcr",ja,[],['https://sputniknews.com/russia/201912251077828891-russian-style-tesla-cybertruck-to-be-sold-for-666666-roubles---reports/'],[],6,2,62,[],[],https://twitter.com/amihiro44/status/1210131768092712961,False,,0,,,,,,,,[],,,,,0.020941632,0.92618775,0.052870665
111,1210127515508969476,1210127515508969476,2019-12-26 09:17:37 UTC,2019-12-26,09:17:37,0,2794694279,lgoony,✨LGOONY✨,,was ich zu weihnachten bekommen habe  -plasma tv 98 zoll -tesla cybertruck mattschwarz -gutschein für flug ins all -rolex aus münchen -nebenrolle in hollywood blockbuster  was ich lieber bekommen hätte  -liebe -zuneigung -nette worte -eine umarmung -ein lächeln -socken  😢,de,[],[],[],27,118,2316,[],[],https://twitter.com/LGoony/status/1210127515508969476,False,,0,,,,,,,,[],,,,,0.18649557,0.7189127,0.09459175
112,1210123681650708481,1210123681650708481,2019-12-26 09:02:23 UTC,2019-12-26,09:02:23,0,891639881075576832,smallmonkyjdee,small monkey john d.,,tweeting @elonmusk  everyday until he gives a small monky a big tesla (day one),en,"[{'screen_name': 'elonmusk', 'name': 'elon musk', 'id': '44196397'}]",[],[],2,5,151,[],[],https://twitter.com/smallmonkyjdee/status/1210123681650708481,False,,0,,,,,,,,[],,,,,0.035608463,0.74709624,0.21729529
113,1210120727048970241,1210120727048970241,2019-12-26 08:50:38 UTC,2019-12-26,08:50:38,0,1214284580,hein_the_slayer,Renaissance Man 👀🦊 🌍 🤝🏼 🇺🇦,,"So... The Burning Question that confounds the analysts &amp; has the  naysayers' short positions on 🔥🔥  What type of business is Tesla? Is it a car co? Software? New Energy? Or is the product The Machine that Builds The Machine, Sprung Structure included?🤔   https://t.co/R2AetdQWME",en,[],['https://www.forbes.com/sites/ciocentral/2019/05/20/why-tesla-is-not-a-car-company-and-what-you-can-learn-from-elon-musk/'],[],4,6,70,[],[],https://twitter.com/Hein_The_Slayer/status/1210120727048970241,False,,0,,,,,,,,[],,,,,0.077681035,0.88340116,0.03891778
114,1210116629696147457,1210116629696147457,2019-12-26 08:34:22 UTC,2019-12-26,08:34:22,0,3168095167,cherrie_jay,Jay Cherrie,,My @Tesla has tried to kill me three times now in two days with sharp multi-lane changes on autopilot. My friends with a much cheaper Leaf are laughing their butts off ‘cause their auto steer works. #tesla #autopilot,en,"[{'screen_name': 'tesla', 'name': 'tesla', 'id': '13298072'}]",[],[],27,30,95,"['tesla', 'autopilot']",[],https://twitter.com/cherrie_jay/status/1210116629696147457,False,,0,,,,,,,,[],,,,,0.8819869,0.097859636,0.020153396
115,1210112883989909505,1210112883989909505,2019-12-26 08:19:29 UTC,2019-12-26,08:19:29,0,700107542052130816,wafvla,Wafula,,"What do y'all do on boxing day?  I would like to thank my pal Dave  for letting me use his Tesla and beach house this year, while my Honda was at the shop and my house was getting fixed up, you really helped me get back up on my feet.. 🚶🏻🚶🏻",en,[],[],[],1,43,55,[],[],https://twitter.com/Wafvla/status/1210112883989909505,False,,0,,,,,,,,[],,,,,0.005510907,0.11740754,0.8770816
116,1210108259828256768,1210108259828256768,2019-12-26 08:01:06 UTC,2019-12-26,08:01:06,0,1064407014472744960,theinsaneapp,Insane,,Cyberhouse For #Tesla #Cybertruck  Note: Link will work only on Android Devices  Cc: @MikeQuindazzi @andy_fitze @evankirstel @jblefevre60 @SwissCognitive @KirkDBorne @ipfconline1 @fogoros @JohnNosta @digitalcloudgal @elonmusk @GlennGilmore @mvollmer1 @rvp   https://t.co/e9j2cYTidP,en,"[{'screen_name': 'mikequindazzi', 'name': 'mike quindazzi ✨', 'id': '2344530218'}, {'screen_name': 'andy_fitze', 'name': 'the ai andy fitze', 'id': '3335731978'}, {'screen_name': 'evankirstel', 'name': '🇺🇦evan kirstel #techfluencer', 'id': '35203319'}, {'screen_name': 'jblefevre60', 'name': 'jean-baptiste lefevre 🇺🇦', 'id': '4374719908'}, {'screen_name': 'swisscognitive', 'name': 'swisscognitive, world-leading ai network', 'id': '808051518242979841'}, {'screen_name': 'kirkdborne', 'name': 'kirk borne', 'id': '534563976'}, {'screen_name': 'ipfconline1', 'name': 'ipfconline 🇺🇦', 'id': '705539763349164032'}, {'screen_name': 'fogoros', 'name': 'lucian fogoros, #dtech2022 #hm22', 'id': '19341361'}, {'screen_name': 'johnnosta', 'name': 'john nosta', 'id': '19711691'}, {'screen_name': 'digitalcloudgal', 'name': 'jo peterson', 'id': '3497268500'}, {'screen_name': 'elonmusk', 'name': 'elon musk', 'id': '44196397'}, {'screen_name': 'glenngilmore', 'name': 'glenn gilmore', 'id': '381801071'}, {'screen_name': 'mvollmer1', 'name': 'dr. marcell vollmer 🇺🇦 #staysafe & carpe diem', 'id': '99674560'}, {'screen_name': 'rvp', 'name': 'ravi visvesvaraya sharada prasad, telecom infotech', 'id': '13584132'}]",['https://insaneapp.page.link/UPnrrdTaeeHiig2U8'],[],1,46,68,"['tesla', 'cybertruck']",[],https://twitter.com/TheInsaneApp/status/1210108259828256768,False,,0,,,,,,,,[],,,,,0.0061422763,0.8698258,0.12403185
117,1210106520731451392,1210106520731451392,2019-12-26 07:54:11 UTC,2019-12-26,07:54:11,0,1139310453987745792,thirdrowtesla,Third Row Tesla Podcast,,Tesla appears to have activated Autopilot dual redundancy for the FSD chip in the latest update @elonmusk @Tesla @karpathy    https://t.co/FeZC01XS4c,en,"[{'screen_name': 'elonmusk', 'name': 'elon musk', 'id': '44196397'}, {'screen_name': 'tesla', 'name': 'tesla', 'id': '13298072'}, {'screen_name': 'karpathy', 'name': 'andrej karpathy', 'id': '33836629'}]",['https://wholemars.net/2019/12/25/autopilot-dual-redundancy-activated-in-latest-update/'],[],3,24,165,[],[],https://twitter.com/thirdrowtesla/status/1210106520731451392,False,,0,,,,,,,,[],,,,,0.0033540616,0.75818485,0.23846097
118,1210099568249053184,1210099568249053184,2019-12-26 07:26:34 UTC,2019-12-26,07:26:34,0,64643056,rt_com,RT,,"This Russian bootleg ‘#Tesla Cybertruck’ goes on SALE for 666,666 rubles  DETAILS:  https://t.co/UFx4adKI4P  https://t.co/S1GnDy0RPQ",en,[],['https://on.rt.com/a7xc'],[],16,58,150,['tesla'],[],https://twitter.com/RT_com/status/1210099568249053184,False,,1,https://pbs.twimg.com/media/EMd7whhX0AAt_B0.jpg,,,,,,,[],,,,,0.04127491,0.8992126,0.059512556
119,1210098592192454656,1210098592192454656,2019-12-26 07:22:41 UTC,2019-12-26,07:22:41,0,121291726,nukem384,Darrell - MR Model 3 Youtuber,,"Thank you @elonmusk and @tesla for making the #model3 cold night after spending the holiday with family. Turn the car heat, seat heat and unfog window all from the app. Car is toasty warm when we get to it and ready to go! What other car can do that? #tesla #teslamodel3",en,"[{'screen_name': 'elonmusk', 'name': 'elon musk', 'id': '44196397'}, {'screen_name': 'tesla', 'name': 'tesla', 'id': '13298072'}]",[],[],6,4,67,"['model3', 'tesla', 'teslamodel3']",[],https://twitter.com/nukem384/status/1210098592192454656,False,,0,,,,,,,,[],,,,,0.0064603896,0.056503236,0.93703634
120,1210096537067376641,1210096537067376641,2019-12-26 07:14:31 UTC,2019-12-26,07:14:31,0,892973250501685248,teslarun,Objective Critique🧨🚀,,"[Breaking]:  2015: All-Competition is coming🤣 2018: JP Morgan-Competition is coming🤣 12/2019: Morgan Stanley: Competition is coming 12/2019: FoxBusiness: Rivian threat to #Tesla 2021: Competition is coming 2025: Competition is coming, almost there 2030: Competition is coming  https://t.co/rYzgsuDi8u",en,[],[],['https://pbs.twimg.com/media/EMsgYY0UUAETmw0.jpg'],9,16,87,['tesla'],[],https://twitter.com/TeslaRun/status/1210096537067376641,False,,1,https://pbs.twimg.com/media/EMsgYY0UUAETmw0.jpg,,,,,,,[],,,,,0.06829267,0.77437234,0.15733495
121,1210092145471901696,1210092145471901696,2019-12-26 06:57:04 UTC,2019-12-26,06:57:04,0,783475735,nuovarealta,≡LIᔕABETh,,"This guy hasn’t understood a thing about Tesla... 🤦‍♀️   all Maybachs will be Museum objects in a decade, and most MBs too. Tesla isn’t simply a car manufacturer, it’s asset is the tech that MB doesn’t have.   That’s why $TSLA value &gt; MB.",en,[],[],[],6,10,59,[],['tsla'],https://twitter.com/NuovaRealta/status/1210092145471901696,False,https://twitter.com/YCalenge/status/1209424426904801280,0,,,,,,,,[],,,,,0.5374392,0.39882258,0.063738264
122,1210090515414372352,1210090515414372352,2019-12-26 06:50:35 UTC,2019-12-26,06:50:35,0,781930918739083264,iliketeslas,i like teslas,,I'm not to sure Elon and Tesla would have worked as hard as they did if $tslaq didn't exist. There has always been this thing about proving haters wrong. $tsla,en,[],[],[],7,7,101,[],"['tslaq', 'tsla']",https://twitter.com/iliketeslas/status/1210090515414372352,False,,0,,,,,,,,[],,,,,0.49510768,0.42202717,0.08286513
123,1210082518583533569,1210082518583533569,2019-12-26 06:18:49 UTC,2019-12-26,06:18:49,0,1035800996214013953,tesla_china,Teslas in Shanghai 🇨🇳 🚗⚡,,Tencent's investment in Tesla is up $2 billion since June !  $tcehy $tsla #tencent #tesla #wechat #特斯拉,en,[],[],[],6,23,128,"['tencent', 'tesla', 'wechat', '特斯拉']","['tcehy', 'tsla']",https://twitter.com/tesla_china/status/1210082518583533569,False,,0,,,,,,,,[],,,,,0.0040243254,0.17817196,0.8178037
124,1210076810756677632,1210076810756677632,2019-12-26 05:56:08 UTC,2019-12-26,05:56:08,0,455275940,somi_teslagirl,Tesla Girl 🇨🇦,,"Started my holiday road trip today. Giving camp mode a try at a rest stop and look at what just came up onscreen about 10 minutes in!!   Haha! Good one, @Tesla! Merry Christmas to you too. @elonmusk you keep making me fall in love with this car!! TY for all you do!! ❤️  https://t.co/rH6rei0EjX",en,"[{'screen_name': 'tesla', 'name': 'tesla', 'id': '13298072'}, {'screen_name': 'elonmusk', 'name': 'elon musk', 'id': '44196397'}]",[],[],11,49,368,[],[],https://twitter.com/somi_teslagirl/status/1210076810756677632,False,,1,https://pbs.twimg.com/ext_tw_video_thumb/1210076775788744704/pu/img/i1Ble30XMEgW0huY.jpg,,,,,,,[],,,,,0.0023226838,0.013925122,0.98375213
125,1210070431400628225,1210070431400628225,2019-12-26 05:30:47 UTC,2019-12-26,05:30:47,0,1278689574,rmattila74,Riku Mattila 🇫🇮 🇪🇺 🇺🇦,,Why is Youtube allowing Tesla owners to post product endorsements for free? This is giving Tesla an unfair advantage over the non-niche automakers!,en,[],[],[],13,6,73,[],[],https://twitter.com/rmattila74/status/1210070431400628225,False,,0,,,,,,,,[],,,,,0.804332,0.18174744,0.013920481
126,1210063687278563328,1210063657075462146,2019-12-26 05:03:59 UTC,2019-12-26,05:03:59,0,951357527501008896,dappergander,Feminist Proper Gander,,Your meemaw is now talking about free Tesla energy and clones and orbital lasers and Pleiadians in the same breath as the Second Coming and the defeat of the antichrist. This was *unthinkable* two years ago.  https://t.co/hvjYS0EFo7,en,[],[],['https://pbs.twimg.com/media/EMsCgpnXkAEcZ_K.png'],4,5,92,[],[],https://twitter.com/dappergander/status/1210063687278563328,False,,1,https://pbs.twimg.com/media/EMsCgpnXkAEcZ_K.png,,,,,,,[],,,,,0.4193852,0.48843107,0.09218381
127,1210060426194513920,1210060426194513920,2019-12-26 04:51:02 UTC,2019-12-26,04:51:02,0,126725052,cvanderstock,Chris Vanderstock #EVtax #HighCourtChallenge,,My dad experiencing Autopilot for the first time. 😆🤣😎 #Model3Au #tesla  https://t.co/44oOuZbDFN,en,[],[],[],20,38,457,"['model3au', 'tesla']",[],https://twitter.com/cvanderstock/status/1210060426194513920,False,,1,https://pbs.twimg.com/ext_tw_video_thumb/1210060199555297280/pu/img/JXAvusMl1QMY5AHk.jpg,,,,,,,[],,,,,0.0040697167,0.11502376,0.8809066
