,id,conversation_id,created_at,date,time,timezone,user_id,username,name,place,tweet,language,mentions,urls,photos,replies_count,retweets_count,likes_count,hashtags,cashtags,link,retweet,quote_url,video,thumbnail,near,geo,source,user_rt_id,user_rt,retweet_id,reply_to,retweet_date,translate,trans_src,trans_dest,negative,neutral,positive
0,1099453902242496513,1099453902242496513,2019-02-23 23:40:11 UTC,2019-02-23,23:40:11,0,1016059981907386368,teslaownerssv,Tesla Owners Silicon Valley,,The walk through of the model X. @tesla Wowzzzzaaaaa  https://t.co/Oad3f2uZa8,en,"[{'screen_name': 'tesla', 'name': 'tesla', 'id': '13298072'}]",[],[],15,15,166,[],[],https://twitter.com/teslaownersSV/status/1099453902242496513,False,,1,https://pbs.twimg.com/ext_tw_video_thumb/1099453796290154496/pu/img/ldZQZeM1d5qNzPiX.jpg,,,,,,,[],,,,,0.0027438332,0.0903395,0.9069167
1,1099453099825975301,1099453099825975301,2019-02-23 23:37:00 UTC,2019-02-23,23:37:00,0,1016059981907386368,teslaownerssv,Tesla Owners Silicon Valley,,Figured out the Christmas music light show. @tesla 🔥🔥🔥  https://t.co/4Av87HhNlo,en,"[{'screen_name': 'tesla', 'name': 'tesla', 'id': '13298072'}]",[],[],7,8,100,[],[],https://twitter.com/teslaownersSV/status/1099453099825975301,False,,1,https://pbs.twimg.com/ext_tw_video_thumb/1099452869357428737/pu/img/TptP8qXJkQgUEH8n.jpg,,,,,,,[],,,,,0.0036566146,0.1723656,0.8239778
2,1099451928390467584,1099451928390467584,2019-02-23 23:32:21 UTC,2019-02-23,23:32:21,0,535862987,castro_turf,Cam Castro,,"First day on the new job, check.   Ride in a Tesla for the first time, also check.  https://t.co/jfiMzHxNfp",en,[],[],"['https://pbs.twimg.com/media/D0IJoixVsAAv2uR.jpg', 'https://pbs.twimg.com/media/D0IJoiwVAAANE44.jpg']",4,0,94,[],[],https://twitter.com/Castro_Turf/status/1099451928390467584,False,,1,https://pbs.twimg.com/media/D0IJoixVsAAv2uR.jpg,,,,,,,[],,,,,0.028315136,0.83734375,0.13434121
3,1099449298473885696,1099449298473885696,2019-02-23 23:21:54 UTC,2019-02-23,23:21:54,0,60840767,zshahan3,Zachary Shahan,,#Tesla Winning  @Tesla @ElonMusk @woodhaus2 @mayemusk,en,"[{'screen_name': 'tesla', 'name': 'tesla', 'id': '13298072'}, {'screen_name': 'elonmusk', 'name': 'elon musk', 'id': '44196397'}, {'screen_name': 'woodhaus2', 'name': 'franz von holzhausen', 'id': '55769345'}, {'screen_name': 'mayemusk', 'name': 'maye musk', 'id': '14171401'}]",[],[],1,22,107,['tesla'],[],https://twitter.com/zshahan3/status/1099449298473885696,False,https://twitter.com/cleantechnica/status/1099441422699245568,0,,,,,,,,[],,,,,0.002585863,0.076864675,0.9205494
4,1099441422699245568,1099441422699245568,2019-02-23 22:50:36 UTC,2019-02-23,22:50:36,0,17060015,cleantechnica,CleanTechnica,,Tesla Model 3 Was Top Selling Car In California In 2nd Half Of 2018 — CleanTechnica Report  https://t.co/cpVlodpbZr  https://t.co/ZaAAkHFVlg,en,[],['https://cleantechnica.com/2019/02/23/tesla-model-3-was-top-selling-car-in-california-in-2nd-half-of-2018-cleantechnica-report/'],['https://pbs.twimg.com/media/D0IAJahWkAAE3uI.png'],4,46,182,[],[],https://twitter.com/cleantechnica/status/1099441422699245568,False,,1,https://pbs.twimg.com/media/D0IAJahWkAAE3uI.png,,,,,,,[],,,,,0.003503689,0.3864037,0.6100926
5,1099438615686344705,1099085597048594432,2019-02-23 22:39:27 UTC,2019-02-23,22:39:27,0,788294514184249344,realchaozhou,Chao Zhou 🧢 🔥🔥🔥,,"@elonmusk Say freaking nice to awesome Meme Elon from Tesla Gigafactory in China. I am only one here reporting live video for you guys. Welcome to follow my Twitter account and YouTube Channel, you will see some factory cool stuff out there in recent couple weeks.  https://t.co/dIpeTSpZh3  https://t.co/25UMHA5HkE",en,[],['https://www.youtube.com/channel/UCXOVZPauzvf1PCJI8Xw0a_A'],[],19,19,133,[],[],https://twitter.com/realChaoZhou/status/1099438615686344705,False,,1,https://pbs.twimg.com/ext_tw_video_thumb/1099438409209147392/pu/img/sKtUXhO6RYek2YA6.jpg,,,,,,,"[{'screen_name': 'elonmusk', 'name': 'Elon Musk', 'id': '44196397'}]",,,,,0.0033588666,0.025593314,0.9710478
6,1099434769832644609,1099434769832644609,2019-02-23 22:24:10 UTC,2019-02-23,22:24:10,0,880602945632575488,thequartering,TheQuartering,,"People ask me all the time what my wife thinks of this YT game. She is a women, with a degree chemistry degree, no scholarships who in her spare time got her pilots license and just bought a tesla....essentially I am married to a beautiful narrative breaking SJW kryptonite pile.  https://t.co/O7gBkjf8qj",en,[],[],['https://pbs.twimg.com/media/D0H6F83WwAAC9T1.jpg'],71,34,823,[],[],https://twitter.com/TheQuartering/status/1099434769832644609,False,,1,https://pbs.twimg.com/media/D0H6F83WwAAC9T1.jpg,,,,,,,[],,,,,0.06335969,0.50456744,0.4320729
7,1099432345323687936,1099432345323687936,2019-02-23 22:14:32 UTC,2019-02-23,22:14:32,0,1019985498662670337,pluginfud,Elmer Spud,,Tesla ownership experience rapidly deteriorating further. so much sus stuff goin on here.  best read in its entirety.  $tsla $tslaq    https://t.co/VSowasXSgY  https://t.co/WEE1vR1niW,en,[],['https://forums.tesla.com/forum/forums/model-3-dying-me'],"['https://pbs.twimg.com/media/D0H3kw8XgAUA-iZ.png', 'https://pbs.twimg.com/media/D0H33d6WsAESesv.png']",17,15,59,[],"['tsla', 'tslaq']",https://twitter.com/PlugInFUD/status/1099432345323687936,False,,1,https://pbs.twimg.com/media/D0H3kw8XgAUA-iZ.png,,,,,,,[],,,,,0.882545,0.10152944,0.01592571
8,1099428748645027841,1099428748645027841,2019-02-23 22:00:14 UTC,2019-02-23,22:00:14,0,9300262,politico,POLITICO,,"Analysis: If California is a socialist hellhole, it’s a socialist hellhole that somehow nurtured Apple, Google, Facebook, Tesla, Uber, Netflix, Oracle and Intel, not to mention old-economy stalwarts like Chevron, Disney, Wells Fargo and the film industry  https://t.co/pOKjXZFde5",en,[],['https://politi.co/2SR5phj'],[],227,911,2160,[],[],https://twitter.com/politico/status/1099428748645027841,False,,0,,,,,,,,[],,,,,0.72535956,0.2559667,0.018673588
9,1099427893262802944,1099427893262802944,2019-02-23 21:56:50 UTC,2019-02-23,21:56:50,0,1016059981907386368,teslaownerssv,Tesla Owners Silicon Valley,,It's coming and in my Tesla app.  https://t.co/9bigcnhBtw,en,[],[],['https://pbs.twimg.com/media/D0Hz1vlVAAUWkiQ.jpg'],11,3,67,[],[],https://twitter.com/teslaownersSV/status/1099427893262802944,False,,1,https://pbs.twimg.com/media/D0Hz1vlVAAUWkiQ.jpg,,,,,,,[],,,,,0.0035614616,0.58882266,0.40761587
10,1099424527690264576,1099424527690264576,2019-02-23 21:43:28 UTC,2019-02-23,21:43:28,0,842824397496836096,skabooshka,skabooshka,,"Tesla continues to rip-off customers by trying to sell USED Model 3s as if they were NEW. What is important is that this bait-and-switch is not a one-off, but a practice that began since at least Q4.   note: in both reports, the odometer displayed ~1,500 miles.  h/t @PlugInFUD  https://t.co/90QLeBFN1w",en,"[{'screen_name': 'pluginfud', 'name': 'elmer spud', 'id': '1019985498662670337'}]",[],"['https://pbs.twimg.com/media/D0HtKrRUcAAXxse.jpg', 'https://pbs.twimg.com/media/D0HtOFfU0AAcC9K.jpg']",14,22,98,[],[],https://twitter.com/skabooshka/status/1099424527690264576,False,,1,https://pbs.twimg.com/media/D0HtKrRUcAAXxse.jpg,,,,,,,[],,,,,0.5446519,0.42311907,0.032228976
11,1099423996364214273,1099423996364214273,2019-02-23 21:41:21 UTC,2019-02-23,21:41:21,0,395052957,yoshi_sudarso,Yoshi Sudarso 🐉,,"Sooooooo, I’m really excited about this. I’ve wanted a @Tesla for so long but always thought it was out of reach. Yesterday, my brand new 2019 Model 3 got delivered to my house! This is the first car I’ve ever CHOSEN, I’m in love, wecome to the family, Tifa Sudarso!!  https://t.co/Ui6bvVm2tJ",en,"[{'screen_name': 'tesla', 'name': 'tesla', 'id': '13298072'}]",[],"['https://pbs.twimg.com/media/D0HvsoEVYAASGEP.jpg', 'https://pbs.twimg.com/media/D0HvspYV4AEWY6B.jpg', 'https://pbs.twimg.com/media/D0HvsqIUcAAHM54.jpg']",35,37,638,[],[],https://twitter.com/yoshi_sudarso/status/1099423996364214273,False,,1,https://pbs.twimg.com/media/D0HvsoEVYAASGEP.jpg,,,,,,,[],,,,,0.0031901225,0.009381234,0.98742867
12,1099421648074231809,1099421648074231809,2019-02-23 21:32:01 UTC,2019-02-23,21:32:01,0,501077161,trobbu,Trobbu | Thomas,,Werde diesen Tag niemals vergessen! Bin nun stolzer Besitzer eines Tesla Model 3 Performance 😍  https://t.co/wOEqRapWav,de,[],[],"['https://pbs.twimg.com/media/D0HuKErX4AAfC0U.jpg', 'https://pbs.twimg.com/media/D0HuKEmXQAAUclF.jpg']",15,9,249,[],[],https://twitter.com/trobbu/status/1099421648074231809,False,,1,https://pbs.twimg.com/media/D0HuKErX4AAfC0U.jpg,,,,,,,[],,,,,0.0031673228,0.028963147,0.9678694
13,1099409039643951104,1099409039643951104,2019-02-23 20:41:55 UTC,2019-02-23,20:41:55,0,1016059981907386368,teslaownerssv,Tesla Owners Silicon Valley,,Once you get a @tesla it's a matter of time before you get a second one,en,"[{'screen_name': 'tesla', 'name': 'tesla', 'id': '13298072'}]",[],[],11,8,79,[],[],https://twitter.com/teslaownersSV/status/1099409039643951104,False,,0,,,,,,,,[],,,,,0.06266499,0.75014263,0.1871922
14,1099403374095519744,1099394426294714372,2019-02-23 20:19:24 UTC,2019-02-23,20:19:24,0,1720701343,zacksjerryrig,JerryRigEverything,,@whatsinside @Tesla @elonmusk Is it permanent?,in,[],[],[],4,2,253,[],[],https://twitter.com/ZacksJerryRig/status/1099403374095519744,False,,0,,,,,,,,"[{'screen_name': 'whatsinside', 'name': ""WHAT'S INSIDE?"", 'id': '3239203002'}, {'screen_name': 'Tesla', 'name': 'Tesla', 'id': '13298072'}, {'screen_name': 'elonmusk', 'name': 'Elon Musk', 'id': '44196397'}]",,,,,0.014382156,0.9603986,0.025219323
15,1099399453599924224,1099399453599924224,2019-02-23 20:03:50 UTC,2019-02-23,20:03:50,0,4852289459,theteslalife,TheTeslaLife,,"Another car thief was arrested in California after stealing a #Tesla and being tracked by the owner with the APP, relaying info to police  https://t.co/t0JaiOykWS  https://t.co/2yEAUZF3l6",en,[],['https://electrek.co/2019/02/23/tesla-stolen-tracked-app-ran-out-power-police-chase/'],['https://pbs.twimg.com/media/D0HZ-UIV4AAUlSh.jpg'],10,20,134,['tesla'],[],https://twitter.com/TheTeslaLife/status/1099399453599924224,False,,1,https://pbs.twimg.com/media/D0HZ-UIV4AAUlSh.jpg,,,,,,,[],,,,,0.45957083,0.5238225,0.016606653
16,1099394426294714372,1099394426294714372,2019-02-23 19:43:51 UTC,2019-02-23,19:43:51,0,3239203002,whatsinside,WHAT'S INSIDE?,,There is a number hidden/etched into my @Tesla screen. I feel like it’s an @elonmusk Easter egg. 69  https://t.co/8yLWXK2yA4,en,"[{'screen_name': 'tesla', 'name': 'tesla', 'id': '13298072'}, {'screen_name': 'elonmusk', 'name': 'elon musk', 'id': '44196397'}]",[],['https://pbs.twimg.com/media/D0HVZYCX4AETt03.jpg'],31,19,512,[],[],https://twitter.com/whatsinside/status/1099394426294714372,False,,1,https://pbs.twimg.com/media/D0HVZYCX4AETt03.jpg,,,,,,,[],,,,,0.13511315,0.7088663,0.15602055
17,1099388528448819201,1099388528448819201,2019-02-23 19:20:25 UTC,2019-02-23,19:20:25,0,755109517612810240,sensarpensar,Spencer,,"If you own a Tesla or an EV, will you ever buy an ICE car again? If you don’t own an EV, what will your next car be. Retweet this please #Tesla $TSLA @Tesla @ValueAnalyst1 @teslaownersSV @tesla_truth @vincent13031925 @elonmusk @Teslarati @Model3Owners",en,"[{'screen_name': 'tesla', 'name': 'tesla', 'id': '13298072'}, {'screen_name': 'valueanalyst1', 'name': 'yaman tasdivar', 'id': '732548050728701953'}, {'screen_name': 'teslaownerssv', 'name': 'tesla owners silicon valley', 'id': '1016059981907386368'}, {'screen_name': 'tesla_truth', 'name': 'steve jobs ghost 👻', 'id': '1067553335970955264'}, {'screen_name': 'vincent13031925', 'name': 'vincentyu.eth', 'id': '1689516060'}, {'screen_name': 'elonmusk', 'name': 'elon musk', 'id': '44196397'}, {'screen_name': 'teslarati', 'name': 'teslarati', 'id': '1308211178'}, {'screen_name': 'model3owners', 'name': 'trev page', 'id': '704835627183788032'}]",[],[],29,60,75,['tesla'],['tsla'],https://twitter.com/sensarpensar/status/1099388528448819201,False,,0,,,,,,,,[],,,,,0.02281001,0.8075242,0.16966572
18,1099386082196623362,1099386082196623362,2019-02-23 19:10:42 UTC,2019-02-23,19:10:42,0,737950399,hitchariide,OpTic Hitch,,David Dobrik collab'd with Lil Pump and by collab I mean screamed Lips Of An Angel at him in the front seat of a tesla.   it might be the best collab I've ever seen,en,[],[],[],5,39,718,[],[],https://twitter.com/hitchariide/status/1099386082196623362,False,,0,,,,,,,,[],,,,,0.0029475011,0.02006229,0.9769902
19,1099373878231601153,1099373878231601153,2019-02-23 18:22:12 UTC,2019-02-23,18:22:12,0,258602317,kimpaquette,Kim Paquette 💫🦄 🇺🇦 🕊,,"A must read: ""Germany’s car giants bet so heavily on diesel – helped in part by falsified emissions data – that they failed to grasp the changes on the horizon."" #Tesla $TSLA  https://t.co/GXy6DUfb41",en,[],['https://www.handelsblatt.com/24026414.html?share=twitter'],[],9,49,169,['tesla'],['tsla'],https://twitter.com/kimpaquette/status/1099373878231601153,False,,0,,,,,,,,[],,,,,0.45229897,0.47867313,0.069027886
20,1099365318315651073,1099365318315651073,2019-02-23 17:48:11 UTC,2019-02-23,17:48:11,0,824107409723588608,itskimjava,It’s Kim Java,,Someone please pinch me... we’ve driven over 100k EV miles! I’m sharing some of my tips in this road trip vlog. Video is live! #Tesla #LikeTesla #ModelS #ModelX #Model3 LINK:  https://t.co/hIfwpaCz9N  https://t.co/1K7zvdlrZd,en,[],['https://youtu.be/zat5DcYmwnw'],['https://pbs.twimg.com/media/D0G67dLWwAEHexZ.jpg'],9,6,223,"['tesla', 'liketesla', 'models', 'modelx', 'model3']",[],https://twitter.com/ItsKimJava/status/1099365318315651073,False,,1,https://pbs.twimg.com/media/D0G67dLWwAEHexZ.jpg,,,,,,,[],,,,,0.045774244,0.29129174,0.66293406
21,1099360033064787968,1099360033064787968,2019-02-23 17:27:11 UTC,2019-02-23,17:27:11,0,2148233600,electrekco,Electrek.co,,Stolen Tesla was tracked through app until it ran out of power after police chase  https://t.co/eTv9tXixVd by @fredericlambert  https://t.co/vBnVpFmKjt,en,"[{'screen_name': 'fredericlambert', 'name': 'fred lambert', 'id': '38253449'}]",['https://electrek.co/2019/02/23/tesla-stolen-tracked-app-ran-out-power-police-chase/'],['https://pbs.twimg.com/media/D0G2H5RWsAEE-uN.jpg'],15,63,413,[],[],https://twitter.com/ElectrekCo/status/1099360033064787968,False,,1,https://pbs.twimg.com/media/D0G2H5RWsAEE-uN.jpg,,,,,,,[],,,,,0.28857997,0.69341105,0.018009014
22,1099359026171719680,1099359026171719680,2019-02-23 17:23:11 UTC,2019-02-23,17:23:11,0,64954895,quirkyllama,🐐QuirkyLlama😾🎩,,"One month after Elon announced FSD-capable HW in all Tesla vehicles, the director of AutoPilot left to start his own FSD company (Aurora). Interesting fact- that company's approach uses LIDAR.",en,[],[],[],5,13,67,[],[],https://twitter.com/quirkyllama/status/1099359026171719680,False,https://twitter.com/jasonsbishop/status/1099136467979268096,0,,,,,,,,[],,,,,0.004293379,0.46405908,0.5316474
23,1099339327778287617,1099339327778287617,2019-02-23 16:04:55 UTC,2019-02-23,16:04:55,0,34713362,business,Bloomberg,,It’s all-electric like a Tesla. It’s priced like a Ford Fiesta  https://t.co/5hB0wZDEkY,en,[],['https://bloom.bg/2E4qH0A'],[],24,50,98,[],[],https://twitter.com/business/status/1099339327778287617,False,,0,,,,,,,,[],,,,,0.020668468,0.6529968,0.32633477
24,1099337348632977408,1099337348632977408,2019-02-23 15:57:03 UTC,2019-02-23,15:57:03,0,34855990,casio_juarez,sabbatical but for shitposting,,New Tesla autopilot prototype spotted.  Pros: is a very good boy Cons: is easily distracted by squirrels  https://t.co/DF22s5cypC,en,[],[],['https://pbs.twimg.com/media/D0GhIqnXgAAFXAO.jpg'],5,6,65,[],[],https://twitter.com/casio_juarez/status/1099337348632977408,False,,1,https://pbs.twimg.com/media/D0GhIqnXgAAFXAO.jpg,,,,,,,[],,,,,0.013793447,0.12562996,0.8605766
25,1099336256377372672,1099336256377372672,2019-02-23 15:52:42 UTC,2019-02-23,15:52:42,0,128288109,danahull,Dana “Resilience Fatigue” Hull 👩🏻‍💻,,I didn’t see a single Tesla during my week in Manhattan. Now I’m back in the Bay Area bubble,en,[],[],[],61,8,127,[],[],https://twitter.com/danahull/status/1099336256377372672,False,,0,,,,,,,,[],,,,,0.3270683,0.569228,0.10370373
26,1099335845776101376,1099333846464643073,2019-02-23 15:51:04 UTC,2019-02-23,15:51:04,0,2223516397,nurodev,Ben,,@MKBHD Smart 👍 Guessing you're going to go for SolarCity and a Tesla Powerwall?,en,[],[],[],1,0,183,[],[],https://twitter.com/nurodev/status/1099335845776101376,False,,0,,,,,,,,"[{'screen_name': 'MKBHD', 'name': 'Marques Brownlee', 'id': '29873662'}]",,,,,0.0065722973,0.36948282,0.62394494
27,1099329434711220225,1099329434711220225,2019-02-23 15:25:36 UTC,2019-02-23,15:25:36,0,922306317292773377,model3vins,Model 3 VINs,,#Tesla registered 365 new #Model3 VINs. ~4% estimated to be dual motor. ~100% estimated to be International. Highest VIN is 295234.  https://t.co/nx3OJloco3,en,[],['https://www.nhtsa.gov/recalls?vin=5YJ3E7EB9KF295234#vin'],[],6,10,123,"['tesla', 'model3']",[],https://twitter.com/Model3VINs/status/1099329434711220225,False,,0,,,,,,,,[],,,,,0.005067429,0.70123386,0.2936988
28,1099311684605394944,1099311684605394944,2019-02-23 14:15:04 UTC,2019-02-23,14:15:04,0,1308211178,teslarati,TESLARATI,,Tesla’s automatic emergency braking saves Model X owner from high-speed collision  https://t.co/TJRNRj08mG,en,[],['https://www.teslarati.com/tesla-automatic-emergency-braking-saves-model-x-video'],[],8,57,335,[],[],https://twitter.com/Teslarati/status/1099311684605394944,False,,0,,,,,,,,[],,,,,0.020169033,0.758231,0.2215999
29,1099302170980175873,1099302170980175873,2019-02-23 13:37:16 UTC,2019-02-23,13:37:16,0,998140573008695296,28delayslater,🇺🇦 🦊 Earl of FrunkPuppy 🇺🇦,,"“the editors and researchers did not ask owners about how Tesla responded to any reported problems. “We asked them to give us the details of what happened to it, but we didn’t ask about their follow up with the automaker and how they got things repaired.”   https://t.co/ZLlD6TUHfM",en,[],['https://www.forbes.com/sites/larrymagid/2019/02/22/consumer-reports-auto-editor-speaks-out-about-tesla-tesla-responds/'],[],8,19,129,[],[],https://twitter.com/28delayslater/status/1099302170980175873,False,,0,,,,,,,,[],,,,,0.50462085,0.485749,0.009630113
30,1099300721474715649,1099200543304474625,2019-02-23 13:31:30 UTC,2019-02-23,13:31:30,0,870629200348274688,simonahac,💧simon holmes à court,,@beneltham the current prime minister said the tesla megabattery was no more significant than the big banana.,en,[],[],[],61,264,799,[],[],https://twitter.com/simonahac/status/1099300721474715649,False,,0,,,,,,,,"[{'screen_name': 'beneltham', 'name': 'Ben Eltham', 'id': '90360929'}]",,,,,0.3665593,0.5831107,0.05033
31,1099299764275826688,1099299764275826688,2019-02-23 13:27:42 UTC,2019-02-23,13:27:42,0,138443298,kingl,King Louie,,#KingLouie #TESLA #ComingSoon  https://t.co/z6uQvTQXvC,und,[],[],['https://pbs.twimg.com/media/D0F_Tw_UcAA2P9i.jpg'],11,35,119,"['kinglouie', 'tesla', 'comingsoon']",[],https://twitter.com/KingL/status/1099299764275826688,False,,1,https://pbs.twimg.com/media/D0F_Tw_UcAA2P9i.jpg,,,,,,,[],,,,,0.0032765993,0.4643525,0.532371
32,1099295167071145985,1099295167071145985,2019-02-23 13:09:26 UTC,2019-02-23,13:09:26,0,1596604202,teslachick,Diana Becker,,"Love my #Tesla - since 2013 only paid for tires and windshield washer fluid.  Remember spark plugs? Oil changes? Belts &amp; hoses?  Smog checks?  Leaky radiator, overheating on hills, cracked engine block?  Alternator?  Batteries that die? Paying these guys to stay up all night?!  https://t.co/YcvlZSsLTK",en,[],[],['https://pbs.twimg.com/media/D0F7H8KUYAEb-dr.jpg'],16,38,213,['tesla'],[],https://twitter.com/teslachick/status/1099295167071145985,False,,1,https://pbs.twimg.com/media/D0F7H8KUYAEb-dr.jpg,,,,,,,[],,,,,0.16529809,0.27424318,0.56045866
33,1099285747797053440,1099285747797053440,2019-02-23 12:32:00 UTC,2019-02-23,12:32:00,0,95023423,uberfacts,UberFacts,,Tesla’s New ‘Dog Mode’ Will Keep Your Dog Cool When You’re Not in the Car  https://t.co/iWtWCqJhXG,en,[],['https://twentytwowords.com/teslas-new-dog-mode-will-keep-dog-cool-youre-not-car/?utm_source=deck&utm_medium=cpc&utm_term=influencer&utm_campaign=dm3'],[],4,46,303,[],[],https://twitter.com/UberFacts/status/1099285747797053440,False,,0,,,,,,,,[],,,,,0.005373917,0.4370081,0.557618
34,1099283335489019904,1099283335489019904,2019-02-23 12:22:25 UTC,2019-02-23,12:22:25,0,1596604202,teslachick,Diana Becker,,"Wait, I’m confused... #Tesla is #1 in customer satisfaction, #1 in safety, yet #ConsumerReports is recommending Subaru, a less satisfying, less safe car because of old issues from last October?  Well I guess CR can be bought.",en,[],[],[],6,8,76,"['tesla', 'consumerreports']",[],https://twitter.com/teslachick/status/1099283335489019904,False,,0,,,,,,,,[],,,,,0.6480603,0.3138954,0.038044177
35,1099273734664245248,1099273734664245248,2019-02-23 11:44:16 UTC,2019-02-23,11:44:16,0,1689516060,vincent13031925,vincentyu.eth,,"Tesla experience center in Beijing, China today February 23rd 2019.   Seriously I didn’t see any demand of Model 3 there 🤭🤫🤣  $TSLA #Tesla #China #Model3 #TeslaChina #特斯拉  https://t.co/dxwglxWdTZ",en,[],[],['https://pbs.twimg.com/media/D0FnofuV4AEVuSU.jpg'],3,6,81,"['tesla', 'china', 'model3', 'teslachina', '特斯拉']",['tsla'],https://twitter.com/vincent13031925/status/1099273734664245248,False,,1,https://pbs.twimg.com/media/D0FnofuV4AEVuSU.jpg,,,,,,,[],,,,,0.30070582,0.51685065,0.18244341
36,1099271420729798656,1099271420729798656,2019-02-23 11:35:04 UTC,2019-02-23,11:35:04,0,2166744882,anthonin,Anthonin,,"Tesla c’est vraiment le futur. Ils ont fait une fonction pour pouvoir laisser les chiens dans la voiture sans aucun risque, qu’ils soient confortables avec la température idéale pendant l’attente 🐶  https://t.co/5RaLdWU7tc",fr,[],[],[],14,199,1549,[],[],https://twitter.com/anthonin/status/1099271420729798656,False,,1,https://pbs.twimg.com/ext_tw_video_thumb/1099271251217010688/pu/img/KgcQmCWercrzyF5h.jpg,,,,,,,[],,,,,0.0452045,0.8392669,0.11552865
37,1099265471793119232,1099265471793119232,2019-02-23 11:11:26 UTC,2019-02-23,11:11:26,0,1689516060,vincent13031925,vincentyu.eth,,"Tesla Model S 3 X showcase at International Commerce Centre (ICC), Hong Kong 🇭🇰  $TSLA #Tesla #Model3 #HongKong #香港 #特斯拉  https://t.co/8j1cbCGVfh",en,[],[],[],5,28,235,"['tesla', 'model3', 'hongkong', '香港', '特斯拉']",['tsla'],https://twitter.com/vincent13031925/status/1099265471793119232,False,,1,https://pbs.twimg.com/ext_tw_video_thumb/1099265394240442368/pu/img/fdHCuV98qAK1OcvO.jpg,,,,,,,[],,,,,0.003288094,0.5173565,0.4793554
38,1099246379954814976,1099246379954814976,2019-02-23 09:55:34 UTC,2019-02-23,09:55:34,0,718747351792398336,alex_avoigt,Alex,,This is @ConsumerReports chart of Tesla Model 3 reliability out of their website.  With this being your own results how could you possibly not recommend the Model 3 with those results ???  Thx to Tom S. at TMC  https://t.co/TTSn5bAoM8,en,"[{'screen_name': 'consumerreports', 'name': 'consumer reports', 'id': '16193528'}]",[],['https://pbs.twimg.com/media/D0FN1SbWwAQEZu9.jpg'],34,61,229,[],[],https://twitter.com/alex_avoigt/status/1099246379954814976,False,,1,https://pbs.twimg.com/media/D0FN1SbWwAQEZu9.jpg,,,,,,,[],,,,,0.05968385,0.6118589,0.32845718
39,1099242607706701826,1099242607706701826,2019-02-23 09:40:35 UTC,2019-02-23,09:40:35,0,896941926,pauldutton1968,Paul Dutton - Kali Mukwarra Barkindji,,"The stunning numbers behind success of Tesla big battery | RenewEconomy So 2% of SA capacity yet makes 55% of the revenue. Govts need to learn! We must protect ourselves and other nations, especially Pacific Is nations in danger of ocean inundation.   https://t.co/dRgUA1Fw52",en,[],['https://reneweconomy.com.au/the-stunning-numbers-behind-success-of-tesla-big-battery-63917/'],[],2,24,63,[],[],https://twitter.com/pauldutton1968/status/1099242607706701826,False,,0,,,,,,,,[],,,,,0.020513097,0.18374808,0.79573876
40,1099242360918036482,1099242360918036482,2019-02-23 09:39:36 UTC,2019-02-23,09:39:36,0,842125105618550785,toploenglish,Toplo✪,,Tesla Roadster Concept  @Tesla @elonmusk @MKBHD @TeslaMotorsClub @teslaownersSV @TeslaOwnersWW @TeslaClubBE  #Tesla #TeslaModel3 #TeslaChina #teslaroadster #Roadster #SpaceX #automobile #londonsupercars #supercars #fastcars #FastFurious #sportscar @LDNSupercars_ @ElonMuskNewsOrg  https://t.co/MmzyvHlT1e,en,"[{'screen_name': 'tesla', 'name': 'tesla', 'id': '13298072'}, {'screen_name': 'elonmusk', 'name': 'elon musk', 'id': '44196397'}, {'screen_name': 'mkbhd', 'name': 'marques brownlee', 'id': '29873662'}, {'screen_name': 'teslamotorsclub', 'name': 'tesla motors club', 'id': '18200793'}, {'screen_name': 'teslaownerssv', 'name': 'tesla owners silicon valley', 'id': '1016059981907386368'}, {'screen_name': 'teslaownersww', 'name': 'tesla owners global', 'id': '871492244200607744'}, {'screen_name': 'teslaclubbe', 'name': 'tesla owners club be 🇧🇪', 'id': '1368052542'}, {'screen_name': 'elonmusknewsorg', 'name': 'elon musk news', 'id': '2564597449'}]",[],[],24,112,408,"['tesla', 'teslamodel3', 'teslachina', 'teslaroadster', 'roadster', 'spacex', 'automobile', 'londonsupercars', 'supercars', 'fastcars', 'fastfurious', 'sportscar']",[],https://twitter.com/toploenglish/status/1099242360918036482,False,,1,https://pbs.twimg.com/ext_tw_video_thumb/1099242170689609728/pu/img/-cQwT1gM5nAcumhW.jpg,,,,,,,[],,,,,0.0042486014,0.7063652,0.28938618
