id,conversation_id,created_at,date,time,timezone,user_id,username,name,place,tweet,language,mentions,urls,photos,replies_count,retweets_count,likes_count,hashtags,cashtags,link,retweet,quote_url,video,thumbnail,near,geo,source,user_rt_id,user_rt,retweet_id,reply_to,retweet_date,translate,trans_src,trans_dest
1162512104273764358,1162512104273764358,2019-08-16 23:50:58 UTC,2019-08-16,23:50:58,+0000,3239203002,whatsinside,WHAT'S INSIDE?,,I don’t own a Tesla to “save the planet”. Does that make me a bad person?,en,[],[],[],40,14,382,[],[],https://twitter.com/whatsinside/status/1162512104273764358,False,,0,,,,,,,,[],,,,
1162506395079585794,1162506395079585794,2019-08-16 23:28:17 UTC,2019-08-16,23:28:17,+0000,164425558,jonerlichman,Jon Erlichman,,Revenue last year:  Apple: $265.6 billion Amazon: $232.9 billion Google: $232.9 billion Microsoft: $110.4 billion IBM: $79.6 billion Intel: $70.8 billion Facebook: $55.8 billion Tesla: $21.5 billion Netflix: $15.8 billion Uber: $11.3 billion  Total: $1 trillion,en,[],[],[],46,532,1779,[],[],https://twitter.com/JonErlichman/status/1162506395079585794,False,,0,,,,,,,,[],,,,
1162497515612200960,1162497515612200960,2019-08-16 22:53:00 UTC,2019-08-16,22:53:00,+0000,238031347,eldeforma,El Deforma,,Le niegan a Daddy Yankee la compra de un Tesla porque a él le gusta la gasolina  https://t.co/U2dlccEGuI,es,[],['https://buff.ly/2Z7wC1v'],[],3,43,171,[],[],https://twitter.com/eldeforma/status/1162497515612200960,False,,0,,,,,,,,[],,,,
1162492797666103298,1162492797666103298,2019-08-16 22:34:15 UTC,2019-08-16,22:34:15,+0000,2148233600,electrekco,Electrek.co,,"Tesla launches solar rental service, can get a solar panel system for $50 per month  https://t.co/mdMuR4KLkc by @fredericlambert  https://t.co/WV95bfBgKl",en,"[{'screen_name': 'fredericlambert', 'name': 'fred lambert', 'id': '38253449'}]",['https://electrek.co/2019/08/16/tesla-solar-rental-service-solar-panel-system/'],['https://pbs.twimg.com/media/ECIBCfvWkAA9ZnT.jpg'],17,104,331,[],[],https://twitter.com/ElectrekCo/status/1162492797666103298,False,,1,https://pbs.twimg.com/media/ECIBCfvWkAA9ZnT.jpg,,,,,,,[],,,,
1162491410848681984,1162491410848681984,2019-08-16 22:28:45 UTC,2019-08-16,22:28:45,+0000,194330200,ecuanimusjustus,ECUANIMUS,,"Los personajes más grandes de la historia, fueron perseguidos y/o condenados por sus enemigos, con calumnias, montajes, infamias, mentiras y falsas acusaciones  Lo hicieron con Jesús de Nazareth, Galileo Galilei, Juana de Arco, Nicola Tesla. Y ahora lo hacen con @AlvaroUribeVel",es,"[{'screen_name': 'alvarouribevel', 'name': 'álvaro uribe vélez', 'id': '61097151'}]",[],[],30,280,504,[],[],https://twitter.com/ecuanimusjustus/status/1162491410848681984,False,,0,,,,,,,,[],,,,
1162491257358356482,1162491257358356482,2019-08-16 22:28:08 UTC,2019-08-16,22:28:08,+0000,594886554,thelastrefuge2,TheLastRefuge,,"Tesla Inc. is the biggest predictable financial collapse on Wall Street.   China has already extracted all Tesla tech, design and engineering elements; and will, IMHO within a year (by end 2020), be launching a Chinese version at one-quarter the price.  Watch.  Bookmark",en,[],[],[],29,178,310,[],[],https://twitter.com/TheLastRefuge2/status/1162491257358356482,False,https://twitter.com/Reuters/status/1162489006132736000,0,,,,,,,,[],,,,
1162488124477464576,1162488124477464576,2019-08-16 22:15:41 UTC,2019-08-16,22:15:41,+0000,4852289459,theteslalife,TheTeslaLife,,On the hunt for the red one now! #Tesla #Model3 #HotWheels,en,[],[],[],4,6,79,"['tesla', 'model3', 'hotwheels']",[],https://twitter.com/TheTeslaLife/status/1162488124477464576,False,https://twitter.com/RenataKonkoly/status/1161341749073207296,0,,,,,,,,[],,,,
1162487954562048001,1162487954562048001,2019-08-16 22:15:01 UTC,2019-08-16,22:15:01,+0000,91478624,forbes,Forbes,,"A new Tesla crash, possibly on Autopilot, gives a lens into how Tesla claims they have better tools for avoiding such crashes, and how they may not be working  https://t.co/vwMFSbqygM  https://t.co/lVzbFEa4fQ",en,[],['http://on.forbes.com/6013EFABV'],['https://pbs.twimg.com/media/ECH8okvXYAIM6Np.jpg'],12,48,101,[],[],https://twitter.com/Forbes/status/1162487954562048001,False,,1,https://pbs.twimg.com/media/ECH8okvXYAIM6Np.jpg,,,,,,,[],,,,
1162479656856985602,1162479656856985602,2019-08-16 21:42:02 UTC,2019-08-16,21:42:02,+0000,847527486552276992,mle_online,Emily Velasco,,I 3D printed a little cone for the mini Tesla coil to direct the sound. I think I'll call it the Sparktrola  https://t.co/xDoTooFAk7,en,[],[],['https://pbs.twimg.com/media/ECH1E_vUYAA-l1R.jpg'],12,23,287,[],[],https://twitter.com/MLE_Online/status/1162479656856985602,False,,1,https://pbs.twimg.com/media/ECH1E_vUYAA-l1R.jpg,,,,,,,[],,,,
1162477240279547906,1162477240279547906,2019-08-16 21:32:26 UTC,2019-08-16,21:32:26,+0000,66834664,lfrancobastos,Luís Franco-Bastos,,No outro dia vi um carro e juro que não era um Tesla.,pt,[],[],[],4,11,354,[],[],https://twitter.com/lfrancobastos/status/1162477240279547906,False,,0,,,,,,,,[],,,,
1162474287879655425,1162474287879655425,2019-08-16 21:20:42 UTC,2019-08-16,21:20:42,+0000,592637613,zedkit7,zedkit,,TESLA ‼️ İREM SU‼️ ERKMEN ‼️ SULVA BUY - THUMBS UP ‼️ ANKARA Takip atı olupta paylaşmayanın kuponu 5 te kalsın :) Hayden iyi gece 👋🏻,tr,[],[],[],14,5,117,[],[],https://twitter.com/zedkit7/status/1162474287879655425,False,,0,,,,,,,,[],,,,
1162470809388167170,1162470809388167170,2019-08-16 21:06:53 UTC,2019-08-16,21:06:53,+0000,17060015,cleantechnica,CleanTechnica,,Tesla Makes Solar Affordable Again With New Monthly Rental Plans  https://t.co/2Vyeniaot7  https://t.co/t7uqfobLKZ,en,[],['https://cleantechnica.com/2019/08/16/tesla-makes-solar-affordable-again-with-new-monthly-rental-plans/'],['https://pbs.twimg.com/media/ECHtCmlXUAM-XZt.jpg'],129,599,5134,[],[],https://twitter.com/cleantechnica/status/1162470809388167170,False,,1,https://pbs.twimg.com/media/ECHtCmlXUAM-XZt.jpg,,,,,,,[],,,,
1162469217569931264,1162469217569931264,2019-08-16 21:00:33 UTC,2019-08-16,21:00:33,+0000,1061504849420836865,tesla_raj,Tesla Raj,,"If anyone says electric cars can’t travel long distance you want to watch @WadeAndersonPT whose on his final leg of a 2 month journey of North America.  Check out his videos on his YouTube: Tesla Social  Just him, his Performance Model 3, cardboard Elon and a lot of cameras!  https://t.co/AjtcpaIDWZ",en,"[{'screen_name': 'wadeandersonpt', 'name': 'wade', 'id': '967929328053862400'}]",[],['https://pbs.twimg.com/media/ECHrlPvVAAEEtK5.jpg'],1,8,95,[],[],https://twitter.com/tesla_raj/status/1162469217569931264,False,,1,https://pbs.twimg.com/media/ECHrlPvVAAEEtK5.jpg,,,,,,,[],,,,
1162468833573183493,1162468833573183493,2019-08-16 20:59:02 UTC,2019-08-16,20:59:02,+0000,821675328661782528,nextmove_de,nextmove,,Please retweet our case with the hashtags #ServiceHell @Tesla if you agree that #Tesla needs to improve considerably in service. @elonmusk has proven many times that he is able to fix problems quickly if attention is high. We really want Tesla to get out of service hell.,en,"[{'screen_name': 'tesla', 'name': 'tesla', 'id': '13298072'}, {'screen_name': 'elonmusk', 'name': 'elon musk', 'id': '44196397'}]",[],[],10,83,152,"['servicehell', 'tesla']",[],https://twitter.com/nextmove_de/status/1162468833573183493,False,,0,,,,,,,,[],,,,
1162467061894799360,1162467061894799360,2019-08-16 20:51:59 UTC,2019-08-16,20:51:59,+0000,1276624890,justints11,Justin Torres,,Shorty was FaceTiming her dad and her dads coworkers saw me and said “he better have a job” and her dad replied with “he has a Tesla do you have a Tesla?” 😂 I fucks with him,en,[],[],[],0,3,50,[],[],https://twitter.com/Justints11/status/1162467061894799360,False,,0,,,,,,,,[],,,,
1162466219427061761,1162466219427061761,2019-08-16 20:48:38 UTC,2019-08-16,20:48:38,+0000,998140573008695296,28delayslater,🇺🇦 🦊 Earl of FrunkPuppy 🇺🇦,,#takeiteasy #itsnothard #listentothecar  #Tesla #Model3  https://t.co/epyeGoQxDA,und,[],[],[],7,2,51,"['takeiteasy', 'itsnothard', 'listentothecar', 'tesla', 'model3']",[],https://twitter.com/28delayslater/status/1162466219427061761,False,,1,https://pbs.twimg.com/ext_tw_video_thumb/1162466156252422144/pu/img/FsWVrKEdyHjlTJ7g.jpg,,,,,,,[],,,,
1162458716345700352,1162458716345700352,2019-08-16 20:18:50 UTC,2019-08-16,20:18:50,+0000,704835627183788032,model3owners,Trev Page,,Nikola Tesla statue in Niagara Falls Canada @elonmusk @tesla  https://t.co/UgOejx59Dg,eu,"[{'screen_name': 'elonmusk', 'name': 'elon musk', 'id': '44196397'}, {'screen_name': 'tesla', 'name': 'tesla', 'id': '13298072'}]",[],"['https://pbs.twimg.com/media/ECHh_hLXUAAItkl.jpg', 'https://pbs.twimg.com/media/ECHh_hQXoAA5tJ7.jpg', 'https://pbs.twimg.com/media/ECHh_hTXoAA8VaM.jpg', 'https://pbs.twimg.com/media/ECHh_hUXsAUoNCf.jpg']",9,7,168,[],[],https://twitter.com/Model3Owners/status/1162458716345700352,False,,1,https://pbs.twimg.com/media/ECHh_hLXUAAItkl.jpg,,,,,,,[],,,,
1162455655862566912,1162455655862566912,2019-08-16 20:06:40 UTC,2019-08-16,20:06:40,+0000,959168599519764480,ray4tesla,Ray4Tesla⚡️🚘☀️🔋,,"Famed Chinese #Tesla enthusiast @xiaoteshushu demonstrates playing beach buggy racing using two controllers, instead of steering wheel and pedals. The two USB slots of Model 3 support left and right game controllers. @elonmusk  https://t.co/6WqFPAgrMD",en,"[{'screen_name': 'xiaoteshushu', 'name': '小特叔叔', 'id': '198124278'}, {'screen_name': 'elonmusk', 'name': 'elon musk', 'id': '44196397'}]",[],[],1,10,69,['tesla'],[],https://twitter.com/ray4tesla/status/1162455655862566912,False,,1,https://pbs.twimg.com/ext_tw_video_thumb/1162455621204975616/pu/img/jMz6AGYJaK1Ta5Jw.jpg,,,,,,,[],,,,
1162451159648485376,1162451159648485376,2019-08-16 19:48:48 UTC,2019-08-16,19:48:48,+0000,414693833,saysphilippe,Philippe Schjelderup,,I dag så jeg en Tesla med XXXX og datter(11) spør: Er det fordi han trenger å huske hvor mange ekser han har hatt? #smartkid,no,[],[],[],2,2,61,['smartkid'],[],https://twitter.com/SaysPhilippe/status/1162451159648485376,False,,0,,,,,,,,[],,,,
1162449945842081793,1162449945842081793,2019-08-16 19:43:59 UTC,2019-08-16,19:43:59,+0000,2479410048,fatmaasaka,Fatma Sidal,,"Bir mucitle ilgili soru sorulduğunda bilemiyorsanız Nikola Tesla deyin, çünkü 700’ün üzerinde patenti olan tek mucittir.",tr,[],[],[],3,2,55,[],[],https://twitter.com/fatmaasaka/status/1162449945842081793,False,,0,,,,,,,,[],,,,
1162448001144692736,1162448001144692736,2019-08-16 19:36:15 UTC,2019-08-16,19:36:15,+0000,182063696,keith__johnston,Keith Johnston,,"Investing $7BN in anything, anywhere, at any time takes balls and whatever you think about @tesla @elonmusk or the cars, you cannot fault their vision, their bravery and their effort. 👏👏👏",en,"[{'screen_name': 'tesla', 'name': 'tesla', 'id': '13298072'}, {'screen_name': 'elonmusk', 'name': 'elon musk', 'id': '44196397'}]",[],[],8,24,77,[],[],https://twitter.com/keith__johnston/status/1162448001144692736,False,https://twitter.com/SCMPNews/status/1162253909165035520,0,,,,,,,,[],,,,
1162445194593222657,1162445194593222657,2019-08-16 19:25:06 UTC,2019-08-16,19:25:06,+0000,1099233052239093761,mrnikolatsla,Mr. Tesla,,Now that’s how you park a @Tesla #Model3 Miss you already.  https://t.co/yXtvwWFe6c,en,"[{'screen_name': 'tesla', 'name': 'tesla', 'id': '13298072'}]",[],['https://pbs.twimg.com/media/ECHVvA4W4AAD21u.jpg'],11,4,87,['model3'],[],https://twitter.com/MrNikolaTsla/status/1162445194593222657,False,,1,https://pbs.twimg.com/media/ECHVvA4W4AAD21u.jpg,,,,,,,[],,,,
1162439611332714496,1162439611332714496,2019-08-16 19:02:55 UTC,2019-08-16,19:02:55,+0000,50012292,benshooter,ben k,,That Tesla QC is as good as ever.,en,[],[],[],13,5,54,[],[],https://twitter.com/Benshooter/status/1162439611332714496,False,https://twitter.com/_dubster/status/1162087784666030081,0,,,,,,,,[],,,,
1162436119218315265,1162436119218315265,2019-08-16 18:49:02 UTC,2019-08-16,18:49:02,+0000,1013959837498134528,golf__douchebag,Golf Douchebag,,"Friend (16 handicap): “I’m thinking about getting a new driver, any recommendations?”  “Yea. Buy a Tesla.”  Friend: “What? Why?”  “Because it can drive for you. Your swing is trash.”",en,[],[],[],3,7,76,[],[],https://twitter.com/Golf__Douchebag/status/1162436119218315265,False,,0,,,,,,,,[],,,,
1162428730658004992,1162428730658004992,2019-08-16 18:19:40 UTC,2019-08-16,18:19:40,+0000,3699668774,carolinegee8,👻Caroline,,Weekend situation... #Supercharger #NoRangeAnxiety @Tesla #Model3  https://t.co/OFkLbkUgzf,en,"[{'screen_name': 'tesla', 'name': 'tesla', 'id': '13298072'}]",[],[],8,10,78,"['supercharger', 'norangeanxiety', 'model3']",[],https://twitter.com/CarolineGee8/status/1162428730658004992,False,,1,https://pbs.twimg.com/ext_tw_video_thumb/1162428648541941760/pu/img/YMaaF6m6i0e6QTGI.jpg,,,,,,,[],,,,
1162427024478281732,1162427024478281732,2019-08-16 18:12:54 UTC,2019-08-16,18:12:54,+0000,801707576,jordankersting,Jordan,,Hey @elonmusk I saw this matte @tesla the other day. Whatcha think?  https://t.co/hiWosSHl4a,en,"[{'screen_name': 'elonmusk', 'name': 'elon musk', 'id': '44196397'}, {'screen_name': 'tesla', 'name': 'tesla', 'id': '13298072'}]",[],"['https://pbs.twimg.com/media/ECHFNv5XkAADmCu.jpg', 'https://pbs.twimg.com/media/ECHFNv9WwAA_9_Q.jpg']",15,32,293,[],[],https://twitter.com/jordankersting/status/1162427024478281732,False,,1,https://pbs.twimg.com/media/ECHFNv5XkAADmCu.jpg,,,,,,,[],,,,
1162422610929618945,1162422610929618945,2019-08-16 17:55:21 UTC,2019-08-16,17:55:21,+0000,18856867,zerohedge,zerohedge,,$5 Million Tesla Model 3 Order Canceled Over Quality Issues  https://t.co/0qr93q9ZbR,en,[],['https://www.zerohedge.com/news/2019-08-16/5-million-tesla-model-3-order-canceled-over-quality-issues'],[],18,43,82,[],[],https://twitter.com/zerohedge/status/1162422610929618945,False,,0,,,,,,,,[],,,,
1162422215062642694,1162421624924254208,2019-08-16 17:53:47 UTC,2019-08-16,17:53:47,+0000,308795969,dmc_ryan,Ryan McCaffrey,,"@KurtHellyn @TeslaModel32 @Alpsoy66 @teslamodel3fan @Model3Owners @rrosenbl @TeslaStars Put them at GAS STATIONS, Audi. Convince people of the EV benefits while they pay crazy gas prices at the pump. You're not winning over the people at Tesla Superchargers!",en,[],[],[],16,22,160,[],[],https://twitter.com/DMC_Ryan/status/1162422215062642694,False,,0,,,,,,,,"[{'screen_name': 'kurtHellyn', 'name': 'dr2thurt', 'id': '3537627681'}, {'screen_name': 'teslamodel32', 'name': 'model3君⚡MIC LR', 'id': '1370682600348545026'}, {'screen_name': 'Alpsoy66', 'name': 'Alp', 'id': '302045293'}, {'screen_name': 'teslamodel3fan', 'name': 'Tesla Model 3 Fan', 'id': '3532426698'}, {'screen_name': 'Model3Owners', 'name': 'Trev Page', 'id': '704835627183788032'}, {'screen_name': 'rrosenbl', 'name': 'Robert @TalkingTesla', 'id': '36770764'}, {'screen_name': 'TeslaStars', 'name': 'TeslaStars✨🇺🇦🕊❤️👀', 'id': '1070423183906476032'}]",,,,
1162420038575579137,1162420038575579137,2019-08-16 17:45:08 UTC,2019-08-16,17:45:08,+0000,2331155062,newmediaguynyc,D,,"All,  Buying my Tesla Model 3 in late November after my Volt lease expires.  Any suggestions or advice you can give me to avoid any potholes is appreciated.  Thx, Guy",en,[],[],[],95,8,168,[],[],https://twitter.com/newmediaguynyc/status/1162420038575579137,False,,0,,,,,,,,[],,,,
1162419418477019139,1162418025754255361,2019-08-16 17:42:40 UTC,2019-08-16,17:42:40,+0000,159199503,iihs_autosafety,IIHS,,"@_jameshatfield_ We don't have the resources to test a relatively low sales volume vehicle. Tesla could nomiate the X and reimburse IIHS for the vehicles. Otherwise it's a $400,000 program for us, which could be better spent on mainstream vehicles or research.",en,[],[],[],21,12,93,[],[],https://twitter.com/IIHS_autosafety/status/1162419418477019139,False,,0,,,,,,,,"[{'screen_name': '_jameshatfield_', 'name': 'James Hatfield | 🤖🚕', 'id': '829935516246159362'}]",,,,
1162418835032608770,1162418835032608770,2019-08-16 17:40:21 UTC,2019-08-16,17:40:21,+0000,13298072,tesla,Tesla,,For all the data lovers out there 📊,en,[],[],[],149,338,4700,[],[],https://twitter.com/Tesla/status/1162418835032608770,False,https://twitter.com/TeslaStraya/status/1161072374017482752,0,,,,,,,,[],,,,
1162416233754648577,1162416233754648577,2019-08-16 17:30:01 UTC,2019-08-16,17:30:01,+0000,91478624,forbes,Forbes,,To what extent does Tesla lull drivers into thinking they can treat their vehicle like a self-driving car?  https://t.co/YYwr21uOLF  https://t.co/EWInMHltlv,en,[],['http://on.forbes.com/6011E29nd'],['https://pbs.twimg.com/media/ECG7Z46WwAEitLS.jpg'],16,24,79,[],[],https://twitter.com/Forbes/status/1162416233754648577,False,,1,https://pbs.twimg.com/media/ECG7Z46WwAEitLS.jpg,,,,,,,[],,,,
1162414074048782336,1162414074048782336,2019-08-16 17:21:26 UTC,2019-08-16,17:21:26,+0000,2148233600,electrekco,Electrek.co,,"Tesla updates Model Y prices, increases price of Model 3 Performance  https://t.co/nkmgyckPaJ by @fredericlambert  https://t.co/AIPPSwhmyD",en,"[{'screen_name': 'fredericlambert', 'name': 'fred lambert', 'id': '38253449'}]",['https://electrek.co/2019/08/16/tesla-model-y-prcie-increase-model-3-performance/'],['https://pbs.twimg.com/media/ECG5cKnWwAYvv6g.jpg'],2,16,77,[],[],https://twitter.com/ElectrekCo/status/1162414074048782336,False,,1,https://pbs.twimg.com/media/ECG5cKnWwAYvv6g.jpg,,,,,,,[],,,,
1162409153186283521,1162409153186283521,2019-08-16 17:01:53 UTC,2019-08-16,17:01:53,+0000,68399705,vivekoberoi,Vivek Anand Oberoi,,My brother @nikesharora the man with the Midas touch and still a pakka desi at heart! Riding into the future with him in his @Tesla Model X. Sheer brilliance!   @elonmusk #TeslaModelX #Tesla #TeslaFamily  https://t.co/9f5g2WwG2E,en,"[{'screen_name': 'nikesharora', 'name': 'nikesh arora', 'id': '52171246'}, {'screen_name': 'tesla', 'name': 'tesla', 'id': '13298072'}, {'screen_name': 'elonmusk', 'name': 'elon musk', 'id': '44196397'}]",[],[],38,73,1009,"['teslamodelx', 'tesla', 'teslafamily']",[],https://twitter.com/vivekoberoi/status/1162409153186283521,False,,1,https://pbs.twimg.com/ext_tw_video_thumb/1162408740240293888/pu/img/JAEhSnV5BjPYZzNw.jpg,,,,,,,[],,,,
1162405427453108224,1162405427453108224,2019-08-16 16:47:05 UTC,2019-08-16,16:47:05,+0000,1689516060,vincent13031925,vincentyu.eth,,Tesla Model 3 gets stellar reviews after initial test drives in Japan  $TSLA #Tesla #Japan   https://t.co/GnKcarTkPR,en,[],['https://www.teslarati.com/tesla-model-3-reviews-test-drives-japan/'],[],5,26,250,"['tesla', 'japan']",['tsla'],https://twitter.com/vincent13031925/status/1162405427453108224,False,,0,,,,,,,,[],,,,
1162402598416084997,1162402598416084997,2019-08-16 16:35:50 UTC,2019-08-16,16:35:50,+0000,740946180,minimalduck,Arash Malek 🦆,,"I’ve had my #Model3 since Sept have put 31,000 mi on it and every morning as I approach the car I think daaamn, this car is sexy af!! Anyone else have this problem? @elonmusk @Tesla",en,"[{'screen_name': 'elonmusk', 'name': 'elon musk', 'id': '44196397'}, {'screen_name': 'tesla', 'name': 'tesla', 'id': '13298072'}]",[],[],16,9,179,['model3'],[],https://twitter.com/MinimalDuck/status/1162402598416084997,False,,0,,,,,,,,[],,,,
1162400578259030018,1162400578259030018,2019-08-16 16:27:48 UTC,2019-08-16,16:27:48,+0000,1017486609707667456,byeonchansoo,Chansoo Byeon,,"My next @Tesla was going to be a #ModelX. Then, I saw this today. #ModelY Performance it is! @elonmusk @Model3Owners @ValueAnalyst1 @marc_benton @tesla_raj #EV #Sustainability Tesla's future is just bright.    https://t.co/AzXnJXkayZ",en,"[{'screen_name': 'tesla', 'name': 'tesla', 'id': '13298072'}, {'screen_name': 'elonmusk', 'name': 'elon musk', 'id': '44196397'}, {'screen_name': 'model3owners', 'name': 'trev page', 'id': '704835627183788032'}, {'screen_name': 'valueanalyst1', 'name': 'yaman tasdivar', 'id': '732548050728701953'}, {'screen_name': 'marc_benton', 'name': 'marc benton', 'id': '14162718'}, {'screen_name': 'tesla_raj', 'name': 'tesla raj', 'id': '1061504849420836865'}]",['https://www.reddit.com/r/teslamotors/comments/cqt33w/i_will_be_very_happy_if_this_size_differential/'],[],6,9,104,"['modelx', 'modely', 'ev', 'sustainability']",[],https://twitter.com/ByeonChansoo/status/1162400578259030018,False,,0,,,,,,,,[],,,,
1162397784177336322,1162397784177336322,2019-08-16 16:16:42 UTC,2019-08-16,16:16:42,+0000,1153476318,enn_nafnlaus,Nafnlaus 🇺🇦 🇮🇸,,"For your information @russ1mitchell (and all other relentlessly anti-Tesla journalists pushing the ""executive departures"" meme, who can't be bothered to do their research):  https://t.co/4hyS1NpUrq",en,"[{'screen_name': 'russ1mitchell', 'name': 'russ mitchell', 'id': '2471516070'}]",[],['https://pbs.twimg.com/media/ECGqni9XUAMxilK.png'],10,32,107,[],[],https://twitter.com/enn_nafnlaus/status/1162397784177336322,False,,1,https://pbs.twimg.com/media/ECGqni9XUAMxilK.png,,,,,,,[],,,,
1162389770493816838,1162389770493816838,2019-08-16 15:44:52 UTC,2019-08-16,15:44:52,+0000,41002042,forgiato,Forgiato Wheels,,Tesla Model X on Forgiato Wheels 🔋  https://t.co/2AnnZtclEt,en,[],[],['https://pbs.twimg.com/media/ECGjVa8UIAEDeEG.jpg'],0,10,124,[],[],https://twitter.com/forgiato/status/1162389770493816838,False,,1,https://pbs.twimg.com/media/ECGjVa8UIAEDeEG.jpg,,,,,,,[],,,,
1162386094169698305,1162386094169698305,2019-08-16 15:30:15 UTC,2019-08-16,15:30:15,+0000,1308211178,teslarati,TESLARATI,,"Tesla adjusts Model Y pricing, updates default color to Pearl White Multi-Coat  https://t.co/4liOj9FL3X",en,[],['https://www.teslarati.com/tesla-model-y-pricing-base-color-update'],[],11,54,447,[],[],https://twitter.com/Teslarati/status/1162386094169698305,False,,0,,,,,,,,[],,,,
1162385809271656448,1162385809271656448,2019-08-16 15:29:07 UTC,2019-08-16,15:29:07,+0000,704835627183788032,model3owners,Trev Page,,Nikola Tesla Blvd. in Hamilton Ontario @tesla @elonmusk  https://t.co/02R173GY0B,eu,"[{'screen_name': 'tesla', 'name': 'tesla', 'id': '13298072'}, {'screen_name': 'elonmusk', 'name': 'elon musk', 'id': '44196397'}]",[],[],7,6,136,[],[],https://twitter.com/Model3Owners/status/1162385809271656448,False,,1,https://pbs.twimg.com/ext_tw_video_thumb/1162385745853800448/pu/img/FH0COVqA3ZqJe_X5.jpg,,,,,,,[],,,,
1162378742309801984,1162376282316976129,2019-08-16 15:01:02 UTC,2019-08-16,15:01:02,+0000,111210694,prestigeiskey,Ryan B.,,"@Drift0r Yeah, get the Tesla Mobile crew out ASAP",en,[],[],[],3,1,155,[],[],https://twitter.com/PrestigeIsKey/status/1162378742309801984,False,,0,,,,,,,,"[{'screen_name': 'Drift0r', 'name': 'Drift0r', 'id': '210839744'}]",,,,
1162376282316976129,1162376282316976129,2019-08-16 14:51:16 UTC,2019-08-16,14:51:16,+0000,210839744,drift0r,Drift0r,,"I'm not a Tesla expert, but I'm pretty sure this is not the sound my car is supposed to make  https://t.co/sxsUytpBCq",en,[],[],[],92,25,650,[],[],https://twitter.com/Drift0r/status/1162376282316976129,False,,1,https://pbs.twimg.com/ext_tw_video_thumb/1162376043740766209/pu/img/u-Rcc0OXZJ2agD_E.jpg,,,,,,,[],,,,
1162374705267056640,1162374705267056640,2019-08-16 14:45:00 UTC,2019-08-16,14:45:00,+0000,23922797,scmpnews,South China Morning Post,,"#Tesla's first overseas assembly plant is near completion in #Shanghai, and it will be able to produce 150,000 electric cars a year.  https://t.co/mJq9yo6zf5",en,[],[],[],3,18,67,"['tesla', 'shanghai']",[],https://twitter.com/SCMPNews/status/1162374705267056640,False,,1,https://pbs.twimg.com/media/ECElKdZU8AItOuE.jpg,,,,,,,[],,,,
1162372640373387269,1162372640373387269,2019-08-16 14:36:47 UTC,2019-08-16,14:36:47,+0000,3063324590,wk057,Jason Hughes,,Craigslist seller: I'm driving a [generic white vehicle]  Me: I'll be in a bright yellow #Tesla  Craigslist seller: Then I think I'll just look for _you_  Me: Can't miss me.  🤣  #OneOfTheseThingsIsNotLikeTheOther  https://t.co/GsQl1G5lbg,en,[],[],['https://pbs.twimg.com/media/ECGTv9FWkAAhGik.jpg'],4,2,71,"['tesla', 'oneofthesethingsisnotliketheother']",[],https://twitter.com/wk057/status/1162372640373387269,False,,1,https://pbs.twimg.com/media/ECGTv9FWkAAhGik.jpg,,,,,,,[],,,,
1162372461142433793,1162372461142433793,2019-08-16 14:36:05 UTC,2019-08-16,14:36:05,+0000,1014589289211092992,rossaalexh,Alexandra Hedborg,,En gammal Toyota Aygo fungerar också hyggligt men varför ska man nöja sig med den när man betalat för en Tesla?,sv,[],[],[],18,42,514,[],[],https://twitter.com/Rossaalexh/status/1162372461142433793,False,https://twitter.com/GreiderDD/status/1162348380741394432,0,,,,,,,,[],,,,
1162365596400570370,1162365596400570370,2019-08-16 14:08:48 UTC,2019-08-16,14:08:48,+0000,18894039,amiedoubled,Amie DD,,"I’ve never experienced anything like this entire Tesla chip implant hack. Over a 1000 emails &amp; private DMs, thousands of comments(mostly good, some hate &amp; threats). Media coverage all over the world, some misinformation. Post questions here and I’ll make a video answering them!",en,[],[],[],33,15,231,[],[],https://twitter.com/amiedoubleD/status/1162365596400570370,False,,0,,,,,,,,[],,,,
1162364646042607616,1162364646042607616,2019-08-16 14:05:01 UTC,2019-08-16,14:05:01,+0000,4852289459,theteslalife,TheTeslaLife,,"The #Tesla Semi was spotted doing some range tests with an almost full load of 75,000 lbs, and the test driver reportedly said that it was meeting or even “exceeding” range expectations.  https://t.co/dy2P4eXtWn  https://t.co/hUaWx0KnTu",en,[],['https://electrek.co/2019/08/15/tesla-semi-electric-truck-exceeds-range-expectation-test-driver/'],"['https://pbs.twimg.com/media/ECGMeOtXUAE6zA9.jpg', 'https://pbs.twimg.com/media/ECGMeOrXoAA7rVZ.jpg', 'https://pbs.twimg.com/media/ECGMeOxX4AABRoh.jpg', 'https://pbs.twimg.com/media/ECGMeOrW4AMLw_v.jpg']",5,29,110,['tesla'],[],https://twitter.com/TheTeslaLife/status/1162364646042607616,False,,1,https://pbs.twimg.com/media/ECGMeOtXUAE6zA9.jpg,,,,,,,[],,,,
