,id,conversation_id,created_at,date,time,timezone,user_id,username,name,place,tweet,language,mentions,urls,photos,replies_count,retweets_count,likes_count,hashtags,cashtags,link,retweet,quote_url,video,thumbnail,near,geo,source,user_rt_id,user_rt,retweet_id,reply_to,retweet_date,translate,trans_src,trans_dest,negative,neutral,positive
90,1135056071515488256,1135056071515488256,2019-06-02 05:30:30 UTC,2019-06-02,05:30:30,0,1016059981907386368,teslaownerssv,Tesla Owners Silicon Valley,,"Chinese-built Tesla Model 3 will be some 13% cheaper, bypassing tariffs  https://t.co/OImQ6PlDhC",en,[],['https://www.cnet.com/roadshow/news/chinese-built-tesla-model-3-prices/?linkId=68380759'],[],4,24,204,[],[],https://twitter.com/teslaownersSV/status/1135056071515488256,False,,0,,,,,,,,[],,,,,0.004505797,0.25503555,0.74045855
91,1135055231719362561,1135055231719362561,2019-06-02 05:27:10 UTC,2019-06-02,05:27:10,0,1016059981907386368,teslaownerssv,Tesla Owners Silicon Valley,,Tesla’s Model 3 is now available in Ireland  https://t.co/LysVvSwlr6,en,[],['https://irishtechnews.ie/teslas-model-3-is-now-available-in-ireland/'],[],1,7,62,[],[],https://twitter.com/teslaownersSV/status/1135055231719362561,False,,0,,,,,,,,[],,,,,0.0021584062,0.54682136,0.4510202
92,1135054727954046976,1135053398150131713,2019-06-02 05:25:10 UTC,2019-06-02,05:25:10,0,808619681443520516,mannymars1,MannyMars🚀🐝,,@engineers_feed @elonmusk future panel gaps on Tesla cars will be seamless 👍,en,[],[],[],3,2,155,[],[],https://twitter.com/Mannymars1/status/1135054727954046976,False,,0,,,,,,,,"[{'screen_name': 'engineers_feed', 'name': 'World of Engineering', 'id': '3429950987'}]",,,,,0.0067355535,0.10283038,0.890434
93,1135038168409858048,1135038168409858048,2019-06-02 04:19:21 UTC,2019-06-02,04:19:21,0,14850587,phoennix10,phoenix10 (smartish),,$TSLA - 1/Tesla caught fire will supercharging.  Sound familiar?,en,[],[],[],3,14,61,[],['tsla'],https://twitter.com/phoennix10/status/1135038168409858048,False,https://twitter.com/ElectrekCo/status/1135024782913806336,0,,,,,,,,[],,,,,0.26952115,0.6752537,0.0552251
94,1135024782913806336,1135024782913806336,2019-06-02 03:26:10 UTC,2019-06-02,03:26:10,0,2148233600,electrekco,Electrek.co,,Tesla vehicle caught on fire while plugged in at Supercharger station  https://t.co/d5bf8kmmve by @fredericlambert  https://t.co/q2jKau81xi,en,"[{'screen_name': 'fredericlambert', 'name': 'fred lambert', 'id': '38253449'}]",['https://electrek.co/2019/06/01/tesla-fire-supercharger/'],['https://pbs.twimg.com/media/D8BrBmsWwAEjDMU.jpg'],57,63,206,[],[],https://twitter.com/ElectrekCo/status/1135024782913806336,False,,1,https://pbs.twimg.com/media/D8BrBmsWwAEjDMU.jpg,,,,,,,[],,,,,0.3551795,0.6195898,0.025230618
95,1135021085680898048,1135021085680898048,2019-06-02 03:11:29 UTC,2019-06-02,03:11:29,0,17060015,cleantechnica,CleanTechnica,,Tesla Design: The Violent Intersection Of Relentless Innovation &amp; Unleashed Creativity  https://t.co/BpkJrhB5FQ  https://t.co/xqjEeIkkfg,en,[],['https://cleantechnica.com/2019/06/01/tesla-design-the-violent-intersection-of-relentless-innovation-unleashed-creativity/'],['https://pbs.twimg.com/media/D8BnqWlXsAE5A6H.jpg'],4,27,218,[],[],https://twitter.com/cleantechnica/status/1135021085680898048,False,,1,https://pbs.twimg.com/media/D8BnqWlXsAE5A6H.jpg,,,,,,,[],,,,,0.017702727,0.7943914,0.18790585
96,1135019880493735936,1134966628683309056,2019-06-02 03:06:41 UTC,2019-06-02,03:06:41,0,944746889194364928,crediblecrypto,Credible Crypto,,"If you haven’t figured it out yet it is not potsticks or Tesla, it is #GVXXF/#GXU Goviex Uranium 😍",en,[],[],[],11,11,87,"['gvxxf', 'gxu']",[],https://twitter.com/CredibleCrypto/status/1135019880493735936,False,,0,,,,,,,,[],,,,,0.007332941,0.16778997,0.8248771
97,1135011968140472320,1135011968140472320,2019-06-02 02:35:15 UTC,2019-06-02,02:35:15,0,538647761,plainrocktweets,Plainrock124,,"Was filming myself inside my car and a big gust of wind blows my camera over. The camera didn't save the clip, cause the SD card got ejected, but our security cam and my Tesla caught it...  https://t.co/GgwKalctfT",en,[],[],[],71,33,507,[],[],https://twitter.com/plainrocktweets/status/1135011968140472320,False,,1,https://pbs.twimg.com/ext_tw_video_thumb/1135011106311684096/pu/img/c6nC01YAeQ8nLOem.jpg,,,,,,,[],,,,,0.5607196,0.4128661,0.02641438
98,1135010145124192256,1135010145124192256,2019-06-02 02:28:00 UTC,2019-06-02,02:28:00,0,989986448295235586,teslatino,"TesLatino 🚀 Rafael - Lover, not a hater.",,"Dear @Tesla,  Don’t tell anyone, but I’m pretty sure that my Model 3 is the funnest thing I have bought in my entire life. Besides that, it also saved my sanity while I was recovering from a terrible motorcycle accident.  I ❤️ U,  Rafael  p.s. Really. Keep it low.",en,"[{'screen_name': 'tesla', 'name': 'tesla', 'id': '13298072'}]",[],[],5,5,161,[],[],https://twitter.com/TesLatino/status/1135010145124192256,False,,0,,,,,,,,[],,,,,0.012065189,0.028922712,0.95901215
99,1134990270184009730,1134990270184009730,2019-06-02 01:09:02 UTC,2019-06-02,01:09:02,0,127363719,michaelschweitz,Michael Ⓜ️,,“Buddy in a Tesla”  https://t.co/vH6uih9m7t,en,[],[],['https://pbs.twimg.com/media/D8BLoVxXkAAwZvu.jpg'],63,25,429,[],[],https://twitter.com/michaelschweitz/status/1134990270184009730,False,,1,https://pbs.twimg.com/media/D8BLoVxXkAAwZvu.jpg,,,,,,,[],,,,,0.010418361,0.9211114,0.0684702
100,1134984072386793472,1134984072386793472,2019-06-02 00:44:24 UTC,2019-06-02,00:44:24,0,3016048987,redkocarlee,Carlee Redko,,Today I had to get a booster seat out of a Tesla.  I do not know how to open a Tesla. The 20 seconds it took me to realize this was the most embarrassing thing that happened all day.  UNTIL the 6 yr old I was babysitting said “are you that poor?”,en,[],[],[],0,1,77,[],[],https://twitter.com/redkocarlee/status/1134984072386793472,False,,0,,,,,,,,[],,,,,0.897624,0.08644473,0.015931383
101,1134980961849040898,1134980961849040898,2019-06-02 00:32:02 UTC,2019-06-02,00:32:02,0,516016088,ninonp14,Nino,,I just dont understand why AMERICANS hate Tesla so much and are so eager to bring the company down??? You should be extremely proud of Tesla. Elon is literally changing the world for better. @elonmusk @Tesla @Teslarati @mayemusk @S_Padival  https://t.co/Xzv4pWi9wo,en,"[{'screen_name': 'elonmusk', 'name': 'elon musk', 'id': '44196397'}, {'screen_name': 'tesla', 'name': 'tesla', 'id': '13298072'}, {'screen_name': 'teslarati', 'name': 'teslarati', 'id': '1308211178'}, {'screen_name': 'mayemusk', 'name': 'maye musk', 'id': '14171401'}, {'screen_name': 's_padival', 'name': '💧sp 🇸🇾🇵🇸🇾🇪🇮🇶🇸🇴', 'id': '717042249624854529'}]",[],['https://pbs.twimg.com/media/D8BDKAHW4AUHwJh.jpg'],26,56,497,[],[],https://twitter.com/ninonp14/status/1134980961849040898,False,,1,https://pbs.twimg.com/media/D8BDKAHW4AUHwJh.jpg,,,,,,,[],,,,,0.27661154,0.23178335,0.49160513
102,1134976731675127808,1134976731675127808,2019-06-02 00:15:14 UTC,2019-06-02,00:15:14,0,717042249624854529,s_padival,💧SP 🇸🇾🇵🇸🇾🇪🇮🇶🇸🇴,,🇺🇸 A Tesla is the most patriotic car an American can buy! 🇺🇸   $TSLA  https://t.co/Coe8mmZ8wh,en,[],['https://youtu.be/MiDWgh7jhTE'],[],7,12,94,[],['tsla'],https://twitter.com/S_Padival/status/1134976731675127808,False,,0,,,,,,,,[],,,,,0.0032603627,0.022921825,0.97381794
