id,conversation_id,created_at,date,time,timezone,user_id,username,name,place,tweet,language,mentions,urls,photos,replies_count,retweets_count,likes_count,hashtags,cashtags,link,retweet,quote_url,video,thumbnail,near,geo,source,user_rt_id,user_rt,retweet_id,reply_to,retweet_date,translate,trans_src,trans_dest
1161063848301826048,1161063848301826048,2019-08-12 23:56:07 UTC,2019-08-12,23:56:07,+0000,2236633914,raesremmurd,Rae Sremmurd,,Rae sremmurd x Tesla 🚙💨,und,[],[],[],5,53,714,[],[],https://twitter.com/RaeSremmurd/status/1161063848301826048,False,https://twitter.com/elonmusk/status/1160637748199301120,0,,,,,,,,[],,,,
1161060988730454016,1160949898956673024,2019-08-12 23:44:45 UTC,2019-08-12,23:44:45,+0000,740946180,minimalduck,Arash Malek 🦆,,@Tesla Last time I tried to visit a gas station...  https://t.co/ekMxYPmZia,en,[],[],"['https://pbs.twimg.com/media/EBzqy7DWsAAmPoo.jpg', 'https://pbs.twimg.com/media/EBzqy6_XoAYAhzt.jpg']",3,6,180,[],[],https://twitter.com/MinimalDuck/status/1161060988730454016,False,,1,https://pbs.twimg.com/media/EBzqy7DWsAAmPoo.jpg,,,,,,,"[{'screen_name': 'Tesla', 'name': 'Tesla', 'id': '13298072'}]",,,,
1161057549216620544,1161057549216620544,2019-08-12 23:31:05 UTC,2019-08-12,23:31:05,+0000,436103176,teslaband,TESLA™,,Drift away to that SUMMER Song ☀️🎶 THANK YOU to all of our Tesla Troops who submitted their summer photos to be included in this video.  This song &amp;  video is for you.  Please RT &amp; help us celebrate.   https://t.co/5LrepZPGC0,en,[],['https://youtu.be/wp32Mx_KnF4'],[],3,21,91,[],[],https://twitter.com/TeslaBand/status/1161057549216620544,False,,0,,,,,,,,[],,,,
1161056770355290112,1161056770355290112,2019-08-12 23:28:00 UTC,2019-08-12,23:28:00,+0000,718747351792398336,alex_avoigt,Alex,,Porsche: we can do 26 times full throttle with the Taycan  Tesla  owner: we did 31 with the Model 3  Why is Porsche even talking about this when they should know having tested the Model 3 extensively that it is doing better?  https://t.co/4PnQh3e6RG  https://t.co/FpLbANKxti,en,[],"['https://thedriven.io/2019/08/12/the-tech-behind-those-26-full-throttle-porsche-taycan-launches/', 'https://www.teslarati.com/tesla-model-3-performance-31-hard-launches-video']",[],10,19,87,[],[],https://twitter.com/alex_avoigt/status/1161056770355290112,False,,0,,,,,,,,[],,,,
1161055536747597824,1161055536747597824,2019-08-12 23:23:05 UTC,2019-08-12,23:23:05,+0000,18856867,zerohedge,zerohedge,,"""Epstein avoided specifics about his work for Tesla. He told me that he had good reason to be cryptic: Once it became public that he was advising the company, he’d have to stop doing so, because he was “radioactive."" - NYT",en,[],[],[],12,54,148,[],[],https://twitter.com/zerohedge/status/1161055536747597824,False,,0,,,,,,,,[],,,,
1161055274196594694,1161055274196594694,2019-08-12 23:22:03 UTC,2019-08-12,23:22:03,+0000,1016059981907386368,teslaownerssv,Tesla Owners Silicon Valley,,"Everyday I wake up, I grow a higher appreciation for the technology and product that has changed my life. There hasn't been a product that has changed my day to day as much as @tesla. It's the @tesla effect! The engineering and technology will blow your mind once you try it  https://t.co/gNjqx0fpEC",en,"[{'screen_name': 'tesla', 'name': 'tesla', 'id': '13298072'}, {'screen_name': 'tesla', 'name': 'tesla', 'id': '13298072'}]",[],['https://pbs.twimg.com/media/EBzlnYSUEAATy0p.jpg'],4,18,119,[],[],https://twitter.com/teslaownersSV/status/1161055274196594694,False,,1,https://pbs.twimg.com/media/EBzlnYSUEAATy0p.jpg,,,,,,,[],,,,
1161054082783727621,1161006911560589319,2019-08-12 23:17:19 UTC,2019-08-12,23:17:19,+0000,3223426134,sethabramson,Seth Abramson,,"@Goldsh0es @UNSEATpac @ShotgunZen @PattyArquette @thedailybeast @NYMag EVIDENCE42/ BREAKING NEWS (NYT): Epstein Told Tech Journalist He Spoke to Saudis About Investing in Tesla  You'll recall my tech journalist friend was told by Epstein that he was investing ""$18 billion"" for an oil-tied Middle Easterner—and I said the evidence pointed toward MBS.",en,[],[],[],9,182,677,[],[],https://twitter.com/SethAbramson/status/1161054082783727621,False,,0,,,,,,,,"[{'screen_name': 'Goldsh0es', 'name': 'Pum', 'id': '131905510'}, {'screen_name': 'UNSEATpac', 'name': 'Sam Spiegel, Ph.D. \U0001faa7', 'id': '831981131561988096'}, {'screen_name': 'PattyArquette', 'name': 'Patricia Arquette', 'id': '122533830'}, {'screen_name': 'thedailybeast', 'name': 'The Daily Beast', 'id': '16012783'}, {'screen_name': 'NYMag', 'name': 'New York Magazine', 'id': '45564482'}]",,,,
1161051594835841025,1161051594835841025,2019-08-12 23:07:26 UTC,2019-08-12,23:07:26,+0000,164425558,jonerlichman,Jon Erlichman,,Here’s how old these companies are:  Snapchat: 8 years Uber: 10 years Twitter: 13 years Facebook: 15 years Tesla: 16 years Google: 21 years Netflix: 22 years Amazon: 25 years Apple: 43 years Intel: 51 years HP: 80 years Disney: 96 years IBM: 108 years,en,[],[],[],27,574,2319,[],[],https://twitter.com/JonErlichman/status/1161051594835841025,False,,0,,,,,,,,[],,,,
1161050103508942848,1161050103508942848,2019-08-12 23:01:30 UTC,2019-08-12,23:01:30,+0000,1689516060,vincent13031925,vincentyu.eth,,"Tesla Shanghai Gigafactory China GF3  August 12th update   After typhoon Lekima, east side fences of #GF3 were mostly came off. Fortunately, no flooding or any damage to GF3 and won’t affect any construction process.   via:  https://t.co/zqPv2L3MdQ  $TSLA #TeslaChina #Tesla #China  https://t.co/ssD1YsIvBn",en,[],['https://youtu.be/jfzzJ-HliQg'],[],5,32,211,"['gf3', 'teslachina', 'tesla', 'china']",['tsla'],https://twitter.com/vincent13031925/status/1161050103508942848,False,,1,https://pbs.twimg.com/ext_tw_video_thumb/1161049963872182272/pu/img/UjkpmT8zcHdQIVuk.jpg,,,,,,,[],,,,
1161045853152391168,1161045853152391168,2019-08-12 22:44:37 UTC,2019-08-12,22:44:37,+0000,14807920,caseyfrank1,caseyfrank1,,"Fascinating and creepy. Had we @MiamiHerald landed an interview with Mr. Epstein -- and we were already trying on the date of this talk -- it wouldn't have been about Tesla. Says something (a lot, actually) about the normalization of his known behavior. #PerversionofJustice",en,"[{'screen_name': 'miamiherald', 'name': 'miami herald', 'id': '14085040'}]",[],[],39,433,1341,['perversionofjustice'],[],https://twitter.com/caseyfrank1/status/1161045853152391168,False,https://twitter.com/caseyfrank1/status/1161044812629532672,0,,,,,,,,[],,,,
1161038718045605888,1161038718045605888,2019-08-12 22:16:16 UTC,2019-08-12,22:16:16,+0000,767,xeni,Xeni 🌻,,“I’d heard that [Jeffrey] Epstein was compiling a list of candidates at [Elon] Musk’s behest — and that Mr. Epstein had an email from Mr. Musk authorizing the search for a new chairman. Mr. Musk and Tesla vehemently deny this.”  https://t.co/MA9SPmQc3f via ⁦@nytimes⁩,en,"[{'screen_name': 'nytimes', 'name': 'the new york times', 'id': '807095'}]",['https://www.nytimes.com/2019/08/12/business/jeffrey-epstein-interview.html?smid=nytcore-ios-share'],[],8,18,60,[],[],https://twitter.com/xeni/status/1161038718045605888,False,,0,,,,,,,,[],,,,
1161037891340046342,1161037891340046342,2019-08-12 22:12:58 UTC,2019-08-12,22:12:58,+0000,793038200,paulhardware,Paul's Hardware,,New Video! TESLA Solar and Powerwall: 1 Year Later  ⚡  https://t.co/VHHwVk6zSt ⚡,en,[],['https://youtu.be/KTOLE0pAsG0'],[],7,32,180,[],[],https://twitter.com/paulhardware/status/1161037891340046342,False,,0,,,,,,,,[],,,,
1161033405234057217,1161033049544507393,2019-08-12 21:55:09 UTC,2019-08-12,21:55:09,+0000,185270017,davidenrich,David Enrich,,"@JamesStewartNYT @elonmusk @Tesla The interview took place ""on background,"" which means the @nytimes couldn't directly attribute anything to Epstein.   Now he is dead, and, given the circumstances, we think that publishing his comments is the right thing to do.",en,"[{'screen_name': 'nytimes', 'name': 'the new york times', 'id': '807095'}]",[],[],109,446,1951,[],[],https://twitter.com/davidenrich/status/1161033405234057217,False,,0,,,,,,,,"[{'screen_name': 'JamesStewartNYT', 'name': 'James B. Stewart', 'id': '400344850'}, {'screen_name': 'elonmusk', 'name': 'Elon Musk', 'id': '44196397'}, {'screen_name': 'Tesla', 'name': 'Tesla', 'id': '13298072'}]",,,,
1161033309712990221,1161033049544507393,2019-08-12 21:54:46 UTC,2019-08-12,21:54:46,+0000,185270017,davidenrich,David Enrich,,"@JamesStewartNYT Jim went to Epstein's NY mansion to discuss rumors that he was advising @elonmusk. Epstein didn't want to talk much about that. (@Tesla says it's not true.) But he was effusive on other topics, including sex and his connections to the rich and powerful.  https://t.co/3AX0qlixOI",en,"[{'screen_name': 'elonmusk', 'name': 'elon musk', 'id': '44196397'}, {'screen_name': 'tesla', 'name': 'tesla', 'id': '13298072'}]",[],['https://pbs.twimg.com/media/EBzRo6tXkAAUmt8.jpg'],96,679,1352,[],[],https://twitter.com/davidenrich/status/1161033309712990221,False,,1,https://pbs.twimg.com/media/EBzRo6tXkAAUmt8.jpg,,,,,,,"[{'screen_name': 'JamesStewartNYT', 'name': 'James B. Stewart', 'id': '400344850'}]",,,,
1161022354824339456,1161022354824339456,2019-08-12 21:11:14 UTC,2019-08-12,21:11:14,+0000,1045479441768566784,energyvest,energyvest 🇺🇦🦊,,Tesla’s lead is unassailable.    “Our conclusion: competition in 2019 and likely 2020 is not a measurable threat to Tesla. The Model 3 is unchallenged in its EV value proposition.”   💪👊😎,en,[],[],[],4,16,103,[],[],https://twitter.com/energyvest/status/1161022354824339456,False,https://twitter.com/loupfunds/status/1161021448909201409,0,,,,,,,,[],,,,
1161021930486583296,1161021930486583296,2019-08-12 21:09:33 UTC,2019-08-12,21:09:33,+0000,809837854981582848,ctr4autosafety,Center for Auto Safety,,"Just got back from speaking with the @FTC (spoiler alert: It was about @Tesla). To learn more about Tesla's history of deceptive advertising, check out our website:   https://t.co/6wBvGHOOj7  https://t.co/HcixmeaLHU",en,"[{'screen_name': 'ftc', 'name': 'ftc', 'id': '187993109'}, {'screen_name': 'tesla', 'name': 'tesla', 'id': '13298072'}]",['https://www.autosafety.org/?s=tesla'],['https://pbs.twimg.com/media/EBzHSv_WkAIoh3P.jpg'],7,16,70,[],[],https://twitter.com/Ctr4AutoSafety/status/1161021930486583296,False,,1,https://pbs.twimg.com/media/EBzHSv_WkAIoh3P.jpg,,,,,,,[],,,,
1161020554037456896,1161020554037456896,2019-08-12 21:04:05 UTC,2019-08-12,21:04:05,+0000,14707266,evacide,Eva,,A mod to turn a Tesla S into a facial recognition and license plate info collection machine? Just because you can do a thing does not necessarily mean you should do a thing.  https://t.co/6clizSD3Nm,en,[],['https://www.wired.com/story/tesla-surveillance-detection-scout/'],[],14,67,241,[],[],https://twitter.com/evacide/status/1161020554037456896,False,,0,,,,,,,,[],,,,
1161009725447856128,1161009725447856128,2019-08-12 20:21:03 UTC,2019-08-12,20:21:03,+0000,15650636,leilanimunter,Leilani Münter 🇺🇦,,"I'm ""Marie Kondo-ing"" (new verb @MerriamWebster?) my office &amp; coolest item rediscovered is @stevewoz's metal business card. We met at Flying Car 2014 &amp; all we talked about was how much we both love our @Tesla P85+ MS, I was the first person he met who also had the + suspension⚡️  https://t.co/IwvkNiNP2d",en,"[{'screen_name': 'merriamwebster', 'name': 'merriam-webster', 'id': '97040343'}, {'screen_name': 'stevewoz', 'name': 'steve wozniak', 'id': '22938914'}, {'screen_name': 'tesla', 'name': 'tesla', 'id': '13298072'}]",[],"['https://pbs.twimg.com/media/EBy8MKfWkAEoRcu.jpg', 'https://pbs.twimg.com/media/EBy8MKbXkAEthiL.jpg']",2,4,78,[],[],https://twitter.com/LeilaniMunter/status/1161009725447856128,False,,1,https://pbs.twimg.com/media/EBy8MKfWkAEoRcu.jpg,,,,,,,[],,,,
1161008260322906112,1161008260322906112,2019-08-12 20:15:14 UTC,2019-08-12,20:15:14,+0000,1308211178,teslarati,TESLARATI,,"Fiat-Chrysler CEO says no CO2 fines until 2020, thanks to Tesla pooling deal  https://t.co/Tnhn9kPQvV",en,[],['https://www.teslarati.com/tesla-pooling-fca-avoids-co2-fines-2020/'],[],9,17,187,[],[],https://twitter.com/Teslarati/status/1161008260322906112,False,,0,,,,,,,,[],,,,
1161006031796867072,1161006031796867072,2019-08-12 20:06:23 UTC,2019-08-12,20:06:23,+0000,995907589425725440,scottishtesla,Scottish Tesla,,"It’s only taken over 3 years but, finally! Model 3 Performance incoming 🚀🚀 #tesla #scotland #ScottishTesla  1,000 free miles of supercharging coming your way @28delayslater  https://t.co/6fbY4tQyt4",en,"[{'screen_name': '28delayslater', 'name': '🇺🇦 🦊 earl of frunkpuppy 🇺🇦', 'id': '998140573008695296'}]",[],['https://pbs.twimg.com/media/EBy41FFWsAAKcmm.jpg'],11,6,200,"['tesla', 'scotland', 'scottishtesla']",[],https://twitter.com/ScottishTesla/status/1161006031796867072,False,,1,https://pbs.twimg.com/media/EBy41FFWsAAKcmm.jpg,,,,,,,[],,,,
1161005181355663360,1161005181355663360,2019-08-12 20:03:00 UTC,2019-08-12,20:03:00,+0000,1408003598,fdrlst,The Federalist,,"Andrew Yang scored a major endorsement this weekend from fellow tech entrepreneur Elon Musk, the founder of PayPal who now leads SpaceX and Tesla.  https://t.co/URuMH8p2PS",en,[],['http://fdrl.st/dnw'],[],14,39,217,[],[],https://twitter.com/FDRLST/status/1161005181355663360,False,,0,,,,,,,,[],,,,
1160990818309742593,1160990818309742593,2019-08-12 19:05:55 UTC,2019-08-12,19:05:55,+0000,2148233600,electrekco,Electrek.co,,Tesla owner takes on Porsche's claim with Model 3 Performance doing 31 launches  https://t.co/L8g12CGPAU by @fredericlambert  https://t.co/1GvI4mH2Vp,en,"[{'screen_name': 'fredericlambert', 'name': 'fred lambert', 'id': '38253449'}]",['https://electrek.co/2019/08/12/tesla-model-3-performance-porsche-claims/'],['https://pbs.twimg.com/media/EByq_xsXsAAnU9E.jpg'],7,34,189,[],[],https://twitter.com/ElectrekCo/status/1160990818309742593,False,,1,https://pbs.twimg.com/media/EByq_xsXsAAnU9E.jpg,,,,,,,[],,,,
1160990502235381761,1160990502235381761,2019-08-12 19:04:40 UTC,2019-08-12,19:04:40,+0000,275686563,verge,The Verge,,A Tesla owner implanted the RFID chip from her Model 3’s keycard into her arm  https://t.co/1B6Xy0pIhI  https://t.co/TvHDV7I3mD,en,[],['https://www.theverge.com/2019/8/12/20800798/tesla-model-3-rfid-chip-keycard-amiedd-video-watch-body-hacking-body-modification?utm_campaign=theverge&utm_content=chorus&utm_medium=social&utm_source=twitter'],['https://pbs.twimg.com/media/EByqtbAXUAYTuu-.jpg'],30,94,370,[],[],https://twitter.com/verge/status/1160990502235381761,False,,1,https://pbs.twimg.com/media/EByqtbAXUAYTuu-.jpg,,,,,,,[],,,,
1160987061123313674,1160987061123313674,2019-08-12 18:51:00 UTC,2019-08-12,18:51:00,+0000,80903194,timaeppel,Timothy Aeppel,,"My Lyft driver just told me about the theory that Donald Trump's youngest son is a time traveler, which is somehow related to what happened to Nicola Tesla's papers after he died . . . or something.",en,[],[],[],58,7,161,[],[],https://twitter.com/TimAeppel/status/1160987061123313674,False,,0,,,,,,,,[],,,,
1160986361324888064,1160984723201626120,2019-08-12 18:48:13 UTC,2019-08-12,18:48:13,+0000,284278132,morganhousel,Morgan Housel,,@wolfejosh Of all the Tesla criticisms I understand this one the least.   This stories are not unique to Tesla. The attention is.    https://t.co/GUhNL4KlHG,en,[],['https://www.abcactionnews.com/news/local-news/up-in-flames/dozens-of-drivers-take-kia-hyundai-to-court-over-spontaneous-vehicle-fires'],[],12,6,117,[],[],https://twitter.com/morganhousel/status/1160986361324888064,False,,0,,,,,,,,"[{'screen_name': 'wolfejosh', 'name': 'Josh Wolfe', 'id': '15370019'}]",,,,
1160985303508631552,1160941773163622400,2019-08-12 18:44:01 UTC,2019-08-12,18:44:01,+0000,512701026,frskyrroz,Skyrroz,,@Casey @Tesla Maybe 😊  https://t.co/MEHRvOGmrP,en,[],[],['https://pbs.twimg.com/media/EByl-ifUcAM-9-U.jpg'],4,12,821,[],[],https://twitter.com/FRSkyRRoZ/status/1160985303508631552,False,,1,https://pbs.twimg.com/media/EByl-ifUcAM-9-U.jpg,,,,,,,"[{'screen_name': 'Casey', 'name': 'Casey Neistat', 'id': '154221292'}, {'screen_name': 'Tesla', 'name': 'Tesla', 'id': '13298072'}]",,,,
1160984825060159489,1160984825060159489,2019-08-12 18:42:07 UTC,2019-08-12,18:42:07,+0000,3427605100,ntftwt,Michael ,,"The reason why most people won't buy a Tesla: ""what if I run out of battery in the middle of nowhere??  The middle of nowhere:  https://t.co/NvNPBoKwob",en,[],[],['https://pbs.twimg.com/media/EBylg1MUcAMllqO.jpg'],6,18,102,[],[],https://twitter.com/NTFTWT/status/1160984825060159489,False,,1,https://pbs.twimg.com/media/EBylg1MUcAMllqO.jpg,,,,,,,[],,,,
1160980798050394112,1160941773163622400,2019-08-12 18:26:06 UTC,2019-08-12,18:26:06,+0000,400952440,mcjuggernuggets,Jesse Tyler Ridgway,,@Casey @Tesla i feel your pain. 😞  https://t.co/Y6ID4yWB6A,en,[],[],['https://pbs.twimg.com/media/EByh4TrX4AIp7Zd.jpg'],30,20,413,[],[],https://twitter.com/McJuggerNuggets/status/1160980798050394112,False,,1,https://pbs.twimg.com/media/EByh4TrX4AIp7Zd.jpg,,,,,,,"[{'screen_name': 'Casey', 'name': 'Casey Neistat', 'id': '154221292'}, {'screen_name': 'Tesla', 'name': 'Tesla', 'id': '13298072'}]",,,,
1160980097089855488,1160980097089855488,2019-08-12 18:23:19 UTC,2019-08-12,18:23:19,+0000,1052869334509469696,teslahistorian,The Short Shorts Historian,,THIS DAY IN $TSLAQ HISTORY:  Remember the great war of BMW vs. Tesla?  @BertelSchmitt 3 years ago:  https://t.co/h9877M5BE0,en,"[{'screen_name': 'bertelschmitt', 'name': 'bertelschmitt™ 🇺🇦💉💉💉🎩🎩🎩🎩🎩', 'id': '134503182'}]",[],['https://pbs.twimg.com/media/EByff_6XkAEqE6n.png'],3,12,106,[],['tslaq'],https://twitter.com/TeslaHistorian/status/1160980097089855488,False,,1,https://pbs.twimg.com/media/EByff_6XkAEqE6n.png,,,,,,,[],,,,
1160980074004393988,1160941773163622400,2019-08-12 18:23:14 UTC,2019-08-12,18:23:14,+0000,19364937,hecknn,HECKNN,,@mikeotoole86 @Casey @westonmd @Tesla Turn it off and on.,en,[],[],[],3,3,109,[],[],https://twitter.com/HECKNN/status/1160980074004393988,False,,0,,,,,,,,"[{'screen_name': 'mikeotoole86', 'name': 'Mike...', 'id': '779840886381346816'}, {'screen_name': 'Casey', 'name': 'Casey Neistat', 'id': '154221292'}, {'screen_name': 'westonmd', 'name': 'Country', 'id': '129479804'}, {'screen_name': 'Tesla', 'name': 'Tesla', 'id': '13298072'}]",,,,
1160975387599523840,1160975387599523840,2019-08-12 18:04:36 UTC,2019-08-12,18:04:36,+0000,260766494,sarabesnara,seviџ,,"vama je vrhunac liberalnog demokratskog shvatanja da kao srbi kazete da tesla ne pripada srbima nego covecanstvu a u sustini to vase shvatanje se najpribliznije moze prikazati recenicom ""poseri se na svoje poreklo da te prihvati svet koji vec sere po tebi i tvom poreklu""",und,[],[],[],1,7,66,[],[],https://twitter.com/sarabesnara/status/1160975387599523840,False,,0,,,,,,,,[],,,,
1160974574760136710,1160974574760136710,2019-08-12 18:01:23 UTC,2019-08-12,18:01:23,+0000,424320811,catclifford,Catherine Clifford,,The #YangGang got a show of support from @elonmusk this weekend. That's perhaps unsurprising as the @Tesla/@SpaceX boss &amp; @AndrewYang have both publicly talked about how UBI will be an eventual necessity when robots &amp; automation put humans out of work.  https://t.co/ZkmjWrtgxL,en,"[{'screen_name': 'elonmusk', 'name': 'elon musk', 'id': '44196397'}, {'screen_name': 'tesla', 'name': 'tesla', 'id': '13298072'}, {'screen_name': 'spacex', 'name': 'spacex', 'id': '34743251'}, {'screen_name': 'andrewyang', 'name': 'andrew yang🧢⬆️🇺🇸', 'id': '2228878592'}]",['https://cnb.cx/2ORDXhK'],[],16,14,75,['yanggang'],[],https://twitter.com/CatClifford/status/1160974574760136710,False,,0,,,,,,,,[],,,,
1160971641523855360,1160971641523855360,2019-08-12 17:49:43 UTC,2019-08-12,17:49:43,+0000,2421203808,conspiracionesp,Conspiraciones,,"Al ser Nikola Tesla uno de los más célebres protagonistas de la historia de la ciencia y la tecnología, conocer algunos de sus ideales, pensamientos y reflexiones es más que interesante.   https://t.co/cu9dBndGnP",es,[],['https://www.youtube.com/watch?v=PLjtR61BSxo'],[],0,32,80,[],[],https://twitter.com/ConspiracionESP/status/1160971641523855360,False,,0,,,,,,,,[],,,,
1160967508217729024,1160967508217729024,2019-08-12 17:33:18 UTC,2019-08-12,17:33:18,+0000,998140573008695296,28delayslater,🇺🇦 🦊 Earl of FrunkPuppy 🇺🇦,,Taycan is estimated at 311 miles of range NEDC.  A Tesla Model 3 has 443 miles of range by that metric. A Model S can go 529 miles based on that standard.  For some fair comparisons.   #Tesla $TSLA #Model3 #ModelS  https://t.co/JfdFfqxZjg,en,[],[],['https://pbs.twimg.com/tweet_video_thumb/EByVytQWwAAK-aV.jpg'],10,26,171,"['tesla', 'model3', 'models']",['tsla'],https://twitter.com/28delayslater/status/1160967508217729024,False,,1,https://pbs.twimg.com/tweet_video_thumb/EByVytQWwAAK-aV.jpg,,,,,,,[],,,,
1160967033619566593,1160967033619566593,2019-08-12 17:31:25 UTC,2019-08-12,17:31:25,+0000,1015237196805169153,reallifestarman,Starman,,I 🖤 the @Tesla Team!  https://t.co/61omSGiGip,en,"[{'screen_name': 'tesla', 'name': 'tesla', 'id': '13298072'}]",[],['https://pbs.twimg.com/media/EByVXFkUIAAXuS_.jpg'],3,12,284,[],[],https://twitter.com/RealLifeStarman/status/1160967033619566593,False,,1,https://pbs.twimg.com/media/EByVXFkUIAAXuS_.jpg,,,,,,,[],,,,
1160966952145313794,1160966952145313794,2019-08-12 17:31:05 UTC,2019-08-12,17:31:05,+0000,909913363,stefansparavalo,шпаравало.,,-Tesla pripada čovečanstvu -Sisaj bre kurac,und,[],[],[],3,5,80,[],[],https://twitter.com/Stefansparavalo/status/1160966952145313794,False,,0,,,,,,,,[],,,,
1160966706652729345,1160966706652729345,2019-08-12 17:30:07 UTC,2019-08-12,17:30:07,+0000,1308211178,teslarati,TESLARATI,,Tesla Model 3 Performance endures 31 hard launches with no throttling  https://t.co/2oOVdwSCOl,en,[],['https://www.teslarati.com/tesla-model-3-performance-31-hard-launches-video'],[],45,147,1280,[],[],https://twitter.com/Teslarati/status/1160966706652729345,False,,0,,,,,,,,[],,,,
1160963018311831552,1160963018311831552,2019-08-12 17:15:27 UTC,2019-08-12,17:15:27,+0000,711802172770557952,offcolourorg,Off Colour,,"The cheapest Tesla is the Model 3 base model for $54 ,990 USD.   That’s also almost double the estimated cost of production for the car.   It’s not eco friendly if it’s not affordable and accessible.",en,[],[],[],4,84,278,[],[],https://twitter.com/OffColourOrg/status/1160963018311831552,False,https://twitter.com/Tesla/status/1160949898956673024,0,,,,,,,,[],,,,
1160958069171318785,1160958069171318785,2019-08-12 16:55:47 UTC,2019-08-12,16:55:47,+0000,221011369,carmencrincoli,"Carmen Crincoli, but Fhqwhgads",,"I have never found a touchscreen that I enjoy using in a car. No, not even a Tesla. They're interesting, but they're not enjoyable or automatic to use. Give me knobs, buttons, switches, and levers any day.  https://t.co/iNcxZMCHSX",en,[],['https://arstechnica.com/cars/2019/08/the-us-navy-says-no-to-touchscreens-maybe-automakers-should-too/'],[],46,62,381,[],[],https://twitter.com/CarmenCrincoli/status/1160958069171318785,False,,0,,,,,,,,[],,,,
1160956732471779333,1160956732471779333,2019-08-12 16:50:29 UTC,2019-08-12,16:50:29,+0000,1689516060,vincent13031925,vincentyu.eth,,"The official Tesla Model 3 introduction event for Taiwan.  August 12th, 2019   via @TeslaOwnersTwn @hsumacher  $TSLA #Tesla #Model3 #Taiwan  https://t.co/XLhM8dDg2U",en,"[{'screen_name': 'teslaownerstwn', 'name': 'tesla owners taiwan', 'id': '1053079454853943296'}, {'screen_name': 'hsumacher', 'name': 'michael hsu', 'id': '133576469'}]",[],[],16,65,410,"['tesla', 'model3', 'taiwan']",['tsla'],https://twitter.com/vincent13031925/status/1160956732471779333,False,,1,https://pbs.twimg.com/ext_tw_video_thumb/1160956645863649280/pu/img/cKgHuDBBaOQBL-gs.jpg,,,,,,,[],,,,
1160955832957329409,1160949898956673024,2019-08-12 16:46:54 UTC,2019-08-12,16:46:54,+0000,552942518,tanthonys7,Tarek,,"@AmyRaspberry @Seanmmvi @MelaynaLokosky @engineers_feed @Tesla You rarely see any Tesla owners just sitting in their car while supercharging. It’s most often timed with a food or potty break. My time at superchargers is never wasted. Especially with children, I cannot even go the full range without stopping for one thing or another.",en,[],[],[],4,0,140,[],[],https://twitter.com/tanthonys7/status/1160955832957329409,False,,0,,,,,,,,"[{'screen_name': 'AmyRaspberry', 'name': 'Amy Raspberry', 'id': '1110456544783679488'}, {'screen_name': 'Seanmmvi', 'name': 'Sean Williams', 'id': '23133479'}, {'screen_name': 'MelaynaLokosky', 'name': 'KillingMyCareer', 'id': '2531643876'}, {'screen_name': 'engineers_feed', 'name': 'World of Engineering', 'id': '3429950987'}, {'screen_name': 'Tesla', 'name': 'Tesla', 'id': '13298072'}]",,,,
1160955445231489024,1160941773163622400,2019-08-12 16:45:22 UTC,2019-08-12,16:45:22,+0000,1324493216,rafidpp,Rafid Parana P,,@Seanskii_ @Casey @Tesla  https://t.co/L0BRifg2IH,und,[],[],['https://pbs.twimg.com/tweet_video_thumb/EByK0LFUIAQ2KUE.jpg'],0,1,400,[],[],https://twitter.com/rafidpp/status/1160955445231489024,False,,1,https://pbs.twimg.com/tweet_video_thumb/EByK0LFUIAQ2KUE.jpg,,,,,,,"[{'screen_name': 'Seanskii_', 'name': 'Sean', 'id': '129323467'}, {'screen_name': 'Casey', 'name': 'Casey Neistat', 'id': '154221292'}]",,,,
1160954634707656712,1160949898956673024,2019-08-12 16:42:09 UTC,2019-08-12,16:42:09,+0000,22088025,slye,Andy Slye,,@BenSullins @Tesla Tesla owners guessing gas prices is like Bill Gates guessing grocery prices.  https://t.co/dwZo9ADhEt,en,[],[],['https://pbs.twimg.com/tweet_video_thumb/EByKE3KWkAEvtv_.jpg'],2,13,525,[],[],https://twitter.com/slye/status/1160954634707656712,False,,1,https://pbs.twimg.com/tweet_video_thumb/EByKE3KWkAEvtv_.jpg,,,,,,,"[{'screen_name': 'Tesla', 'name': 'Tesla', 'id': '13298072'}]",,,,
