,id,conversation_id,created_at,date,time,timezone,user_id,username,name,place,tweet,language,mentions,urls,photos,replies_count,retweets_count,likes_count,hashtags,cashtags,link,retweet,quote_url,video,thumbnail,near,geo,source,user_rt_id,user_rt,retweet_id,reply_to,retweet_date,translate,trans_src,trans_dest,negative,neutral,positive
0,1237163732976844800,1237163732976844800,2020-03-09 23:49:53 UTC,2020-03-09,23:49:53,0,985686123123949568,kristennetten,•K10•♥️🕊🇺🇦 🦊,,What Shareholders mtg 2020 Tesla will be like 😆  https://t.co/ONZseUH2eW,en,[],[],[],29,17,323,[],[],https://twitter.com/Kristennetten/status/1237163732976844800,False,,1,https://pbs.twimg.com/ext_tw_video_thumb/1237100430187999232/pu/img/cNpKxs7jPGIRk2gj.jpg,,,,,,,[],,,,,0.012453867,0.7131106,0.27443546
1,1237154964167962625,1237154964167962625,2020-03-09 23:15:03 UTC,2020-03-09,23:15:03,0,1308211178,teslarati,TESLARATI,,Tesla Model 3 stuns hulking SUV after stare down for stoplight sprint  https://t.co/TpPcbiHSRt,en,[],['https://www.teslarati.com/tesla-thumbs-up-suv-stoplight-race-video'],[],9,22,314,[],[],https://twitter.com/Teslarati/status/1237154964167962625,False,,0,,,,,,,,[],,,,,0.0057700495,0.74036515,0.2538646
2,1237152851656204288,1237110914014269440,2020-03-09 23:06:39 UTC,2020-03-09,23:06:39,0,1171562160591237120,kingazastyles,💬 NEW FACE NEW DAY,,Malpractice Lifeline &amp; Tesla Wattson! YEEHAW WESTERN TIME  https://t.co/WbC0kMuUk1,en,[],[],['https://pbs.twimg.com/media/ESs_9NEU4AE4qpK.jpg'],8,39,158,[],[],https://twitter.com/kingazastyles/status/1237152851656204288,False,,1,https://pbs.twimg.com/media/ESs_9NEU4AE4qpK.jpg,,,,,,,[],,,,,0.13341595,0.56426364,0.30232042
3,1237142971327246336,1237142971327246336,2020-03-09 22:27:24 UTC,2020-03-09,22:27:24,0,959168599519764480,ray4tesla,Ray4Tesla⚡️🚘☀️🔋,,Tesla Giga 4 Berlin Promised Rapid Construction By Prime Minster.   https://t.co/Jd9hacmEt0,en,[],['https://www.tesmanian.com/blogs/tesmanian-blog/tesla-giga-4-berlin-promised-rapid-construction-by-prime-minster'],[],0,26,128,[],[],https://twitter.com/ray4tesla/status/1237142971327246336,False,,0,,,,,,,,[],,,,,0.0039265645,0.55645037,0.4396231
4,1237141305970524160,1237141305970524160,2020-03-09 22:20:46 UTC,2020-03-09,22:20:46,0,1275357529,manualusuariobr,Manual do Usuário,,Lembram quando a Tesla anunciou aquela aberração do Cybertruck e falei que carro é um grande símbolo da cultura hetero/small dick energy  e aí a reaçada do Twitter caiu matando dizendo “onde já se viu?? O que é isso?” Pois bem:  https://t.co/siNIPxgbZF,pt,[],[],['https://pbs.twimg.com/media/ESs1GDnX0AEvg_m.jpg'],5,16,70,[],[],https://twitter.com/manualusuariobr/status/1237141305970524160,False,,1,https://pbs.twimg.com/media/ESs1GDnX0AEvg_m.jpg,,,,,,,[],,,,,0.10045684,0.8396767,0.059866507
5,1237140523053395971,1237140523053395971,2020-03-09 22:17:40 UTC,2020-03-09,22:17:40,0,985243593538338816,teslaconomics,Teslaconomics,,"⚠️PANIC PANIC PANIC!⚠️   SELL SELL SELL!  $TSLA shares are being transferred from holders that are [short-term, worried, panicked] and are being transferred to investors that are [patient, long-term, and understand the intrinsic future].   Give it to me you fools! 🍨   #Tesla",en,[],[],[],9,21,283,['tesla'],['tsla'],https://twitter.com/Teslaconomics/status/1237140523053395971,False,,0,,,,,,,,[],,,,,0.36447895,0.42033362,0.21518748
6,1237138591907811328,1237138221475168257,2020-03-09 22:09:59 UTC,2020-03-09,22:09:59,0,1421721,cardoso,cardoso,,"Foi preciso uma Tesla pra começar a vender carros pra pessoas normais, que gostavam de carros e não queriam só um patinete com coberta pra ir na loja de maconha orgânica.",pt,[],[],[],2,5,103,[],[],https://twitter.com/Cardoso/status/1237138591907811328,False,,0,,,,,,,,[],,,,,0.060421526,0.8465395,0.093038954
7,1237132290570031104,1237132286535008256,2020-03-09 21:44:57 UTC,2020-03-09,21:44:57,0,140668859,greentheonly,green,,"This further cements my opinion that it makes zero sense of ""custom-ordering"" anything from Tesla, you just need to wait until end of quarter, drop by a service center and see what they have in stock at what discounts, anything else is just throwing money away.",en,[],[],[],12,0,122,[],[],https://twitter.com/greentheonly/status/1237132290570031104,False,,0,,,,,,,,[],,,,,0.76628053,0.21497841,0.018740976
8,1237132286535008256,1237132286535008256,2020-03-09 21:44:56 UTC,2020-03-09,21:44:56,0,140668859,greentheonly,green,,"Performed an interesting experiment. Ordered a 'new custom made' X at Tesla - that sure means they'll make you a new one, unlike with the 3, right? Wrong! What actually happened: they got a cheaper priced one off a lot in Texas that somebody else ordered but did not accept",en,[],[],[],19,20,161,[],[],https://twitter.com/greentheonly/status/1237132286535008256,False,,0,,,,,,,,[],,,,,0.15370472,0.51811415,0.32818115
9,1237130046256472064,1237130046256472064,2020-03-09 21:36:02 UTC,2020-03-09,21:36:02,0,1139310453987745792,thirdrowtesla,Third Row Tesla Podcast,,BMW iX3 goes 220 miles on a 75 kWh battery   Tesla Model Y goes 315 on that same 75 kWh battery,en,[],[],[],8,8,134,[],[],https://twitter.com/thirdrowtesla/status/1237130046256472064,False,,0,,,,,,,,[],,,,,0.02706498,0.7843593,0.18857574
10,1237123010810667008,1237123010810667008,2020-03-09 21:08:05 UTC,2020-03-09,21:08:05,0,1061504849420836865,tesla_raj,Tesla Raj,,@elonmusk you and the sneaky team @tesla snuck in another one! Cybertruck Easter egg in camp mode!  https://t.co/BvPSQrUdL4,en,"[{'screen_name': 'tesla', 'name': 'tesla', 'id': '13298072'}]",[],[],3,4,65,[],[],https://twitter.com/tesla_raj/status/1237123010810667008,False,,1,https://pbs.twimg.com/ext_tw_video_thumb/1237122965348605952/pu/img/3ciAhSOZQvxgyPfO.jpg,,,,,,,[],,,,,0.0033494106,0.20754164,0.78910905
11,1237115649807331331,1237115649807331331,2020-03-09 20:38:50 UTC,2020-03-09,20:38:50,0,2909731000,traduisonsles,Traduisons Les,,"« Tandis que chez nous, ces feignasses d’aide-soignantes roulent en Tesla, et passent leurs vacances à Monaco »  https://t.co/5TnKvscFbd",fr,[],[],['https://pbs.twimg.com/media/ESseH9gX0AEIRcq.jpg'],3,130,508,[],[],https://twitter.com/TraduisonsLes/status/1237115649807331331,False,,1,https://pbs.twimg.com/media/ESseH9gX0AEIRcq.jpg,,,,,,,[],,,,,0.05326636,0.8972479,0.04948581
12,1237110300022898694,1237110300022898694,2020-03-09 20:17:34 UTC,2020-03-09,20:17:34,0,1308211178,teslarati,TESLARATI,,Tesla Model Y loses another rival after BMW cancels iX3’s US launch  https://t.co/sRwyXRoD3X,en,[],['https://www.teslarati.com/bmw-cancels-tesla-model-y-competitor-united-states/'],[],19,93,817,[],[],https://twitter.com/Teslarati/status/1237110300022898694,False,,0,,,,,,,,[],,,,,0.26101065,0.6940312,0.044958163
13,1237104160044126209,1237103597306904577,2020-03-09 19:53:10 UTC,2020-03-09,19:53:10,0,755504,alexandraerin,Alexandra Erin (She/Her),,"Like people who cheer whenever Tesla or Facebook stock dives because the geniuses said/did something iffy and the headlines say the CEO ""lost exty zillion dollars""... no one's going to Muskerberg's house with a dump truck to confiscate cash.",en,[],[],[],2,8,60,[],[],https://twitter.com/AlexandraErin/status/1237104160044126209,False,,0,,,,,,,,[],,,,,0.7140629,0.2605904,0.025346542
14,1237102129837309953,1237102129837309953,2020-03-09 19:45:06 UTC,2020-03-09,19:45:06,0,1689516060,vincent13031925,vincentyu.eth,,Tesla Giga 4 Berlin 🇩🇪 Promised Rapid Construction By Prime Minster  $TSLA #Tesla #GF4 #Germany  https://t.co/rV0EbI1ynJ,en,[],['https://www.tesmanian.com/blogs/tesmanian-blog/tesla-giga-4-berlin-promised-rapid-construction-by-prime-minster'],[],2,37,193,"['tesla', 'gf4', 'germany']",['tsla'],https://twitter.com/vincent13031925/status/1237102129837309953,False,,0,,,,,,,,[],,,,,0.0030015022,0.33083695,0.6661616
15,1237102079589511168,1237102079589511168,2020-03-09 19:44:54 UTC,2020-03-09,19:44:54,0,1139310453987745792,thirdrowtesla,Third Row Tesla Podcast,,Tesla popularized electric vehicles by hiring hundreds of thousands of paid actors to pretend to love them,en,[],[],[],44,17,316,[],[],https://twitter.com/thirdrowtesla/status/1237102079589511168,False,,0,,,,,,,,[],,,,,0.067727335,0.35167712,0.5805957
16,1237101105668132867,1237101105668132867,2020-03-09 19:41:02 UTC,2020-03-09,19:41:02,0,2148233600,electrekco,Electrek.co,,"Tesla Cybertruck and Model Y gain tons of mindshare, survey shows  https://t.co/JV9wDo3EaO by @fredericlambert",en,"[{'screen_name': 'fredericlambert', 'name': 'fred lambert', 'id': '38253449'}]",['https://electrek.co/2020/03/09/tesla-cybertruck-and-model-y-gain-tons-of-mindshare-survey-shows/'],[],1,10,93,[],[],https://twitter.com/ElectrekCo/status/1237101105668132867,False,,0,,,,,,,,[],,,,,0.0036979434,0.33750805,0.658794
17,1237099431142572033,1237099431142572033,2020-03-09 19:34:23 UTC,2020-03-09,19:34:23,0,966459150,stanceit,#𝗦𝘁𝗮𝗻𝗰𝗲𝗜𝘁,,BAGGED TESLA 😍😍😍  https://t.co/7cSRtp7fMN,en,[],[],['https://pbs.twimg.com/media/ESsPX41XgAAuR01.jpg'],10,196,1199,[],[],https://twitter.com/stanceit/status/1237099431142572033,False,,1,https://pbs.twimg.com/media/ESsPX41XgAAuR01.jpg,,,,,,,[],,,,,0.0037011772,0.012834468,0.9834645
18,1237097783187759104,1237097783187759104,2020-03-09 19:27:50 UTC,2020-03-09,19:27:50,0,3763506026,realoverheardla,Overheard,,"""Nothing makes me feel more alive than cutting off a Tesla.""",en,[],[],[],3,41,386,[],[],https://twitter.com/realoverheardla/status/1237097783187759104,False,,0,,,,,,,,[],,,,,0.07599227,0.23761745,0.68639034
19,1237091871953952771,1237057188109189121,2020-03-09 19:04:20 UTC,2020-03-09,19:04:20,0,732548050728701953,valueanalyst1,Yaman Tasdivar,,"@Wheels88Fortune @liamdenning In 2020, Tesla will be the only profitable automaker.",en,[],[],[],15,9,107,[],[],https://twitter.com/ValueAnalyst1/status/1237091871953952771,False,,0,,,,,,,,"[{'screen_name': 'Wheels88Fortune', 'name': 'Investment Boarder', 'id': '3826571592'}, {'screen_name': 'liamdenning', 'name': 'Liam Denning', 'id': '188829085'}]",,,,,0.010869461,0.20356268,0.7855679
20,1237090684110131200,1237090684110131200,2020-03-09 18:59:37 UTC,2020-03-09,18:59:37,0,1689516060,vincent13031925,vincentyu.eth,,Tesla Cybertruck Will Smash This Major US Pickup Brand ( Dodge Ram 😉)   Of cuz other ones too  $TSLA #Tesla #Cybertruck   https://t.co/DbyGwmGPEF,en,[],['https://www.tesmanian.com/blogs/tesmanian-blog/tesla-cybertruck-ram-1500-fiat-chrysler'],[],6,20,157,"['tesla', 'cybertruck']",['tsla'],https://twitter.com/vincent13031925/status/1237090684110131200,False,,0,,,,,,,,[],,,,,0.0053230077,0.16609891,0.82857823
21,1237089493389369348,1237089493389369348,2020-03-09 18:54:53 UTC,2020-03-09,18:54:53,0,897446848004227072,crypto_birb,CRYPTO₿IRB,,If I wasn't bald 2020 would take my hair away already: military aggression coronavirus pandemic economy collapsing Italy sinking stonks? more like stones treasury yields record lows TSLA buyers can't afford a tesla tire At least btc filled 7685 gap Curious what future brings...  https://t.co/DDQ3I5Pitc,en,[],[],['https://pbs.twimg.com/media/ESsGVo4WoAIUz3H.jpg'],9,6,83,[],[],https://twitter.com/crypto_birb/status/1237089493389369348,False,,1,https://pbs.twimg.com/media/ESsGVo4WoAIUz3H.jpg,,,,,,,[],,,,,0.77185696,0.20386663,0.02427628
22,1237083258128605184,1237083258128605184,2020-03-09 18:30:07 UTC,2020-03-09,18:30:07,0,47429047,locust9,David Goldfarb 💙💛,,"ok just had a ride in a tesla with this driver who made me feel better about the world. am posting what he told me just so it might help.  him: “yes this virus is bad. But humans are tough. And worse things have happened to us. I worry sometimes, but mostly i forget to worry.”",en,[],[],[],6,2,53,[],[],https://twitter.com/locust9/status/1237083258128605184,False,,0,,,,,,,,[],,,,,0.03174242,0.15234965,0.815908
23,1237083148909006851,1237083148909006851,2020-03-09 18:29:41 UTC,2020-03-09,18:29:41,0,2823091872,kutadgubilim,Kutadgu Bilim,,"""Tesla AutoPilot"" sistemi, etrafındaki kamera ve sensörler ile her cisme isim vererek olası durumları hesaplar ve araç sistemlerini kontrol eder.  https://t.co/17OhitTvvR",tr,[],[],[],9,148,1613,[],[],https://twitter.com/KutadguBilim/status/1237083148909006851,False,,1,https://pbs.twimg.com/ext_tw_video_thumb/1237083015320305664/pu/img/ygCtL8QyolonUTtB.jpg,,,,,,,[],,,,,0.017386694,0.896232,0.0863812
24,1237081353524367362,1237081353524367362,2020-03-09 18:22:33 UTC,2020-03-09,18:22:33,0,1308211178,teslarati,TESLARATI,,"Hey @elonmusk, you got us.  Tesla hid a #Cybertruck easter egg within an Easter egg  https://t.co/la4raDLHJV",en,"[{'screen_name': 'elonmusk', 'name': 'elon musk', 'id': '44196397'}]",['https://www.teslarati.com/tesla-cybertruck-easter-egg-camp-mode/'],[],6,26,321,['cybertruck'],[],https://twitter.com/Teslarati/status/1237081353524367362,False,,0,,,,,,,,[],,,,,0.013725749,0.4063413,0.57993287
25,1237079448651845633,1237079448651845633,2020-03-09 18:14:59 UTC,2020-03-09,18:14:59,0,3101262673,teslaratiteam,Teslarati Team,,Well played @elonmusk and @Tesla team! A #cybertruck Easter egg within an Easter egg 👏  https://t.co/hudxaE4VAt,en,"[{'screen_name': 'elonmusk', 'name': 'elon musk', 'id': '44196397'}, {'screen_name': 'tesla', 'name': 'tesla', 'id': '13298072'}]",[],[],19,44,670,['cybertruck'],[],https://twitter.com/TeslaratiTeam/status/1237079448651845633,False,,1,https://pbs.twimg.com/ext_tw_video_thumb/1237079017292881920/pu/img/6qNXR4aTTwD5Z8ql.jpg,,,,,,,[],,,,,0.0019609742,0.011834355,0.9862048
26,1237073241304227840,1237073241304227840,2020-03-09 17:50:19 UTC,2020-03-09,17:50:19,0,1139310453987745792,thirdrowtesla,Third Row Tesla Podcast,,"The most genius part of GM’s EV event last week was not showing us any cars.   If we saw the cars we’d laugh. Nobody would take their plans seriously.   But with no car to see, the headlines are that their new invisible car is “better” than a Tesla.   Ok 👍",en,[],[],[],4,3,81,[],[],https://twitter.com/thirdrowtesla/status/1237073241304227840,False,,0,,,,,,,,[],,,,,0.34888664,0.34243956,0.30867374
27,1237070719290413056,1237070719290413056,2020-03-09 17:40:17 UTC,2020-03-09,17:40:17,0,466864852,bosnerdley,Bo Snerdley,,Tesla CEO Elon Musk thinks the coronavirus panic is 'dumb.' A million Twitter users liked his tweet.  https://t.co/nkPnWlFmqc via @usatoday,en,"[{'screen_name': 'usatoday', 'name': 'usa today', 'id': '15754281'}]",['https://www.usatoday.com/story/tech/2020/03/08/coronavirus-tesla-elon-musk-dumb-panic-silicon-valley/4994870002/'],[],21,87,499,[],[],https://twitter.com/BoSnerdley/status/1237070719290413056,False,,0,,,,,,,,[],,,,,0.0517234,0.45626634,0.49201027
28,1237061401224663042,1237061401224663042,2020-03-09 17:03:16 UTC,2020-03-09,17:03:16,0,1308211178,teslarati,TESLARATI,,Tesla Giga Berlin is cutting through Germany’s red tape like a hot knife through butter  https://t.co/Jf9Wshbxua,en,[],['https://www.teslarati.com/tesla-giga-berlin-cuts-germany-red-tape/'],[],8,45,387,[],[],https://twitter.com/Teslarati/status/1237061401224663042,False,,0,,,,,,,,[],,,,,0.06967845,0.793726,0.1365955
29,1237060772817039360,1237060772817039360,2020-03-09 17:00:46 UTC,2020-03-09,17:00:46,0,1689516060,vincent13031925,vincentyu.eth,,"Tesla Megapack Installed In Canada, Small Utility Could Save Up To $200K Per Year  $TSLA #Tesla #Energy  https://t.co/kbPtg9ha2L",en,[],['https://www.tesmanian.com/blogs/tesmanian-blog/tesla-megapack-installed-in-canada-small-utility-could-save-up-to-200k-per-year'],[],0,30,185,"['tesla', 'energy']",['tsla'],https://twitter.com/vincent13031925/status/1237060772817039360,False,,0,,,,,,,,[],,,,,0.004752399,0.34821,0.6470377
30,1237057188109189121,1237057188109189121,2020-03-09 16:46:31 UTC,2020-03-09,16:46:31,0,188829085,liamdenning,Liam Denning,,Tesla has dropped 30% since 2/19 and now trades at only 159x 2020 GAAP earnings $TSLA,en,[],[],[],27,28,297,[],['tsla'],https://twitter.com/liamdenning/status/1237057188109189121,False,,0,,,,,,,,[],,,,,0.7672881,0.2133223,0.01938941
31,1237056887142715392,1237056887142715392,2020-03-09 16:45:19 UTC,2020-03-09,16:45:19,0,2148233600,electrekco,Electrek.co,,Tesla Autopilot automatically avoids head-on collision with car in wrong lane  https://t.co/8ekQmcodWw by @fredericlambert,en,"[{'screen_name': 'fredericlambert', 'name': 'fred lambert', 'id': '38253449'}]",['https://electrek.co/2020/03/09/tesla-autopilot-automatically-avoids-head-on-collision-car-wrong-lane/'],[],9,32,192,[],[],https://twitter.com/ElectrekCo/status/1237056887142715392,False,,0,,,,,,,,[],,,,,0.013743136,0.659803,0.32645386
32,1237054712358240257,1237054712358240257,2020-03-09 16:36:41 UTC,2020-03-09,16:36:41,0,966734358651592704,netflixandlamp,NetflixAndLamp,,This is a terrible market crash. Stock prices are all the way back down to levels not seen since [checks notes] 4 months ago. Tesla has crashed all the way back down to levels not seen since [checks notes] 5 weeks ago. Terrible market crash I tell you. Terrible. $TSLA,en,[],[],[],22,59,413,[],['tsla'],https://twitter.com/NetflixAndLamp/status/1237054712358240257,False,,0,,,,,,,,[],,,,,0.94978493,0.043505598,0.00670933
33,1237053488540114945,1237053488540114945,2020-03-09 16:31:49 UTC,2020-03-09,16:31:49,0,247091695,mitchlafon,Mitch Lafon,,"On This Day - March 9th 2004. The mighty fun Tesla release fantastic album, Into The Now. It was the band’s first studio album since 1994’s Bust A Nut. @TeslaBand  https://t.co/eYw3tb0jlJ",en,"[{'screen_name': 'teslaband', 'name': 'tesla™', 'id': '436103176'}]",[],['https://pbs.twimg.com/media/ESrllt6WAAEzz6f.jpg'],18,15,105,[],[],https://twitter.com/mitchlafon/status/1237053488540114945,False,,1,https://pbs.twimg.com/media/ESrllt6WAAEzz6f.jpg,,,,,,,[],,,,,0.0014610251,0.03211381,0.9664253
34,1237051807916056576,1237051807916056576,2020-03-09 16:25:08 UTC,2020-03-09,16:25:08,0,430995737,girlswhocode,Girls Who Code,,No better place to be for Introduce a Girl to Engineering Day! Thanks to @Tesla for letting us see coders in action! #PartnerOfTheDay 🙌👩‍💻🙌  https://t.co/O2XWnIzfHb,en,"[{'screen_name': 'tesla', 'name': 'tesla', 'id': '13298072'}]",[],"['https://pbs.twimg.com/media/ESrkB9dXsAEQKW0.jpg', 'https://pbs.twimg.com/media/ESrkDvVXYAEXkMB.jpg']",1,20,112,['partneroftheday'],[],https://twitter.com/GirlsWhoCode/status/1237051807916056576,False,,1,https://pbs.twimg.com/media/ESrkB9dXsAEQKW0.jpg,,,,,,,[],,,,,0.0018889499,0.008378647,0.98973244
35,1237051528533458947,1237051528533458947,2020-03-09 16:24:02 UTC,2020-03-09,16:24:02,0,615328000,droid254,Droid 🤖,,Nikola Tesla accurately predicted the mobile phone,en,[],[],[],10,9,83,[],[],https://twitter.com/droid254/status/1237051528533458947,False,,0,,,,,,,,[],,,,,0.01952155,0.60210353,0.3783749
36,1237050908799840261,1237050908799840261,2020-03-09 16:21:34 UTC,2020-03-09,16:21:34,0,624315071,allyyarid,ally yarid,,"Anytime an Atheist suggets that belief in God is for people of lesser intelligence... ask them if they’ve ever heard of Albert Einstein, Sir Isaac Newton, Galileo Galilei, Werner Heisenberg, Nikola Tesla, Guglielmo Marconi, or Johannes Kepler. All brilliant. All believed in God.",en,[],[],[],15,131,941,[],[],https://twitter.com/allyyarid/status/1237050908799840261,False,,0,,,,,,,,[],,,,,0.12025825,0.5670381,0.31270364
37,1237049639209185281,1237049639209185281,2020-03-09 16:16:31 UTC,2020-03-09,16:16:31,0,1154401204677566466,mandr3as,AndrewOnTech,,I truly love ever single true (long) @Tesla shareholder out there. A true community that sticks together and never loses faith in the big picture. #GoTSLA @elonmusk @thirdrowtesla #share #tsla #tslaq @Sofiaan @vincent13031925 @flcnhvy @DerCaspar @markbspiegel,en,"[{'screen_name': 'tesla', 'name': 'tesla', 'id': '13298072'}, {'screen_name': 'elonmusk', 'name': 'elon musk', 'id': '44196397'}, {'screen_name': 'thirdrowtesla', 'name': 'third row tesla podcast', 'id': '1139310453987745792'}, {'screen_name': 'sofiaan', 'name': 'sofiaan fraval', 'id': '49417006'}, {'screen_name': 'vincent13031925', 'name': 'vincentyu.eth', 'id': '1689516060'}, {'screen_name': 'flcnhvy', 'name': 'viv ✶', 'id': '1060180551544528897'}, {'screen_name': 'dercaspar', 'name': 'caspar - creating a positive future ❤️\u200d\U0001fa79🦊 🇺🇦', 'id': '149845895'}, {'screen_name': 'markbspiegel', 'name': 'mark b. spiegel', 'id': '258612274'}]",[],[],8,4,66,"['gotsla', 'share', 'tsla', 'tslaq']",[],https://twitter.com/mandr3as/status/1237049639209185281,False,,0,,,,,,,,[],,,,,0.004161887,0.015108278,0.9807298
38,1237046544370556928,1237046544370556928,2020-03-09 16:04:14 UTC,2020-03-09,16:04:14,0,52370117,jpr007,JPR007,,TESLA AND FORD MODEL T IN PERSPECTIVE  Tesla’s annual sales have exceeded those of the Model T in five of the last seven years  https://t.co/mXyQ39iarM,en,[],[],['https://pbs.twimg.com/media/ESrfRPPWkAAfGFc.jpg'],12,41,192,[],[],https://twitter.com/jpr007/status/1237046544370556928,False,,1,https://pbs.twimg.com/media/ESrfRPPWkAAfGFc.jpg,,,,,,,[],,,,,0.00236572,0.09724102,0.9003932
39,1237046287855304705,1237046287855304705,2020-03-09 16:03:12 UTC,2020-03-09,16:03:12,0,1139310453987745792,thirdrowtesla,Third Row Tesla Podcast,,"The 50,000th Tesla has been registered in Norway. @elonmusk",en,"[{'screen_name': 'elonmusk', 'name': 'elon musk', 'id': '44196397'}]",[],[],0,7,72,[],[],https://twitter.com/thirdrowtesla/status/1237046287855304705,False,https://twitter.com/nasalahe/status/1236963268616425474,0,,,,,,,,[],,,,,0.0058834446,0.800214,0.19390248
40,1237045675961040896,1237045675961040896,2020-03-09 16:00:47 UTC,2020-03-09,16:00:47,0,7309052,yahoonews,Yahoo News,,Tesla CEO Elon Musk thinks the coronavirus panic is 'dumb.' A million Twitter users liked his tweet.  https://t.co/Lwyr4xA3om  https://t.co/jKTzzatU4J,en,[],['https://yhoo.it/2TQPxJi'],['https://pbs.twimg.com/media/ESrefHmX0AAUF4b.jpg'],14,22,71,[],[],https://twitter.com/YahooNews/status/1237045675961040896,False,,1,https://pbs.twimg.com/media/ESrefHmX0AAUF4b.jpg,,,,,,,[],,,,,0.04100986,0.36497146,0.5940186
41,1237045135700938752,1237045135700938752,2020-03-09 15:58:38 UTC,2020-03-09,15:58:38,0,1109313353489371136,teslaphotografr,Tesla Photographer (Taylor),,Here’s our new wrap! @Tesla @elonmusk #tesla  https://t.co/MGItfc3VIr,en,"[{'screen_name': 'tesla', 'name': 'tesla', 'id': '13298072'}, {'screen_name': 'elonmusk', 'name': 'elon musk', 'id': '44196397'}]",[],"['https://pbs.twimg.com/media/ESrd_kkUUAEHkbM.jpg', 'https://pbs.twimg.com/media/ESrd_k1U4AAPC88.jpg', 'https://pbs.twimg.com/media/ESrd_kkVAAE6FDR.jpg']",45,38,463,['tesla'],[],https://twitter.com/teslaphotografr/status/1237045135700938752,False,,1,https://pbs.twimg.com/media/ESrd_kkUUAEHkbM.jpg,,,,,,,[],,,,,0.0031589505,0.60382277,0.3930183
42,1237042563531464712,1237042563531464712,2020-03-09 15:48:24 UTC,2020-03-09,15:48:24,0,979225070764634112,tesletter,Tesletter,,Model Ys ready to go out to their new owners   Do you have a delivery date yet? When?  Source: Facebook Tesla Owners Group  https://t.co/3VZAPVPHUw,en,[],[],"['https://pbs.twimg.com/media/ESrbkslUwAA7Fg3.jpg', 'https://pbs.twimg.com/media/ESrbkskUMAAyy_3.jpg', 'https://pbs.twimg.com/media/ESrbksZUwAE9U_3.jpg', 'https://pbs.twimg.com/media/ESrbksoUYAA4-eF.jpg']",13,65,458,[],[],https://twitter.com/tesletter/status/1237042563531464712,False,,1,https://pbs.twimg.com/media/ESrbkslUwAA7Fg3.jpg,,,,,,,[],,,,,0.0041331435,0.8904963,0.1053705
43,1237038502723891207,1237038502723891207,2020-03-09 15:32:16 UTC,2020-03-09,15:32:16,0,704835627183788032,model3owners,Trev Page,,"The biggest hurdle as I see it isn’t that makers can’t make EVs, although they’re late to the game, is the dealers are totally out to lunch save for an extremely very few edge cases.  Meanwhile Tesla keeps gobbling up market share.",en,[],[],[],13,13,151,[],[],https://twitter.com/Model3Owners/status/1237038502723891207,False,https://twitter.com/Teslarati/status/1237030714975150081,0,,,,,,,,[],,,,,0.73728454,0.24257039,0.020144936
44,1237037334153043968,1237037334153043968,2020-03-09 15:27:38 UTC,2020-03-09,15:27:38,0,950073454262472705,crazyvaladv,Crazyval Adv,,"Alfa Romeo is a really, really fast car and for Tesla Model X (7 seater) to be as fast you have to attach a trailer with another Alfa Romeo on it 🤔",en,[],[],[],0,15,89,[],[],https://twitter.com/CrazyvalADV/status/1237037334153043968,False,https://twitter.com/thirdrowtesla/status/1236883626354065409,0,,,,,,,,[],,,,,0.03224796,0.33664966,0.6311023
45,1237037332089331718,1237037332089331718,2020-03-09 15:27:37 UTC,2020-03-09,15:27:37,0,953357473834065920,teslamiles,Tesla Miles,,"150,000 @Tesla miles!  https://t.co/XhK06sytUk",en,"[{'screen_name': 'tesla', 'name': 'tesla', 'id': '13298072'}]",[],"['https://pbs.twimg.com/media/ESrW45yUwAE-Hky.jpg', 'https://pbs.twimg.com/media/ESrW45xUEAALR9v.jpg', 'https://pbs.twimg.com/media/ESrW45xU8AEbGDX.jpg']",3,4,67,[],[],https://twitter.com/TeslaMiles/status/1237037332089331718,False,,1,https://pbs.twimg.com/media/ESrW45yUwAE-Hky.jpg,,,,,,,[],,,,,0.0037668047,0.5715867,0.42464632
46,1237036281734955008,1237036281734955008,2020-03-09 15:23:27 UTC,2020-03-09,15:23:27,0,1139310453987745792,thirdrowtesla,Third Row Tesla Podcast,,"Tesla delivered 3,958 cars in February -- or about 30% of all new-energy vehicles in the country -- said Cui Dongshu, secretary general of the China Passenger Car Association, in an online briefing on Monday. That’s a “pretty good performance,” he said.",en,[],[],[],1,15,116,[],[],https://twitter.com/thirdrowtesla/status/1237036281734955008,False,,0,,,,,,,,[],,,,,0.0034497858,0.15842953,0.8381206
