,id,conversation_id,created_at,date,time,timezone,user_id,username,name,place,tweet,language,mentions,urls,photos,replies_count,retweets_count,likes_count,hashtags,cashtags,link,retweet,quote_url,video,thumbnail,near,geo,source,user_rt_id,user_rt,retweet_id,reply_to,retweet_date,translate,trans_src,trans_dest,negative,neutral,positive
0,1253471359734333440,1253471359734333440,2020-04-23 23:50:35 UTC,2020-04-23,23:50:35,0,551006128,ramonricky71,ricky ramirez,,Loving my gloss black powder coated wheels and gloss black Chrome delete @Tesla  https://t.co/JtyvKfM72d,en,"[{'screen_name': 'tesla', 'name': 'tesla', 'id': '13298072'}]",[],['https://pbs.twimg.com/media/EWU5hqOWsAoYb2J.jpg'],12,5,79,[],[],https://twitter.com/ramonricky71/status/1253471359734333440,False,,1,https://pbs.twimg.com/media/EWU5hqOWsAoYb2J.jpg,,,,,,,[],,,,,0.0029936207,0.022682253,0.9743241
1,1253470855990054912,1253470829305872384,2020-04-23 23:48:35 UTC,2020-04-23,23:48:35,0,875784434041147393,cppinvest,"FlowPoint Partners, LLC",,"@AlderLaneeggs has said it.  This is one tough Jaguar.  It appears now the country is buying Musk's line.  But I like that dynamic.  The complacency exhibited by my friend didn't exist in 2019.  Less than a year ago, people were actually speaking of Tesla as a company in trouble.",en,[],[],[],23,1,74,[],[],https://twitter.com/cppinvest/status/1253470855990054912,False,,0,,,,,,,,[],,,,,0.2629285,0.4760866,0.26098496
2,1253466340511240192,1253430146335305729,2020-04-23 23:30:38 UTC,2020-04-23,23:30:38,0,870324519788879872,heathereheying,Heather E Heying,,"@RubinReport Madison, Tesla, Fairfax and Melrose.  https://t.co/3RiIj07KVA",en,[],[],['https://pbs.twimg.com/media/EWU0_PnUwAEVQUY.jpg'],4,1,72,[],[],https://twitter.com/HeatherEHeying/status/1253466340511240192,False,,1,https://pbs.twimg.com/media/EWU0_PnUwAEVQUY.jpg,,,,,,,"[{'screen_name': 'RubinReport', 'name': 'Dave Rubin', 'id': '18379614'}]",,,,,0.0072860904,0.94880587,0.043908052
3,1253465774137597952,1253465774137597952,2020-04-23 23:28:23 UTC,2020-04-23,23:28:23,0,1061504849420836865,tesla_raj,Tesla Raj,,One thing I don’t miss about my old VW Jetta was the rear center seat hump on the floor. Not on a Tesla!  https://t.co/XnYWiUc51O,en,[],[],['https://pbs.twimg.com/media/EWU0eewU4AAu9aK.jpg'],6,4,127,[],[],https://twitter.com/tesla_raj/status/1253465774137597952,False,,1,https://pbs.twimg.com/media/EWU0eewU4AAu9aK.jpg,,,,,,,[],,,,,0.3183091,0.33584544,0.3458454
4,1253465034191077376,1253465034191077376,2020-04-23 23:25:27 UTC,2020-04-23,23:25:27,0,2884909108,ravonslyfe,RAVON,,UGHHSHEHEHWHEHEHE i want a tesla,en,[],[],[],98,25,826,[],[],https://twitter.com/RavonsLyfe/status/1253465034191077376,False,,0,,,,,,,,[],,,,,0.17950793,0.34495535,0.4755367
5,1253451867687796737,1253451867687796737,2020-04-23 22:33:07 UTC,2020-04-23,22:33:07,0,196758036,rodydavis,Rody Davis,,"After over a year of appeals @apple has rejected all my submissions for the @AppStore  for my @FlutterDev @Tesla ""Sidecar for Tesla” app. 😑 I have a ton of users in beta and Android users are happy!  https://t.co/yl82gXNzMZ",en,"[{'screen_name': 'apple', 'name': 'apple', 'id': '380749300'}, {'screen_name': 'appstore', 'name': 'app store', 'id': '74594552'}, {'screen_name': 'flutterdev', 'name': 'flutter', 'id': '420730316'}, {'screen_name': 'tesla', 'name': 'tesla', 'id': '13298072'}]",[],['https://pbs.twimg.com/media/EWUn0wXUcAEcuVk.jpg'],19,17,152,[],[],https://twitter.com/rodydavis/status/1253451867687796737,False,,1,https://pbs.twimg.com/media/EWUn0wXUcAEcuVk.jpg,,,,,,,[],,,,,0.52213097,0.294999,0.18287002
6,1253443887517118464,1253443887517118464,2020-04-23 22:01:25 UTC,2020-04-23,22:01:25,0,3369253000,balkanutopia,Balkan Utopia,,"Lepše zvuči da smo nebeski narod najstariji, nego da smo našim greškama koje ne priznajemo uništili 2 pokolenja.  Većina je kao Era Ojdanić, a misli da je Tesla.  Knjiga postade neprijatelj, a vajdica autoritet.  Neće Srbi nestati zbog manjka velikih ljudi, već zbog viška idiota.",und,[],[],[],8,23,204,[],[],https://twitter.com/BalkanUtopia/status/1253443887517118464,False,,0,,,,,,,,[],,,,,0.060412377,0.850279,0.089308694
7,1253440845157740550,1253440845157740550,2020-04-23 21:49:19 UTC,2020-04-23,21:49:19,0,436429668,nikkeiasia,Nikkei Asia,,Elon Musk had praised GPIF for doing 'the right thing' in opposing short-selling. Now he has hired the pension fund's former CIO as a Tesla board member. #tesla #elonmusk @elonmusk  https://t.co/a8MGY4I9nd,en,"[{'screen_name': 'elonmusk', 'name': 'elon musk', 'id': '44196397'}]",['https://s.nikkei.com/3cJd5Yl'],[],2,28,96,"['tesla', 'elonmusk']",[],https://twitter.com/NikkeiAsia/status/1253440845157740550,False,,0,,,,,,,,[],,,,,0.008679819,0.35583228,0.6354879
8,1253439553664421895,1253439553664421895,2020-04-23 21:44:12 UTC,2020-04-23,21:44:12,0,739284612099256320,julia_bergeron,Julia Bergeron🌻🇺🇦,,Perhaps this was the delay at the landing zone. Which one of you is responsible for this? Hmmm Tesla owners?  https://t.co/LWBM4rFHp3,en,[],[],['https://pbs.twimg.com/media/EWUcoJgWsAE-KoS.jpg'],10,40,334,[],[],https://twitter.com/julia_bergeron/status/1253439553664421895,False,,1,https://pbs.twimg.com/media/EWUcoJgWsAE-KoS.jpg,,,,,,,[],,,,,0.58795816,0.40320814,0.008833663
9,1253439042512760833,1253439042512760833,2020-04-23 21:42:10 UTC,2020-04-23,21:42:10,0,985686123123949568,kristennetten,•K10•♥️🕊🇺🇦 🦊,,Excited to see Hiro Mizuno joining  Tesla Board of Directors.    Great choice Tesla! 🚘   He ran Japan’s $1.6tn pension fund.  Mizuno put a squeeze on short  sellers. Investors are considering following his lead.  “I never met a short seller who has a long-term perspective.”  https://t.co/5OhwiJFpzP,en,[],[],['https://pbs.twimg.com/media/EWUcJsAUMAAdPv2.jpg'],13,41,350,[],[],https://twitter.com/Kristennetten/status/1253439042512760833,False,,1,https://pbs.twimg.com/media/EWUcJsAUMAAdPv2.jpg,,,,,,,[],,,,,0.0019134174,0.019362358,0.9787242
10,1253438935461580800,1253438935461580800,2020-04-23 21:41:44 UTC,2020-04-23,21:41:44,0,1689516060,vincent13031925,vincentyu.eth,,Tesla Names Hiromichi Mizuno as New Independent Director to its Board  Mr Mizuno was the Executive Managing Director and Chief Investment Officer of Japan’s Government Pension Investment Fund  $TSLA #Tesla   https://t.co/KEVggKNIXe,en,[],['https://www.tesmanian.com/blogs/tesmanian-blog/tesla-tsla-names-hiromichi-mizuno-as-new-independent-director-to-its-board'],[],13,21,185,['tesla'],['tsla'],https://twitter.com/vincent13031925/status/1253438935461580800,False,,0,,,,,,,,[],,,,,0.0050046965,0.81630427,0.17869087
11,1253436067027402752,1253436067027402752,2020-04-23 21:30:20 UTC,2020-04-23,21:30:20,0,20841000,carpervert,Jonny Smith,,"If you hadn't watched this yet, it is another lovely ode to an car company who made EVs cool decades before Tesla. So many of us have strong @TamiyaUK memories at the root of our car/engineering/driving fascination. Stay safe/isolated, &amp; let's keep this #modelcitizen thing going.",en,"[{'screen_name': 'tamiyauk', 'name': 'tamiya uk', 'id': '72826833'}]",[],[],10,9,139,['modelcitizen'],[],https://twitter.com/Carpervert/status/1253436067027402752,False,https://twitter.com/harrismonkey/status/1244212435935993857,0,,,,,,,,[],,,,,0.0032376552,0.020725591,0.9760367
12,1253433758239215618,1253433758239215618,2020-04-23 21:21:10 UTC,2020-04-23,21:21:10,0,349249475,gerberkawasaki,Ross Gerber,,Serious BOD upgrade for Tesla. This guy is the real deal. “Tesla  has added Hiromichi Mizuno as a new member to its board of directors and audit committee — the former chief investment officer of Japan’s $1.5 trillion pension fund...” $tsla #Japan   https://t.co/nLPatbHjHN,en,[],['https://techcrunch.com/2020/04/23/teslas-newest-board-member-has-a-long-stance-against-short-selling/'],[],10,45,353,['japan'],['tsla'],https://twitter.com/GerberKawasaki/status/1253433758239215618,False,,0,,,,,,,,[],,,,,0.0027249483,0.05723966,0.94003546
13,1253430569448255489,1253430569448255489,2020-04-23 21:08:30 UTC,2020-04-23,21:08:30,0,1116353841908158464,spotted_model,@spotted_model,,Red car black and white world. #tesla  https://t.co/dAK2MEzXLE,en,[],[],['https://pbs.twimg.com/media/EWUUc3NUEAA8ir6.jpg'],4,3,90,['tesla'],[],https://twitter.com/spotted_model/status/1253430569448255489,False,,1,https://pbs.twimg.com/media/EWUUc3NUEAA8ir6.jpg,,,,,,,[],,,,,0.08673593,0.83753306,0.075731136
14,1253430376631947266,1253430376631947266,2020-04-23 21:07:44 UTC,2020-04-23,21:07:44,0,2497269751,dmartinez_uy,Ing. Daniel Martínez,,"Nikola Tesla, Martin Cooper, Ida Holz, Guillermo Marconi, Eladio Dieste, Hedy Lamarr. Todos ingenieros/as 🗳",es,[],[],[],83,93,802,[],[],https://twitter.com/Dmartinez_uy/status/1253430376631947266,False,https://twitter.com/_carolinasca/status/1253084532095561728,0,,,,,,,,[],,,,,0.014532737,0.8463277,0.13913952
15,1253426307041386496,1253426307041386496,2020-04-23 20:51:33 UTC,2020-04-23,20:51:33,0,956834823557058560,getjeda,Jeda Products,,"Tesla Model Y USB Hub by Jeda. You can reserve/purchase one on our website now. Coming May.  ✅6 Ports in total: 4 USB A , 2 USB C (1 hidden USB A port in sentry compartment) ✅ Data / Power on all ports  ✅ Premium finish &amp; materials   https://t.co/QBxcljY5AK  🔋💾🎮  https://t.co/dWWlFYnJpi",en,[],['https://getjeda.com/product/jeda-usb-hub-model-y/'],"['https://pbs.twimg.com/media/EWUO_PeUcAER1PX.jpg', 'https://pbs.twimg.com/media/EWUO_ylU0AUA68i.jpg']",6,26,64,[],[],https://twitter.com/getjeda/status/1253426307041386496,False,,1,https://pbs.twimg.com/media/EWUO_PeUcAER1PX.jpg,,,,,,,[],,,,,0.0037848055,0.63168555,0.36452976
16,1253425550598631437,1253425550598631437,2020-04-23 20:48:33 UTC,2020-04-23,20:48:33,0,543971421,covellomassimo,Thank you for flying with SpaceX,,Can I just say again how smooth and painless and #SocialDistancing safe today’s #tesla mobile service was!!! Thanks @elonmusk and thank you Tesla mobile ranger Christopher!!! #Model3  https://t.co/CXj7zSqASW,en,"[{'screen_name': 'elonmusk', 'name': 'elon musk', 'id': '44196397'}]",[],['https://pbs.twimg.com/media/EWUP488VcAEflo2.jpg'],4,1,47,"['socialdistancing', 'tesla', 'model3']",[],https://twitter.com/CovelloMassimo/status/1253425550598631437,False,,1,https://pbs.twimg.com/media/EWUP488VcAEflo2.jpg,,,,,,,[],,,,,0.0025060608,0.010199153,0.9872948
17,1253423686897373185,1253423686897373185,2020-04-23 20:41:09 UTC,2020-04-23,20:41:09,0,2148233600,electrekco,Electrek.co,,Tesla appoints former heard of Japan’s Government Pension Investment Fund to its board  https://t.co/hWRaROoPgp by @fredericlambert,en,"[{'screen_name': 'fredericlambert', 'name': 'fred lambert', 'id': '38253449'}]",['https://electrek.co/2020/04/23/tesla-appoints-japan-government-pension-investment-fund-head-board-directors/'],[],2,15,89,[],[],https://twitter.com/ElectrekCo/status/1253423686897373185,False,,0,,,,,,,,[],,,,,0.006273357,0.8909408,0.10278582
18,1253421385344376835,1253421385344376835,2020-04-23 20:32:00 UTC,2020-04-23,20:32:00,0,2148233600,electrekco,Electrek.co,,The military develops plan to use EVs similar to Tesla Semi for remote missions  https://t.co/JKTkjzLHwy by @bradberman,en,"[{'screen_name': 'bradberman', 'name': 'bradley berman', 'id': '19567403'}]",['https://electrek.co/2020/04/23/the-military-develops-plan-to-use-evs-similar-to-tesla-semi-for-remote-missions/'],[],7,19,82,[],[],https://twitter.com/ElectrekCo/status/1253421385344376835,False,,0,,,,,,,,[],,,,,0.005719294,0.8910782,0.103202626
19,1253409532996280320,1253409532996280320,2020-04-23 19:44:54 UTC,2020-04-23,19:44:54,0,1139310453987745792,thirdrowtesla,Third Row Tesla Podcast,,"In over a decade, Waymo has driven over 10 million miles.   Tesla reached 1 BILLION miles on Autopilot in November 2018.   In the year and a half since then, they're now over 3 billion miles, and the rate of growth is accelerating!  Tesla owns the long tail. @elonmusk  https://t.co/CvfiSfnLay",en,"[{'screen_name': 'elonmusk', 'name': 'elon musk', 'id': '44196397'}]",[],[],7,10,87,[],[],https://twitter.com/thirdrowtesla/status/1253409532996280320,False,,1,https://pbs.twimg.com/ext_tw_video_thumb/1253409024847966208/pu/img/nNolh1xG3mjPwByC.jpg,,,,,,,[],,,,,0.0028068153,0.06474718,0.9324461
20,1253400110630723585,1253400110630723585,2020-04-23 19:07:28 UTC,2020-04-23,19:07:28,0,1139310453987745792,thirdrowtesla,Third Row Tesla Podcast,,"Looks like ⁦@TomBrady⁩ drives a Tesla Model S P100D, chrome deleted   Good taste in cars ⁦@elonmusk⁩  https://t.co/H8UScwy0Et",en,"[{'screen_name': 'tombrady', 'name': 'tom brady', 'id': '1108050829393707008'}, {'screen_name': 'elonmusk', 'name': 'elon musk', 'id': '44196397'}]",[],['https://pbs.twimg.com/media/EWT4vHzU8AECOFL.jpg'],15,27,308,[],[],https://twitter.com/thirdrowtesla/status/1253400110630723585,False,,1,https://pbs.twimg.com/media/EWT4vHzU8AECOFL.jpg,,,,,,,[],,,,,0.0060805557,0.09914408,0.89477533
21,1253400101961244675,1253400101961244675,2020-04-23 19:07:26 UTC,2020-04-23,19:07:26,0,2148233600,electrekco,Electrek.co,,"Elon Musk hypes up Tesla smart home HVAC, hints at Cybertruck feature  https://t.co/gaWBTvuj7I by @fredericlambert",en,"[{'screen_name': 'fredericlambert', 'name': 'fred lambert', 'id': '38253449'}]",['https://electrek.co/2020/04/23/elon-musk-hypes-tesla-smart-home-hvac-cybertruck/'],[],3,35,167,[],[],https://twitter.com/ElectrekCo/status/1253400101961244675,False,,0,,,,,,,,[],,,,,0.003137675,0.4358238,0.56103843
22,1253395711070257155,1253395711070257155,2020-04-23 18:49:59 UTC,2020-04-23,18:49:59,0,31263848,stevenmarkryan,stevenmarkryan,,Couldn't resist.  Now on the clips channel:   https://t.co/AxnPz3mkna  😂  @MunroAssociates @Tesla  https://t.co/MkEBVYOCh4,en,"[{'screen_name': 'munroassociates', 'name': 'munro & associates', 'id': '614690892'}, {'screen_name': 'tesla', 'name': 'tesla', 'id': '13298072'}]",['https://youtu.be/7L_eMTuHNhU'],['https://pbs.twimg.com/media/EWT0fOwXQAAKjDf.jpg'],4,7,69,[],[],https://twitter.com/stevenmarkryan/status/1253395711070257155,False,,1,https://pbs.twimg.com/media/EWT0fOwXQAAKjDf.jpg,,,,,,,[],,,,,0.008531457,0.1958514,0.7956171
23,1253395584138055680,1253395584138055680,2020-04-23 18:49:28 UTC,2020-04-23,18:49:28,0,1166970075523571712,tebernkireci1,Tebernüş Kireçci,,ABD merkezli Politika Araştırmaları Enstitüsü'ne göre aralarında Amazon’un kurucusu Jeff Bezos ile Tesla’nın genel müdürü Elon Musk ile Zoom'un kurucusu Eric Yuan’ında olduğu Amerikalı milyarderlerin varlığı Corona salgını döneminde neredeyse yüzde 10 arttı.  Sorusu: Şaşırdık mı?,tr,[],[],[],14,85,453,[],[],https://twitter.com/TebernKireci1/status/1253395584138055680,False,,0,,,,,,,,[],,,,,0.08549547,0.8551802,0.059324294
24,1253395539753869312,1252981206913859584,2020-04-23 18:49:18 UTC,2020-04-23,18:49:18,0,3167257102,erdayastronaut,Everyday Astronaut,,@elonmusk @psidart @TOGregTO @kimbal So obviously one day “oh whoops we have a new division of Tesla home that is basically just life support” 😂 but really it’s been refined and perfected and spun off of something they’ve been doing for years 😉,en,[],[],[],9,9,209,[],[],https://twitter.com/Erdayastronaut/status/1253395539753869312,False,,0,,,,,,,,"[{'screen_name': 'elonmusk', 'name': 'Elon Musk', 'id': '44196397'}, {'screen_name': 'psidart', 'name': 'wannabe futurist', 'id': '56474182'}, {'screen_name': 'TOGregTO', 'name': '🇨🇦 TOGregTO 🇨🇦#FSDBeta Tester 🇺🇦', 'id': '172812223'}, {'screen_name': 'kimbal', 'name': '𝙺𝚒𝚖𝚋𝚊𝚕 𝙼𝚞𝚜𝚔 🤠', 'id': '4767021'}]",,,,,0.040530767,0.4271487,0.53232044
25,1253395486045687808,1253395486045687808,2020-04-23 18:49:05 UTC,2020-04-23,18:49:05,0,1139310453987745792,thirdrowtesla,Third Row Tesla Podcast,,Me: Hi I’d like to order a Model 3   Tesla: Great; how about some solar panels to go with that for $50 a month?   Me: Ok sure   Tesla: and maybe a more efficient Tesla HVAC?   Me: Umm yeah I —   Tesla: And have you seen our Tesla apparel? Maybe a Tesla shirt?   Me: Okay,en,[],[],[],9,7,92,[],[],https://twitter.com/thirdrowtesla/status/1253395486045687808,False,,0,,,,,,,,[],,,,,0.0063814563,0.21906975,0.77454877
26,1253395315912294405,1252981206913859584,2020-04-23 18:48:24 UTC,2020-04-23,18:48:24,0,3167257102,erdayastronaut,Everyday Astronaut,,"@elonmusk @psidart @TOGregTO We know how this goes 😂 Elon and his team have probably been secretly working on this for years to live on mars anyway! Looks at everything, Boring company = Mars habitat, Tesla solar and battery = mars power, Tesla Cars = mars rover, @kimbal’s urban farming = Mars food",en,"[{'screen_name': 'kimbal', 'name': '𝙺𝚒𝚖𝚋𝚊𝚕 𝙼𝚞𝚜𝚔 🤠', 'id': '4767021'}]",[],[],22,15,364,[],[],https://twitter.com/Erdayastronaut/status/1253395315912294405,False,,0,,,,,,,,"[{'screen_name': 'elonmusk', 'name': 'Elon Musk', 'id': '44196397'}, {'screen_name': 'psidart', 'name': 'wannabe futurist', 'id': '56474182'}, {'screen_name': 'TOGregTO', 'name': '🇨🇦 TOGregTO 🇨🇦#FSDBeta Tester 🇺🇦', 'id': '172812223'}]",,,,,0.16861211,0.65652466,0.17486322
27,1253391663998873601,1253391663998873601,2020-04-23 18:33:54 UTC,2020-04-23,18:33:54,0,1308211178,teslarati,TESLARATI,,Impressive look at Tesla Autopilot navigating the twists and turns of a complex Sin City construction zone  https://t.co/cLaNHUIVS0,en,[],['https://www.teslarati.com/tesla-autopilot-navigate-las-vegas-construction-zone/'],[],9,87,790,[],[],https://twitter.com/Teslarati/status/1253391663998873601,False,,0,,,,,,,,[],,,,,0.004796062,0.19446267,0.80074126
28,1253389019683192832,1253389019683192832,2020-04-23 18:23:23 UTC,2020-04-23,18:23:23,0,872519322077470721,tdanetwork,TD Ameritrade Network,,"Tesla is in a position to dominate every category in the auto sector, says Hatem Dhiab. “If you think about the next 3 or 5 years, it’s tough not to see this company having $100 billion-plus in revenue.”  🔥Dhiab evaluates the future of $TSLA with @NPetallides. 👀 @GerberKawasaki",en,"[{'screen_name': 'npetallides', 'name': 'nicole petallides', 'id': '2353958539'}, {'screen_name': 'gerberkawasaki', 'name': 'ross gerber', 'id': '349249475'}]",[],[],8,70,221,[],['tsla'],https://twitter.com/TDANetwork/status/1253389019683192832,False,,0,,,,,,,,[],,,,,0.007383385,0.21403852,0.778578
29,1253385817101238273,1253385817101238273,2020-04-23 18:10:40 UTC,2020-04-23,18:10:40,0,1689516060,vincent13031925,vincentyu.eth,,Audi Simply “Copy &amp; Paste” Tesla Website Description!!  Another example of ”lack of innovation?! ”  $TSLA #Tesla   https://t.co/1azIOfqdMy,en,[],['https://www.tesmanian.com/blogs/tesmanian-blog/audi-simply-copy-paste-tesla-website-description'],[],12,25,181,['tesla'],['tsla'],https://twitter.com/vincent13031925/status/1253385817101238273,False,,0,,,,,,,,[],,,,,0.7739573,0.19325936,0.03278331
30,1253385474841993217,1253385474841993217,2020-04-23 18:09:18 UTC,2020-04-23,18:09:18,0,959471389282578432,evafoxu,Eva Fox 狐🦊❤️🇺🇦,,Audi Simply “Copy &amp; Paste” Tesla Website Description 😂  @Tesla @ElonMusk 🤣I'm not kidding 🤓 #Tesla #Audi   https://t.co/CNSvB9ijHe,en,"[{'screen_name': 'tesla', 'name': 'tesla', 'id': '13298072'}, {'screen_name': 'elonmusk', 'name': 'elon musk', 'id': '44196397'}]",['https://www.tesmanian.com/blogs/tesmanian-blog/audi-simply-copy-paste-tesla-website-description'],[],8,9,71,"['tesla', 'audi']",[],https://twitter.com/EvaFoxU/status/1253385474841993217,False,,0,,,,,,,,[],,,,,0.031124132,0.38061678,0.58825904
31,1253384489386102792,1253384489386102792,2020-04-23 18:05:23 UTC,2020-04-23,18:05:23,0,1348363014,troythedesigner,troythedesigner 🦂,,40 acres and a mule now is a 2 bedroom apartment and a Tesla now,en,[],[],[],2,13,41,[],[],https://twitter.com/troythedesigner/status/1253384489386102792,False,,0,,,,,,,,[],,,,,0.037471097,0.82054776,0.14198108
32,1253384291402362882,1253382881071767561,2020-04-23 18:04:36 UTC,2020-04-23,18:04:36,0,827684125414981633,leonardoxomega,Rocky,,@HermaineM Tesla I ♥ It,tr,[],[],[],0,0,206,[],[],https://twitter.com/leonardoXOmega/status/1253384291402362882,False,,0,,,,,,,,"[{'screen_name': 'HermaineM', 'name': 'Hermaine M', 'id': '918372090'}]",,,,,0.004995953,0.04292853,0.9520756
33,1253381855094726663,1253381855094726663,2020-04-23 17:54:55 UTC,2020-04-23,17:54:55,0,1181314496557670400,planetavenus39,Venus,,"""Cuando comprendas que toda opinión es una visión cargada de historia personal...  Empezarás a comprender que todo juicio es una confesión "".  ▪︎Nikola Tesla   #YoMeQuedoEnCasaLeyendo  https://t.co/HGqlbWmcTs",es,[],[],['https://pbs.twimg.com/media/EWToJnYWAAAJ8HO.jpg'],1,68,111,['yomequedoencasaleyendo'],[],https://twitter.com/PlanetaVenus39/status/1253381855094726663,False,,1,https://pbs.twimg.com/media/EWToJnYWAAAJ8HO.jpg,,,,,,,[],,,,,0.016876005,0.8442903,0.13883363
34,1253381433218891776,1253381433218891776,2020-04-23 17:53:15 UTC,2020-04-23,17:53:15,0,8360172,justindross,JD Ross,,"SpaceX’s Starlink is progressing fast enough that you can pretty safely assume there will be broadband speed internet in most of the world within years.  Tesla solar + powerwall, Starlink internet, water filter &amp; septic, Amazon, homeschooling = a good life anywhere with water?",en,[],[],[],3,1,90,[],[],https://twitter.com/justindross/status/1253381433218891776,False,,0,,,,,,,,[],,,,,0.007322424,0.1254441,0.8672336
35,1253375996679593992,1253375126625804288,2020-04-23 17:31:38 UTC,2020-04-23,17:31:38,0,278850197,camargolescano,Nico Camargo Lescano,,"@FabBallarini @CoronaConsultas Poner a Edison contra Tesla fue estratégico, para ponerle picante a la ronda? O así salió en el sorteo? 😂😂😂",es,[],[],[],5,2,172,[],[],https://twitter.com/camargolescano/status/1253375996679593992,False,,0,,,,,,,,"[{'screen_name': 'FabBallarini', 'name': 'Fabricio Ballarini', 'id': '593189095'}, {'screen_name': 'CoronaConsultas', 'name': 'CoronaConsultas', 'id': '1242199799341989889'}]",,,,,0.06881281,0.8466264,0.084560804
36,1253375599848165378,1252981206913859584,2020-04-23 17:30:04 UTC,2020-04-23,17:30:04,0,56474182,psidart,wannabe futurist,,"@elonmusk @TOGregTO In the mission to accelerate this planet away from fossil fuels, how interested is Tesla in creating HVAC products for homes using geothermal energy? Hopefully inspired from heat pump in Model Y",en,[],[],[],4,15,310,[],[],https://twitter.com/psidart/status/1253375599848165378,False,,0,,,,,,,,"[{'screen_name': 'elonmusk', 'name': 'Elon Musk', 'id': '44196397'}, {'screen_name': 'TOGregTO', 'name': '🇨🇦 TOGregTO 🇨🇦#FSDBeta Tester 🇺🇦', 'id': '172812223'}]",,,,,0.00540019,0.24060425,0.7539957
37,1253372589453594624,1253372589453594624,2020-04-23 17:18:06 UTC,2020-04-23,17:18:06,0,1139310453987745792,thirdrowtesla,Third Row Tesla Podcast,,Audi copy pasting info from Tesla’s website is such a metaphor for legacy auto’s entire EV strategy  just copy paste what tesla and @elonmusk are doing...,en,"[{'screen_name': 'elonmusk', 'name': 'elon musk', 'id': '44196397'}]",[],[],4,8,78,[],[],https://twitter.com/thirdrowtesla/status/1253372589453594624,False,https://twitter.com/thirdrowtesla/status/1253369243212451841,0,,,,,,,,[],,,,,0.46027687,0.4870715,0.05265169
38,1253372579122987014,1253372577520779264,2020-04-23 17:18:04 UTC,2020-04-23,17:18:04,0,140668859,greentheonly,green,,The upside is we now have a real working email of a Tesla IP legal person (since normal aliases don't work) that is essential enough to keep working in these trying times. DM me if you have a GPL violation or other IP-related matter you need to contact Tesla about.,en,[],[],[],11,12,197,[],[],https://twitter.com/greentheonly/status/1253372579122987014,False,,0,,,,,,,,[],,,,,0.037840296,0.26645628,0.6957034
39,1253372577520779264,1253372577520779264,2020-04-23 17:18:03 UTC,2020-04-23,17:18:03,0,140668859,greentheonly,green,,"Woke up to this today.  ""huh, must be some bg music in one of my video clips"" I thought...  But nope, it was Tesla.  As a PSA - I removed all the other excerpts from that document from my account. The entire document is still at large on the internet for those interested.  https://t.co/VpEDvmq07B",en,[],[],"['https://pbs.twimg.com/media/EWTemu_X0AIS8wv.png', 'https://pbs.twimg.com/media/EWTe3BuWsAAG3LG.jpg']",14,31,229,[],[],https://twitter.com/greentheonly/status/1253372577520779264,False,,1,https://pbs.twimg.com/media/EWTemu_X0AIS8wv.png,,,,,,,[],,,,,0.3050783,0.629778,0.0651437
40,1253371887121555456,1253369337274150914,2020-04-23 17:15:19 UTC,2020-04-23,17:15:19,0,981179219207213057,p_ferragu,Pierre Ferragu,,"3/3 What comes next: single backbone cable going around the car, connecting local sub-systems. Patent filed. Road to &gt;10x reduction in wiring length. Tesla innovates faster and in a way only an integrated player with access to silicon valley talents can. Good luck competition.  https://t.co/QnCjsl8Jl9",en,[],[],['https://pbs.twimg.com/media/EWTfE9gXsAAC6yb.png'],1,8,101,[],[],https://twitter.com/p_ferragu/status/1253371887121555456,False,,1,https://pbs.twimg.com/media/EWTfE9gXsAAC6yb.png,,,,,,,[],,,,,0.0039425585,0.11868348,0.87737393
41,1253369337274150914,1253369337274150914,2020-04-23 17:05:11 UTC,2020-04-23,17:05:11,0,981179219207213057,p_ferragu,Pierre Ferragu,,"We published today continuous innovation at #Tesla, part 1.  Focus is wiring. 1/3 5kg less wiring in Model 3 vs. Model S! dozen body MCUs combined into 3 VCUs. requires vertical integration; other car manufacturers are prisoners of supplier sub-systems and can't do that. $TSLA",en,[],[],[],5,26,169,['tesla'],['tsla'],https://twitter.com/p_ferragu/status/1253369337274150914,False,,0,,,,,,,,[],,,,,0.020098029,0.29635647,0.6835455
