,id,conversation_id,created_at,date,time,timezone,user_id,username,name,place,tweet,language,mentions,urls,photos,replies_count,retweets_count,likes_count,hashtags,cashtags,link,retweet,quote_url,video,thumbnail,near,geo,source,user_rt_id,user_rt,retweet_id,reply_to,retweet_date,translate,trans_src,trans_dest,negative,neutral,positive
0,1272313266010648576,1272313266010648576,2020-06-14 23:41:35 UTC,2020-06-14,23:41:35,0,253373616,pclark15,paulclark.eth,,"If you can only have one Tesla for the rest of your life, which one and why?",en,[],[],[],107,28,198,[],[],https://twitter.com/pclark15/status/1272313266010648576,False,,0,,,,,,,,[],,,,,0.067781396,0.80723363,0.12498491
1,1272311349494849537,1272311349494849537,2020-06-14 23:33:58 UTC,2020-06-14,23:33:58,0,17060015,cleantechnica,CleanTechnica,,Tesla Model Y Review From Owner Of Full Tesla S-3-X-Y Lineup  https://t.co/ePC4Igw7O9,en,[],['https://cleantechnica.com/2020/06/14/tesla-model-y-review-from-owner-of-full-tesla-s-3-x-y-lineup/'],[],8,33,357,[],[],https://twitter.com/cleantechnica/status/1272311349494849537,False,,0,,,,,,,,[],,,,,0.0056224763,0.89023393,0.10414373
2,1272310498025967623,1272305206521405440,2020-06-14 23:30:35 UTC,2020-06-14,23:30:35,0,244675457,anti_social_med,flawed human,,@new_branches shoutout @Tesla,en,"[{'screen_name': 'tesla', 'name': 'tesla', 'id': '13298072'}]",[],[],0,0,86,[],[],https://twitter.com/anti_social_med/status/1272310498025967623,False,,0,,,,,,,,"[{'screen_name': 'new_branches', 'name': 'New Branches', 'id': '806643290745475073'}]",,,,,0.009216807,0.7266168,0.26416624
3,1272302801788588032,1272302801788588032,2020-06-14 23:00:00 UTC,2020-06-14,23:00:00,0,113771891,historyla,History Latinoamérica,,"Algunos de los hoteles de Nueva York están conectados por túneles subterráneos ¿pudo Tesla experimentar 10 metros bajo ese suelo? ¿sus archivos perdidos, podrían en realidad estar escondidos en ese lugar?  https://t.co/Nnw6ou3nQz",es,[],[],[],0,69,169,[],[],https://twitter.com/HistoryLA/status/1272302801788588032,False,,1,https://pbs.twimg.com/media/EaQ4WSSXYAImOlI.jpg,,,,,,,[],,,,,0.046509996,0.8870025,0.06648747
4,1272289043754225664,1272289043754225664,2020-06-14 22:05:20 UTC,2020-06-14,22:05:20,0,251375636,kuh__lil,Doc Ahk,,"“Khalil jus has a million dollar smile that will brighten your day” - Michelle Obama   “Honestly, I got the idea for Tesla from Khalil” - Elon Musty   “Khalil fine as hell and sing way better than Trey and his songs” - Lori Harvey  https://t.co/r2rMCA33YB",en,[],[],"['https://pbs.twimg.com/media/EagUI-bWAAAmR64.jpg', 'https://pbs.twimg.com/media/EagUI-ZWoAI72s_.jpg']",5,33,97,[],[],https://twitter.com/Kuh__Lil/status/1272289043754225664,False,,1,https://pbs.twimg.com/media/EagUI-bWAAAmR64.jpg,,,,,,,[],,,,,0.007106443,0.06860154,0.924292
5,1272277575474327555,1272277575474327555,2020-06-14 21:19:46 UTC,2020-06-14,21:19:46,0,834842291852414976,celebekk,asena,,"Pek çok kişi dış dünyanın seyrine o denli kapılmıştır ki, kendi içinde olup bitenlerden tamamen habersizdir. -Nikola Tesla",tr,[],[],[],0,0,77,[],[],https://twitter.com/celebekk/status/1272277575474327555,False,,0,,,,,,,,[],,,,,0.050437517,0.85718155,0.09238097
6,1272275116697587712,1272275116697587712,2020-06-14 21:10:00 UTC,2020-06-14,21:10:00,0,992633006,webtekno,Webtekno,,"Tesla Roadster, SpaceX Motoruyla Baş Döndürücü Bir Hızlanmaya Kavuşabilir  ➤  https://t.co/odHjzqDnrX  https://t.co/XHYXbe93za",tr,[],['https://bit.ly/2AzYvVC'],['https://pbs.twimg.com/media/Eaf8n0sXYAEEE12.jpg'],5,5,231,[],[],https://twitter.com/webtekno/status/1272275116697587712,False,,1,https://pbs.twimg.com/media/Eaf8n0sXYAEEE12.jpg,,,,,,,[],,,,,0.016065609,0.9260349,0.057899434
7,1272275085915828232,1272275085915828232,2020-06-14 21:09:52 UTC,2020-06-14,21:09:52,0,7111232,disinformatico,Paolo Attivissimo,,"@elonmusk I just bought a Model S. Contrary to the email Tesla sent me, it had rear wheels too! :-)  https://t.co/yg5xHP9Oub",en,[],[],['https://pbs.twimg.com/media/EagHFYgXQAAhoL-.png'],15,3,168,[],[],https://twitter.com/disinformatico/status/1272275085915828232,False,,1,https://pbs.twimg.com/media/EagHFYgXQAAhoL-.png,,,,,,,[],,,,,0.005444813,0.1761074,0.8184477
8,1272271242507280386,1272271242507280386,2020-06-14 20:54:36 UTC,2020-06-14,20:54:36,0,17060015,cleantechnica,CleanTechnica,,Tesla Model S Delivery Event Is 8 Years Old (Video)  https://t.co/lVG3wrfGze,en,[],['https://cleantechnica.com/2020/06/14/tesla-model-s-delivery-event-is-8-years-old-video/'],[],13,74,1041,[],[],https://twitter.com/cleantechnica/status/1272271242507280386,False,,0,,,,,,,,[],,,,,0.0052651684,0.84536576,0.1493691
9,1272268222440636416,1272268222440636416,2020-06-14 20:42:36 UTC,2020-06-14,20:42:36,0,706694847,master_ov,MasterOv,,"100 @Tesla Cars Referred, Sold &amp; Delivered! 🎉 Thank you everyone who ordered after watching the channel, it means a lot! (🤞we win the Roadster! THINK OF THE CONTENT!)  https://t.co/bgfk1vAUSV",en,"[{'screen_name': 'tesla', 'name': 'tesla', 'id': '13298072'}]",[],['https://pbs.twimg.com/media/EagAk2WXsAEIXfI.jpg'],10,3,138,[],[],https://twitter.com/master_ov/status/1272268222440636416,False,,1,https://pbs.twimg.com/media/EagAk2WXsAEIXfI.jpg,,,,,,,[],,,,,0.002125554,0.0110257,0.98684883
10,1272264477916921859,1272186071548338178,2020-06-14 20:27:43 UTC,2020-06-14,20:27:43,0,3572908275,callummarkie,Callum Markie,,@Memeulous @camkirkham_ “it all started when i bought my new tesla”,en,[],[],[],9,0,176,[],[],https://twitter.com/callummarkie/status/1272264477916921859,False,,0,,,,,,,,"[{'screen_name': 'Memeulous', 'name': 'Memeulous', 'id': '2800268383'}, {'screen_name': 'camkirkham_', 'name': 'Cam Kirkham BABY', 'id': '2496987336'}]",,,,,0.049492776,0.86312497,0.08738215
11,1272262946446606338,1272250639201046533,2020-06-14 20:21:38 UTC,2020-06-14,20:21:38,0,3405760034,subhash_kak,Subhash Kak ☀️,,"For those who were surprised by the story of Vivekananda and Tesla, here is where to find further information:   https://t.co/C9AwgAcft3",en,[],['https://www.currentscience.ac.in/Volumes/113/11/2207.pdf'],[],4,33,87,[],[],https://twitter.com/subhash_kak/status/1272262946446606338,False,,0,,,,,,,,[],,,,,0.04199086,0.87534285,0.08266622
12,1272261333241614336,1272261333241614336,2020-06-14 20:15:13 UTC,2020-06-14,20:15:13,0,349249475,gerberkawasaki,Ross Gerber,,Tesla preparing for its typical end of the quarter marathon push to make and beat expectations... #ModelY are ready for launch. Going to be busy at #Tesla $tsla #TeslaModelY #TeslaModel3,en,[],[],[],17,28,328,"['modely', 'tesla', 'teslamodely', 'teslamodel3']",['tsla'],https://twitter.com/GerberKawasaki/status/1272261333241614336,False,,0,,,,,,,,[],,,,,0.0027191488,0.07826973,0.9190113
13,1272257791407714304,1272257791407714304,2020-06-14 20:01:09 UTC,2020-06-14,20:01:09,0,792984182108528640,sandavidcito,Jøsué,,tesla 0 speed bumps 1,en,[],[],[],0,18,243,[],[],https://twitter.com/sandavidcito/status/1272257791407714304,False,https://twitter.com/engineers_feed/status/1272249098226319361,0,,,,,,,,[],,,,,0.0515834,0.8418672,0.106549256
14,1272257511781838849,1272257511781838849,2020-06-14 20:00:02 UTC,2020-06-14,20:00:02,0,692023,westcoastbill,bill lee 🚽,,"this reminds of when everyone underestimated @tesla master plan (2006)  https://t.co/D0NQUkF2e9 and part deux (2016)  https://t.co/c4inshwqwB once again, here’s the path ahead -  https://t.co/bqryN22Rif #placeyourbets",en,"[{'screen_name': 'tesla', 'name': 'tesla', 'id': '13298072'}]","['https://www.tesla.com/blog/secret-tesla-motors-master-plan-just-between-you-and-me', 'https://www.tesla.com/blog/master-plan-part-deux', 'https://youtu.be/n6M3MQsAyvg']",[],10,26,272,['placeyourbets'],[],https://twitter.com/westcoastbill/status/1272257511781838849,False,,0,,,,,,,,[],,,,,0.08677232,0.64894295,0.26428476
15,1272251090214490112,1272251090214490112,2020-06-14 19:34:31 UTC,2020-06-14,19:34:31,0,959471389282578432,evafoxu,Eva Fox 狐🦊❤️🇺🇦,,"Tesla $TSLA shares are a valuable asset, as the company has a great advantage over any other automaker. @CathieDWood (ARK Invest), spoke about her unwavering belief in deeply disruptive technology companies such as #Tesla 💪🏼  @Tesla @elonmusk ☀️  https://t.co/DJ7fzCilIS",en,"[{'screen_name': 'cathiedwood', 'name': 'cathie wood', 'id': '2361631088'}, {'screen_name': 'tesla', 'name': 'tesla', 'id': '13298072'}, {'screen_name': 'elonmusk', 'name': 'elon musk', 'id': '44196397'}]",['https://www.tesmanian.com/blogs/tesmanian-blog/cathie-wood-of-ark-invest-in-an-interview-with-marketwatch'],[],1,16,70,['tesla'],['tsla'],https://twitter.com/EvaFoxU/status/1272251090214490112,False,,0,,,,,,,,[],,,,,0.0024544608,0.023855722,0.97368973
16,1272250368894828549,1272250368894828549,2020-06-14 19:31:39 UTC,2020-06-14,19:31:39,0,2150280847,delafro_,CANDACE SINCLAIRE,,The amount of men hating on that girl for getting a Tesla is just... y’all need therapy. Desperately.,en,[],[],[],3,30,98,[],[],https://twitter.com/delafro_/status/1272250368894828549,False,,0,,,,,,,,[],,,,,0.9052555,0.08777799,0.006966546
17,1272250174908162048,1272250174908162048,2020-06-14 19:30:53 UTC,2020-06-14,19:30:53,0,1020627011008540672,elonsbrain,🧠 Elon’s Brain ,,Looks like @arctechinc is my #5000th follower!  Thank you!!!  And a big thank you everyone for helping me reach this goal!  The future is brighter than ever with @Tesla and @SpaceX and I'm so happy to be here with you all sharing our experiences.  Mad ❤️ to you all!  - 🧠,en,"[{'screen_name': 'arctechinc', 'name': 'james locke', 'id': '131988806'}, {'screen_name': 'tesla', 'name': 'tesla', 'id': '13298072'}, {'screen_name': 'spacex', 'name': 'spacex', 'id': '34743251'}]",[],[],2,3,53,['5000th'],[],https://twitter.com/ElonsBrain/status/1272250174908162048,False,,0,,,,,,,,[],,,,,0.0023823767,0.005581356,0.9920363
18,1272249098226319361,1272249098226319361,2020-06-14 19:26:36 UTC,2020-06-14,19:26:36,0,3429950987,engineers_feed,World of Engineering,,2020 Tesla Cyberbike   https://t.co/IWmSIxFpFA,in,[],['https://twitter.com/scale_banana/status/1272248977140977665/video/1'],[],461,13377,52745,[],[],https://twitter.com/engineers_feed/status/1272249098226319361,False,,0,,,,,,,,[],,,,,0.007965664,0.89363337,0.09840097
19,1272243662827786240,1272243662827786240,2020-06-14 19:05:01 UTC,2020-06-14,19:05:01,0,18856867,zerohedge,zerohedge,,"Tesla Is ""Having Issues"" Boosting Output Of Its Model Y  https://t.co/TZy8l0SZsv",en,[],['https://www.zerohedge.com/technology/tesla-having-issues-boosting-output-its-model-y'],[],17,18,100,[],[],https://twitter.com/zerohedge/status/1272243662827786240,False,,0,,,,,,,,[],,,,,0.5845226,0.40060884,0.014868529
20,1272240100479512576,1272240100479512576,2020-06-14 18:50:51 UTC,2020-06-14,18:50:51,0,1053004440398118912,rebuildsrich,Rich Rebuilds,,My Tesla cyberquad update video!  https://t.co/mUkxAHEvk9  https://t.co/8IXVpL2eeD,en,[],['https://youtu.be/B6-IQnsE4wY'],['https://pbs.twimg.com/media/Eafnm_cWkAAM8Ws.jpg'],5,8,161,[],[],https://twitter.com/RebuildsRich/status/1272240100479512576,False,,1,https://pbs.twimg.com/media/Eafnm_cWkAAM8Ws.jpg,,,,,,,[],,,,,0.004347675,0.58425355,0.41139874
21,1272238989089681409,1272238989089681409,2020-06-14 18:46:26 UTC,2020-06-14,18:46:26,0,2148233600,electrekco,Electrek.co,,Tesla starts deliveries in Big 3's backyard after years of fighting  https://t.co/vM7bosK8Xr by @fredericlambert,en,"[{'screen_name': 'fredericlambert', 'name': 'fred lambert', 'id': '38253449'}]",['https://electrek.co/2020/06/14/tesla-delivery-big-3s-backyard-battle/'],[],2,34,177,[],[],https://twitter.com/ElectrekCo/status/1272238989089681409,False,,0,,,,,,,,[],,,,,0.018919243,0.82252336,0.15855734
22,1272238878129377282,1272238878129377282,2020-06-14 18:46:00 UTC,2020-06-14,18:46:00,0,318993598,q_review,Quinton Reviews🎬,,"The first contact Earth will make with aliens will be when men from Mars hover over DC, drop Elon Musk's Tesla Roadster on the white house lawn, and leave a note that reads ""stop shooting your garbage into space""",en,[],[],[],5,29,284,[],[],https://twitter.com/Q_Review/status/1272238878129377282,False,,0,,,,,,,,[],,,,,0.24246061,0.6875362,0.07000319
23,1272235356277088256,1272235356277088256,2020-06-14 18:32:00 UTC,2020-06-14,18:32:00,0,214217821,tikensoo_509,Kensley Vardy Beaucéjour🇭🇹,,Funny story one time some random dude asked me if he could charge his phone in my car for a couple minutes because his phone has died and he wasn’t able to get in his Tesla. 😂,en,[],[],[],1,11,67,[],[],https://twitter.com/tikensoo_509/status/1272235356277088256,False,https://twitter.com/ImRealExclusive/status/1271593667720024064,0,,,,,,,,[],,,,,0.3442259,0.54698026,0.10879386
24,1272230636946931717,1272230636946931717,2020-06-14 18:13:15 UTC,2020-06-14,18:13:15,0,1198313150858383360,cybrtrkguy,The Cybertruck Guy,,The biggest game-changer for Tesla? Licensing their battery tech.   Imagine Tesla powered: -Boats -Power tools -Cruise Ships -RVs -Fork lifts -Dump trucks -Military vehicles,en,[],[],[],23,21,226,[],[],https://twitter.com/cybrtrkguy/status/1272230636946931717,False,,0,,,,,,,,[],,,,,0.0040521035,0.120587915,0.8753599
25,1272230556428914688,1272230556428914688,2020-06-14 18:12:56 UTC,2020-06-14,18:12:56,0,615328000,droid254,Droid 🤖,,Will I am's custom Tesla model S  https://t.co/ahvFAhcl3H,en,[],[],['https://pbs.twimg.com/media/Eafe8omXkAIm6JZ.jpg'],11,45,303,[],[],https://twitter.com/droid254/status/1272230556428914688,False,,1,https://pbs.twimg.com/media/Eafe8omXkAIm6JZ.jpg,,,,,,,[],,,,,0.009747652,0.8937525,0.096499816
26,1272227255930859523,1272227255930859523,2020-06-14 17:59:49 UTC,2020-06-14,17:59:49,0,878051860426276864,bennywu45,Tesla Owners Vancouver,,"$tsla I finally got my model 3 last Friday, the sales said they have around 1500 model 3 to deliver in June. Vancouver will pass La to become the most density of 3 . Too many rich people live in Vancouver, and do not know why every people wants Tesla instead of bmw now?",en,[],[],[],7,15,172,[],['tsla'],https://twitter.com/bennywu45/status/1272227255930859523,False,,0,,,,,,,,[],,,,,0.049217064,0.54044145,0.41034153
27,1272225398185549831,1272224460586627072,2020-06-14 17:52:26 UTC,2020-06-14,17:52:26,0,1689516060,vincent13031925,vincentyu.eth,,@mayemusk Wow!! The only Tesla model that ever comes with keys.,en,[],[],[],3,5,206,[],[],https://twitter.com/vincent13031925/status/1272225398185549831,False,,0,,,,,,,,"[{'screen_name': 'mayemusk', 'name': 'Maye Musk', 'id': '14171401'}]",,,,,0.0032272837,0.040363424,0.95640916
28,1272225139023888387,1272225139023888387,2020-06-14 17:51:24 UTC,2020-06-14,17:51:24,0,1325716237,toys_celebrity,Celebrity Toys,,"Juju Smith-Schuster’s Custom Tesla $150,000🔥  https://t.co/ivdJzPXT5L",und,[],[],['https://pbs.twimg.com/media/EafaBTHWAAk5dSx.jpg'],2,65,368,[],[],https://twitter.com/toys_celebrity/status/1272225139023888387,False,,1,https://pbs.twimg.com/media/EafaBTHWAAk5dSx.jpg,,,,,,,[],,,,,0.0059579224,0.6074823,0.38655978
29,1272224460586627072,1272224460586627072,2020-06-14 17:48:42 UTC,2020-06-14,17:48:42,0,14171401,mayemusk,Maye Musk,,Cleaning up during lockdown and found the original Tesla Roadster car key and key holder. What’s a car key? 🤣🤣  https://t.co/qXHLLlhPf3,en,[],[],['https://pbs.twimg.com/media/EafZZt7UcAIJvYP.jpg'],156,221,5535,[],[],https://twitter.com/mayemusk/status/1272224460586627072,False,,1,https://pbs.twimg.com/media/EafZZt7UcAIJvYP.jpg,,,,,,,[],,,,,0.04114373,0.658933,0.29992333
30,1272222385803071490,1272222385803071490,2020-06-14 17:40:28 UTC,2020-06-14,17:40:28,0,1048487046187286528,routebetter,A Better Routeplanner,,"ABRP 4.0.11 out today on iOS, Android and web! New stuff includes vehicle configurations - switch between and automatically calibrate your driving with trailer, bike racks etc (Premium), 3D driving mode for web and Tesla browser, and plan refresh in driving mode which works :-)  https://t.co/S05TRdyGkT",en,[],[],['https://pbs.twimg.com/media/EafXeUAWAAE33l8.jpg'],6,26,101,[],[],https://twitter.com/RouteBetter/status/1272222385803071490,False,,1,https://pbs.twimg.com/media/EafXeUAWAAE33l8.jpg,,,,,,,[],,,,,0.0027773536,0.19359829,0.8036243
31,1272221717276921858,1272221717276921858,2020-06-14 17:37:48 UTC,2020-06-14,17:37:48,0,18872613,lindsaydemeola,lindsay,,just added a tesla to my vision board rip,en,[],[],[],3,5,122,[],[],https://twitter.com/lindsaydemeola/status/1272221717276921858,False,,0,,,,,,,,[],,,,,0.57896507,0.38315952,0.037875418
32,1272221265294618624,1272219112148631553,2020-06-14 17:36:01 UTC,2020-06-14,17:36:01,0,2544468266,afrosenju,AfroSenju,,It's not a tesla. The 'T' was a typo lmao,en,[],[],[],10,2,571,[],[],https://twitter.com/AfroSenju/status/1272221265294618624,False,,0,,,,,,,,[],,,,,0.66752,0.30390567,0.028574364
33,1272206550447222784,1272206550447222784,2020-06-14 16:37:32 UTC,2020-06-14,16:37:32,0,1100520274200416256,tesmanian_com,Tesmanian.com,,Tesla Q2 China Sales Will Get Extra Boost By Shenzhen City Additional 20K RMB Incentives  https://t.co/OdUvr1ZOEa  https://t.co/QucAb75ei5,en,[],['https://www.tesmanian.com/blogs/tesmanian-blog/tesla-q2-china-sales-will-get-extra-boost-by-shenzhen-city-additional-20k-rmb-incentives?utm_source=dlvr.it&utm_medium=twitter'],['https://pbs.twimg.com/media/EafJHZ2UYAARBIU.jpg'],3,31,123,[],[],https://twitter.com/Tesmanian_com/status/1272206550447222784,False,,1,https://pbs.twimg.com/media/EafJHZ2UYAARBIU.jpg,,,,,,,[],,,,,0.0033604873,0.42393592,0.5727037
34,1272206259220025350,1272206259220025350,2020-06-14 16:36:23 UTC,2020-06-14,16:36:23,0,971762941015089152,bgrahamdisciple,B Graham Disciple,,"Better hurry folks. You can buy this USED 2020 Tesla Model 3 LR on Carvana RN for only $6,000 more than a BRAND NEW 2020 LR model 3 available for IMMEDIATE purchase directly from Tesla. Since everyone likes to pay more for used cars than new cars, this car will sell fast.  https://t.co/DDkv2GI3eH",en,[],[],['https://pbs.twimg.com/media/EafI2RJWAAE2BJe.jpg'],20,18,154,[],[],https://twitter.com/bgrahamdisciple/status/1272206259220025350,False,,1,https://pbs.twimg.com/media/EafI2RJWAAE2BJe.jpg,,,,,,,[],,,,,0.0054132715,0.13260709,0.8619797
35,1272201242370994177,1272201242370994177,2020-06-14 16:16:27 UTC,2020-06-14,16:16:27,0,898336170504933376,oha_alex,Alex Oha 📈,,"On Monday, Spain Government will announce a 3.75 billion euro plan to help the automotive sector, ""It will include an incentive for electric vehicles"" #Tesla  https://t.co/u2ACTYlTH1",en,[],[],['https://pbs.twimg.com/media/EafESQ-XQAEQhr2.jpg'],9,52,386,['tesla'],[],https://twitter.com/oha_alex/status/1272201242370994177,False,,1,https://pbs.twimg.com/media/EafESQ-XQAEQhr2.jpg,,,,,,,[],,,,,0.0030723058,0.26533866,0.7315891
36,1272199299640762370,1272199299640762370,2020-06-14 16:08:44 UTC,2020-06-14,16:08:44,0,1169348503975317504,driveteslaca,Drive Tesla 🇨🇦,,Who's looking for spare parts for their #Tesla #ModelY already?  https://t.co/Ykhl9x6WZJ,en,[],['https://driveteslacanada.ca/model-y/first-totalled-model-y-new-tesla-suv-severely-damaged-in-rear-end-collision/'],[],20,6,78,"['tesla', 'modely']",[],https://twitter.com/DriveTeslaca/status/1272199299640762370,False,,0,,,,,,,,[],,,,,0.01438881,0.88132375,0.10428746
37,1272196974641590272,1272196974641590272,2020-06-14 15:59:29 UTC,2020-06-14,15:59:29,0,16045536,_gettingstoned,GettingStoned.eth,,Little Tesla is no longer little. Can’t believe he is 7 months. I remember when he was 9 days old eyes barely open and abandoned by his mom.   This is one of his baby blankets a neighbor gave him. It was a whole neighborhood effort in saving this kitten. ❤️  https://t.co/Ba5nIqNJEP,en,[],[],['https://pbs.twimg.com/media/EafAZvrWoAACQIT.jpg'],12,5,104,[],[],https://twitter.com/_GettingStoned/status/1272196974641590272,False,,1,https://pbs.twimg.com/media/EafAZvrWoAACQIT.jpg,,,,,,,[],,,,,0.06971175,0.2823592,0.64792895
38,1272195181584900102,1272195181584900102,2020-06-14 15:52:22 UTC,2020-06-14,15:52:22,0,1175164547746844672,teslaownersebay,Tesla East Bay Club |Fremont| 🇺🇦🕊🦊,,S3XY Weekend @tesla Factory report: #HellaTeslas being loaded for delivery.  https://t.co/Dfih050oVq,en,"[{'screen_name': 'tesla', 'name': 'tesla', 'id': '13298072'}]",[],[],3,12,90,['hellateslas'],[],https://twitter.com/TeslaOwnersEBay/status/1272195181584900102,False,,1,https://pbs.twimg.com/ext_tw_video_thumb/1272195104694956032/pu/img/4jxpvrgVsutYKT04.jpg,,,,,,,[],,,,,0.0070968457,0.9326151,0.060288098
39,1272195143467249665,1272195143467249665,2020-06-14 15:52:13 UTC,2020-06-14,15:52:13,0,17060015,cleantechnica,CleanTechnica,,Tesla Model 3 SR+ Reported To Have 39% Gross Margin In China  https://t.co/TcMd6vd1Sr,en,[],['https://cleantechnica.com/2020/06/14/tesla-model-3-sr-reported-to-have-39-gross-margin-in-china/'],[],2,36,154,[],[],https://twitter.com/cleantechnica/status/1272195143467249665,False,,0,,,,,,,,[],,,,,0.0052704257,0.69636625,0.29836336
40,1272186897159372800,1272186897159372800,2020-06-14 15:19:27 UTC,2020-06-14,15:19:27,0,1175270410151182336,i_amroyaltyy,i_amroyaltyy 🇭🇹,,"Why do I keep seeing Tesla’s down my TL, no one likes Toyota’s anymore? 😭😭",en,[],[],[],5,16,79,[],[],https://twitter.com/i_amroyaltyy/status/1272186897159372800,False,,0,,,,,,,,[],,,,,0.9078134,0.08523759,0.006948995
41,1272186107472437248,1272184344157683713,2020-06-14 15:16:18 UTC,2020-06-14,15:16:18,0,1689516060,vincent13031925,vincentyu.eth,,Appreciated Tesla Owners Club (China Chongqing) members which volunteer to help in the show  https://t.co/OZdl97NFnN,en,[],[],[],1,6,95,[],[],https://twitter.com/vincent13031925/status/1272186107472437248,False,,1,https://pbs.twimg.com/ext_tw_video_thumb/1272186006448402432/pu/img/PtDukjNQLdJGp0Wz.jpg,,,,,,,[],,,,,0.003341255,0.10341998,0.89323866
42,1272184344157683713,1272184344157683713,2020-06-14 15:09:18 UTC,2020-06-14,15:09:18,0,1689516060,vincent13031925,vincentyu.eth,,Tesla Demand In China Gets “Supercharged” In Chongqing Auto Show 2020  $TSLA #Tesla #China   https://t.co/eoQdCXEcbO,en,[],['https://www.tesmanian.com/blogs/tesmanian-blog/tesla-demand-in-china-gets-supercharged-in-chongqing-auto-show-2020'],[],2,36,242,"['tesla', 'china']",['tsla'],https://twitter.com/vincent13031925/status/1272184344157683713,False,,0,,,,,,,,[],,,,,0.00483142,0.48827118,0.5068973
43,1272183931387944964,1272183931387944964,2020-06-14 15:07:39 UTC,2020-06-14,15:07:39,0,704835627183788032,model3owners,Trev Page,,Tesla Roadster could hit 0-60 mph in 1.1 sec with SpaceX thrusters.   Founder’s edition will be plenty fast thank-you very much   https://t.co/GPExKRIXYb,en,[],['https://www.teslarati.com/tesla-roadster-0-60-mph-1-1-seconds-spacex-thrusters/'],[],24,55,421,[],[],https://twitter.com/Model3Owners/status/1272183931387944964,False,,0,,,,,,,,[],,,,,0.005748884,0.08859695,0.9056542
44,1272182894954344450,1272182894954344450,2020-06-14 15:03:32 UTC,2020-06-14,15:03:32,0,1100520274200416256,tesmanian_com,Tesmanian.com,,Tesla Demand In China Gets “Supercharged” In Chongqing Auto Show 2020  https://t.co/WQ0VDVO8Us  https://t.co/M7ft4XoRTT,en,[],['https://www.tesmanian.com/blogs/tesmanian-blog/tesla-demand-in-china-gets-supercharged-in-chongqing-auto-show-2020?utm_source=dlvr.it&utm_medium=twitter'],['https://pbs.twimg.com/media/EaezmesU4AAzg60.jpg'],0,19,156,[],[],https://twitter.com/Tesmanian_com/status/1272182894954344450,False,,1,https://pbs.twimg.com/media/EaezmesU4AAzg60.jpg,,,,,,,[],,,,,0.0050488287,0.6807727,0.31417838
45,1272180521208934401,1272176461324132353,2020-06-14 14:54:06 UTC,2020-06-14,14:54:06,0,1689516060,vincent13031925,vincentyu.eth,,"@28delayslater Stay in fight by showing the world of the real development from Tesla, not direct engage with those stupid Qs.  That’s what I am doing ✌🏻👊🏻",en,[],[],[],1,2,63,[],[],https://twitter.com/vincent13031925/status/1272180521208934401,False,,0,,,,,,,,"[{'screen_name': '28delayslater', 'name': '🇺🇦 🦊 Earl of FrunkPuppy 🇺🇦', 'id': '998140573008695296'}]",,,,,0.08111406,0.43200678,0.48687923
46,1272176037078523905,1272176037078523905,2020-06-14 14:36:17 UTC,2020-06-14,14:36:17,0,1689516060,vincent13031925,vincentyu.eth,,Tesla Owners Clubs In China 🇨🇳 Help Boost The Country’s GDP With Pop-Up Markets Across The Nation  Many great photos in the article:  https://t.co/VLKrrShOEt  @elonmusk @Teslacn  https://t.co/B7PMzoHwHF,en,"[{'screen_name': 'elonmusk', 'name': 'elon musk', 'id': '44196397'}, {'screen_name': 'teslacn', 'name': 'tesla greater china', 'id': '1201427034754318337'}]",['https://www.tesmanian.com/blogs/tesmanian-blog/tesla-owners-club-china-gdp'],[],28,89,1219,[],[],https://twitter.com/vincent13031925/status/1272176037078523905,False,,1,https://pbs.twimg.com/ext_tw_video_thumb/1272176015977005057/pu/img/XW2Z7TJgNjayiSMc.jpg,,,,,,,[],,,,,0.0018311063,0.027736647,0.97043216
47,1272175853560950784,1272175853560950784,2020-06-14 14:35:34 UTC,2020-06-14,14:35:34,0,1238951706785796096,teslachillmode,TeslaChillMode #TeslaIndia🇮🇳,,Just saw this on IG. The “MODEL 3 PRIORITY” sticker? Is this new or a Europe only thing. I’ve never seen one before. Do S &amp; X have to wait? Idk @Tesla @elonmusk  https://t.co/1MLTYDlBCK,en,"[{'screen_name': 'tesla', 'name': 'tesla', 'id': '13298072'}, {'screen_name': 'elonmusk', 'name': 'elon musk', 'id': '44196397'}]",[],['https://pbs.twimg.com/media/EaetMZOUYAAM63U.jpg'],15,3,74,[],[],https://twitter.com/TeslaChillMode/status/1272175853560950784,False,,1,https://pbs.twimg.com/media/EaetMZOUYAAM63U.jpg,,,,,,,[],,,,,0.16327554,0.79564965,0.041074906
