,id,conversation_id,created_at,date,time,timezone,user_id,username,name,place,tweet,language,mentions,urls,photos,replies_count,retweets_count,likes_count,hashtags,cashtags,link,retweet,quote_url,video,thumbnail,near,geo,source,user_rt_id,user_rt,retweet_id,reply_to,retweet_date,translate,trans_src,trans_dest,negative,neutral,positive
93,1340618922895286274,1340618922895286274,2020-12-20 11:23:53 UTC,2020-12-20,11:23:53,0,1176433616831832065,truth_tesla,Tesla Facts,,"1/  There's a valuable but under-reported aspect of Tesla joining the S&amp;P 500 tomorrow: the decade long flight of capital from active funds to passive index funds and the massive, unprecedented, ongoing cash inflows passive index funds enjoy.   https://t.co/WFXOWsL9h6  https://t.co/fU5mu779Dy",en,[],['https://www.morningstar.com/insights/2019/06/12/asset-parity'],['https://pbs.twimg.com/media/EprVgLyXUAYPxGj.jpg'],9,14,145,[],[],https://twitter.com/truth_tesla/status/1340618922895286274,False,,1,https://pbs.twimg.com/media/EprVgLyXUAYPxGj.jpg,,,,,,,[],,,,,0.003528841,0.12560442,0.8708668
94,1340618593487220737,1340618593487220737,2020-12-20 11:22:34 UTC,2020-12-20,11:22:34,0,855795055,mortenlund89,Morten Grove - Captain of all Tesla-Ships 🚢,,"🚢Tesla-Feeder-Ship News🚢 🚢Lydden, yes Lydden, has arrived in Oslo⚓️, Norway🇳🇴 very likely with #Model3 🚗 onboard for the EV-crazy country. She is too big for Drammen, so Oslo it is. This only happens when there's 📈 demand in Norway.  https://t.co/MYv9Acn4du",en,[],[],['https://pbs.twimg.com/media/EprUn0mWwAAnU4q.jpg'],2,10,69,['model3'],[],https://twitter.com/mortenlund89/status/1340618593487220737,False,,1,https://pbs.twimg.com/media/EprUn0mWwAAnU4q.jpg,,,,,,,[],,,,,0.006239143,0.45521706,0.53854376
95,1340616488944807942,1340616488944807942,2020-12-20 11:14:13 UTC,2020-12-20,11:14:13,0,125376632,federicorampini,Federico Rampini,,"Alla vigilia dell'ingresso di #Tesla nell'indice S&amp;P500  #ElonMusk il fondatore della più nota marca Usa di auto elettrica ha tradito la #California per trasferirsi in #Texas, nuovo Eldorado liberista dove si pagano meno tasse.",it,[],[],[],15,26,147,"['tesla', 'elonmusk', 'california', 'texas']",[],https://twitter.com/FedericoRampini/status/1340616488944807942,False,,0,,,,,,,,[],,,,,0.04389436,0.7750094,0.18109635
96,1340615736696291328,1340615736696291328,2020-12-20 11:11:13 UTC,2020-12-20,11:11:13,0,1201427034754318337,teslacn,Tesla Greater China,,"Leaves fall to the ground, we fall in Tesla🍂 #Tesla  https://t.co/8nT4WXQyZD",en,[],[],['https://pbs.twimg.com/media/EprSOXMVgAE7FbE.jpg'],10,19,311,['tesla'],[],https://twitter.com/teslacn/status/1340615736696291328,False,,1,https://pbs.twimg.com/media/EprSOXMVgAE7FbE.jpg,,,,,,,[],,,,,0.058435265,0.6938169,0.2477478
97,1340612957840035840,1340612957840035840,2020-12-20 11:00:11 UTC,2020-12-20,11:00:11,0,20902138,alistairmilne,Alistair Milne,,Year-to-date performance (USD):  Tesla $TSLA +730% #Bitcoin $BTC  +227% NVIDIA $NVDA +126% PayPal $PYPL +119% MicroStrategy $MSTR +111% AMD $AMD +110% Apple $APPL +74% Amazon $AMZN  +73% Netflix $NFLX +65% Alphabet $GOOGL +29% JPMorgan $JPM -11% Exxon Mobil $XON -34%,en,[],[],[],8,51,229,['bitcoin'],"['tsla', 'btc', 'nvda', 'pypl', 'mstr', 'amd', 'appl', 'amzn', 'nflx', 'googl', 'jpm', 'xon']",https://twitter.com/alistairmilne/status/1340612957840035840,False,,0,,,,,,,,[],,,,,0.024061628,0.7424055,0.23353274
98,1340612732974981123,1340612732974981123,2020-12-20 10:59:17 UTC,2020-12-20,10:59:17,0,1201036254814425089,ed_mobiel,MobielEd,,Finally! I am the proud owner of my first Tesla. A Red/White M3P. Now I can feel like a true member of the Tesla family. 🥰 Love you all!  https://t.co/Q1wQ0oUlJE,en,[],[],"['https://pbs.twimg.com/media/EprQK74XEAAx-wF.jpg', 'https://pbs.twimg.com/media/EprQK7xW4AEXneG.jpg', 'https://pbs.twimg.com/media/EprQK7zWMAMoWOs.jpg', 'https://pbs.twimg.com/media/EprQK8vWMAAeMmD.jpg']",174,59,1967,[],[],https://twitter.com/ed_mobiel/status/1340612732974981123,False,,1,https://pbs.twimg.com/media/EprQK74XEAAx-wF.jpg,,,,,,,[],,,,,0.0024615412,0.009139601,0.9883989
99,1340611424469565442,1340611424469565442,2020-12-20 10:54:05 UTC,2020-12-20,10:54:05,0,989162755,kurtimeni,ünal kurtçimeni,,"Tesla bir keresinde şöyle demişti:  Nikola Tesla ""Tüm biyolojik sistemimiz - beyin ve dünyanın kendisi - aynı frekanslarda çalışıyor.""  ""Bu rezonans sistemini elektronik olarak kontrol edebilirsek, insanlığın tüm zihinsel sistemini doğrudan kontrol edebiliriz.""",tr,[],[],[],8,56,263,[],[],https://twitter.com/kurtimeni/status/1340611424469565442,False,,0,,,,,,,,[],,,,,0.022070304,0.8757661,0.10216364
