,id,conversation_id,created_at,date,time,timezone,user_id,username,name,place,tweet,language,mentions,urls,photos,replies_count,retweets_count,likes_count,hashtags,cashtags,link,retweet,quote_url,video,thumbnail,near,geo,source,user_rt_id,user_rt,retweet_id,reply_to,retweet_date,translate,trans_src,trans_dest,negative,neutral,positive
47,1288507930887835656,1288507930887835656,2020-07-29 16:13:24 UTC,2020-07-29,16:13:24,0,4858119358,elecclassiccars,Electric Classic Cars,,"Another one reborn ready for it's second life. 90% finished and with only 1/3 of its battery pack in the ride height is way off, but with its small Tesla drive unit in it'll be a little pocket rocket go-kart. 😎⚡👍 #porsche914 #electricporsche #electric914  https://t.co/8kw8OnB4DG",en,[],[],[],11,23,221,"['porsche914', 'electricporsche', 'electric914']",[],https://twitter.com/elecclassiccars/status/1288507930887835656,False,,1,https://pbs.twimg.com/ext_tw_video_thumb/1288507904635609099/pu/img/DPyfxDoWQF2izXkr.jpg,,,,,,,[],,,,,0.004133033,0.0538906,0.94197637
48,1288507594508820487,1288507594508820487,2020-07-29 16:12:04 UTC,2020-07-29,16:12:04,0,84950626,orthereaboot,luis carruthers,,"When $TSLA sells ""battery systems"" they are merely repacking Samsung/Panasonic/LG batteries and selling them as either a tax scam or for the publicity.  Tesla is adding another layer &amp; associated 100% of the time. There's 0 tech here.",en,[],[],[],10,13,115,[],['tsla'],https://twitter.com/orthereaboot/status/1288507594508820487,False,,0,,,,,,,,[],,,,,0.59879243,0.37532657,0.025881007
49,1288507084263133185,1288507084263133185,2020-07-29 16:10:02 UTC,2020-07-29,16:10:02,0,1689516060,vincent13031925,vincentyu.eth,,"Tesla Giga Shanghai, Berlin, Texas, Nevada and More, An All-Factory Scale Comparison  by @EvaFoxU, @SmokeyShorts   https://t.co/BsGsdwdqKz",en,"[{'screen_name': 'evafoxu', 'name': 'eva fox 狐🦊❤️🇺🇦', 'id': '959471389282578432'}, {'screen_name': 'smokeyshorts', 'name': 'smokey 🦊🇺🇦', 'id': '1142075458231492608'}]",['https://www.tesmanian.com/blogs/tesmanian-blog/tesla-factories'],[],9,18,117,[],[],https://twitter.com/vincent13031925/status/1288507084263133185,False,,0,,,,,,,,[],,,,,0.0055706277,0.8965265,0.097902924
50,1288506370778632192,1288506370778632192,2020-07-29 16:07:12 UTC,2020-07-29,16:07:12,0,18856867,zerohedge,zerohedge,,PG&amp;E TURNS POSITIVE ON NEWS IT/TESLA BUILDING LITHIUM SYSTEM  what?,en,[],[],[],12,11,81,[],[],https://twitter.com/zerohedge/status/1288506370778632192,False,,0,,,,,,,,[],,,,,0.25070596,0.72043204,0.028861966
51,1288505689162350593,1288505689162350593,2020-07-29 16:04:30 UTC,2020-07-29,16:04:30,0,275295731,davidtayar5,David Tayar,,"* PG&amp;E, Tesla Break Ground on Landmark Battery Energy Storage System  $TSLA  https://t.co/YOVfZSc7rp",en,[],[],['https://pbs.twimg.com/media/EeGxFxDWoAEximh.jpg'],5,26,126,[],['tsla'],https://twitter.com/davidtayar5/status/1288505689162350593,False,,1,https://pbs.twimg.com/media/EeGxFxDWoAEximh.jpg,,,,,,,[],,,,,0.0056365235,0.8664461,0.12791732
52,1288504829648801794,1288504829648801794,2020-07-29 16:01:05 UTC,2020-07-29,16:01:05,0,1308211178,teslarati,TESLARATI,,Tesla factory comparison depicts Gigafactory Texas’ gargantuan size  https://t.co/91hzIvFV9M,en,[],['https://www.teslarati.com/tesla-factory-size-comparison-gargantuan-giga-austin/?cc=1'],[],5,55,350,[],[],https://twitter.com/Teslarati/status/1288504829648801794,False,,0,,,,,,,,[],,,,,0.014059483,0.90515786,0.08078258
53,1288504565298393088,1288504565298393088,2020-07-29 16:00:02 UTC,2020-07-29,16:00:02,0,1100520274200416256,tesmanian_com,Tesmanian.com,,"Morgan Stanley Raises Tesla TSLA Bull Case to $2,500 and PT to $1,050 from $740  https://t.co/EQpxygnkUx",en,[],['https://www.tesmanian.com/blogs/tesmanian-blog/tesla-tsla-bull-case-raised-to-2-500-by-morgan-stanley?utm_source=dlvr.it&utm_medium=twitter'],[],2,13,86,[],[],https://twitter.com/Tesmanian_com/status/1288504565298393088,False,,0,,,,,,,,[],,,,,0.0042066695,0.6459877,0.3498057
54,1288503112643223553,1288503112643223553,2020-07-29 15:54:15 UTC,2020-07-29,15:54:15,0,415794343,tweetermeyer,E.W. Niedermeyer,,"Hypothesis: Tesla is actually developing Full Self-Driving as a SAE Level 4 project, with the domain defined as ""Elon's Commute""",en,[],[],[],10,3,58,[],[],https://twitter.com/Tweetermeyer/status/1288503112643223553,False,,0,,,,,,,,[],,,,,0.011323598,0.7809913,0.2076851
55,1288502611444813826,1288502611444813826,2020-07-29 15:52:16 UTC,2020-07-29,15:52:16,0,1689516060,vincent13031925,vincentyu.eth,,"Morgan Stanley Raises Tesla $TSLA Bull Case to $2,500 and PT to $1,050 from $740   https://t.co/dYLTCGn0YA",en,[],['https://www.tesmanian.com/blogs/tesmanian-blog/tesla-tsla-bull-case-raised-to-2-500-by-morgan-stanley'],[],12,55,333,[],['tsla'],https://twitter.com/vincent13031925/status/1288502611444813826,False,,0,,,,,,,,[],,,,,0.0040054256,0.58576596,0.41022873
56,1288502407408697344,1288502407408697344,2020-07-29 15:51:27 UTC,2020-07-29,15:51:27,0,1053485936191856640,inelonwetrust__,InElonWeTrust,,Show me one single car that can do this!  🤫 You can’t.  Yet people continue to doubt @Tesla @elonmusk,en,"[{'screen_name': 'tesla', 'name': 'tesla', 'id': '13298072'}, {'screen_name': 'elonmusk', 'name': 'elon musk', 'id': '44196397'}]",[],[],5,15,93,[],[],https://twitter.com/Inelonwetrust__/status/1288502407408697344,False,https://twitter.com/A11electric/status/1288501941312663552,0,,,,,,,,[],,,,,0.6001277,0.30560905,0.0942632
57,1288502281160163329,1288501122504642562,2020-07-29 15:50:57 UTC,2020-07-29,15:50:57,0,1291945442,ppathole,Pranay Pathole,,Tesla &amp; SpaceX also helped with the ventilators &amp; with N95 masks    https://t.co/VI5Sr63nzO,en,[],['https://cleantechnica.com/2020/03/21/elon-musk-should-have-1000-ventilators-next-week-250k-n95-masks-for-hospitals-tomorrow-cleantechnica-exclusive/'],[],6,20,158,[],[],https://twitter.com/PPathole/status/1288502281160163329,False,,0,,,,,,,,[],,,,,0.0053441827,0.5094973,0.48515853
58,1288501653734166528,1288501122504642562,2020-07-29 15:48:28 UTC,2020-07-29,15:48:28,0,1291945442,ppathole,Pranay Pathole,,I mean @Tesla is literally helping in vaccine production for @CureVacAG by setting up RNA microfactories   @elonmusk    https://t.co/q3xOP7JobJ,en,"[{'screen_name': 'tesla', 'name': 'tesla', 'id': '13298072'}, {'screen_name': 'curevacag', 'name': 'curevac ag', 'id': '1389555827212685312'}, {'screen_name': 'elonmusk', 'name': 'elon musk', 'id': '44196397'}]",['https://twitter.com/elonmusk/status/1278578543044300805?s=20'],[],11,26,223,[],[],https://twitter.com/PPathole/status/1288501653734166528,False,https://twitter.com/elonmusk/status/1278578543044300805?s=20,0,,,,,,,,[],,,,,0.0053498377,0.48554727,0.5091029
59,1288501471219261440,1288501471219261440,2020-07-29 15:47:44 UTC,2020-07-29,15:47:44,0,57061127,misschic5,CR ♊🌑 🇲🇽🇮🇹,,"Que tristeza, otra empresa importante que no estará en México.  Tesla le dice adiós a Guanajuato.  https://t.co/ejKWH1zUWx",es,[],['https://www.motorpasion.com.mx/industria/adios-guanajuato-nueva-fabrica-tesla-se-construira-texas'],[],241,1977,3349,[],[],https://twitter.com/MissChic5/status/1288501471219261440,False,,0,,,,,,,,[],,,,,0.022912214,0.8470829,0.13000488
60,1288500833726930948,1288500833726930948,2020-07-29 15:45:12 UTC,2020-07-29,15:45:12,0,169550797,diaz_manuel,Manuel Díaz,,"A ver jóvenes:   Si en el 2012 hubieran comprado un auto Tesla en 57 mil dólares   ¡Mejor hubieran comprado sus acciones!   50,000 usd en acciones de tesla en el 2013 hoy valen mas de 2millones.  La mamoneria cuesta. 😉",es,[],[],[],22,55,301,[],[],https://twitter.com/diaz_manuel/status/1288500833726930948,False,,0,,,,,,,,[],,,,,0.01552896,0.558689,0.42578202
61,1288498714483597312,1288498714483597312,2020-07-29 15:36:47 UTC,2020-07-29,15:36:47,0,255044335,tortugaconqueso,Xavier Ibn-La'Ahad,,hey su mesías del tesla actually tira código o namas es un yeyepreneur?,es,[],[],[],19,33,269,[],[],https://twitter.com/tortugaconqueso/status/1288498714483597312,False,,0,,,,,,,,[],,,,,0.017161556,0.89985454,0.08298386
62,1288497031984619521,1288497031984619521,2020-07-29 15:30:06 UTC,2020-07-29,15:30:06,0,1161703589942878208,garyblack00,Gary Black,,"$TSLA  Tesla Might Be ‘Mind-Boggling Cheap’ at $1,500  https://t.co/le8ZKcrFOF",en,[],['https://www.barrons.com/articles/tesla-stock-might-be-mind-boggling-cheap-at-1-500-51596036337'],[],15,66,365,[],['tsla'],https://twitter.com/garyblack00/status/1288497031984619521,False,,0,,,,,,,,[],,,,,0.017292188,0.48883924,0.49386853
63,1288496012177244163,1288496012177244163,2020-07-29 15:26:03 UTC,2020-07-29,15:26:03,0,1689516060,vincent13031925,vincentyu.eth,,Tesla ( $TSLA ) Margins Could Be Supercharged By Battery Day Breakthroughs   https://t.co/ZRQqqVyr0T,en,[],['https://www.tesmanian.com/blogs/tesmanian-blog/tesla-tsla-battery-day-margins'],[],7,29,257,[],['tsla'],https://twitter.com/vincent13031925/status/1288496012177244163,False,,0,,,,,,,,[],,,,,0.0037909306,0.25484973,0.7413593
64,1288494097926434816,1288494097926434816,2020-07-29 15:18:26 UTC,2020-07-29,15:18:26,0,20402945,cnbc,CNBC,,Move over Tesla: Robinhood day-trading crowd finds a new speculative favorite in Kodak  https://t.co/FnCtraqnPX,en,[],['https://cnb.cx/2BFwEUB'],[],17,23,100,[],[],https://twitter.com/CNBC/status/1288494097926434816,False,,0,,,,,,,,[],,,,,0.0058658216,0.4552173,0.53891677
65,1288487325857730560,1288487325857730560,2020-07-29 14:51:32 UTC,2020-07-29,14:51:32,0,259725229,valaafshar,Vala Afshar,,Year Founded:   1865 Nokia 1876 Ericsson 1880 Kodak 1911 IBM 1928 Motorola 1938 Samsung 1939 HP 1946 Sony 1968 Intel 1975 Microsoft 1976 Apple 1984 Dell 1984 Cisco 1994 Amazon 1997 Netflix 1998 Google 1999 Salesforce 2003 Tesla 2004 Facebook 2006 Twitter 2008 Airbnb 2009 Uber,en,[],[],[],7,30,95,[],[],https://twitter.com/ValaAfshar/status/1288487325857730560,False,,0,,,,,,,,[],,,,,0.013667805,0.904918,0.081414215
66,1288484187285016576,1288484187285016576,2020-07-29 14:39:03 UTC,2020-07-29,14:39:03,0,14628959,automotive_news,Automotive News,,Tesla's Musk says he's open to supplying batteries to rivals  https://t.co/E6rC1OtyPL  https://t.co/Zreoowy1wr,en,[],['http://dlvr.it/Rcc1jM'],['https://pbs.twimg.com/media/EeGdiinU8AEspNE.jpg'],2,16,82,[],[],https://twitter.com/Automotive_News/status/1288484187285016576,False,,1,https://pbs.twimg.com/media/EeGdiinU8AEspNE.jpg,,,,,,,[],,,,,0.0042828647,0.572823,0.42289415
67,1288484126140641294,1288484126140641294,2020-07-29 14:38:49 UTC,2020-07-29,14:38:49,0,28571999,bespokeinvest,Bespoke,,Makes Tesla look like a Utility stock.  https://t.co/jhvsR1rnV3,en,[],[],['https://pbs.twimg.com/media/EeGdc3XXkAEu0bm.png'],8,35,207,[],[],https://twitter.com/bespokeinvest/status/1288484126140641294,False,,1,https://pbs.twimg.com/media/EeGdc3XXkAEu0bm.png,,,,,,,[],,,,,0.054198075,0.79829484,0.14750707
68,1288482912518774795,1288482912518774795,2020-07-29 14:33:59 UTC,2020-07-29,14:33:59,0,25150164,georgedlang,George Lang,,"Stitt wasted $2 million in taxpayer money on a drug that is infamously inefficacious for treating coronavirus; and an additional $1.5 million in legal fees over the gaming compacts. We can only imagine how much Stitt spent to lure the Tesla Cybertruck plant to Austin, Texas.",en,[],[],[],2,25,67,[],[],https://twitter.com/GeorgeDLang/status/1288482912518774795,False,https://twitter.com/FreePressOKC/status/1288213086894161921,0,,,,,,,,[],,,,,0.86582744,0.12497086,0.0092015965
69,1288480786119892992,1288480786119892992,2020-07-29 14:25:32 UTC,2020-07-29,14:25:32,0,17060015,cleantechnica,CleanTechnica,,Elon Says Tesla Willing To Share Software &amp; Powertrains With Competitors  https://t.co/lLYwHHcfBW,en,[],['https://cleantechnica.com/2020/07/29/elon-says-tesla-willing-to-share-software-powertrains-with-competitors/'],[],13,70,319,[],[],https://twitter.com/cleantechnica/status/1288480786119892992,False,,0,,,,,,,,[],,,,,0.005059008,0.8707627,0.1241782
70,1288480303460352000,1288480303460352000,2020-07-29 14:23:37 UTC,2020-07-29,14:23:37,0,2882113533,blackhatwizardd,Cold Email Wizard 📩,,I could have $5m and I’m still not buying a $500k car.  I could buy a Tesla in cash right now.  STILL  I’m whipping my Honda Civic until it dies.,en,[],[],[],11,4,84,[],[],https://twitter.com/blackhatwizardd/status/1288480303460352000,False,,0,,,,,,,,[],,,,,0.71268314,0.23490927,0.052407466
71,1288479327261270016,1288479327261270016,2020-07-29 14:19:45 UTC,2020-07-29,14:19:45,0,23824000,frank_schaeffer,Frank - Glory to Ukraine - Schaeffer,,Just noting that Tesla was given coronavirus bailout despite being valued at more than $270BILLION and owner and crank Elon Musk says second stimulus package was 'not in the best interests of people.',en,[],[],[],2,55,84,[],[],https://twitter.com/Frank_Schaeffer/status/1288479327261270016,False,,0,,,,,,,,[],,,,,0.6948709,0.28947318,0.015655937
72,1288476601127186434,1288476601127186434,2020-07-29 14:08:55 UTC,2020-07-29,14:08:55,0,1564476542,catiororeflexiv,Catioro Reflexivo,,"Você sabia que o focinho tem em média 300 milhões de células olfativas enquanto os humanos têm apenas 5 milhões?   Quer saber mais sobre os focinhos, corre lá no perfil @tesla.am que tem um monte de curiosidades!  https://t.co/qZfUBqrKOg",pt,"[{'screen_name': 'tesla', 'name': 'tesla', 'id': '13298072'}]",[],['https://pbs.twimg.com/media/EeGWo6eXgAIF-st.jpg'],2,7,154,[],[],https://twitter.com/CatioroReflexiv/status/1288476601127186434,False,,1,https://pbs.twimg.com/media/EeGWo6eXgAIF-st.jpg,,,,,,,[],,,,,0.037079185,0.8969715,0.065949395
73,1288474850756108288,1288474850756108288,2020-07-29 14:01:57 UTC,2020-07-29,14:01:57,0,1308211178,teslarati,TESLARATI,,Tesla's (TSLA) growth gets it two new price targets from Morgan Stanley  https://t.co/p3nEvFo1qu,en,[],['https://www.teslarati.com/tesla-tsla-price-target-bull-case-morgan-stanley/'],[],7,18,257,[],[],https://twitter.com/Teslarati/status/1288474850756108288,False,,0,,,,,,,,[],,,,,0.003593042,0.2002137,0.79619324
74,1288473898615357440,1288473898615357440,2020-07-29 13:58:10 UTC,2020-07-29,13:58:10,0,959168599519764480,ray4tesla,Ray4Tesla⚡️🚘☀️🔋,,Tesla’s mission won’t be complete without getting all automakers on board. Sustainability is too big an issue for one company to tackle.,en,[],[],[],3,4,77,[],[],https://twitter.com/ray4tesla/status/1288473898615357440,False,https://twitter.com/vincent13031925/status/1288463506207997952,0,,,,,,,,[],,,,,0.3302667,0.5098922,0.159841
75,1288472956717301764,1288472956717301764,2020-07-29 13:54:26 UTC,2020-07-29,13:54:26,0,349249475,gerberkawasaki,Ross Gerber,,Teslas offer to supply VW batteries because Tesla doesn’t want to totally dominate the EV car biz is pretty funny. Elon playing nice but we all know they can’t make enough just for tesla. It’s a gesture from the victor. Classy. $tsla,en,[],[],[],51,29,452,[],['tsla'],https://twitter.com/GerberKawasaki/status/1288472956717301764,False,,0,,,,,,,,[],,,,,0.15981433,0.49645782,0.34372786
76,1288472675942162432,1288472675942162432,2020-07-29 13:53:19 UTC,2020-07-29,13:53:19,0,1689516060,vincent13031925,vincentyu.eth,,Tesla &amp; Other EV Owners Get Small Victory In NY After Senate Passes Anti-ICE-ing Bill  by @PurplePanda88   https://t.co/0cnL2vCEel,en,"[{'screen_name': 'purplepanda88', 'name': 'dani 🌸', 'id': '227525516'}]",['https://www.tesmanian.com/blogs/tesmanian-blog/tesla-ev-owners-anti-ice-bill-passed-in-new-york?utm_source=dlvr.it&utm_medium=twitter'],[],1,10,96,[],[],https://twitter.com/vincent13031925/status/1288472675942162432,False,,0,,,,,,,,[],,,,,0.008067158,0.56028634,0.43164662
77,1288472552671608832,1288472552671608832,2020-07-29 13:52:49 UTC,2020-07-29,13:52:49,0,54230567,nonlineargrowth,Stanley Yuan 🔋🥬,,$TSLA just dropped a series of Singapore-based job posts today; this time making it very clear that it will launch in South East Asia very soon. The country manager JD suggests that Tesla has a dedicated emerging market expansion team studying various EM opps. Exciting times!  https://t.co/kcmmRBq7Zf,en,[],[],"['https://pbs.twimg.com/media/EeGSBVQVoAA1j9l.png', 'https://pbs.twimg.com/media/EeGSnK8VAAU9w5J.png']",8,31,188,[],['tsla'],https://twitter.com/NonlinearGrowth/status/1288472552671608832,False,,1,https://pbs.twimg.com/media/EeGSBVQVoAA1j9l.png,,,,,,,[],,,,,0.002151159,0.07932527,0.9185234
78,1288470891890749443,1288470891890749443,2020-07-29 13:46:13 UTC,2020-07-29,13:46:13,0,26071213,justin_toemay,Justin Toemay,,Please tell me the story of how “Tesla copied Nikola” @WholeMarsBlog @ThirdRowNikola @FierceBadger420 @Kristennetten @ThirdRowEarl  https://t.co/znl5jMdTQ5,en,"[{'screen_name': 'wholemarsblog', 'name': 'whole mars catalog', 'id': '1263491240336769026'}, {'screen_name': 'thirdrownikola', 'name': 'third row nikola', 'id': '1278316763923599362'}, {'screen_name': 'fiercebadger420', 'name': 'mrevor tilton', 'id': '1279989903116218368'}, {'screen_name': 'kristennetten', 'name': '•k10•♥️🕊🇺🇦 🦊', 'id': '985686123123949568'}, {'screen_name': 'thirdrowearl', 'name': 'third row earl', 'id': '1278877236024741888'}]",[],"['https://pbs.twimg.com/media/EeGRcjqVAAE-Zwf.jpg', 'https://pbs.twimg.com/media/EeGRcjmU0AEE1Zw.jpg']",20,22,266,[],[],https://twitter.com/Justin_Toemay/status/1288470891890749443,False,,1,https://pbs.twimg.com/media/EeGRcjqVAAE-Zwf.jpg,,,,,,,[],,,,,0.01587295,0.9182966,0.06583046
79,1288468038115893249,1288468038115893249,2020-07-29 13:34:53 UTC,2020-07-29,13:34:53,0,309639874,xenius101,Ryan Scanlan 👀,,"It's a sad day, my first @Tesla Thor has been removed from my account to transfer to it's new owner.  Goodbye, Thor, you rocked my world and changed my life forever. Many happy miles to you in your new home.  Now, the replacement, a blue Perf Y should be here in 4-8 weeks!  https://t.co/ELWuHFqhRh",en,"[{'screen_name': 'tesla', 'name': 'tesla', 'id': '13298072'}]",[],['https://pbs.twimg.com/media/EeGOrHPXgAMVtRU.jpg'],12,8,136,[],[],https://twitter.com/Xenius101/status/1288468038115893249,False,,1,https://pbs.twimg.com/media/EeGOrHPXgAMVtRU.jpg,,,,,,,[],,,,,0.4835235,0.24156779,0.27490875
80,1288463506207997952,1288463506207997952,2020-07-29 13:16:53 UTC,2020-07-29,13:16:53,0,1689516060,vincent13031925,vincentyu.eth,,"Tesla Open To Licensing Autopilot &amp; Supplying OEMs With Powertrains, Batteries To Push EV Adoption  https://t.co/DFvpRNouRA",en,[],['https://www.tesmanian.com/blogs/tesmanian-blog/tesla-autopilot-powertrain-battery-pack'],[],15,32,256,[],[],https://twitter.com/vincent13031925/status/1288463506207997952,False,,0,,,,,,,,[],,,,,0.0056156893,0.74437624,0.25000805
81,1288463033434427395,1288463033434427395,2020-07-29 13:15:00 UTC,2020-07-29,13:15:00,0,8315402,olhardigital,Olhar Digital,,Bilionários têm posições opostas em relação à pandemia; fundador da Microsoft diz que o tema não é especialidade do CEO da Tesla.  https://t.co/5iIIORTbs2,pt,[],['https://olhardigital.com.br/noticia/bill-gates-critica-postura-negacionista-de-elon-musk-sobre-covid-19/104243'],[],14,16,183,[],[],https://twitter.com/olhardigital/status/1288463033434427395,False,,0,,,,,,,,[],,,,,0.04512017,0.87308335,0.08179653
82,1288461410889011200,1288461410889011200,2020-07-29 13:08:33 UTC,2020-07-29,13:08:33,0,1117905238516752384,b_energized,Brandan 😁⚡️,,Today is my Dad’s 61st birthday and we haven’t seen Him since June 1st. Can I get some birthday wishes for him to make him feel special? He loves Teslas and Formula E! @elonmusk @FIAFormulaE @tesla,en,"[{'screen_name': 'elonmusk', 'name': 'elon musk', 'id': '44196397'}, {'screen_name': 'fiaformulae', 'name': 'abb fia formula e world championship', 'id': '703581570'}, {'screen_name': 'tesla', 'name': 'tesla', 'id': '13298072'}]",[],[],37,6,103,[],[],https://twitter.com/B_Energized/status/1288461410889011200,False,,0,,,,,,,,[],,,,,0.00948337,0.086688496,0.9038282
83,1288458542559539206,1288458542559539206,2020-07-29 12:57:09 UTC,2020-07-29,12:57:09,0,1201427034754318337,teslacn,Tesla Greater China,,"Grateful to our owners for the love and passions, you are inspiring more people to witness the changes Tesla has made to the world.  https://t.co/zbSyRgtmav",en,[],[],[],10,76,593,[],[],https://twitter.com/teslacn/status/1288458542559539206,False,,1,https://pbs.twimg.com/ext_tw_video_thumb/1288454967334825986/pu/img/JX7apf6CGyo2J_sA.jpg,,,,,,,[],,,,,0.0025471048,0.010836454,0.9866164
84,1288453342688092160,1288453342688092160,2020-07-29 12:36:29 UTC,2020-07-29,12:36:29,0,1475927364,webscoundrel,your good friend sof,,"much like a tesla, i need lithium to run.. but the point of difference between us is that i do not support a coup in bolivia",en,[],[],[],1,1,81,[],[],https://twitter.com/webscoundrel/status/1288453342688092160,False,,0,,,,,,,,[],,,,,0.31084812,0.6328584,0.056293443
85,1288450817142468609,1288450817142468609,2020-07-29 12:26:27 UTC,2020-07-29,12:26:27,0,1063252578878803968,teslaforthe_win,SomePeopleCallMeTheSpaceCowboy 🌻 🇺🇦 💪,,Tesla is building 5 plants....GM is closing 5 plants.....Welcome to the New Power Generation ⚡️  https://t.co/YxQ2Fo5OGw,en,[],[],['https://pbs.twimg.com/media/EeF_LCiXoAECahW.jpg'],7,59,299,[],[],https://twitter.com/TeslaForThe_Win/status/1288450817142468609,False,,1,https://pbs.twimg.com/media/EeF_LCiXoAECahW.jpg,,,,,,,[],,,,,0.0075212186,0.4515137,0.5409651
86,1288450599453769728,1288450599453769728,2020-07-29 12:25:35 UTC,2020-07-29,12:25:35,0,1201427034754318337,teslacn,Tesla Greater China,,🐶Enjoy the moment with Tesla,en,[],[],[],5,11,168,[],[],https://twitter.com/teslacn/status/1288450599453769728,False,https://twitter.com/Shayne71/status/1287978287642288128,0,,,,,,,,[],,,,,0.0026691891,0.03079849,0.96653223
87,1288446985431920640,1288446985431920640,2020-07-29 12:11:14 UTC,2020-07-29,12:11:14,0,1184953263042387969,ghost_scot,Scot,,"Here is a reminder that @Tesla will not give up on any opportunity to deceive its customers. There is no Model S that gets a 402 mile EPA estimated range and also does 0-60 in 2.3 seconds. The long range plus does 0-60 in 3.7, while the Performance MS has a 348mi EPA est.  https://t.co/IzU5ANtAgC",en,"[{'screen_name': 'tesla', 'name': 'tesla', 'id': '13298072'}]",[],"['https://pbs.twimg.com/media/EeF7s0oWoAIUYxd.jpg', 'https://pbs.twimg.com/media/EeF7s0YXoAAnj-u.jpg', 'https://pbs.twimg.com/media/EeF7s0XXoAI6Q9E.jpg']",5,13,97,[],[],https://twitter.com/ghost_scot/status/1288446985431920640,False,,1,https://pbs.twimg.com/media/EeF7s0oWoAIUYxd.jpg,,,,,,,[],,,,,0.2858995,0.6313546,0.082745925
88,1288444769736232961,1288444769736232961,2020-07-29 12:02:25 UTC,2020-07-29,12:02:25,0,1308211178,teslarati,TESLARATI,,Tesla's most conservative Performance-branded vehicle silently slays screaming V12 Lamborghini in the quarter mile  https://t.co/Kq1zC2e0F8,en,[],['https://www.teslarati.com/tesla-model-y-beats-v12-lamborghini-video'],[],20,90,855,[],[],https://twitter.com/Teslarati/status/1288444769736232961,False,,0,,,,,,,,[],,,,,0.006308791,0.40271938,0.5909719
89,1288442484499062785,1288442484499062785,2020-07-29 11:53:21 UTC,2020-07-29,11:53:21,0,568621669,insideevs,InsideEVs,,Which automaker will be the first to use Tesla tech? Autopilot in every new car?  https://t.co/iRCH8cF9gl,en,[],['https://insideevs.com/news/436389/tesla-licensing-software-supplying-powertrains-batteries/'],[],10,25,84,[],[],https://twitter.com/InsideEVs/status/1288442484499062785,False,,0,,,,,,,,[],,,,,0.004959211,0.77168405,0.22335662
90,1288438798544764928,1288438798544764928,2020-07-29 11:38:42 UTC,2020-07-29,11:38:42,0,529167837,thexential,Ryan FSD Hanson 🦊🇺🇦🛡,,"So I tried to convince my coworker to buy a @Tesla. I failed. His reason, he wants to shift gears. After 3 weeks he now regrets his #Hyundai ICE purchase and wishes he bought a model 3 instead. Too bad his value dropped so much already that he can’t trade without major $$$ loss.",en,"[{'screen_name': 'tesla', 'name': 'tesla', 'id': '13298072'}]",[],[],52,25,483,['hyundai'],[],https://twitter.com/theXential/status/1288438798544764928,False,,0,,,,,,,,[],,,,,0.82431644,0.15889357,0.016790088
91,1288431627895312384,1288431627895312384,2020-07-29 11:10:12 UTC,2020-07-29,11:10:12,0,52370117,jpr007,JPR007,,"Elon Musk invites other automakers to use Tesla software, batteries and tech  https://t.co/yETnYt1zHF",en,[],['https://www.teslarati.com/elon-musk-tesla-software-batteries-invitation-legacy-auto/'],[],14,15,87,[],[],https://twitter.com/jpr007/status/1288431627895312384,False,,0,,,,,,,,[],,,,,0.004547663,0.5575945,0.43785787
92,1288431577446440960,1288431577446440960,2020-07-29 11:10:00 UTC,2020-07-29,11:10:00,0,816653,techcrunch,TechCrunch,,"Elon Musk says Tesla is open to licensing Autopilot, supplying powertrains and batteries to other automakers  https://t.co/P3j1HvMXWD by @etherington",en,"[{'screen_name': 'etherington', 'name': 'darrell etherington', 'id': '15425183'}]",['https://tcrn.ch/2X3w7TF'],[],3,55,180,[],[],https://twitter.com/TechCrunch/status/1288431577446440960,False,,0,,,,,,,,[],,,,,0.0042077163,0.7130012,0.2827908
93,1288431419438448640,1288431419438448640,2020-07-29 11:09:22 UTC,2020-07-29,11:09:22,0,52370117,jpr007,JPR007,,Volkswagen says Tesla has 10-year start in electric cars - Reuters  https://t.co/LjcmLHNjgV,en,[],['https://www.reuters.com/article/us-volkswagen-electric-tesla/volkswagen-says-tesla-has-10-year-start-in-electric-cars-idUSKBN20Z2Y9'],[],20,48,195,[],[],https://twitter.com/jpr007/status/1288431419438448640,False,,0,,,,,,,,[],,,,,0.0053140903,0.7182138,0.27647218
