,id,conversation_id,created_at,date,time,timezone,user_id,username,name,place,tweet,language,mentions,urls,photos,replies_count,retweets_count,likes_count,hashtags,cashtags,link,retweet,quote_url,video,thumbnail,near,geo,source,user_rt_id,user_rt,retweet_id,reply_to,retweet_date,translate,trans_src,trans_dest,negative,neutral,positive
0,1340808885775572996,1340808885775572996,2020-12-20 23:58:44 UTC,2020-12-20,23:58:44,0,1002616999267262465,troyteslike,Troy Teslike,,"In case some of you find this interesting, here is Tesla's FSD take rate based on data from my surveys.  https://t.co/2EgILmkPp3",en,[],[],['https://pbs.twimg.com/media/EpuCU5pXIAIpocJ.png'],36,14,293,[],[],https://twitter.com/TroyTeslike/status/1340808885775572996,False,,1,https://pbs.twimg.com/media/EpuCU5pXIAIpocJ.png,,,,,,,[],,,,,0.0037968133,0.50703305,0.48917016
1,1340808036710027266,1340808036710027266,2020-12-20 23:55:21 UTC,2020-12-20,23:55:21,0,1652541,reuters,Reuters,,"Tesla's Elon Musk asks about converting ""large transactions"" to bitcoin  https://t.co/CQvkWnoUw3  https://t.co/A0eSUkz65C",en,[],['http://reut.rs/34tPj0G'],['https://pbs.twimg.com/media/EpuBza2WwAIUwgt.jpg'],25,26,118,[],[],https://twitter.com/Reuters/status/1340808036710027266,False,,1,https://pbs.twimg.com/media/EpuBza2WwAIUwgt.jpg,,,,,,,[],,,,,0.008548071,0.9126222,0.07882972
2,1340805939860004866,1340805939860004866,2020-12-20 23:47:01 UTC,2020-12-20,23:47:01,0,857693619406467072,gualestrit,Gualestrit,,"Tesla entra en el S&amp;P 500 con un peso del 1.69%, la quinta mayor acción del índice (sexta mayor empresa tras Alphabet).  $TSLA $SPX  https://t.co/gdxdP5FZNi  https://t.co/StPRjs4ku2",es,[],['https://www.cnbc.com/amp/2020/12/20/tesla-enters-the-sp-500-with-1point69percent-weighting-in-the-benchmark-fifth-largest.html'],['https://pbs.twimg.com/media/Ept_5ZdWMAAPvUm.png'],5,28,128,[],"['tsla', 'spx']",https://twitter.com/gualestrit/status/1340805939860004866,False,,1,https://pbs.twimg.com/media/Ept_5ZdWMAAPvUm.png,,,,,,,[],,,,,0.010893735,0.70508194,0.28402433
3,1340804644574924801,1340804644574924801,2020-12-20 23:41:52 UTC,2020-12-20,23:41:52,0,1277156582409687040,bamtheteslaman1,Plaid Brad,,If you don’t follow these people please do they are a blessing to the Tesla community and so kind ❤️. @CodingMark @Kristennetten @28delayslater @kimpaquette @TeslaTas @_TeslaTom @TeslaStraya @B_Energized @moosuraj they have helped me so much thanks 💚 just to name a few.,en,"[{'screen_name': 'codingmark', 'name': 'mark💙💛🦊', 'id': '952755407788826624'}, {'screen_name': 'kristennetten', 'name': '•k10•♥️🕊🇺🇦 🦊', 'id': '985686123123949568'}, {'screen_name': '28delayslater', 'name': '🇺🇦 🦊 earl of frunkpuppy 🇺🇦', 'id': '998140573008695296'}, {'screen_name': 'kimpaquette', 'name': 'kim paquette 💫🦄 🦊 🇺🇦 ☮️ 🕊', 'id': '258602317'}, {'screen_name': 'teslastraya', 'name': 'teslastraya', 'id': '1076276451471585280'}, {'screen_name': 'b_energized', 'name': 'brandan 😁⚡️', 'id': '1117905238516752384'}, {'screen_name': 'moosuraj', 'name': 'mosuraj', 'id': '1460569605785669636'}]",[],[],14,2,55,[],[],https://twitter.com/bamtheteslaman1/status/1340804644574924801,False,,0,,,,,,,,[],,,,,0.00757593,0.016584368,0.9758397
4,1340804387682332674,1340804387682332674,2020-12-20 23:40:51 UTC,2020-12-20,23:40:51,0,1174849507919618049,sarajawesome,Sara,,Front row parking for the @Tesla owners!? Hell yes! Love being and EV owner for SO MANY REASONS!!!!!  https://t.co/z5cxWrPfBf,en,"[{'screen_name': 'tesla', 'name': 'tesla', 'id': '13298072'}]",[],['https://pbs.twimg.com/media/Ept-eqDXEAEn49c.jpg'],7,2,77,[],[],https://twitter.com/SaraJAwesome/status/1340804387682332674,False,,1,https://pbs.twimg.com/media/Ept-eqDXEAEn49c.jpg,,,,,,,[],,,,,0.0024249845,0.012344553,0.98523045
5,1340803481310023680,1340803481310023680,2020-12-20 23:37:15 UTC,2020-12-20,23:37:15,0,243013409,sawyermerritt,Sawyer Merritt 📈🚀,,"NEWS: Tesla enters the S&amp;P 500 with 1.69% weighting in the benchmark, fifth largest. $TSLA  https://t.co/fAfnpM9iLh",en,[],['https://www.cnbc.com/2020/12/20/tesla-enters-the-sp-500-with-1point69percent-weighting-in-the-benchmark-fifth-largest.html'],[],12,37,483,[],['tsla'],https://twitter.com/SawyerMerritt/status/1340803481310023680,False,,0,,,,,,,,[],,,,,0.00448611,0.3914125,0.6041014
6,1340803458471919616,1340803458471919616,2020-12-20 23:37:10 UTC,2020-12-20,23:37:10,0,1016059981907386368,teslaownerssv,Tesla Owners Silicon Valley,,.@elonmusk making a speech of when tesla took over old GM factory in Fremont. It’s been an awesome ride so far.   https://t.co/yPriOnshmy,en,"[{'screen_name': 'elonmusk', 'name': 'elon musk', 'id': '44196397'}]",[],[],6,28,243,[],[],https://twitter.com/teslaownersSV/status/1340803458471919616,False,,1,https://pbs.twimg.com/ext_tw_video_thumb/1253547967002247168/pu/img/0cHfGMbRde6RkgvU.jpg,,,,,,,[],,,,,0.0020083429,0.0150957685,0.982896
7,1340801718343376901,1340785040867909634,2020-12-20 23:30:15 UTC,2020-12-20,23:30:15,0,971046392872521730,trylolli,Lolli 🍭,,"hey @elonmusk real talk...offering a bitcoin rebate on a new Tesla would actually send bitcoin to $420,000 and Tesla to $6,969",en,"[{'screen_name': 'elonmusk', 'name': 'elon musk', 'id': '44196397'}]",[],[],7,8,104,[],[],https://twitter.com/trylolli/status/1340801718343376901,False,,0,,,,,,,,[],,,,,0.052933354,0.7319143,0.21515228
8,1340799678988861441,1340799678988861441,2020-12-20 23:22:08 UTC,2020-12-20,23:22:08,0,56562803,peterschiff,Peter Schiff,,It seems like @elonmusk was only joking about exposing Tesla shareholders to Bitcoin. So I don't need to convince the board not to turn Tesla into a double bubble. But I'm still willing to debate @michael_saylor on #Bitcoin verse #gold.  Perhaps @joerogan is willing to moderate.,en,"[{'screen_name': 'elonmusk', 'name': 'elon musk', 'id': '44196397'}, {'screen_name': 'joerogan', 'name': 'joe rogan', 'id': '18208354'}]",[],[],979,273,3777,"['bitcoin', 'gold']",[],https://twitter.com/PeterSchiff/status/1340799678988861441,False,,0,,,,,,,,[],,,,,0.23236679,0.6984664,0.069166675
9,1340798770813030400,1340798770813030400,2020-12-20 23:18:32 UTC,2020-12-20,23:18:32,0,34713362,business,Bloomberg,,"Elon Musk inquires about converting “large transactions” of Tesla Inc.’s balance sheet into Bitcoin in a Twitter exchange with Michael Saylor, a prominent booster of the digital currency  https://t.co/HOpwLGAu3V",en,[],['https://trib.al/IGsoNPp'],[],40,86,313,[],[],https://twitter.com/business/status/1340798770813030400,False,,0,,,,,,,,[],,,,,0.008590543,0.9132965,0.07811294
10,1340795408600186885,1340795408600186885,2020-12-20 23:05:10 UTC,2020-12-20,23:05:10,0,1652541,reuters,Reuters,,Tesla's Elon Musk asks about converting 'large transactions' to bitcoin  https://t.co/qQpK63bfsq  https://t.co/OdeAGLgnLo,en,[],['http://reut.rs/2WuxcTY'],['https://pbs.twimg.com/media/Ept2UYAWMAcfIAK.jpg'],49,42,157,[],[],https://twitter.com/Reuters/status/1340795408600186885,False,,1,https://pbs.twimg.com/media/Ept2UYAWMAcfIAK.jpg,,,,,,,[],,,,,0.008761663,0.9143167,0.07692137
11,1340794268978438151,1340794268978438151,2020-12-20 23:00:39 UTC,2020-12-20,23:00:39,0,1308211178,teslarati,TESLARATI,,PSA: Hitting a Tesla will summon a self-pit maneuver #tankmode  https://t.co/tzcWhQMFb3 by @ResidentSponge,en,"[{'screen_name': 'residentsponge', 'name': 'simon alvarez', 'id': '798749450223030272'}]",['https://www.teslarati.com/tesla-autopilot-crash-model-3-pit-maneuver-instant-karma-video'],[],6,12,178,['tankmode'],[],https://twitter.com/Teslarati/status/1340794268978438151,False,,0,,,,,,,,[],,,,,0.035801478,0.8276021,0.13659646
12,1340789325802303488,1340789325802303488,2020-12-20 22:41:00 UTC,2020-12-20,22:41:00,0,368059065,dondurrett,Don Durrett - goldstockdata.com,,"If you don't own this ETF, you should have a good reason why not. This is probably the next Tesla, which was up 700% in 2020. That's my ballpark target for this gem, perhaps a bit lower, but not much.",en,[],[],[],20,17,184,[],[],https://twitter.com/DonDurrett/status/1340789325802303488,False,https://twitter.com/TheLastDegree/status/1340772437106061313,0,,,,,,,,[],,,,,0.043669548,0.32545862,0.63087183
13,1340787195318169600,1340787195318169600,2020-12-20 22:32:32 UTC,2020-12-20,22:32:32,0,131988806,arctechinc,James Locke,,"For those curious, here is @Tesla #FSDBeta handling the same tight turn at a 3-way stop going other direction. This time has to make a tight left turn with a vehicle waiting to make the right turn which can be seen on visulatization. That didn't stop beta from making this turn.  https://t.co/bFBFuZ0qv0",en,"[{'screen_name': 'tesla', 'name': 'tesla', 'id': '13298072'}]",[],[],4,5,102,['fsdbeta'],[],https://twitter.com/arctechinc/status/1340787195318169600,False,,1,https://pbs.twimg.com/ext_tw_video_thumb/1340787164460695552/pu/img/NqTQMknryn2OQRD3.jpg,,,,,,,[],,,,,0.027484793,0.88563013,0.086885184
14,1340780779354222592,1340780779354222592,2020-12-20 22:07:02 UTC,2020-12-20,22:07:02,0,131988806,arctechinc,James Locke,,Great video showing @Tesla #FSDBeta handling a very sharp right turn at a stop sign. Properly waiting for the other traffic that was also at the intersection. Software version 2020.48.10.1  https://t.co/H8rXVgmgwQ,en,"[{'screen_name': 'tesla', 'name': 'tesla', 'id': '13298072'}]",[],[],28,109,1141,['fsdbeta'],[],https://twitter.com/arctechinc/status/1340780779354222592,False,,1,https://pbs.twimg.com/ext_tw_video_thumb/1340780719799300096/pu/img/FziZjBfJzGvtYNPG.jpg,,,,,,,[],,,,,0.005733619,0.067418724,0.9268476
15,1340779805176782850,1340779805176782850,2020-12-20 22:03:10 UTC,2020-12-20,22:03:10,0,968822209077653504,oyagakoniosieyo,きしやん＠コツコツ熊本,,今宵はS&amp;P500にTESLAが組み入れられますね！  しかしですね。多数の個人投資家が使ってるであろう先進国 or 全世界株式インデックスファンドには、TESLAはだいぶ前から入ってるというね😎  あっ、おはようございます😆  https://t.co/kHFqKTSI9b,ja,[],[],"['https://pbs.twimg.com/media/Eptn27JVQAAVhBB.png', 'https://pbs.twimg.com/media/EptoHnOVoAI8uEn.png']",2,1,59,[],[],https://twitter.com/oyagakoniosieyo/status/1340779805176782850,False,,1,https://pbs.twimg.com/media/Eptn27JVQAAVhBB.png,,,,,,,[],,,,,0.040886644,0.8915149,0.06759859
16,1340773030310473728,1340773030310473728,2020-12-20 21:36:15 UTC,2020-12-20,21:36:15,0,1039607262229065728,ginog01328427,Sarajah the Great Prophet,,Every article in the mainstream media on the subject of Tesla is an attempt to manipulate you. I have foretold the future with mind bending accuracy and have made an incredible amount of money by understanding that basic principle.,en,[],[],[],9,5,85,[],[],https://twitter.com/GinoG01328427/status/1340773030310473728,False,,0,,,,,,,,[],,,,,0.19865413,0.51312935,0.2882165
17,1340772038072524800,1340772038072524800,2020-12-20 21:32:18 UTC,2020-12-20,21:32:18,0,18856867,zerohedge,zerohedge,,Looks like it will be Tesla    https://t.co/wrwXlJnv5S,en,[],['https://twitter.com/zerohedge/status/1331628365607018496'],[],12,24,199,[],[],https://twitter.com/zerohedge/status/1340772038072524800,False,https://twitter.com/zerohedge/status/1331628365607018496,0,,,,,,,,[],,,,,0.019747762,0.7834892,0.19676302
18,1340771554221682688,1340771554221682688,2020-12-20 21:30:23 UTC,2020-12-20,21:30:23,0,17060015,cleantechnica,CleanTechnica,,Tesla Giga Texas Is Growing At Plaid Mode    https://t.co/n0P0FKM3aj  by @JohnnaCrider1  https://t.co/gBu8BVgCSJ,en,"[{'screen_name': 'johnnacrider1', 'name': 'johnna crider', 'id': '1957568797'}]",['https://cleantechnica.com/2020/12/20/tesla-giga-texas-is-growing-at-plaid-mode/'],['https://pbs.twimg.com/media/EptglnpW4AEEBvc.jpg'],6,28,304,[],[],https://twitter.com/cleantechnica/status/1340771554221682688,False,,1,https://pbs.twimg.com/media/EptglnpW4AEEBvc.jpg,,,,,,,[],,,,,0.0031871637,0.33907002,0.65774274
19,1340767560447475713,1340767560447475713,2020-12-20 21:14:31 UTC,2020-12-20,21:14:31,0,1089176993340579840,xrpjackson,💀Chainsaw Jackson💀,,"Hey @elonmusk , if you buy #xrp we will all be able to buy Tesla!!   #XRPCommunity",en,"[{'screen_name': 'elonmusk', 'name': 'elon musk', 'id': '44196397'}]",[],[],56,45,618,"['xrp', 'xrpcommunity']",[],https://twitter.com/XrpJackson/status/1340767560447475713,False,,0,,,,,,,,[],,,,,0.0065660947,0.19598846,0.79744536
20,1340766217154400256,1340766217154400256,2020-12-20 21:09:11 UTC,2020-12-20,21:09:11,0,1529722572,tatianatmac,Tatiana Mac,,Today I learned that Tesla has a “limp mode.” 😐,en,[],[],[],15,0,67,[],[],https://twitter.com/TatianaTMac/status/1340766217154400256,False,,0,,,,,,,,[],,,,,0.71612203,0.25972158,0.024156285
21,1340763530832723968,1340763530832723968,2020-12-20 20:58:30 UTC,2020-12-20,20:58:30,0,2930041633,valkitty666,Damien,,おはようございます  今週働くと年末年始のお休みに入りますね  イギリスのロックダウン TESLAのS&amp;P500採用 クリスマス休暇 どのように影響するのか神も知りません,ja,[],[],[],0,0,57,[],[],https://twitter.com/valkitty666/status/1340763530832723968,False,,0,,,,,,,,[],,,,,0.04696979,0.91070116,0.042328935
22,1340762912340783106,1340762912340783106,2020-12-20 20:56:03 UTC,2020-12-20,20:56:03,0,1049188118652510208,nelsonn_x33,NEL$ON,,me in 2075 omw to pick up my grandkids in my tesla  https://t.co/meIOpHPZ0z,en,[],[],[],0,29,66,[],[],https://twitter.com/nelsonn_x33/status/1340762912340783106,False,,1,https://pbs.twimg.com/ext_tw_video_thumb/1340762844153966595/pu/img/aeTgPBkNGb4LDh98.jpg,,,,,,,[],,,,,0.020911068,0.7421539,0.23693487
23,1340762048947478536,1340762048947478536,2020-12-20 20:52:37 UTC,2020-12-20,20:52:37,0,90651198,gregabbott_tx,Greg Abbott,,It looks like Elon Musk is extending another of his companies into Texas.  He already has @Tesla &amp; @SpaceX operations here.  Now he’s expanding his boring company in Texas—which is a tunnel-building construction business.  More news later.  @elonmusk     https://t.co/wOgq27WKoL,en,"[{'screen_name': 'tesla', 'name': 'tesla', 'id': '13298072'}, {'screen_name': 'spacex', 'name': 'spacex', 'id': '34743251'}, {'screen_name': 'elonmusk', 'name': 'elon musk', 'id': '44196397'}]",['https://fxn.ws/3nmfwFX'],[],242,374,2977,[],[],https://twitter.com/GregAbbott_TX/status/1340762048947478536,False,,0,,,,,,,,[],,,,,0.004498476,0.63851035,0.35699123
24,1340760478000230401,1340760478000230401,2020-12-20 20:46:22 UTC,2020-12-20,20:46:22,0,20402945,cnbc,CNBC,,"Tesla enters the S&amp;P 500 with 1.69% weighting in the benchmark, fifth largest  https://t.co/wTe0LQS48T",en,[],['https://cnb.cx/3h7wmWA'],[],21,64,235,[],[],https://twitter.com/CNBC/status/1340760478000230401,False,,0,,,,,,,,[],,,,,0.0059323716,0.6570416,0.33702624
25,1340760467380318210,1340755433477332992,2020-12-20 20:46:20 UTC,2020-12-20,20:46:20,0,718747351792398336,alex_avoigt,Alex,,To put this into perspective  A 'normal' permit period would be 2-3 years but Tesla makes it in 1,en,[],[],[],3,7,77,[],[],https://twitter.com/alex_avoigt/status/1340760467380318210,False,,0,,,,,,,,[],,,,,0.07051307,0.8098125,0.11967446
26,1340753562725306369,1340753562725306369,2020-12-20 20:18:54 UTC,2020-12-20,20:18:54,0,20690398,manmademoon,Duncan Jones,,"Man!!  I just came up with a decent “if Tesla made menorahs” joke and realized I missed Hanukkah!  Happy Hanukkah, those that celebrate it. You’re very lucky I’m bad with dates. ❤️",en,[],[],[],12,1,147,[],[],https://twitter.com/ManMadeMoon/status/1340753562725306369,False,,0,,,,,,,,[],,,,,0.08982291,0.11408014,0.79609704
27,1340752630340079617,1340752630340079617,2020-12-20 20:15:11 UTC,2020-12-20,20:15:11,0,928759224599040001,crypto,Bloomberg Crypto,,"Elon Musk inquires about converting “large transactions” of Tesla Inc.’s balance sheet into Bitcoin in a Twitter exchange with Michael Saylor, a prominent booster of the digital currency  https://t.co/bci1YoTt5J",en,[],['https://trib.al/Wfvs6xS'],[],74,271,1202,[],[],https://twitter.com/crypto/status/1340752630340079617,False,,0,,,,,,,,[],,,,,0.008590543,0.9132965,0.07811294
28,1340752576090939393,1340581313406001153,2020-12-20 20:14:58 UTC,2020-12-20,20:14:58,0,2189541,starkness,elizabeth stark 🍠,,"@elonmusk Just wait till you cay pay for Tesla charging with #bitcoin over the Lightning Network. Oh wait, you already can!   https://t.co/I5UC4oFGLz",en,[],['http://andyschroder.com/DistributedCharge/'],[],22,86,606,['bitcoin'],[],https://twitter.com/starkness/status/1340752576090939393,False,,0,,,,,,,,"[{'screen_name': 'elonmusk', 'name': 'Elon Musk', 'id': '44196397'}]",,,,,0.0071170875,0.39291653,0.5999664
29,1340752148590542848,1340752148590542848,2020-12-20 20:13:16 UTC,2020-12-20,20:13:16,0,1229566359257763840,teslaownersnbay,Tesla Owners North Bay,,"Happy Holidays from Tesla Owners North Bay!  Hope your holidays are full of health, joy and all the things you wished for.  @Tesla @elonmusk @TOC_Fremont  https://t.co/X6myObB6MQ",en,"[{'screen_name': 'tesla', 'name': 'tesla', 'id': '13298072'}, {'screen_name': 'elonmusk', 'name': 'elon musk', 'id': '44196397'}]",[],[],7,30,166,[],[],https://twitter.com/TeslaOwnersNBay/status/1340752148590542848,False,,1,https://pbs.twimg.com/ext_tw_video_thumb/1340751310971314176/pu/img/oJolCua4sUTIJlXg.jpg,,,,,,,[],,,,,0.0017534768,0.010629748,0.98761684
30,1340751964217376769,1340751964217376769,2020-12-20 20:12:32 UTC,2020-12-20,20:12:32,0,1016059981907386368,teslaownerssv,Tesla Owners Silicon Valley,,"Tesla: +10,981% stock up in the past decade. What a journey. @elonmusk",en,"[{'screen_name': 'elonmusk', 'name': 'elon musk', 'id': '44196397'}]",[],[],50,145,4616,[],[],https://twitter.com/teslaownersSV/status/1340751964217376769,False,,0,,,,,,,,[],,,,,0.0036605785,0.023270449,0.9730689
31,1340750638465073156,1340750638465073156,2020-12-20 20:07:16 UTC,2020-12-20,20:07:16,0,1267622877215555589,pulsopopular_,Pulso Popular,,"🇺🇲 | ¿Texas será la próxima Silicon Valley? Tesla, Oracle y HP ya dejaron California por los altos impuestos y regulaciones.   https://t.co/h3sryBcMFw",es,[],['https://derechadiario.com.ar/norteamerica_estados-unidos/texas-sera-la-proxima-silicon-valley-tesla-oracle-y-hp-ya-dejaron-california-por-los-altos-impuestos-y-regulaciones'],[],14,187,1262,[],[],https://twitter.com/pulsopopular_/status/1340750638465073156,False,,0,,,,,,,,[],,,,,0.027709844,0.8872947,0.084995516
32,1340750410575994883,1340750410575994883,2020-12-20 20:06:22 UTC,2020-12-20,20:06:22,0,164425558,jonerlichman,Jon Erlichman,,"Stock gains in the past decade:  Tesla: +10,981% Nvidia: +3,594% AMD: +3,466% Netflix: +1,978% Amazon: +1,702% Adobe: +1,647% Mastercard: +1,438% Visa: +1,163% Apple: +1,006% Microsoft: +687% Salesforce: +566% Starbucks: +531% Nike: +510% Google: +484% Costco: +411% Disney: +367%",en,[],[],[],56,457,2725,[],[],https://twitter.com/JonErlichman/status/1340750410575994883,False,,0,,,,,,,,[],,,,,0.009263229,0.30672976,0.6840071
33,1340750009659252737,1340750009659252737,2020-12-20 20:04:46 UTC,2020-12-20,20:04:46,0,259725229,valaafshar,Vala Afshar,,U.S. technology companies founded by 1st and 2nd generation immigrants  Apple Google Amazon Facebook Oracle IBM Uber Airbnb Yahoo Intel EMC eBay SpaceX VMWare AT&amp;T Tesla NVIDIA Qualcomm Paypal ADP Reddit Slack WeWork Stripe Cognizant Intuit 3M Zoom  43% of Fortune 500 companies  https://t.co/UvJaU2puYl,en,[],[],['https://pbs.twimg.com/media/EptNBNTW8AI_N8-.jpg'],0,36,131,[],[],https://twitter.com/ValaAfshar/status/1340750009659252737,False,,1,https://pbs.twimg.com/media/EptNBNTW8AI_N8-.jpg,,,,,,,[],,,,,0.012021545,0.78338003,0.20459831
34,1340749594666405888,1340749594666405888,2020-12-20 20:03:07 UTC,2020-12-20,20:03:07,0,48989220,soulista,"Fabrizio,",,"Ho appena adoperato per la prima volta quell'aggeggio per tagliare la mela a spicchi e penso che il suo inventore dovrebbe avere un posto nel Pantheon a fianco di Leonardo, Curie, Tesla, Fermi e gente di quel calibro.",it,[],[],[],18,9,113,[],[],https://twitter.com/soulista/status/1340749594666405888,False,,0,,,,,,,,[],,,,,0.07703935,0.737585,0.18537554
35,1340749117920829441,1340749117920829441,2020-12-20 20:01:14 UTC,2020-12-20,20:01:14,0,47339629,ryanmink,Ryan Mink,,The Gus Tesla with the longest reception of his career of 34 yards.,en,[],[],[],1,7,219,[],[],https://twitter.com/ryanmink/status/1340749117920829441,False,,0,,,,,,,,[],,,,,0.00550556,0.38337564,0.61111873
36,1340748673370697731,1340747707095388161,2020-12-20 19:59:28 UTC,2020-12-20,19:59:28,0,1253062687061348352,0riguin4l_nam3,Chappy ✧｡*ﾟ+,,@sayorijoestar Nicola Tesla: *crea algo* Thomas Edison:  https://t.co/N4eABhFRRm,es,[],[],['https://pbs.twimg.com/media/EptLz2MWwAAGNFI.jpg'],0,37,543,[],[],https://twitter.com/0riguin4l_Nam3/status/1340748673370697731,False,,1,https://pbs.twimg.com/media/EptLz2MWwAAGNFI.jpg,,,,,,,"[{'screen_name': 'sayorijoestar', 'name': 'Meh', 'id': '1053483086783172608'}]",,,,,0.017137613,0.9313592,0.051503222
37,1340747449313464320,1340747449313464320,2020-12-20 19:54:36 UTC,2020-12-20,19:54:36,0,588261604,bloombergasia,Bloomberg Asia,,"Elon Musk inquires about converting “large transactions” of Tesla Inc.’s balance sheet into Bitcoin in a Twitter exchange with Michael Saylor, a prominent booster of the digital currency  https://t.co/z9gTIgsgPd",en,[],['https://trib.al/xLbJ4uH'],[],45,160,624,[],[],https://twitter.com/BloombergAsia/status/1340747449313464320,False,,0,,,,,,,,[],,,,,0.008590543,0.9132965,0.07811294
38,1340744809280094210,1340744809280094210,2020-12-20 19:44:07 UTC,2020-12-20,19:44:07,0,14372486,engadget,Engadget,,Elon Musk says Tesla's Full Self-Driving subscription arrives in early 2021  https://t.co/8giBQpnHEA  https://t.co/cfsvO2fzBs,en,[],['https://engt.co/3p8yKiP'],['https://pbs.twimg.com/media/EptITHuWMAAA0Y4.jpg'],9,32,208,[],[],https://twitter.com/engadget/status/1340744809280094210,False,,1,https://pbs.twimg.com/media/EptITHuWMAAA0Y4.jpg,,,,,,,[],,,,,0.0031710572,0.54659045,0.45023856
39,1340742069980176384,1340742069980176384,2020-12-20 19:33:13 UTC,2020-12-20,19:33:13,0,291943645,eb7,Erick 🦦,,"El otro lado de EB cuando no esta en el Tesla....Pick-up Truck EB  Como disfruto manejar esta camioneta, es la unica manera que manejando en miami me dejan pasar sin pitarme  https://t.co/W75i162Xb2",es,[],[],"['https://pbs.twimg.com/media/EptFzWGXcAQ7Pvn.jpg', 'https://pbs.twimg.com/media/EptFzWFW4AE4q05.jpg']",13,6,303,[],[],https://twitter.com/EB7/status/1340742069980176384,False,,1,https://pbs.twimg.com/media/EptFzWGXcAQ7Pvn.jpg,,,,,,,[],,,,,0.045447,0.8837102,0.07084265
40,1340739431557423104,1340739431557423104,2020-12-20 19:22:44 UTC,2020-12-20,19:22:44,0,34713362,business,Bloomberg,,"Elon Musk inquires about converting “large transactions” of Tesla Inc.’s balance sheet into Bitcoin in a Twitter exchange with Michael Saylor, a prominent booster of the digital currency  https://t.co/xGq2AL7I7q",en,[],['https://trib.al/DeQknr3'],[],242,789,3531,[],[],https://twitter.com/business/status/1340739431557423104,False,,0,,,,,,,,[],,,,,0.008590543,0.9132965,0.07811294
41,1340727121027612672,1340727121027612672,2020-12-20 18:33:49 UTC,2020-12-20,18:33:49,0,1689516060,vincent13031925,vincentyu.eth,,"Tesla Model 3 Is Now the Official Car of the Mayor of Eltville am Rhein, Germany 🇩🇪    https://t.co/Amiiy1Vymi",en,[],['https://www.tesmanian.com/blogs/tesmanian-blog/tesla-model-3-is-now-the-official-car-of-the-mayor-of-eltville-am-rhein-germany'],[],11,32,474,[],[],https://twitter.com/vincent13031925/status/1340727121027612672,False,,0,,,,,,,,[],,,,,0.003100072,0.6201255,0.37677434
42,1340727076408549378,1340727076408549378,2020-12-20 18:33:39 UTC,2020-12-20,18:33:39,0,1100520274200416256,tesmanian_com,Tesmanian.com,,"Tesla Model 3 Is Now the Official Car of the Mayor of Eltville am Rhein, Germany 🇩🇪    https://t.co/e7VadgE4G5",en,[],['https://www.tesmanian.com/blogs/tesmanian-blog/tesla-model-3-is-now-the-official-car-of-the-mayor-of-eltville-am-rhein-germany'],[],4,19,186,[],[],https://twitter.com/Tesmanian_com/status/1340727076408549378,False,,0,,,,,,,,[],,,,,0.003100072,0.6201255,0.37677434
43,1340725970853011457,1340725970853011457,2020-12-20 18:29:15 UTC,2020-12-20,18:29:15,0,596204926,manic_marge,Marge,,#Tesla Model S #ShotOniPhone  https://t.co/OQVW0okC5t,ca,[],[],['https://pbs.twimg.com/media/Eps3KavUUAA0uDv.jpg'],24,23,501,"['tesla', 'shotoniphone']",[],https://twitter.com/Manic_Marge/status/1340725970853011457,False,,1,https://pbs.twimg.com/media/Eps3KavUUAA0uDv.jpg,,,,,,,[],,,,,0.0041815764,0.7994227,0.19639565
44,1340721983420510210,1340721511217451010,2020-12-20 18:13:24 UTC,2020-12-20,18:13:24,0,3430882365,waywardwinifred,Fred,,Congratulations to Amy's consultants who are buying themselves new Tesla's and townhomes for Christmas this year. You did well!,en,[],[],[],1,5,69,[],[],https://twitter.com/WaywardWinifred/status/1340721983420510210,False,,0,,,,,,,,[],,,,,0.003121366,0.019431528,0.97744703
45,1340720911817859073,1340602021221707777,2020-12-20 18:09:09 UTC,2020-12-20,18:09:09,0,2189384234,4bogail,a+bi,,@elonmusk Give me tesla,en,[],[],[],0,0,0,[],[],https://twitter.com/4bogail/status/1340720911817859073,False,,0,,,,,,,,"[{'screen_name': 'elonmusk', 'name': 'Elon Musk', 'id': '44196397'}]",,,,,0.0778405,0.82432514,0.0978343
46,1340720603653754881,1340709212700098560,2020-12-20 18:07:55 UTC,2020-12-20,18:07:55,0,29893444,heydave7,Dave Lee,,"And for the record, I’ve never felt the need to push Tesla (or any stock for the matter) on people so that the price of the stock would go up or in hopes that the stock price would go up.  If I did, that would only show my insecurity in it’s long-term prospects.",en,[],[],[],32,0,167,[],[],https://twitter.com/heydave7/status/1340720603653754881,False,,0,,,,,,,,[],,,,,0.6195642,0.3415443,0.038891446
